id,question1,question2,is_duplicate,CosineSimilarity,JaccardSimilarity,Levenshtein,DiceSimilarity
137964,best way start conversation unknown girl mumbai ?,ise reference solution ?,0,0.0,0.0,37,0.7272727272727273
137965,best age marriage person working ? ?,best age marriage ?,0,0.0,0.0,17,0.8148148148148148
137966,paddy rice 's processing technology recent years ?,paddy rice 's processing technology recent years ?,1,0.0,0.0,0,1.0
137967,babies fists clenched almost time ?,babies cry soon delivered ? scientific reason behind ?,0,0.0,0.0,36,0.8823529411764706
137968,original arabs arabia `` black-african '' ?,original arabs arabian peninsula black ?,1,0.0,0.0,18,0.7878787878787878
137969,would life death ?,"life death , live ?",1,0.0,0.0,13,0.8
137970,chandra babu naidu win 2019 elections ap ?,anti corruption bureau arrest ap cm chandra babu naidu even get caught vote note case ?,0,0.0,0.0,59,0.7804878048780488
137971,india affected 500 1000 rupee notes banned ?,consequences 500 1000 rupee notes banning ?,1,0.0,0.0,15,0.8947368421052632
137972,best topics write school magazine ? class 9 .,consistently find topics write ?,0,0.0,0.0,36,0.7027027027027027
137973,quantum entanglement effect faster speed light ?,quantum entanglement happen faster speed light ?,1,0.0,0.0,6,0.972972972972973
137974,dry ice dangerous ? continuous inhaling affect health ?,safe dry ice smoke party 1000 people six hours ?,0,0.0,0.0,42,0.8
137975,funniest joke 've ever heard ?,funny joke ever heard ?,1,0.0,0.0,8,0.8484848484848485
137976,overcome dreams snakes mean dream snake ?,mean dream snakes ?,1,0.0,0.0,24,0.8695652173913043
137977,future ?,future ?,1,0.0,0.0,0,1.0
137978,worse : tea coffee ?,"beverages : better , tea coffee ?",0,0.0,0.0,16,0.8148148148148148
137979,could attain high iq ?,get high iq ?,1,0.0,0.0,11,0.6363636363636364
137980,sex feel like girls ?,sex feel like guy ?,0,0.0,0.0,4,0.8695652173913043
137981,first letter four letter word meaning `` grow light sun rises ?,11 letter word means stinky smell ?,0,0.0,0.0,40,0.7777777777777778
137982,symptoms bad starter solenoid ?,symptoms bad starter solenoid ?,1,0.0,0.0,0,1.0
137983,things new employees know going first day slm ?,things new employees know going first day & ?,0,0.0,0.0,3,0.975609756097561
137984,best binary options trading strategy ?,good strategies follow trading binary options ?,1,0.0,0.0,31,0.9090909090909091
137985,buy good cheap led bulb ?,get cheap led filament bulbs ?,1,0.0,0.0,17,0.75
137986,one buy ? honda hornet 160r suzuki gixxer ?,looking buy new bike . suzuki gixxer 155 honda hornet 160r . one buy ?,1,0.0,0.0,45,0.9166666666666666
137987,think going win 2016 presidential election ?,"think would win election , trump clinton ?",1,0.0,0.0,25,0.75
137988,best black animated characters ?,best black anime characters ?,1,0.0,0.0,3,0.967741935483871
137989,best ways improve english 'm good english ?,best way improve spoken english soon ?,1,0.0,0.0,20,0.926829268292683
137990,difference supercharging turbocharging ?,difference turbocharger supercharger ?,1,0.0,0.0,14,1.0
137991,good web development career ?,javascript good web development ?,0,0.0,0.0,18,0.918918918918919
137992,dogs short lifespans ?,countryside dog feel meets dog lives luxurious city life ?,0,0.0,0.0,45,0.7428571428571429
137993,xi jinping get elected president china ?,president xi jinping dedicated socialist believer marxism ?,0,0.0,0.0,39,0.8648648648648649
137994,improve english self study ?,improve english self-studying ?,1,0.0,0.0,4,0.9743589743589743
137995,"venture capital investor , opportunity invest twitter passed , rationale ?","venture capital investor , opportunity invest google passed , rationale ?",0,0.0,0.0,6,0.9473684210526315
137996,probability non leap year 52 sundays ?,probability leap year 53 sundays 53 mondays ?,0,0.0,0.0,16,0.918918918918919
137997,get rid belly fat ?,whats best way reduce belly fat ?,1,0.0,0.0,16,0.7586206896551724
137998,isotopes radioactive ?,isotopes radioactive ?,0,0.0,0.0,0,1.0
137999,horror movies mostly rated less 7 imdb ?,less scary horror movies rated highly imdb ?,0,0.0,0.0,24,0.9142857142857143
138000,abel ( weeknd ) like person ?,"many times artist weeknd say often , song called often ?",0,0.0,0.0,37,0.7027027027027027
138001,lose weight faster ?,easiest way lose weight faster ?,1,0.0,0.0,12,0.9655172413793104
138002,someone learn english one year ?,learn english well one month ?,0,0.0,0.0,18,0.896551724137931
138003,like dating beautiful woman ?,like attractive woman ?,0,0.0,0.0,11,0.75
138004,become happier ?,become happier job ?,0,0.0,0.0,4,0.96
138005,men think sending woman `` dick pic '' increase chances intercourse ?,men send lewd photos women ?,0,0.0,0.0,51,0.7058823529411765
138006,fastest ways increase height ?,anyone increase height ?,1,0.0,0.0,11,0.896551724137931
138007,greek mythology need capitalized ? ?,word `` '' capitalized ?,0,0.0,0.0,20,0.7428571428571429
138008,add profile picture quora ?,often change quora profile picture ?,0,0.0,0.0,23,0.875
138009,"better , seo ppc ?",seo better ppc ?,1,0.0,0.0,10,0.9523809523809523
138010,"number comes next sequence 0,4,18,48,100,180 ?",number comes next sequence ?,0,0.0,0.0,18,0.8484848484848485
138011,"caused crash alien craft roswell , new mexico 1947 ?",alien spacecraft crash roswell ?,1,0.0,0.0,34,0.75
138012,effects demonitizing 500 1000 rupees notes indian economy ?,banning 500 1000 inr going help indian economy ?,1,0.0,0.0,28,0.8095238095238095
138013,n't third major political party united states ?,united states two main political parties ?,0,0.0,0.0,28,0.8648648648648649
138014,favorite animal ? ?,favorite animals ?,1,0.0,0.0,2,0.9629629629629629
138015,colors christmas ? represent ?,colors christmas mean ?,1,0.0,0.0,9,0.9655172413793104
138016,name bhima 's mace gada mahabharatha gave bhima ?,win mace fight balarama bhima ?,0,0.0,0.0,29,0.7878787878787878
138017,'s meaning ending season 1 `` man high castle '' ? actually happens end ?,germans japanese think `` man high castle '' ?,0,0.0,0.0,42,0.8
138018,nissan skyline gtr illegal u.s. ?,legally import nissan skyline us ?,0,0.0,0.0,28,0.875
138019,best way get work cruise ship ?,'s best way hired work cruise ship ?,1,0.1617325636311473,0.0,7,0.918918918918919
138020,'s use matrices real life ?,glass weapons like skyrim useful real life ?,0,0.0,0.0,24,0.6875
138021,& parole detention centers ga ?,job opportunities available canadian pr holder ?,0,0.0,0.0,37,0.8
138022,examples sentences using word `` militarism '' ?,examples sentences using word `` implacable '' ?,0,0.0,0.0,8,0.9767441860465116
138023,hillary clinton sick potus ?,pneumonia affect hillary clinton health perspective ?,0,0.0,0.0,32,0.8571428571428571
138024,bats classified mammals ?,first classified bats mammals ?,0,0.0,0.0,9,0.9629629629629629
138025,process ( reversible irreversible ) heat absorbed greater ?,people first two names ?,0,0.0,0.0,44,0.6470588235294118
138026,get european clients startup want apps developed us ? company designs websites also develop apps ( ios+android ) ?,want learn ios development build social app summer . ?,0,0.0,0.0,77,0.8636363636363636
138027,train/improve intuition ?,ways strengthen intuition ?,1,0.0,0.0,14,0.6896551724137931
138028,ways sexist ?,guys sexist 're young immature ? change ways ?,0,0.0,0.0,35,0.6896551724137931
138029,speed laptop ?,speed laptop ?,1,0.0,0.0,0,1.0
138030,evil person ever knew personally ?,worst person ever met ?,1,0.0,0.0,19,0.7407407407407407
138031,difference traditional tv series miniseries ?,best bbc tv miniseries ?,0,0.0,0.0,27,0.7857142857142857
138032,bootstrap.js ?,bootstrapping ?,0,0.0,0.0,4,0.782608695652174
138033,earth flat ? sky dome ?,earth flat ?,1,0.0,0.0,11,0.75
138034,concentrate social studies harvard ?,syllabus social studies 10 harvard ?,0,0.0,0.0,14,0.8571428571428571
138035,universities lund enterprises recruit new grads ? majors looking ?,universities insight enterprises recruit new grads ? majors looking ?,0,0.0,0.0,7,0.9767441860465116
138036,rich men like big boobs small ones ?,hack wifi using command prompt ?,0,0.0,0.0,26,0.7428571428571429
138037,'s difference syllabus undergraduate student britain india ?,treatment options bartholin cyst apart marsupialization ?,0,0.0,0.0,48,0.7567567567567568
138038,remove ads youtube videos ?,remove ads youtube apk ?,1,0.0,0.0,6,0.9032258064516129
138039,influence judaism world ?,impact judaism world ?,1,0.0,0.0,7,0.8484848484848485
138040,could soviet union defeated nazi germany ?,soviet union nazi germany inhumanely executed soldiers desertion ww2 . two ruthless ?,0,0.0,0.0,64,0.8636363636363636
138041,covalent bonds ? occur ?,covalent bonding ?,1,0.0,0.0,9,0.8275862068965517
138042,overcome 214 ( b ) denial us f1 visa ?,"f1 visa got rejected twice 214 ( b ) , wanted know job offer conditional degree usa would show ties home country ?",0,0.0,0.0,84,0.8461538461538461
138043,banning 500 1000 rupees notes impact real estate construction industry india ?,demonetisation 1000 500 rupees notes affect real estate industry ?,1,0.0,0.0,39,0.9302325581395349
138044,think pm 's decision banning 500 100 rupee notes ?,see pm modi ’ move banning old 500 1000 rupee currency notes ?,1,0.0,0.0,29,0.851063829787234
138045,asked iim indore fpm research writing exam ?,howmany seats iim fpm ?,0,0.0,0.0,31,0.8
138046,best seo company delhi ncr optimize website top ?,best seo company delhi digital marketing ?,1,0.0,0.0,21,0.9
138047,ok serious job tcs preparing cat ?,college major usually produces best writers ?,0,0.0,0.0,34,0.8108108108108109
138048,adidas logo three lines ?,three stripes adidas logo represent ?,0,0.0,0.0,23,0.9655172413793104
138049,learn oral english well ?,best way learn english speaking ?,1,0.0,0.0,18,0.8
138050,feel high heroin ?,heroin best feeling world ?,0,0.0,0.0,19,0.8148148148148148
138051,enroll rakuten institute technology ?,punjab institute technology ?,0,0.0,0.0,13,0.8571428571428571
138052,"'ve scammed , legally ?",scammed ? happened lose ?,0,0.0,0.0,16,0.6666666666666666
138053,get views questions quora ?,get views answers quora ?,0,0.0,0.0,7,1.0
138054,"important inventions created assyrian empire , compare afsharid dynasty ?","important inventions created assyrian empire , compare achaemenid empire ?",0,0.0,0.0,13,0.972972972972973
138055,would best way control anger ?,solution control anger ?,1,0.0,0.0,11,0.8387096774193549
138056,best web design firms london ?,best web designing agency london ?,1,0.0,0.0,9,0.8125
138057,n't people read question ?,electronics engineer india job opportunities uk ?,0,0.0,0.0,38,0.8
138058,grammar : know use ?,use english grammar ?,0,0.0,0.0,19,0.7407407407407407
138059,"examples `` unfair advantages '' cities among competitors , lead success ?","examples `` unfair advantages '' countries among competitors , lead success ?",0,0.0,0.0,4,1.0
138060,plane named geometry ?,symbol plane geometry ?,1,0.0,0.0,10,0.896551724137931
138061,start preparation ias ( detail ) ?,"wan na start preparing ias exam , proceed ?",1,0.0,0.0,24,0.7272727272727273
138062,credit card better ? sbi amex ?,best credit card sbi card ?,0,0.0,0.0,18,0.9166666666666666
138063,update ios 9.1 ?,update ios 10 ?,0,0.0,0.0,3,0.8888888888888888
138064,parents full access teens phone ?,parent ethical right read children 's texts chats emails without permission knowledge ?,0,0.0,0.0,63,0.7567567567567568
138065,mystery bermuda triangle finally solved ?,mystery bermuda triangle finally solved ?,1,0.0,0.0,0,1.0
138066,make money e-commerce ?,make money via e-commerce ?,1,0.0,0.0,4,0.9230769230769231
138067,best tv series learning english ?,good tv series watch learning spoken english ?,1,0.0,0.0,17,0.7878787878787878
138068,best korean drama ?,best korean dramas time ?,1,0.0,0.0,6,0.9629629629629629
138069,people say philosophy useless and/or practical ? ( view description ),people say philosophy useless and/or practical ? ( view description ),0,0.0,0.0,0,1.0
138070,nri quota students also counselling manipal ?,fees manipal main campus cse nri quota ?,0,0.0,0.0,36,0.9142857142857143
138071,skills needed become film critic ?,individual become film critic ?,1,0.0,0.0,12,0.8484848484848485
138072,difference decimal integers natural decimals ?,32 % 20 rounded one decimal place ?,0,0.0,0.0,35,0.7058823529411765
138073,india done surgical strike ?,india done surgical strikes ?,1,0.0,0.0,1,1.0
138074,build laptop home ?,build laptop ?,1,0.0,0.0,5,0.88
138075,one followers instagram appear list even though fact following ?,appear followers list im following list instagram ?,0,0.0,0.0,42,0.8888888888888888
138076,unsubscribe quora good ?,unsubscribe delete quora account ?,1,0.0,0.0,13,0.9032258064516129
138077,could george w bush tony blair tried war crimes ?,george w. bush and/or tony blair war criminals ?,1,0.0,0.0,24,0.9523809523809523
138078,take selfie snapchat without clicking button ? timer ?,take selfie stephen curry ?,0,0.0,0.0,34,0.8421052631578947
138079,think caste based reservation good india ?,caste based reservation good society ?,1,0.0,0.0,12,0.9090909090909091
138080,canadians think british accents ?,americans think british accents ?,0,0.0,0.0,5,0.9285714285714286
138081,get job ?,get job ?,1,0.0,0.0,0,1.0
138082,many human beings lived earth since beginning time ?,many human beings ever lived ?,1,0.0,0.0,26,0.9444444444444444
138083,minority shares ?,minor ?,0,0.0,0.0,10,0.7
138084,height fall die ?,"ants know wo n't die , falling height ?",0,0.0,0.0,29,0.7586206896551724
138085,"market disequilibrium , condition may happen ?",market disequilibrium happen ?,1,0.0,0.0,16,0.9
138086,convert cgpa percentage engineering 8 semesters ?,calculate engineering aggregate percentage 8 semesters vtu ?,0,0.0,0.0,33,0.9090909090909091
138087,review movie shivaay ?,shivaay movie review rating public says ?,1,0.0,0.0,27,0.7647058823529411
138088,make 1000 dollars online ?,make first 1000 dollars ?,1,0.0,0.0,13,0.9032258064516129
138089,steps follow learn machine learning ?,start learning machine learning ?,1,0.0,0.0,13,0.875
138090,existentialism still prevail ? philosophy guide life ?,canvas protein fiber ?,0,0.0,0.0,42,0.7222222222222222
138091,"suitable solar panel installation provider near ridgecrest , california ca ?","suitable solar panel installation provider near parlier , california ca ?",0,0.0,0.0,9,0.9743589743589743
138092,crack neet 2018 ?,crack neet ?,0,0.0,0.0,5,0.8181818181818182
138093,intj person ?,insights intj personality type ?,1,0.0,0.0,19,0.8148148148148148
138094,top master 's statistics programs ?,"rising junior , steps take get top master 's program statistics ?",0,0.0,0.0,42,0.8484848484848485
138095,cause person vomit white foam ?,mean vomit white,1,0.0,0.0,17,0.7586206896551724
138096,become rich age 13 ?,become rich young age ?,1,0.0,0.0,8,0.8275862068965517
138097,planets spherical ?,"gravity space , planets spherical ?",1,0.0,0.0,16,0.8666666666666667
138098,celiac disease ?,cure celiac disease ?,0,0.0,0.0,5,0.9
138099,wait long doctor 's offices ?,true doctors us affairs office staff ?,0,0.18360695289985543,0.0,23,0.8
138100,funny lies narendra modi ?,trolls narendra modi ?,1,0.0,0.0,8,0.8571428571428571
138101,difference industrialist & businessman ?,"difference industrialist , businessman entrepreneur ?",0,0.0,0.0,14,0.9142857142857143
138102,put candles birthday cakes ?,significance logic behind blowing candles birthday cakes ?,1,0.0,0.0,33,0.8421052631578947
138103,aggregator ?,aggregator ?,1,0.0,0.0,0,1.0
138104,anyone else think cats plain evil ?,true 're deeply crazy love someone wo n't find anyone else attracted think anyone else ?,0,0.0,0.0,66,0.8
138105,biggest misconceptions narcissistic personality disorder ?,narcissistic personality disorder ?,0,0.0,0.0,23,0.9090909090909091
138106,"god created everything , include satan right ? created satan ?","god created everything , knows everything ahead time , create satan ?",1,0.0,0.0,23,0.8717948717948718
138107,kumari kandam exist ?,kumari kandam really exist ocean another myth ?,1,0.0,0.0,26,0.8484848484848485
138108,igot 389 marks cocubes assessment test 2016 expect job mnc ?,edge seventeen ( 2016 movie ) get greenlit ? 's backstory movie got made ?,0,0.0,0.0,58,0.7307692307692307
138109,hate love person time ? ever happened ?,loved person . person love back . hate person . happening ?,0,0.0,0.0,33,0.8333333333333334
138110,much free memory iphone 6s 32gb come ?,much free memory iphone 6s 16gb come ?,0,0.0,0.0,2,0.9230769230769231
138111,strong mind ?,become person strong mind ?,1,0.0,0.0,14,0.8461538461538461
138112,light darkness represent ?,light particle nature store light container 100 % reflective open dark room release ?,0,0.0,0.0,65,0.7692307692307693
138113,'s impossible 99 × 0 ?,"body except brain/brainstem , would degrade die , long would take brain degrade enough end consciousness ?",0,0.0,0.07692307692307687,94,0.5128205128205128
138114,make mind stable ?,make mind stable ?,1,0.0,0.0,0,1.0
138115,water dispenser work ?,well water pills work ?,0,0.19388255790488834,0.0,12,0.8888888888888888
138116,much money would cost buy aardman animation studios ?,major studio purchase aardman animation studios ?,1,0.0,0.0,21,0.8333333333333334
138117,"many gods asian countries like china , japan & india ?","many gods asian countries like china , japan & india . ?",1,0.0,0.0,2,0.9787234042553191
138118,pleasure people get answering questions quora ?,people answer quora ?,1,0.0,0.0,26,0.896551724137931
138119,could universe computer simulation ?,living simulation ?,1,0.0,0.0,20,0.8
138120,love married man ?,"married man love married , ?",0,0.0,0.0,15,0.96
138121,much time waiter spend taking orders ?,worth time good idea take gre test without preparation order see much progress need make ?,0,0.0,0.0,65,1.0
138122,order watch star wars movies ?,best order watch star wars series ?,1,0.0,0.0,8,0.896551724137931
138123,stop loud ?,stop loud talkative ?,1,0.0,0.0,10,0.782608695652174
138124,best rainy-day activities children bay area ?,good rainy day activities bay area ?,1,0.0,0.0,14,0.8484848484848485
138125,corporate finance : computer science graduates hired banks work ?,pros cons working corporate finance fortune 500 vs. investment banking ?,0,0.11576040955207076,0.0,51,0.8444444444444444
138126,"get activation code online game , clash kings ?",find free/ad-free cheat clash kings app android get free gold ?,0,0.0,0.0,50,0.7894736842105263
138127,get traffic website ?,increase traffic website ? jeenkart.com,1,0.0,0.0,20,0.7741935483870968
138128,change color sim tower signal android ?,android change background color black white ? black background energy efficient ?,0,0.0,0.0,57,0.8108108108108109
138129,interesting stories sun ( surya ) hindu mythology ?,exactly story behind `` shiva linga '' hindu mythology ?,0,0.0,0.0,29,0.8095238095238095
138130,control water pollution industries ?,control noise water pollution ?,0,0.0,0.0,17,0.967741935483871
138131,best restaurants delhi ?,best restaurant delhi ?,1,0.0,0.0,1,1.0
138132,indian king attacked nation outside indian sub continent ?,true india never invaded foreign country ?,0,0.0,0.0,41,0.7741935483870968
138133,indirect uses ?,indirect selling ?,0,0.0,0.0,6,0.8695652173913043
138134,dye black dark hair ombre purple without bleaching ?,dye hair dark purple without bleach ?,0,0.0,0.0,18,0.9230769230769231
138135,best reference book ies mechanical engineering engineering materials production engineering ?,present good books `` strength materials '' ?,0,0.0,0.0,66,0.8780487804878049
138136,a3 sized paper came use ?,a3 sized paper first came use ?,1,0.0,0.0,6,0.9333333333333333
138137,show charisma dance ?,c++ program skip multiple x display remaining numbersa n numbers.accept x n users . ?,0,0.0,0.0,72,0.6486486486486487
138138,next best us consumer hardware company work apple ?,best tech companies work bangalore ?,0,0.1348816898692826,0.0,32,0.85
138139,'s like meet superwoman ( lilly singh ) ?,like date superwoman ( lilly singh ) ?,0,0.0,0.0,7,0.9545454545454546
138140,embarrassing moment ever happened ?,embarrassing thing ever happened work class ?,0,0.0,0.0,16,0.8947368421052632
138141,iot ( internet things ) based projects btech ece final year students ?,things needed learned iot ece student ?,0,0.0,0.0,43,0.8205128205128205
138142,characters hundred questions ?,personal qualities important medical laboratory scientist ?,0,0.0,0.0,44,0.8235294117647058
138143,corporate culture like cubic ? culture different companies ?,corporate culture like premier ? culture different companies ?,0,0.0,0.0,6,0.972972972972973
138144,cottontail rabbits found ?,cottontail rabbits sleep ?,1,0.0,0.0,5,0.8275862068965517
138145,improve english creative writing skills ?,improve english speaking writing skills ?,1,0.0,0.0,5,0.972972972972973
138146,could donald trump get mexico pay border wall ?,donald trump make mexico pay wall ? make sense mexico pay ? mexico ?,1,0.0,0.0,44,0.9
138147,websites similar coursera ?,"moocs developed universities spain similar edx , coursera , khan academy , nptel mit ocw ?",0,0.0,0.0,65,0.7368421052631579
138148,roms size 256 kwords x 4 bits available . design 1 mword x 8 bit rom using ?,kngine competitor google ?,0,0.0,0.0,64,0.5714285714285714
138149,many liberals atheists ?,many atheists liberal ?,1,0.0,0.0,13,1.0
138150,best hair oils india preventing hair loss ?,best hair oils india women ?,0,0.0,0.0,18,0.8484848484848485
138151,mobile phone invented ?,invented mobile phones ? mobile phones invented ?,0,0.0,0.0,26,0.9655172413793104
138152,jimmy fallon wear toupee ?,jimmy fallon nice person appears show ?,0,0.0,0.0,20,0.8571428571428571
138153,differences raspberry pi arduino ?,differences arduino raspberry pi ?,1,0.0,0.0,16,1.0
138154,stop smoking ?,quit smoking ? ?,1,0.0,0.0,6,0.8695652173913043
138155,corporate culture like collegium pharmaceutical ? culture different companies ?,corporate culture like west pharmaceuticals ? culture different companies ?,0,0.0,0.0,9,0.95
138156,get rid stink bug smell ?,ways get rid stink bugs naturally ?,1,0.0,0.0,13,0.875
138157,optimize life ?,optimal age life ?,0,0.0,0.0,5,0.8695652173913043
138158,exercise routine lose weight get good shape ?,exercise lose weight ?,1,0.0,0.0,23,0.8484848484848485
138159,difference shared bandwidth dedicated bandwidth ?,using shared hosting bandwidth usage full every minute . bandwidth usage cpanel ? reduce ?,0,0.0,0.0,60,0.7692307692307693
138160,jaoi isro ?,get isro ?,1,0.0,0.0,4,0.7058823529411765
138161,heat transfer : setting a/c lower temperature increase energy consumption electric bill ?,"driving force ( ) heat transfer , ( b ) electric current flow , ( c ) fluid flow ?",0,0.0,0.0,71,0.782608695652174
138162,stop service host : local system using resources ?,enable wifi hotspot windows 7 32 bit system . using system resources instead 3rd party applications ?,0,0.0,0.0,68,0.782608695652174
138163,ask someone friends benefits ?,find girl interested friends benefits kind relationship ?,0,0.0,0.09999999999999998,35,0.8484848484848485
138164,university college london fees international students ?,university college london good school ?,0,0.0,0.0,24,0.9142857142857143
138165,google search operator partial word search ?,use ‘ around ’ — google ’ search operator proximity search — case searching two words ?,0,0.0,0.0,51,0.8
138166,forbe 's criteria deciding powerful person world ?,third rank world 's powerful political leaders forbes ?,0,0.0,0.0,41,0.926829268292683
138167,laptop look programmer ?,desktop look programmer ?,0,0.0,0.0,4,0.9230769230769231
138168,emotional abuse ?,emotional abuse ?,0,0.0,0.0,0,1.0
138169,possible upgrade yosemite el capitan os x sierra ?,deforestation harming latin america ?,0,0.0,0.0,36,0.8108108108108109
138170,'s highest net worth male fitness models/coaches ?,phil jackson 's approximate net worth 2015 ? coaching executive contributed total ?,0,0.0,0.0,61,0.7346938775510204
138171,10 favorite horror movies ?,whats favorite horror movie ?,1,0.0,0.0,6,0.896551724137931
138172,biswapati sarkar : work ?,biswapati sarkar : hiring ?,0,0.1789446082430135,0.0,5,0.8571428571428571
138173,reasons people abusive ?,people abuse ?,1,0.0,0.0,10,0.8333333333333334
138174,happens already super confident anxious drink alcohol ?,procedures taken one finds dead venomous snake nearby ?,0,0.0,0.0,41,0.85
138175,subliminal frequency remove moles yes safe ?,"mammalian cell keep consuming substrate ( 's present ) ? yes , keep consuming amount ( moles nutrient ( glucose ) ) every minute ?",0,0.0,0.0,102,0.7619047619047619
138176,started world war world war ii ?,causes world war ?,0,0.0,0.0,18,0.8333333333333334
138177,really necessary charge laptop battery 8 hours first use ?,need charge 8 hours new mobile battery ?,1,0.0,0.0,40,0.8780487804878049
138178,people 's appearance demeanor change sex ?,many people sex given time ?,0,0.0,0.0,31,0.7272727272727273
138179,purpose life ?,feel purpose life ?,1,0.0,0.0,5,1.0
138180,difference sociology psychology ?,"difference anthropology , sociology psychology ?",0,0.0,0.0,15,0.9142857142857143
138181,invest small amount money start companies ?,best way invest small amount money ?,0,0.0,0.0,25,0.8484848484848485
138182,united states like 2100 ?,likely happen 2100 ?,1,0.0,0.0,15,0.7586206896551724
138183,know guy like likes back ?,boy know girl likes ?,0,0.0,0.0,15,0.8666666666666667
138184,electron spinning disappear/appear around nucleus ?,"energy changes one state another , electron get 's energy rotate around nucleus ?",1,0.0,0.0,51,0.8
138185,significance numbers printed cricket players ' jerseys ?,decides colour country 's cricket team 's jersey ?,0,0.0,0.0,32,0.8780487804878049
138186,grow grass terrace ?,'s fastest way grow grass ?,0,0.0,0.0,20,0.8333333333333334
138187,largest country ?,largest countries world ?,1,0.0,0.0,9,0.8666666666666667
