id,question1,question2,is_duplicate,CosineSimilarity,JaccardSimilarity,Levenshtein,DiceSimilarity
251003,'s favorite tv show ?,television series : favorite tv show ?,1,0.0,0.0,18,0.8666666666666667
251004,suitable inpatient drug alcohol rehab center near jefferson county al ?,good inpatient drug alcohol rehab center jefferson county al ?,1,0.0,0.0,13,1.0
251005,engineering entrance exams one appear ?,engineering entrance exams appear year ?,1,0.0,0.0,7,0.9333333333333333
251006,cringiest code ever seen ?,absurd code 've ever seen ?,1,0.0,0.0,13,0.7407407407407407
251007,differenes medes chaldeans ?,true muslim spit 'shirkhurma ' ( sweet ) eating ?,0,0.0,0.0,40,0.6470588235294118
251008,clandestine cia agents get email addresses ?,set second instagram account email address ?,0,0.0,0.0,25,0.9333333333333333
251009,must k-pop idols always live entertainment dorms whole music career ? looks like free unlike american music artists .,k-pop idols asian ?,0,0.0,0.0,98,0.6666666666666666
251010,u.s. president ?,first u.s. president ?,0,0.0,0.0,6,0.96
251011,good websites pieces software banned available india ?,software engineer good firm india . everything seems interesting beginning loose interest . ?,0,0.0,0.0,71,0.85
251012,get feeling law school everyone else studying harder ?,immigration laws changed last several decades ? easier harder person immigrate u.s. today ?,0,0.0,0.0,65,0.9047619047619048
251013,funniest books 've ever read ?,funniest books read ?,1,0.0,0.0,9,0.9375
251014,laws regarding child support colorado ?,much pay want cancel order amazon yet dispatched ?,0,0.0,0.0,39,0.8947368421052632
251015,south korea : south korean government right-wing left-wing ?,pahlavis iran left-wing rulers right-wing rulers ?,0,0.0,0.0,40,0.8717948717948718
251016,feel day tripping shrooms ?,feel going trip exam ?,0,0.0,0.0,15,0.8484848484848485
251017,get hiccups eat anything hot spicy ? :,people get hiccups eat ?,1,0.0,0.0,28,0.8666666666666667
251018,makes good mother ?,qualities good mother ?,1,0.0,0.0,6,0.8275862068965517
251019,learn digital marketing nagpur ?,learn ( study ) digital marketing ?,0,0.0,0.0,17,0.8484848484848485
251020,masturbating gym affect anything ?,stretching gym ?,0,0.0,0.0,23,0.8666666666666667
251021,subscription box services would recommend people europe ?,subscription box services would recommend european customer ?,1,0.0,0.0,11,0.9743589743589743
251022,possible way available conduct sport ?,happens citizens continue use old 500 100 notes nov 9 ? still exchange notes till dec 30 .,0,0.0,0.0,73,0.6818181818181818
251023,god create mosquitoes ?,nature create useless creatures like mosquitoes ?,1,0.0,0.0,29,0.8387096774193549
251024,neucleuotid ?,`` '' ?,0,0.0,0.0,11,0.26666666666666666
251025,common problem ?,common problems teaching ?,0,0.0,0.0,10,0.7857142857142857
251026,long famoustylishnails.com around ? come popular ?,long notospy.com around ? come 's popular ?,0,0.0,0.0,17,0.9
251027,food little crabs eat ?,crabs eat ?,0,0.0,0.0,12,0.782608695652174
251028,best way invest money ?,invest money ?,1,0.0,0.0,9,0.88
251029,cheer depressed person ?,possible cheer someone clinically depressed ?,1,0.0,0.0,31,0.7857142857142857
251030,differences wikitude artoolkit ?,difference wikitude artoolkit ?,1,0.0,0.0,1,0.9696969696969697
251031,alternatives electoral college u.s. ?,alternatives electoral college ?,0,0.0,0.0,5,0.9333333333333333
251032,ask dad money ?,ask borrow money dad ?,0,0.0,0.0,10,0.88
251033,leap years since 2000 ?,many leap years 2000 years ?,0,0.0,0.0,15,0.8888888888888888
251034,future solar energy ?,solar energy actually economically viable ?,0,0.0,0.0,33,0.8125
251035,forget girlfriend ?,forget first girlfriend ?,1,0.0,0.0,6,0.96
251036,shoe bites back ankle . ?,wear ankle boots ?,0,0.0,0.0,18,0.7857142857142857
251037,driving enthusiasts prefer manual gearboxes automatic ?,self-driving cars available consumers ?,0,0.0,0.0,40,0.8780487804878049
251038,post question quora ?,add questions quora ?,1,0.0,0.0,5,0.9230769230769231
251039,top 10 classic rock songs ?,top 10 birthday songs ?,0,0.0,0.0,11,0.7878787878787878
251040,indian muslims think modi ?,indian muslims think narendra modi ?,1,0.0,0.0,9,0.9333333333333333
251041,threaten someone fart ?,would someone threatened fart ?,0,0.0,0.0,18,0.8571428571428571
251042,best affordable switches vlan ?,best affordable vpns ?,0,0.0,0.0,12,0.8484848484848485
251043,best way flush methamphetamines system ?,flush meth blood ?,1,0.0,0.0,27,0.7333333333333333
251044,dog able stand hind legs . help ?,reasons dog would lose strength legs eventually able walk properly and/or enthusiasm want get ?,0,0.0,0.0,75,0.7692307692307693
251045,osso bucco healthy ?,visited 10 schools . sentence right ?,0,0.0,0.0,28,0.5806451612903226
251046,importance detecting incubation period common cold ?,incubation period common cold ?,0,0.0,0.0,21,0.9696969696969697
251047,employees threshold pharmaceuticals good work-life balance ? differ across positions departments ?,employees spectrum pharmaceuticals good work-life balance ? differ across positions departments ?,0,0.0,0.0,8,1.0
251048,perfect age marriage professional ?,perfect age marriage boys ?,0,0.0,0.0,10,0.875
251049,holy grails energy ?,holy grail biology ?,0,0.0,0.0,6,0.8333333333333334
251050,become famous youtube span one year like tanner fox ?,prepare gate upsc ( cse ) simultaneously ? please suggest . 'm 3rd year btech .,0,0.0,0.0,57,0.7555555555555555
251051,"square root 15,241,578,750,190,521 ?",square root [ math ] 17535 [ /math ] ?,0,0.0,0.0,23,0.6842105263157895
251052,one watch game thrones ?,people like game thrones ?,1,0.0,0.0,9,0.8
251053,three daily practices stay young ?,enough swim 500 meters daily stay fit ?,0,0.0,0.0,29,0.8205128205128205
251054,tricks4me.com scam ?,backup.com scam ?,0,0.0,0.0,7,0.6923076923076923
251055,check verizon voicemail online ?,check verizon 's voicemail online ?,1,0.0,0.0,3,0.9375
251056,warm water jet skin provoke itching ?,bad drink warm water ?,0,0.0,0.0,29,0.6875
251057,feel child mentally challenged father ?,feel mentally challenged child ?,0,0.0,0.0,12,0.967741935483871
251058,dumbledore die book `` harry potter '' ?,albus dumbledore die harry potter novels ?,1,0.0,0.0,20,0.8421052631578947
251059,long take eggs boil ?,long take boil egg ?,1,0.0,0.0,8,0.96
251060,think india 's surgical strikes pakistan ?,rest world think indian army 's surgical strike pok ?,1,0.0,0.0,24,0.9
251061,adroid staff use iphone ?,face breakout crying ?,0,0.0,0.0,19,0.7096774193548387
251062,"according vedic astrology , type profession go ?",ways prove love someone ?,0,0.0,0.0,35,0.7272727272727273
251063,buy iphone 6s ?,buy iphone 6s ?,1,0.0,0.0,0,1.0
251064,"nasa spacex working , plans develop , space machine clean `` 500,000 pieces space debris '' orbiting earth threatening satellites ?",could space debris earth orbit cleaned ?,0,0.0,0.0,100,0.7272727272727273
251065,million dollar businesses start laptop ?,million-dollar businesses start laptop ?,1,0.0,0.0,1,0.9696969696969697
251066,crack gmat ?,way crack gmat ?,1,0.0,0.0,4,0.9
251067,best way learn c language ?,study c language ?,1,0.0,0.0,11,0.8571428571428571
251068,video game content licensing work ?,need type license game website ?,0,0.0,0.0,26,0.8
251069,mind-blowing gadgets tools people n't know ?,mind blowing gadgets tools people dont know ?,1,0.0,0.0,4,0.9444444444444444
251070,students score well without attending classes even studying seriously.are tough concepts stored birth ?,corrupt congress government karnataka ?,0,0.0,0.0,83,0.7368421052631579
251071,"worth go germany india , job seeker visa ? 5 years experience software developer .",'m mechanical engineer india 4 years experience ( 2 years germany ) . difficult find permanent job germany ?,0,0.0,0.07692307692307687,73,0.8070175438596491
251072,unusual aspects politics government oman ?,unusual aspects politics government japan ?,0,0.0,0.0,3,0.9714285714285714
251073,srm sonepat srm modinagar better computer science enginnering ?,"srm ncr sonepat , better campus ?",0,0.0,0.0,39,0.875
251074,"best restaurants try visiting bokaro steel city , jharkhand , india ? try 're ?",change father 's name birth certificate ?,0,0.0,0.0,60,0.717948717948718
251075,european union break great britain quits ?,european union remain intact break ?,1,0.0,0.0,18,0.8387096774193549
251076,walter white dead ?,walter white die ?,0,0.0,0.0,3,1.0
251077,im single mum told crush also single liked . mean said n't much offer ?,liked boy . told crush . n't really talk . regain friendship ( also best friend ) ?,0,0.0,0.0,55,0.8695652173913043
251078,tips hacks getting classes want freshman truman state ?,tips hacks getting classes want freshman ball state ?,0,0.0,0.0,6,0.9473684210526315
251079,lucid dreams used ?,lucid dreams ?,0,0.0,0.0,5,1.0
251080,protect ?,protect ?,0,0.0,0.0,0,1.0
251081,difference torque moment ?,exactly difference torque force ?,0,0.0,0.0,13,0.8387096774193549
251082,difference computer science computer engineering ?,"'s difference computer engineering , computer technology , computer science engineering ?",0,0.0,0.0,41,0.8648648648648649
251083,"handy guide difference voltage , watts amperes ?",difference phase line voltage ?,0,0.0,0.0,31,0.8780487804878049
251084,new porn sites best porn videos ?,best site sell porn videos ?,0,0.0,0.0,11,0.9285714285714286
251085,good programming language start advance ?,valuable programming language future learn ?,1,0.0,0.0,18,0.8571428571428571
251086,good facts stalin ?,interesting facts joseph stalin ?,1,0.0,0.0,18,0.8
251087,ca n't stop eating much ?,keep over-eating ?,0,0.0,0.0,16,0.6666666666666666
251088,earn money online ?,earn money online india ?,1,0.0,0.0,6,0.9565217391304348
251089,indians obsessed castes ?,indians obsessed notion religion caste ?,1,0.0,0.0,17,0.8888888888888888
251090,awesome things malmö standard guide books ?,awesome things tokyo standard guide books ?,0,0.0,0.0,5,0.9230769230769231
251091,back bonding organic chemistry ?,back bonding ?,1,0.0,0.0,18,0.7586206896551724
251092,legit freeadvice.com ?,legit millsberry.com ?,0,0.0,0.0,10,0.7741935483870968
251093,okay jealous ?,okay get jealous ?,1,0.0,0.0,4,0.9166666666666666
251094,learn python absolutely beginner free ?,learn python free ?,1,0.0,0.0,20,0.8387096774193549
251095,truthfulness mean ?,truth mean ?,0,0.0,0.0,7,0.8695652173913043
251096,good ways render json html browser-side using javascript ?,best ways request json key-values web page client-side javascript ?,0,0.0,0.0,32,0.9166666666666666
251097,way knowing guy gay ?,subtle ways tell guy gay ?,1,0.0,0.0,15,0.6086956521739131
251098,benefits applying aloe vera face ?,benefits using aloe vera face/skin ?,1,0.0,0.0,10,0.8648648648648649
251099,ways make gold food coloring ?,make blue food coloring ?,0,0.0,0.0,9,0.8571428571428571
251100,happens suspicious activity instagram account ?,know suspicious activity instagram,1,0.0,0.0,17,0.8571428571428571
251101,makes taboo role play erotic ?,role play like pro ?,0,0.0,0.0,20,0.8148148148148148
251102,know sell real estate property ?,know sell real estate property ?,0,0.0,0.0,0,1.0
251103,mean reboot bootloader ?,unlock bootloader ?,0,0.0,0.0,9,0.8461538461538461
251104,buy counterfeit money dark web ?,deep/dark web access ?,0,0.0,0.0,25,0.6451612903225806
251105,hack whatsapp remotely ?,hack spy someone 's whatsapp conversation ?,0,0.0,0.0,25,0.8571428571428571
251106,would best gift present friend birthday ?,best gift given girl birthday ?,0,0.0,0.0,16,0.8648648648648649
251107,"difference sushi , sashimi , nigiri ?",difference coconut oil cooking hair ?,0,0.0,0.0,21,0.7878787878787878
251108,check mobile battery capacity ?,check mobile inbuilt battery capacity ?,1,0.0,0.0,8,0.9411764705882353
251109,fresh fruit allowed domestic flight ?,keep cream & shampoo domestic flights ?,0,0.0,0.0,18,0.8648648648648649
251110,views india banning 500 1000 notes ? way affect indian economy ?,use banning 500 1000 rupee notes introducing new 500 2000 rupee notes ?,1,0.0,0.0,47,0.8095238095238095
251111,one become male escort ?,"wanted male prostitute , would best way start ?",0,0.0,0.0,32,0.75
251112,solution kashmir issue ?,think best solution kashmir issue ?,1,0.0,0.0,11,0.967741935483871
251113,best small scale industry bihar ?,best small scale industries ?,0,0.0,0.0,6,0.9375
251114,"significance david nolen 's `` functional final frontier '' talk om , react , clojurescript ?",learn clojurescript without learning clojure ?,0,0.0,0.0,70,0.7619047619047619
251115,ban 500 1000 rupee note stop black money ?,"scrapping 500 1000 rupee notes , rbi planning fight black money ?",1,0.0,0.0,27,0.8888888888888888
251116,name soli comes ?,3 major challenges faced india ?,0,0.0,0.0,25,0.7586206896551724
251117,possible reservation free india ?,expect reservation free india future ?,0,0.0,0.0,15,0.8484848484848485
251118,future big projects electrical technology ?,organize files big project ?,0,0.0,0.0,33,0.8947368421052632
251119,acupuncture points close alignment lymph nodes follow lymphatic fluid system ?,tell lymph nodes swollen ?,0,0.0,0.0,55,0.8
251120,purpose buying youtube view work ?,safe buy youtube views ?,0,0.0,0.0,14,0.7741935483870968
251121,youtube videos watch ?,watch 'unavailable ' videos youtube ?,0,0.0,0.0,23,0.9142857142857143
251122,ever get free domain name ?,ragister free domain name ?,1,0.0,0.0,7,0.9285714285714286
251123,would consequences brexit uk citizens ?,"event brexit , would consequence eu citizens uk , uk citizens eu ?",0,0.0,0.0,33,0.95
251124,boss n't listen advice although right predicting outcome ?,job bad boss steps take make life easier quitting job option ?,0,0.0,0.0,45,0.8095238095238095
251125,see individual instagram post account private ?,"gain access person 's instagram photos , account private ?",1,0.0,0.0,25,0.8648648648648649
251126,silicon product transmit heat ?,"silicon pv cells reusable second life full service life , say , 50 % productivity ?",0,0.0,0.0,62,0.75
251127,win next lok sabha elections india 2019 ?,win 2019 elections india ?,1,0.0,0.0,19,0.8947368421052632
251128,benefits aloe vera skin ?,benefits aloe vera skin ?,1,0.0,0.0,0,1.0
251129,assistant professors give letters recommendation ?,"important rank professor ( i.e . assistant professor , associate prof , etc ) case recommendation letter phd admissions ?",0,0.0,0.0,78,0.8
251130,ladies favorite smelling cologne men ?,best cologne men ?,0,0.0,0.0,21,0.7586206896551724
251131,type indian rupee symbol keyboard windows 10 ?,get new ( inr ) rupee symbol us laptop keyboard ?,0,0.0,0.0,29,0.8837209302325582
251132,love attraction ?,"love attraction , ?",1,0.0,0.0,2,0.96
251133,marry guy dont love ?,marry woman dont love ?,0,0.0,0.0,5,0.896551724137931
251134,n't tall trees fall ?,n't people whose houses burn forest fires move tree lines homes ?,0,0.0,0.0,51,0.6666666666666666
251135,"came first , egg hen ?","ideal answer someone asks came first , egg hen ?",1,0.0,0.0,26,0.8571428571428571
251136,academic pressure workload bowling green state like ?,mechanism kumada reaction ?,0,0.0,0.0,39,0.8333333333333334
251137,difference operations manager business analyst ?,difference business developer business analyst ?,0,0.0,0.0,16,0.9230769230769231
251138,basic difference 2g 3g ?,basic difference 2g 2.5g 2.75g ?,1,0.0,0.0,9,0.875
251139,best diet weight lose ?,lose weight diet ?,1,0.0,0.0,11,0.96
251140,phone previously synced google account bypassed ?,many gmail accounts create one phone number ?,0,0.0,0.0,38,0.9230769230769231
251141,plotly.com : automatically average data across multiple charts ?,plot multiple time series plots single excel graph ?,0,0.0,0.09090909090909094,46,0.8205128205128205
251142,spindle motor differ induction motor ?,torque produced 3 phase induction motor ?,0,0.0,0.0,20,0.8235294117647058
251143,makes johnnie walker blue label special profound ?,friend recently found blue label johnny walker oldest scotch whiskey atleast 25 yrs old .. sell ?,0,0.0,0.0,69,0.8444444444444444
251144,difference wordpress.org wordpress.com ?,difference wordpress.com wordpress.org ?,1,0.0,0.0,6,1.0
251145,stay motivated ?,stay constantly motivated ?,1,0.0,0.0,11,0.8888888888888888
251146,forgotten rrb roll number . get roll number back ?,filling form mumbai university . want know whether examination seat number 10th 12th board roll . ?,0,0.0,0.0,74,0.7272727272727273
251147,clear doubts physics ?,good website clarify physics doubts aipmt level ?,0,0.0,0.0,35,0.8717948717948718
251148,formal communication ? examples ?,examples formal communication ?,1,0.0,0.0,20,1.0
251149,founder isis ? s/he ?,founder isis ?,1,0.0,0.0,7,0.9166666666666666
251150,best youtube channel rbi grade b preparation ?,prepare rbi grade b exam 2017 ?,0,0.0,0.0,26,0.5714285714285714
251151,'m confused maruti swift vxi hyundai grand i10 sports . better two ?,better car hyundai i10 grand sportz maruti suzuki swift ?,0,0.0,0.0,49,0.8846153846153846
251152,typical path becoming hollywood director ?,steps someone follow become hollywood director ?,1,0.0,0.0,20,0.8947368421052632
251153,anyone tried sharks tank/ dragons den style tv show tech companies silicon valley ?,anyone tried sharks tank/ dragons den style tv show tech companies ?,1,0.0,0.0,15,1.0
251154,simulate underwater wireless sensor networks matlab ?,scheduling problem underwater wireless sensor networks ?,0,0.0,0.0,21,0.8947368421052632
251155,support monarchic system government ?,"best answer question , didnt attain lecture ? viva ?",0,0.0,0.0,42,0.7027027027027027
251156,since dark energy appears mean infinite potential dark energy created infinite ?,dark energy created expansion infinite created ?,1,0.0,0.0,48,0.918918918918919
251157,world war 3 ever take place ?,imminent world war three ?,1,0.0,0.0,21,0.6896551724137931
251158,would describe pain getting tattoo ?,describe pain tattoo ?,1,0.0,0.0,14,0.875
251159,apply student visa canada 3-year gap studies ?,math studies student wish apply good business school canada . taking gap year math courses help ?,0,0.0,0.0,64,0.7619047619047619
251160,good colleges accepting mat scores ?,best colleges accepting mat scores ?,1,0.0,0.0,4,0.9375
251161,person learn hack ?,learn hacking ?,1,0.0,0.0,10,0.8
251162,buy ugly christmas sweater san francisco ?,buy ugly christmas sweater sf ?,1,0.0,0.0,11,0.9473684210526315
251163,advantages disadvantages using nuclear energy ?,ser advantages disadvantages nuclear power ?,1,0.0,0.0,15,0.8823529411764706
251164,purpose mosquitoes flies earth ?,wipe mosquitos face earth ?,0,0.0,0.0,9,0.9090909090909091
251165,"atomic structure , solar system , milky way planar , therefore universe planar . anything motion one predominant direction observations indicate universe expanding . expansion flat nature ?","expanding edge universe , observing expansion , would see ?",0,0.0,0.0,148,0.8260869565217391
251166,cases exonym chosen people political purpose mind ?,"think case past people angry existing politics rallied behind firebrand , things turned even worse ?",0,0.0,0.0,74,0.8181818181818182
251167,font text `` fabulous '' mobile app android ?,best font type size use mobile app ?,0,0.0,0.0,27,0.8108108108108109
251168,best books beginners learn java ?,best reference books learning java ?,1,0.0,0.0,17,0.9411764705882353
251169,stop biting/eating nails ?,stop biting nails ?,1,0.0,0.0,7,0.9230769230769231
251170,travel speed light ?,could survive traveling speed light ?,0,0.0,0.0,17,0.875
251171,speed google maps assume car ?,speed google maps assume generates estimated times car routes ?,1,0.0,0.0,33,0.9032258064516129
251172,pay parking ticket non-governmental agency ?,"pay parking ticket obtained hebbal , india ?",0,0.0,0.0,17,0.8108108108108109
251173,get quora 's mailing list ?,get quora email list ?,1,0.0,0.0,6,0.9333333333333333
251174,want make video games . start ? need know ?,skills need video game designer/animator ?,1,0.0,0.0,27,0.8823529411764706
251175,best torrent sites available india trai blocked many torrents ?,"majority torrent sites blocked india . torrent site get movies ? p.s . 'm bachelor ( working yet ) , ca n't afford buy original dvd 's .",0,0.0,0.0,95,0.75
251176,differences tempera acrylic paint ?,would use tempera paint acrylic ?,0,0.0,0.0,21,0.8823529411764706
251177,get designer collection affordable floor tiles sydney ?,get huge choice high quality wall floor tiles sydney ?,1,0.0,0.0,23,0.8648648648648649
251178,live 100 years ?,live 100 ?,1,0.0,0.0,6,0.8
251179,drinking packed juice safe higenic ? dont think ?,safe smoke cigarettes open pack left bug bombed ?,0,0.0,0.0,42,0.8717948717948718
251180,things new employees know going first day & ?,things new employees know going first day sonic ?,0,0.0,0.0,5,0.9523809523809523
251181,cv worthy online digital marketing courses ?,best online courses available digital business marketing management ?,1,0.0,0.0,41,0.9
251182,calcium liquid ?,calcium ?,0,0.0,0.0,7,0.8888888888888888
251183,someone make suicide look like accident ?,anyway could make suicide look like accident ?,1,0.0,0.0,11,0.9375
251184,simple ideas influential entertainment ?,simple ideas influential technology ?,0,0.0,0.0,11,0.8235294117647058
251185,atlanta gay ?,atlanta known gay capital ?,1,0.0,0.0,14,0.7272727272727273
251186,placement iem kolkata ?,placement iem kolkata ?,1,0.0,0.0,0,1.0
251187,lose body fat quickly ?,lose weight quickly ? need serious help .,1,0.0,0.0,27,0.7368421052631579
251188,things new employees know going first day atwood oceanics ?,things new employees know going first day oceaneering international ?,0,0.0,0.0,20,1.0
251189,ca n't delete questions quora ?,delete question quora ?,1,0.0,0.0,8,0.9333333333333333
251190,get iodine poisoning eat many shrimp ?,eat many shrimp get iodine poisioning ?,1,0.0,0.0,29,1.0
251191,color get mixing gold brown hair dye ?,color would get mixing gold brown hair dye black hair ?,1,0.0,0.0,17,0.95
251192,correct way pronounce `` quora '' ?,correct way pronounce `` nuclear '' ?,0,0.0,0.0,5,0.9375
251193,average salary sde ii position amazon ?,take yahoo ! sde offer california amazon sde offer seattle ?,0,0.0,0.0,42,0.7894736842105263
251194,men cum ?,men pre-cum ?,0,0.0,0.0,4,0.8235294117647058
251195,chart preparation time train 11301 ?,chart preparation time train . 19708 ?,0,0.11796884103371075,0.1428571428571429,5,0.8571428571428571
251196,characteristics communism ?,characteristics communism ?,1,0.0,0.0,0,1.0
251197,"macbook wo n't boot , get flashing folder question mark—what mean ?",flashing folder question mark mean macbook ?,1,0.0,0.0,36,0.9130434782608695
251198,win america presidential elections 2016 ?,think going win 2016 presidential election ?,1,0.0,0.0,22,0.9047619047619048
251199,engine oil best tvs apache rtr 160 ?,best engine oil tvs apache rtr 160 ?,1,0.0,0.0,10,1.0
251200,abhimanyu sood ?,actually abhimanyu sood ?,1,0.0,0.0,9,0.896551724137931
251201,`` scorch '' mean movie maze runner : scorch trials ?,maze runner : scorch trials post credits scenes ?,0,0.0,0.0,44,0.8717948717948718
251202,best coaching centers csat delhi ?,best csat coaching center bangalore ?,0,0.0,0.0,15,0.967741935483871
251203,best small sized girls tatoos ?,best small sized tatoos men ?,0,0.0,0.0,10,0.896551724137931
251204,"significant voices uk request stop funding royal family turn members simple citizens ? , ?",uk monarchy ? role royal family play politics ? powers royal family administration ?,0,0.0,0.0,73,0.8260869565217391
251205,happens eye medicine enters eye ?,happen start seeing world eyes permanently shaded grey ?,0,0.0,0.0,36,0.8484848484848485
251206,would win fight tyrion lannister podrick payne ?,cartographers detect trails visible aerial photography ?,0,0.0,0.0,42,0.8205128205128205
251207,best ways lose weight fast ?,best way reduce weight fast ?,1,0.0,0.0,6,0.8125
251208,best way cook bacon crock pot ?,best ways cook bacon crock pot ?,1,0.0,0.0,1,1.0
251209,gate forum center chennai gate ?,difference gate 2017 gate 2018 forums validity ?,0,0.0,0.0,37,0.717948717948718
251210,main purpose building george w. bush presidential center ?,beautiful porn actoress photos ?,0,0.0,0.0,44,0.8421052631578947
251211,similarities/differences testudine beaks bird beaks ?,'s difference bird beaks turtle beaks ?,1,0.0,0.0,26,0.9142857142857143
251212,movies jennifer aniston lesbian kiss ?,emraan hashmi kisses much movies ?,0,0.0,0.0,29,0.75
251213,people smell get old ?,causes old people smell odor removed elder ?,1,0.0,0.0,25,0.72
251214,daniel ek : expect spotify india ?,spotify launch 's services india ?,1,0.0,0.0,23,0.7894736842105263
251215,make video call jio sim phone volte support video calling ?,unable video call jio sim jio users ? oppo f1s .,0,0.0,0.0,31,0.8095238095238095
251216,euphoria reason happens often . ?,sometimes wake anxiety sure . sometimes clue anxious . happen ?,0,0.0,0.0,48,0.7777777777777778
251217,publish theses agriculture international library thesis ?,publish theses biodiversity international library thesis ?,0,0.0,0.0,11,0.8888888888888888
251218,easy get w-2 form subway ?,wrong name w-2 . pointed employer . happens next ? get new w-2 ?,0,0.0,0.0,51,0.717948717948718
251219,meaning purpose life ?,'s meaning life ? ( mathematically logically ),1,0.0,0.0,33,0.7058823529411765
251220,modulus elasticity ?,modulus rigidity ?,0,0.0,0.0,6,0.8148148148148148
251221,dhoni start career ?,think dhoni tells age wrong ?,0,0.0,0.0,18,0.8275862068965517
251222,jobs pay 250k year ?,"take secure high-level ( high paying , like 250k+ ) sales job ? break noise ?",0,0.2576764807676868,0.0,62,0.6818181818181818
251223,kind questions quora n't ok ? quora 's policy question deletion ?,easy way quora find asked question ?,0,0.0,0.11111111111111116,43,0.8333333333333334
251224,boring job 've ever ?,boring/interesting job ever done ?,1,0.0,0.0,18,0.8148148148148148
