id,question1,question2,is_duplicate,CosineSimilarity,JaccardSimilarity,Levenshtein,DiceSimilarity
248002,find part-time jobs ?,find part-time jobs ?,0,1.0,1.0,0,1.0
248003,evidence suggests life death ?,life death possible ?,1,0.0,0.0,21,0.7333333333333333
248004,tips hacks making degree psychology useful ?,tips hacks making degree counseling psychology useful ?,0,0.0,0.0,11,1.0
248005,mind blowing smartphones gadgets ?,mind blowing phone gadgets ?,1,0.0,0.0,6,0.9714285714285714
248006,know someone lying ?,tell someone lying phone ?,1,0.0,0.0,10,0.8148148148148148
248007,locations tennessee suitable prom ?,locations washington suitable prom ?,0,0.0,0.0,10,0.9142857142857143
248008,cottontail rabbits look like ?,cottontail rabbits winter ?,0,0.0,0.0,9,0.9285714285714286
248009,find track lost mobile device using imei number ?,app track imei numbers ?,0,0.10932711353336164,0.0,30,0.8
248010,many days period get pregnant ?,get pregnant 16 days period ?,1,0.0,0.0,25,0.9032258064516129
248011,personal life ?,"engineering student currently entering third year . , want study economics dse . help ?",0,0.0,0.0,77,0.6470588235294118
248012,many people ask questions quora found google search ?,people ask stupid questions quora could easily answered google ?,1,0.0,0.0,32,0.9047619047619048
248013,much average cost treat lung cancer ?,much cost treat lung cancer ?,1,0.0,0.0,8,0.967741935483871
248014,best pmp certification course provider bangalore ?,best institute pmp exam training bangalore ?,0,0.0,0.0,28,0.8648648648648649
248015,experts nanotechnology ?,currently biggest figures nanotechnology ?,1,0.0,0.0,21,0.8235294117647058
248016,getting 51-55 marks kvpy sa 2016.can get admission iisc perform well interview ?,heart beat fast every time worry ?,0,0.0,0.11111111111111116,64,0.6363636363636364
248017,get grey 's anatomy season 11 episode 11 online ?,watch episodes greys anatomy ?,0,0.0,0.0,37,0.8333333333333334
248018,guy says look hot mean ?,mean guy says 're looking sexy ?,0,0.0,0.0,16,0.8125
248019,best places see las vegas ?,'s best show see las vegas ?,0,0.0,0.0,9,0.7692307692307693
248020,"ca n't countries afford china 's high quality products , insist buy low quality chinese products chinese want buy ?",hongkongers insist use traditional chinese characters hate called `` chinese '' ?,0,0.0,0.0,80,0.7906976744186046
248021,best ways get rid acne ?,best way get rid acne ?,1,0.0,0.0,1,1.0
248022,"vacuum energy infinite ? , ? dark energy ?",get dark energy vacuum energy universe expands ? happen forever ?,1,0.0,0.0,40,0.85
248023,"must read books lawyer , especially context indian law ?",good books new indian lawyer must read ?,1,0.0,0.0,38,0.8780487804878049
248024,bestmytest.com ?,paypalcorner.com ?,0,0.0,0.0,12,0.6666666666666666
248025,behave office first job ?,behave office ?,1,0.0,0.0,10,0.8461538461538461
248026,key benefits impact analysis testing ?,"cmdb goals , benefits effects relation key stakeholders ?",0,0.0,0.0,37,0.8421052631578947
248027,difficult concepts doctors grasp ?,difficult concept grasp physics ?,0,0.0,0.0,14,0.9444444444444444
248028,company owns starkist tuna ? starkist tune established ?,anne frank 's `` real '' diary ? ( facsimile ),0,0.0,0.0,43,0.7
248029,even slight difference ground clearance car 15 inch alloys 16 inch alloys ?,types alloys ? differ ?,0,0.0,0.0,62,0.7222222222222222
248030,differences fresh cilantro dried cilantro ?,difference cilantro coriander ?,0,0.0,0.0,18,0.9285714285714286
248031,many americans white teeth ?,americans get white teeth ?,1,0.0,0.0,9,0.9285714285714286
248032,feeling bored social situations sign asperger 's ?,feel like people judging social situations ?,0,0.0,0.0,32,0.8648648648648649
248033,hotel near san francisco airport offers free parking ?,hotels near san francisco airport offers free parking ?,1,0.0,0.0,1,1.0
248034,powers ias officer judge ?,"powerful , judge ias officer ?",0,0.0,0.0,17,0.9411764705882353
248035,get concentrate studies ?,concentrate study ?,1,0.0,0.0,7,0.8888888888888888
248036,happens break copyright law italy ?,happens break copyright law australia ?,0,0.0,0.0,6,0.9743589743589743
248037,department justice executive rather judicial branch government ?,much citizens involved judicial branch united states government ?,0,0.0,0.0,41,0.9302325581395349
248038,first pianist record complete works fauré ?,first pianist record complete works mozart ?,0,0.0,0.0,5,0.9230769230769231
248039,"dream girl 've never seen , mean ?","dream girl like , romantic context . mean ?",0,0.0,0.0,20,0.7272727272727273
248040,true japan get arrested shaking hands girls certain age ?,true japan efforts rewarded well u.s ?,0,0.0,0.0,35,0.7428571428571429
248041,individuals events history source pride togo ?,individuals events history source pride china ?,0,0.0,0.0,5,0.972972972972973
248042,one learn hacking step step ?,learn hacking beginner ?,1,0.0,0.0,11,0.8275862068965517
248043,windows 2000 firewall compared windows xp firewall ?,windows 2000 firewall compared ipfirewall ?,0,0.0,0.0,9,0.972972972972973
248044,choose career ?,could choose career modelling ?,0,0.0,0.0,16,0.72
248045,scope amc mbbs ?,scope research us mbbs ?,0,0.0,0.0,9,0.8695652173913043
248046,blow drying hair every day bad ?,cure dry hair ( male ) ?,0,0.0,0.0,18,0.6451612903225806
248047,india still able win gold medal rio olympics even 4 days medal ?,many gold india win rio olympic ?,1,0.0,0.0,43,0.8333333333333334
248048,greatest way understanding life ?,ca n't resolve object light resolve object ?,0,0.0,0.0,35,0.6470588235294118
248049,best option ms supply chain managment ?,best colleges us m.s . supply chain management ?,1,0.0,0.0,14,0.972972972972973
248050,write bhaskar.com ?,write revoltpress.com ?,0,0.0,0.0,10,0.7741935483870968
248051,l get crew crack ?,download spyhunter 4.20.9 crack + setup ?,0,0.0,0.0,29,0.5714285714285714
248052,question marked needing improvements ?,ask quora question something marked `` needs improvement ? `` ?,1,0.0,0.0,31,0.9473684210526315
248053,better xbox one playstation ?,better : xbox playstation ? ?,1,0.0,0.0,8,0.967741935483871
248054,feel like freight forwarder ?,freight forwarding ?,0,0.0,0.0,13,0.896551724137931
248055,personal thing remove first ’ get married ?,"know someone crush , like person , make first move , scared run away ?",0,0.0,0.0,47,0.8095238095238095
248056,free flow silencers damage engine reduce top speed royal enfield motorcycles long run ? myth ?,apart red rooster silencers silencers affect milage royal enfield bullet ?,0,0.0,0.0,61,0.926829268292683
248057,challenges using facebook live ?,use facebook live creative way ?,0,0.0,0.0,27,0.8
248058,stupid things done ?,stupid thing done ?,1,0.0,0.0,1,1.0
248059,imbalance cause unbalanced body point disease triggered ?,treating illness symptoms drugs medical wisdom knowing sickness cured ?,0,0.0,0.0,53,0.9230769230769231
248060,"girlfriend misses ex-boyfriend . told loves , nowadays thinks lot . ?","girlfriend told missed guy loved , yet still loves . possible ?",0,0.0,0.0,41,0.8260869565217391
248061,'s favorite song ?,favorite song song recommend ?,1,0.0,0.0,18,0.8666666666666667
248062,would better president : hillary clinton donald trump ?,would hillary clinton better president donald trump ?,1,0.0,0.0,28,0.975609756097561
248063,like aircraft technician ?,aircraft repair technician ?,0,0.0,0.0,11,0.88
248064,integrate [ math ] \sin^2 ( x ) [ /math ] ?,"[ math ] \int \sin^2 ( x ) \ , dx [ /math ] ?",0,0.0,0.0,21,0.8780487804878049
248065,certificates needed interview ssc cgl obc creamy layer candidate ?,validity period non-creamy obc certificate ?,0,0.0,0.0,43,0.8717948717948718
248066,biggest unrealistic fear ?,biggest superficial fear ?,0,0.0,0.0,9,0.9333333333333333
248067,would everyone earth speak language ?,would world different everyone spoke language ?,1,0.0,0.0,22,0.9230769230769231
248068,animal species exhibit homosexual behaviors times overpopulation ?,humans animals have/had one species one time ?,0,0.0,0.125,47,0.8648648648648649
248069,regrow eyebrows ?,regrow eyelashes quickly ?,0,0.0,0.0,13,0.6666666666666666
248070,effects oxymorons poetry ? examples ?,examples structured poetry ?,0,0.0,0.0,27,0.875
248071,indian government stopped making 1000 rupee note started making 2000 instead ?,banning 500 1000 rupee notes appreciated government bringing 500 2000 rupees market ?,1,0.0,0.0,63,0.9302325581395349
248072,mean bone density 3 times higher average ?,choose curtain ?,0,0.0,0.0,34,0.7096774193548387
248073,grammarly.com work ?,priceline.com works ?,0,0.0,0.0,9,0.7142857142857143
248074,best shots order bar ?,popular shots ordered bar ?,1,0.0,0.0,9,0.88
248075,difference tomato sauce tomato paste ?,make tomato sauce pasta ?,0,0.0,0.0,17,0.7857142857142857
248076,like anime ?,hate animals ?,0,0.0,0.0,6,0.8
248077,examples wrong scientific beliefs held long periods ?,famous liberal anti-scientific beliefs ?,0,0.0,0.0,34,0.7894736842105263
248078,gangs pilots like bikers ?,"ride two wheeler munnar coimbatore ? since cross widlife sanctuary way , 'm little concerned…",0,0.0,0.0,79,0.631578947368421
248079,people accept homoeopathy ?,people accept homeopathy ?,0,0.0,0.0,1,1.0
248080,keep calm attitude like jimmy wales ?,"attitude important find girlfriend , come adolf hitler many ?",0,0.0,0.09090909090909094,47,0.7027027027027027
248081,powerful superhero ?,powerful superhero ?,1,0.0,0.0,0,1.0
248082,operating system preferable developers programmers ? ?,operating system software engineers use ?,1,0.0,0.0,25,0.8333333333333334
248083,"like live hanover , germany ?",like live germany ?,0,0.0,0.0,10,0.896551724137931
248084,differences business model revenue model ?,different revenue model business model ?,1,0.0,0.0,17,0.9375
248085,colour blind people better night vision people standard full colour vision ?,blind people see ?,0,0.0,0.0,58,0.7096774193548387
248086,scrapping rs 500 rs 1000 notes help reducing black money corruption ?,demonetization help tackling black money corruption ?,1,0.0,0.0,33,0.8888888888888888
248087,publish book india ?,get poetry book published india ?,0,0.0,0.0,20,0.8484848484848485
248088,learn english quickly ?,learn english short time ?,1,0.0,0.1428571428571429,10,0.7333333333333333
248089,apply wall load flat slab ?,maximum size square slab placed right-angled corner parapet wall thickness ' ' without toppling ?,0,0.0,0.0,81,0.5641025641025641
248090,"billy bush howard stern helped donald trump record lascivious remarks , n't summarily fired retained nbc ?","overpopulation , n't god help combating issue making lots people , male female , infertile ?",0,0.0,0.0,77,0.9387755102040817
248091,overcome social anxiety ?,best way get rid social anxiety ?,1,0.0,0.0,15,0.8235294117647058
248092,lead bank india ?,lead bank schemes ?,1,0.0,0.0,7,0.782608695652174
248093,secret area 51 ?,exactly known area 51 ? exist ?,0,0.0,0.0,20,0.7142857142857143
248094,role bill rights play ratification ?,role bill rights ratification ?,1,0.0,0.0,5,0.9411764705882353
248095,improve english speaking skill ?,could improve english ?,1,0.0,0.0,21,0.8484848484848485
248096,good decision pursue mba human resources completing pg course domain ?,"one mba ( hr ) ? specifically , courses professional studies one opt completing mba human resources ?",0,0.0,0.0,69,0.8837209302325582
248097,major causes fall roman empire ?,important causes effects fall roman empire ?,1,0.0,0.0,15,0.9375
248098,screen cast android without using chromecast ?,cast phone screen tv without chromecast ?,0,0.0,0.0,25,0.8823529411764706
248099,dustin stop posting questions quora 2015 ?,start serviced apartment business bangalore ?,0,0.0,0.0,33,0.7368421052631579
248100,dealt severe depression without medication ?,treat depression without medication ?,1,0.0,0.0,10,0.9444444444444444
248101,english word `` jomblo '' ?,'s english word 'jhak ' ?,0,0.0,0.0,12,0.8571428571428571
248102,proven god higher exist ?,belief beliefs : existence god proven disproven ?,1,0.0,0.0,37,0.8235294117647058
248103,many views answers required become top writer quora ?,top writers selected quora ?,1,0.0,0.0,34,0.8333333333333334
248104,best institute gmat preparations delhi ?,best gmat coaching delhi/ncr get facilities ?,1,0.0,0.0,33,0.8648648648648649
248105,period 10 days late tested negative four times . cramping along fatigue white discharge . could pregnant ?,"many days missed period , negative urine pregnancy test considered conclusive ?",0,0.0,0.0,69,0.8444444444444444
248106,saltwater taffy candy imported bahamas ?,saltwater taffy candy imported mongolia ?,1,0.0,0.0,8,0.9230769230769231
248107,math behind virtual reality ?,ways attentive class distracted ?,0,0.0,0.0,24,0.7741935483870968
248108,differences ukrainian people russians ?,’ russian people use facebook ?,0,0.0,0.0,26,0.9090909090909091
248109,define term art aesthetics ?,join hyundai verna ola/uber…and income keep driver ?,0,0.0,0.0,39,0.6111111111111112
248110,hack facebook account logged ’ password email ?,recover facebook password email ?,1,0.0,0.0,23,0.8292682926829268
248111,forgot atm pin . ?,whenever forget atm pin number ?,0,0.0,0.0,16,0.7741935483870968
248112,got ears pierced 6 gauge weeks ago keep falling . stop happening ?,applied google online portal weeks ago recently got referred employee . hurt help chances ?,0,0.0,0.0,63,0.9333333333333333
248113,examples inclined plane help explain ?,inclined plane ? examples ?,1,0.0,0.0,18,0.9629629629629629
248114,revenue model snapchat ?,revenue model snapchat ?,1,0.0,0.0,0,1.0
248115,pros cons using quantitative research ?,pros cons using php rules engine ?,0,0.0,0.0,19,0.8387096774193549
248116,download sanjay sharma digital communication pdf ?,download pdf files ?,0,0.0,0.0,36,0.7058823529411765
248117,beautiful natural boobs 've ever seen ?,beautiful famous actress ever seen ?,0,0.0,0.0,15,0.9090909090909091
248118,would happen earth stopped rotating ?,would happen us humans earth suddenly stopped spinning ?,1,0.0,0.0,24,0.9444444444444444
248119,even use quora ?,use quora ?,1,0.0,0.0,5,0.9
248120,go med school ?,doctor ?,0,0.0,0.0,10,0.5555555555555556
248121,large 100 square feet ?,calculate linear feet square feet ?,0,0.0,0.0,17,0.7857142857142857
248122,raj kapoor famous russia ?,was/is raj kapoor famous russia ?,1,0.0,0.0,7,0.9285714285714286
248123,male porn stars remove foreskin penis ?,bed male porn star ?,0,0.0,0.0,27,0.8
248124,differences black leopard black jaguar ?,"'s difference cheetahs , cougars , jaguars , leopards , mountain lions , panthers , pumas , lynxes , bobcats ?",0,0.0,0.0,81,0.8181818181818182
248125,deleted,download flash season 2 episodes ?,0,0.0,0.0,29,0.3157894736842105
248126,get ipad pro imac ?,would anyone get ipad pro ?,0,0.0,0.0,18,0.7586206896551724
248127,stop smoking weed ?,stop smoking weed ?,0,0.0,0.0,0,1.0
248128,worst answers ever read quora ?,'s weirdest/worst question ever a2aed read quora ?,0,0.0,0.0,25,0.875
248129,get associates degree community college ?,get associates degree community college ?,1,0.0,0.0,0,1.0
248130,could universe nothing black hole ?,theories observable universe ( 93 billion light years across ) inside black hole ?,0,0.0,0.0,53,0.8837209302325582
248131,unexpected things first-time visitors pakistan notice ?,unexpected things first-time visitors egypt notice ?,0,0.10250471473323439,0.09999999999999998,7,0.9302325581395349
248132,16 years old . late start learning piano ?,'m almost 40. late learn piano ?,1,0.0,0.0,20,0.7428571428571429
248133,good malazan book fallen series ?,reviews steve erikson 's malazan series ?,1,0.0,0.0,26,0.7647058823529411
248134,difference love romance ?,difference love lover ?,0,0.0,0.0,6,0.9230769230769231
248135,people become terrorists ?,people become terrorist ?,1,0.0,0.0,1,1.0
248136,red velvet cake taste like ?,people hate eat chicken ?,0,0.0,0.0,16,0.6923076923076923
248137,probability tossing 5 coins ?,"three coins tossed , probability getting least 1 head ?",0,0.0,0.0,36,0.8333333333333334
248138,things new employees know going first day select medical ?,things new employees know going first day icu medical ?,0,0.0,0.0,5,0.9767441860465116
248139,places delhi sit alone study peace ?,place delhi sit alone peace ?,0,0.0,0.0,7,0.9333333333333333
248140,bladder infection cause miscarriage ?,bladder infection cause miscarriage ?,1,0.0,0.0,0,1.0
248141,laptop best 25000 ?,best laptop 25000 india ?,1,0.0,0.0,15,0.896551724137931
248142,made prisma famous ?,made prince famous ?,0,0.0,0.0,3,0.9285714285714286
248143,friedreich 's disease identified ?,would make emachines computer beep ?,0,0.0,0.0,28,0.7058823529411765
248144,audacity recording quality protools ?,plug vox amp laptop record bass lines audacity software ?,0,0.0,0.0,35,0.8292682926829268
248145,police track iphone ?,police track stolen iphone ?,1,0.0,0.0,7,0.9655172413793104
248146,disable past event text field sencha ?,one determine use vaadin vs sencha jqm framework ?,0,0.0,0.0,39,0.6842105263157895
248147,"hotel etah would safe unmarried couples , without harassment police , hotel staff , moral police ?","hotel bulandshahr would safe unmarried couples , without harassment police , hotel staff , moral police ?",0,0.0,0.0,9,0.975609756097561
248148,`` middle class '' mean ?,like middle class ?,0,0.0,0.0,12,0.8333333333333334
248149,"feel like break something angry , hug kiss 're happy ?",xiaomi redmi pro releasing india ?,0,0.0,0.0,40,0.7027027027027027
248150,"guaranteed honest response one question , would question , would ask ?","could ask stranger meet question guaranteed 100 % honest answer , would ask ?",1,0.0,0.0,47,0.8636363636363636
248151,students understand new concepts quickly ?,engineering students understand concepts quickly ?,1,0.0,0.0,16,0.9473684210526315
248152,correct quote gandalf saying `` wizard never late ... '' say ?,gandalf say falls ? say ?,0,0.0,0.0,41,0.5882352941176471
248153,n't weed legal u.s ?,weed legal throughout u.s ?,0,0.0,0.0,15,0.8275862068965517
248154,"hurt sex first time ? , ?",reduce first time sex pain ?,1,0.15748493308126973,0.125,14,0.7586206896551724
248155,many times lost wallet ?,'ve lost wallet ?,0,0.0,0.0,9,0.75
248156,really love say `` love '' next day found blocked viber 2 yrs relationship ?,"boyfriend tells serious relationship constantly tells intelligent smart n't love , wants change fall love ?",0,0.0,0.0,84,0.84
248157,cost living high ?,world cost living lowest ?,0,0.0,0.0,12,0.8148148148148148
248158,credit cards best benefits travel ?,credit cards best benefits travel india ?,0,0.0,0.0,6,1.0
248159,invented boat ?,invented bicycle ?,0,0.0,0.0,6,0.782608695652174
248160,much earn via android app [ paid free ] ?,"much android app 50,000+ downloads earn ads ?",0,0.0,0.0,31,0.717948717948718
248161,"consumes less power , air conditioner ceiling fan ?","consumes less power , air conditioner fan mode ceiling fan ?",0,0.0,0.0,9,1.0
248162,"north indian get admission ceg , anna university ?",non-tamil nadu students get admission ceg anna university b.tech ?,0,0.0,0.0,25,0.8780487804878049
248163,scream roller coasters ?,people scream roller coasters ?,0,0.0,0.0,7,0.9565217391304348
248164,"learning three languages right , add another one wait later ?",match different types halter tops ?,0,0.0,0.0,46,0.7428571428571429
248165,'s difference commercial banking retail banking ?,difference commercial banks investment banks ?,0,0.0,0.0,16,0.918918918918919
248166,scrape contact information email web page ?,good web scraping tool building contact information online directories ?,0,0.0,0.0,40,0.9473684210526315
248167,chinese people think indians ?,korean/japanese/chinese people think indians ?,0,0.0,0.0,16,0.9090909090909091
248168,always one helping others need someone nobody comes ?,one help need one talk ?,0,0.0,0.0,33,0.6875
248169,feel like mother asperger 's syndrome child children asperger 's syndrome ?,feel like father asperger 's syndrome child children also asperger 's syndrome ?,0,0.0,0.0,7,1.0
248170,believe live computer simulation know people ai simulations ?,know 're living computer simulation ?,0,0.0,0.0,37,0.9230769230769231
248171,cultures eat horse placenta ? ?,kind food appaloosa horses eat ?,0,0.0,0.0,25,0.8
248172,’ looking prominent research topics related big data service ( bdaas ) . idea highly appreciated .,"anyone please provide details list hindi songs , easy play guiter 1 cord beginner ?",0,0.0,0.0,72,0.782608695652174
248173,job interviews : someone asperger 's disclose asperger 's job interview ?,brother asperger 's disclose job interviews ?,1,0.0,0.0,34,0.9302325581395349
248174,movie scene ?,movie scene ?,1,0.0,0.0,0,1.0
248175,buy goods amazon ship vietnam ?,way ship goods amazon ukraine ?,0,0.0,0.0,17,0.8421052631578947
248176,measure thickness paper ?,measure thickness paper ?,1,0.0,0.0,0,1.0
248177,better collect business cards/contact information give business cards ?,read data arduino matlab ?,0,0.0,0.0,55,0.8235294117647058
248178,snapdeal n't send invoice product ?,n't snapdeal sell books ?,0,0.0,0.0,23,0.7741935483870968
248179,effective cures eczema ?,known cure eczema ?,1,0.0,0.0,10,0.6666666666666666
248180,increase vocabulary online ?,best way increase vocabulary ?,0,0.0,0.0,16,0.9375
248181,wo n't left eye stop twitching ?,left eye keep twitching involuntarily ?,1,0.0,0.0,24,0.8108108108108109
248182,build messaging app step step android ?,build messaging app ?,0,0.0,0.0,18,0.9032258064516129
248183,"'m 5 letter word . normally . remove 1st letter , 'll find . remove 1st & 2nd letters , ca n't see . ?","give book=220 , send letter =440 , read book=400 write letter = ?",0,0.06519229546233564,0.0,73,0.6808510638297872
248184,grow size breast ?,increase size breast ?,1,0.0,0.0,7,0.8
248185,average bit rate hd video ?,many gigs take film 1.5 hrs hd video ?,0,0.0,0.0,21,0.6857142857142857
248186,crazy ex stories ?,`` crazy ex '' stories ?,1,0.0,0.0,6,0.9285714285714286
248187,real life examples karma ?,real life examples “ karma '' ?,1,0.0,0.0,5,0.9285714285714286
248188,quora becoming less like facebook ?,quora becoming another publicity platform like facebook ?,0,0.0,0.0,25,0.8717948717948718
248189,real effective exchange rate ( reer ) ?,expected gbp inr exchange rate feb 2017 ?,0,0.0,0.0,22,0.7027027027027027
248190,learn invest stock market mutual funds ?,invest money stock market ?,1,0.0,0.0,24,0.8484848484848485
248191,n't directory cell phone numbers ?,directory landline individual phone numbers ?,1,0.0,0.0,21,0.9230769230769231
248192,lose minimum 5kg weight 1 week ?,start walking every day 3 miles lose weight ? much ? walk 3 miles every day 1 week .,0,0.0,0.0,64,0.7804878048780488
248193,anything besides quora useful us ?,safe camping south america ?,0,0.0,0.0,27,0.7777777777777778
248194,purpose find life ?,feel purpose life ?,1,0.22016460602267066,0.0,10,0.9166666666666666
248195,track phone number ?,someone track location cellphone cell number ?,1,0.0,0.0,26,0.9090909090909091
248196,allowed forbid son hang friends 3 months talked back ?,highest rank military get ?,0,0.0,0.0,42,0.7777777777777778
248197,get six packs becoming thin 14.5 % body fat percentage age 18 height 172 cms weight 60 kgs ?,14 % body fat healthy ?,0,0.0,0.0,72,0.5957446808510638
248198,become pro gamer ?,become pro gamer ?,1,0.0,0.0,0,1.0
248199,soundness concrete ?,self-leveling concrete self-compacting concrete ?,0,0.0,0.0,33,0.6206896551724138
248200,distribution input important probabilistic analysis algorithm ? always assume input uniformly distributed ?,geometric distribution important ?,0,0.0,0.0,87,0.8717948717948718
248201,make java sliding puzzle game using images ?,create simple game using java netbeans ?,0,0.0,0.0,26,0.8
248202,dating culture like uc berkeley ?,criticisms uc berkeley ?,0,0.0,0.0,17,0.8
248203,n't women `` urges '' seeing naked man ?,"heterosexual man , n't find naked scantily clad women particularly attractive . unusual ?",0,0.0,0.09090909090909094,70,0.7272727272727273
248204,forced ?,physics : force ?,0,0.0,0.0,11,0.6666666666666666
248205,tips making job interview process rbc bearings ?,advantages mikrotik larg companies used ?,0,0.0,0.0,40,0.8421052631578947
248206,twitter censoring brand 's tweets ?,"user deletes tweet twitter , associated re-tweets also deleted ?",0,0.0,0.0,45,0.75
248207,films entertainment ?,many movie directors make one good film ?,0,0.0,0.0,32,0.7741935483870968
248208,floral foams made ?,make floral foam ?,0,0.0,0.0,11,0.8571428571428571
248209,"dream repeatedly parents/siblings/friends/relatives death , mean ? make dreams go away ?",mean repeatedly get vivid dreams ?,0,0.0,0.0,60,0.8
248210,best way start learning programming concepts skills ?,start programming zero level ?,1,0.0,0.0,30,0.8
248211,factors differentiate usain bolt others make run fast ?,usain bolt fast ?,1,0.0,0.0,38,0.7741935483870968
248212,best websites career advice ?,best websites getting career advice ?,1,0.0,0.0,8,0.9285714285714286
248213,neil armstrong really go moon nasa faked moon landings ?,neil armstrong really travel moon ?,1,0.0,0.0,25,0.875
248214,increase traffic website without investing ?,increase website traffic ?,1,0.0,0.0,23,0.8387096774193549
248215,permanent home remedy itching private parts ?,home remedies use ?,0,0.0,0.0,30,0.6896551724137931
248216,"best way single woman find single , wealthy man marry take care financially ( also includes parts relationship like love , trust companionship ) ?",like loving woman married someone else even though loving way past ? morally ethically right ?,0,0.06433375415920574,0.0,106,0.8979591836734694
248217,would imaginary conversation look like us soldiers three different centuries deployed team military operation ?,sets special operations soldiers apart regular soldiers military ?,0,0.0,0.0,68,0.8780487804878049
248218,join iit diploma e & c ?,bpharm mpharm join iit ?,0,0.0,0.0,21,0.7142857142857143
