id,question1,question2,is_duplicate,CosineSimilarity,JaccardSimilarity,Levenshtein,DiceSimilarity
401944,"25 , longest job stayed 1 year . changed 4 jobs since 2013. change current.job learning anyting ?","23 , 've changed job 3 times year . normal keep changing job ?",0,0.0,0.0,66,0.8148148148148148
401945,hyper ligament laxity ?,hear ligament ( foot ) tears ?,0,0.0,0.0,16,0.75
401946,hash function ?,hashing function ?,1,0.0,0.0,3,0.96
401947,many amperes ( amps ) come wall outlet ?,bad leave charger wall outlet ?,0,0.0,0.0,21,0.6470588235294118
401948,healthy eat one chicken every day ?,healthy eat instant white oats every day ?,1,0.0,0.0,14,0.875
401949,last prophet god send jews ?,many prophets god send jews ?,0,0.0,0.0,4,0.9090909090909091
401950,favourite time day ?,favourite time day ?,1,0.0,0.0,0,1.0
401951,pros cons benoa bali reklamasi ?,famous bali usa ?,0,0.0,0.0,21,0.6923076923076923
401952,present final designs clients ?,present designs clients ?,1,0.0,0.0,6,0.9285714285714286
401953,specific gravity bitumen ?,plastic waste thermally decomposed make bitumen ?,0,0.0,0.0,34,0.7692307692307693
401954,soda bad ?,soda bad ?,1,0.0,0.0,0,1.0
401955,lose weight without workout ?,best way lose weight : cardio strength workouts ?,0,0.0,0.0,24,0.8
401956,lose 10 kg 15 days ?,exactly 15 days get shape . aim lose 10 kg . ?,1,0.0,0.0,36,0.7777777777777778
401957,many languages need computer programming best ?,best programming languages beginners ?,1,0.0,0.0,34,0.9142857142857143
401958,still india developing country ?,india still developing country ?,1,0.0,0.0,10,1.0
401959,best day life ? happened ?,best day life ? ?,1,0.0,0.0,9,0.8888888888888888
401960,bitcoin bitcoin mining ?,significance bitcoin mining bitcoin industry ?,1,0.0,0.0,26,0.7142857142857143
401961,many calories shot jack daniel 's honey whiskey ?,ways drink jack daniel 's whiskey ?,0,0.0,0.0,20,0.918918918918919
401962,world war 3 closer ever ?,likely world war iii future ?,1,0.0,0.0,19,0.6428571428571429
401963,"like born alone , live alone , die alone ?",like get married live alone ?,0,0.0,0.0,22,0.8275862068965517
401964,good photo editing apps android ?,good photo editing apps android work ?,1,0.0,0.0,5,0.9333333333333333
401965,start learning passionate programming `` zero '' abilities ?,start learning programming ?,1,0.0,0.0,32,0.875
401966,vr headsets compatible moto x 1st gen ?,12th bba b tech ?,0,0.0,0.0,31,0.5806451612903226
401967,tibco spotfire used ?,tibco spotfire ?,0,0.0,0.0,5,0.9230769230769231
401968,"pokemon ranger temple sea , manaphy angsty ?",manaphy panic attack pokémon ranger temple sea ?,1,0.0,0.0,38,0.8888888888888888
401969,first thing think wake ?,'s first thing wake every morning ?,0,0.0,0.0,20,0.8484848484848485
401970,elon musk wear watch ?,"elon musk ever watch tv ? mean , able much ?",0,0.0,0.0,25,0.9142857142857143
401971,painful death hanging ?,death hanging painful ?,1,0.0,0.0,16,1.0
401972,get mom anything valentines day ?,gift wife valentine ?,0,0.0,0.0,18,0.7142857142857143
401973,expect completing msc economics iit roorkee ?,person get iit mtech completing msc ?,0,0.0,0.0,31,0.9032258064516129
401974,succeed medical school ?,tips medical student medical school ?,1,0.0,0.0,17,0.896551724137931
401975,marking question needing improvement ?,quora always mark questions needing improvement ?,1,0.0,0.0,17,0.9230769230769231
401976,"qualified jee advanced sc category . mean top 22,500 sc candidates among india ?",getting 95 jee advance year cut 66 ( sc category ) . rank expect ?,0,0.05213867221234123,0.0,53,0.7547169811320755
401977,short-term disability insurance work florida ?,short-term disability insurance work texas ?,0,0.0,0.0,7,0.9545454545454546
401978,virali modi : virali modi overrated ?,virali modi : virali modi spotted mumbai ?,0,0.15934731064368188,0.125,12,0.8666666666666667
401979,make girlfriend insecure ?,make girlfriend less insecure ?,0,0.0,0.0,5,1.0
401980,oracle financial services software provide accommodation ?,working accenture 10 months . got offer oracle financial services double package role : flexcube developer . go ?,0,0.0,0.0,76,0.782608695652174
401981,debit card ?,exactly debit card ?,1,0.0,0.0,8,0.8695652173913043
401982,need 3 marks qualify sem end exams ( engineering 1st sem ) .will lecturer give ?,profits listed companies higher year ago ?,0,0.0,0.0,60,0.6956521739130435
401983,improve english speaking ?,improve english language ?,1,0.0,0.0,8,0.9375
401984,complete simulation brain help us formalize theory brain ? ?,cool brain facts help use brain effectively ?,0,0.0,0.0,37,0.9230769230769231
401985,color pant goes well white color shirt ?,color shirt goes well grey pants ?,0,0.0,0.0,19,0.9696969696969697
401986,careers statistics changing 's necessary stay current ?,"careers english changing , 's necessary stay current ?",0,0.0,0.0,10,0.9375
401987,going best computer programming languages future ?,best computer language learn ?,1,0.0,0.0,24,0.9411764705882353
401988,get cyber security background ?,get started cyber security industry ?,1,0.0,0.0,18,0.9375
401989,learn coding home ?,learn coding home ?,1,0.0,0.0,0,1.0
401990,resolution 2017 ?,new years resolutions 2017 ?,1,0.0,0.0,11,0.9090909090909091
401991,tiger kill kabali ?,immunisation ?,0,0.0,0.0,14,0.47619047619047616
401992,avoid ex go school ?,move ex go school ?,0,0.0,0.0,4,0.8461538461538461
401993,happens born wedlock malaysia ?,ca n't govt india print enough money meet tide ? broke ?,0,0.0,0.0,45,0.8
401994,corporate culture like power solutions international ? culture different companies ?,corporate culture like anixter international ? culture different companies ?,0,0.0,0.0,14,0.9473684210526315
401995,'m musically inclined . easily learn play guitar ?,ways learn play guitar ?,1,0.0,0.0,27,0.8235294117647058
401996,install tuxcut kali linux ?,install wine kali linux ?,0,0.0,0.0,6,0.88
401997,lucrative patents ?,search pending patents issued yet ?,0,0.0,0.0,23,0.8
401998,teach someone value time ?,teach child value time procrastinate ?,1,0.0,0.0,21,0.9090909090909091
401999,best cbse schools chennai ?,best cbse school chennai ?,1,0.0,0.0,1,1.0
402000,know start fall love someone ?,know 're unconditionally love someone ?,1,0.0,0.0,15,0.8
402001,someone download whole playlist youtube ?,download whole playlist 40 videos youtube one go ?,1,0.0,0.0,25,0.8717948717948718
402002,easiest way hypnotize ?,hypnotize someone ?,0,0.0,0.0,17,0.8888888888888888
402003,biotic abiotic factors ? differ ?,differences biotic abiotic components ?,1,0.0,0.0,25,0.896551724137931
402004,"love relationship take turn parents , ?",improve portuguese pronunciation ?,0,0.0,0.0,30,0.7878787878787878
402005,win 2015 ipl ?,win 2015 indian premier league ?,1,0.0,0.0,18,0.7586206896551724
402006,ovulation ?,signs 're ovulating ?,0,0.0,0.0,12,0.8
402007,"ms excel , filter multiple columns simultaneously , criteria range column different ?","way insert multiple images excel , image one row , column b filename ?",0,0.0,0.0,52,0.9302325581395349
402008,best websites programmer visit ?,must visit websites beginner programmer ?,0,0.0,0.0,23,0.9375
402009,setting `` bruiser '' neal shusterman influence plot ?,setting plot wizard oz ?,0,0.0,0.0,39,0.7027027027027027
402010,good fonts ?,best fonts blogs ?,0,0.0,0.0,10,0.8
402011,horrible mean bosses ?,tackle horrible boss ?,0,0.0,0.0,14,0.8148148148148148
402012,burn fat ?,one burn pounds body fat ?,1,0.0,0.0,16,0.75
402013,cause astigmatism ?,caused astigmatism ?,1,0.0,0.0,1,0.9565217391304348
402014,happens brain watch horror movies ?,would like breath liquid oxygen temperature n't affect ?,0,0.0,0.0,43,0.7142857142857143
402015,get free pokemon go coins ?,get free pokecoins ?,1,0.0,0.0,7,0.9655172413793104
402016,"hypothetically , country went war india , would three countries want side ?","hypothetically , country went war indonesia , three countries would want side ?",0,0.0,0.0,16,1.0
402017,use turbocharger petrol engine ?,cant use diesel petrol engine ?,0,0.0,0.0,14,0.9090909090909091
402018,lessons learned life ?,learn life ?,1,0.0,0.0,10,0.8571428571428571
402019,tiffany trump 's new secret service protection detail make less popular party ? effect social life ?,"n't polylactic acid used , relation petroleum based plastics ?",0,0.0,0.0,74,0.8571428571428571
402020,worth going see new year 's eve fireworks alone manchester piccadilly gardens ?,worth going times square new year 's eve ?,0,0.0,0.0,51,0.8095238095238095
402021,individuals events history source pride angola ?,individuals events history source pride china ?,0,0.0,0.0,5,0.972972972972973
402022,ticketmeout.com ?,wikianswers.com ?,0,0.0,0.0,10,0.72
402023,often guys regret rejecting girl ?,guys feel rejecting girl ?,0,0.0,0.0,10,0.967741935483871
402024,air gap length small induction motor synchronous motor ?,synchronous motor run induction motor ?,0,0.0,0.0,38,0.8484848484848485
402025,would possible go alternate universe ?,possible travel alternate universe ?,1,0.0,0.0,12,0.9090909090909091
402026,unhealthy stop masturbating ?,caramel unhealthy ?,0,0.12986608217633575,0.0,23,0.7741935483870968
402027,nfc good ?,nfc ?,0,0.0,0.0,5,0.7692307692307693
402028,improve chances getting ivy league school ?,improve chances getting ivy league ?,1,0.0,0.0,7,1.0
402029,become math genius ?,become math genius ?,1,0.0,0.0,0,1.0
402030,water vapour ?,water vapour ? used ?,1,0.0,0.0,7,0.9166666666666666
402031,get rid back acne chest acne ?,"acne scarring chest , get rid ?",0,0.0,0.0,22,0.896551724137931
402032,recover lost photos videos samsung galaxy ?,recover lost photos videos app lock vault samsung galaxy s6 ?,0,0.0,0.0,18,0.9545454545454546
402033,much money make sites like electrical4u ?,"mount rushmore famous , created ?",0,0.0,0.0,29,0.7647058823529411
402034,love job ? ? love ?,"love job ? , job love ?",1,0.0,0.0,5,0.9411764705882353
402035,magic real ? great magicians perform trick ? real logic behind tricks ?,"tricks behind david blaine ’ magic ? ’ possibly real , right ?",0,0.0,0.0,51,0.8837209302325582
402036,cellphone called cellphone ?,cellphone ?,0,0.0,0.0,17,0.9
402037,way query quora database ?,way query metadata quora ?,1,0.0,0.0,11,0.8888888888888888
402038,great britain olympics england ?,united kingdom called great britain olympics ?,1,0.0,0.0,30,0.9473684210526315
402039,examples human behaviors ?,examples human behavior ?,1,0.0,0.0,1,1.0
402040,glucose six phosphate formed first steps glycolysis ?,function phosphorylation monosaccarides ?,0,0.0,0.0,36,0.9230769230769231
402041,india get fgfa amca fighter jets ?,india developing 5th generation fighter aircraft ? future plan ?,0,0.0,0.0,42,0.7428571428571429
402042,trump win election ?,think trump could win presidency ?,1,0.0,0.0,20,0.8484848484848485
402043,health ?,health ?,1,0.0,0.0,0,1.0
402044,track person basing mobile phone ?,track person mobile online ?,1,0.0,0.0,11,0.9411764705882353
402045,find right person ?,find right person ?,1,0.0,0.0,0,1.0
402046,got period days started could cause ?,cause woman 's period late ?,0,0.0,0.0,25,0.8235294117647058
402047,promote someone social media ?,promote social media ?,1,0.0,0.0,8,0.9655172413793104
402048,popular name born ?,many black babies born america ?,0,0.0,0.0,20,0.7407407407407407
402049,benzene carcinogen ?,nicotine carcinogen ?,0,0.0,0.0,6,0.8695652173913043
402050,hack whatsapp imei ?,anyone hack mobile whatsapp ?,0,0.0,0.0,19,0.8387096774193549
402051,best restaurants guwahati ?,best restaurant guwahati ?,1,0.0,0.0,1,1.0
402052,"penalty driving without license alabama , compare penalties washington ?","penalty driving without license alabama , compare penalties california ?",0,0.0,0.0,9,0.9787234042553191
402053,raise seed money fintech startup ?,adverse effects butter ghee ?,0,0.0,0.0,24,0.7272727272727273
402054,'m fluent english speaker however find struggling meaningful conversations . tips websites advanced practice ?,best websites speak english natives ?,0,0.0,0.0,86,0.7804878048780488
402055,visual studio code ? used ?,'s difference visual studio code vs visual studio 2015 rc ?,0,0.0,0.0,34,0.7647058823529411
402056,suggestions movies like social network ?,best crime/drama/mystery/thriller movies ?,0,0.0,0.0,36,0.7222222222222222
402057,rigid body ?,really fascinating non intuitive results applications rigid body rotation ?,0,0.0,0.0,63,0.6206896551724138
402058,indian super league : team expected supported ?,indian super league team widest fan base ? team passionate fans league ?,1,0.0,0.0,39,0.8421052631578947
402059,quora pronounced ?,pronounce `` quora '' ?,0,0.0,0.0,18,0.88
402060,host website ?,host website ?,1,0.0,0.0,0,1.0
402061,think egoistic good bad ?,egoistic viewed bad thing ?,0,0.0,0.0,17,0.9032258064516129
402062,bilateral polycystic ovaries happen postnatally ?,bilateral poly cystic ovaries happen post natally ?,1,0.0,0.0,2,1.0
402063,say describe need financial aid coursera full answers ?,say describe need financial aid coursera ?,1,0.0,0.0,13,0.9696969696969697
402064,jiuduidodo good shoe company ?,lotto good shoe brand ?,0,0.0,0.0,14,0.6451612903225806
402065,win us presidential elections 2016 : hillary clinton donald trump ?,next president usa : hillary clinton donald trump ?,1,0.0,0.0,21,0.8636363636363636
402066,teaching kids money early age boost economy country long run ? ?,teaching kids money early age boost economy country longrun ?,1,0.0,0.0,3,1.0
402067,arguments support electing donald trump ?,valid rational reasons voting donald trump ?,1,0.0,0.0,21,0.9411764705882353
402068,best financial planning tool ?,best financial planning apps ?,0,0.0,0.0,4,0.9655172413793104
402069,see someone 's private instagram account ?,look someone 's instagram 's private ?,1,0.0,0.0,21,0.8823529411764706
402070,best way get connected global b2b suppliers ?,"best worst things public transit hamadan , hamadan , iran ? could improved ?",0,0.0,0.0,55,0.8571428571428571
402071,feel peace ?,reach destination peace ?,1,0.0,0.0,15,0.5454545454545454
402072,country conquered another country modern age ?,'s last country annexed conquered another country ?,0,0.0,0.0,27,0.8235294117647058
402073,happens cub linux website ?,happens microsoft copies source code linux ships windows ?,0,0.0,0.0,37,0.8333333333333334
402074,"suitable solar panel installation provider near san fernando , california ca ?","suitable solar panel installation provider near san marcos , california ca ?",0,0.0,0.0,7,0.9743589743589743
402075,n't france build maginot line defend border belgium ?,"ww1 , germans executed schlieffen plan , avoiding main army invading belgium . hindsight , n't french anticipated would avoid maginot line way ww2 ?",0,0.0,0.0,117,0.7659574468085106
402076,polar covalent bonds formed ?,covalent bonds formed ?,0,0.0,0.0,6,0.9696969696969697
402077,rheumatoid arthritis cured ?,promising cure rheumatoid arthritis ?,0,0.0,0.0,21,0.9032258064516129
402078,could germany world war ii attack soviet union ?,world war ii : country world war ii ? country benefited war ?,0,0.0,0.0,36,0.7894736842105263
402079,beautiful woman country ?,handsome man beautiful woman country ?,1,0.0,0.0,13,0.918918918918919
402080,money importance life ?,money really important living life ?,1,0.0,0.0,15,0.9032258064516129
402081,employees eastman kodak good work-life balance ? differ across positions departments ?,employees eastman chemical good work-life balance ? differ across positions departments ?,0,0.0,0.0,7,0.9777777777777777
402082,dna polymer ?,dna ?,0,0.0,0.0,8,0.5882352941176471
402083,ssl mean ?,https/ssl ?,0,0.0,0.0,9,0.5
402084,go back android 4.4.4 kitkat htc one m8 updated 5.0.1 lollipop ?,iball 5.9l andriod 4.0.4 version . update android 4.4.4 kitkat version ?,0,0.0,0.0,49,0.8085106382978723
402085,movies everyone see ?,good movies watch ?,1,0.0,0.0,17,0.6153846153846154
402086,music groups similar plain white 's ?,groups similar avett brothers ?,0,0.0,0.0,17,0.8333333333333334
402087,difference arduino uno arduino due ?,difference arduino nano arduino uno ?,0,0.0,0.0,5,1.0
402088,would partner cheated ? would person cheat partner ?,qualifies cheating partner ?,0,0.0,0.0,33,0.7878787878787878
402089,melania trump intelligent ?,melania trump like person ?,0,0.0,0.0,10,0.8571428571428571
402090,meditation space like ?,meditation ?,0,0.0,0.0,11,0.8
402091,women gossip men ?,women pragmatic men ?,0,0.0,0.0,7,0.8
402092,google expected recruit manipal institute technology next 4 years ?,google come lnmiit near future campus placements ?,0,0.0,0.0,42,0.8421052631578947
402093,lost voter id . apply indian voter id duplicate online ?,transfer voter id card new address ?,0,0.0,0.0,39,0.7878787878787878
402094,buy frm books india ? study schweser books come default registration ?,best online frm course ( fintree maybe ) india addition schweser notes ?,0,0.0,0.07692307692307687,60,0.9090909090909091
402095,get meth system 3 days ?,get meth system asap ?,1,0.0,0.0,5,0.8695652173913043
402096,much marks secured aiims mbbs topper 2016 ?,sathvik reddy erla 's marks aiims ( air 1 ) ?,0,0.0,0.0,34,0.65
402097,get best legal support property transaction sydney ?,hire experienced professional property transaction sydney ?,1,0.0,0.0,25,0.8333333333333334
402098,"possible generate reverse gravitational waves eliminate earth gravity , thus manufacture real hover boards flying cars ?",artificially generate gravity ?,0,0.0,0.0,99,0.7368421052631579
402099,good software use create cheat sheets ?,good guake terminal cheat sheets ?,0,0.0,0.0,14,0.7878787878787878
402100,good alternative kindle ebook reader ?,good kindle alternatives open ( / open source ) ?,0,0.0,0.0,26,0.7777777777777778
402101,2g network become 3g network ?,3g faster 2g network ?,0,0.0,0.0,15,0.8
402102,safe eat raw pig sausage ?,safe eat raw hotdogs ?,0,0.0,0.0,10,0.7692307692307693
402103,nutritive values oats ?,nutritional value pomegranates ?,0,0.0,0.0,13,0.896551724137931
402104,remedy water softener overflowing ?,effects water softener overflowing ?,0,0.0,0.0,6,0.8823529411764706
402105,"sue german startup wasting 4 months work permit , firing joining giving bad reviews future employers ?",7th sem e & c student intership hledays ?,0,0.0,0.0,81,0.7111111111111111
402106,prepare net exam statistics ?,prepare net exam finance ?,0,0.0,0.0,8,0.9230769230769231
402107,long study ?,long study ?,0,0.0,0.0,0,1.0
402108,rotten eggs smell funny ?,hardboiled eggs smell like sulfur ?,0,0.0,0.0,17,0.7096774193548387
402109,good mach ( microsoft academy college hires ) - program ?,"want software engineer . go college programming school like app academy , bloc general assembly ? go programming school , chances getting job google facebook ?",0,0.0,0.0,124,0.782608695652174
402110,name give mathematics education blog ?,advice would give someone launching blog scratch help build following quickly ?,0,0.0,0.0,57,0.8372093023255814
402111,believe area 51 alien related base ?,think area 51 ?,0,0.0,0.0,25,0.7407407407407407
402112,use omegle ipod touch compared using twoo ?,use omegle ipod touch compared using cams.com ?,0,0.0,0.0,7,0.9473684210526315
402113,"difference reasoning , logical reasoning , verbal reasoning , data interpretation , verbal ability , quantitative aptitude competitive exam terms ?","difference logical , analytical , non-verbal verbal reasoning ?",0,0.0,0.0,104,0.8636363636363636
402114,likely world war iii future ?,"close world war three , bad would ?",1,0.0,0.0,20,0.7096774193548387
402115,odds trump assassinated inauguration day ?,would donald trump assassinated elected ?,1,0.0,0.0,23,0.8484848484848485
402116,brand endorsements mr. shivaji satam ?,brands mayank agarwal manish pandey endorsed ?,0,0.0,0.0,32,0.7222222222222222
402117,hillary disbarred ?,hillary clinton disbarred ?,1,0.0,0.0,8,0.8571428571428571
402118,order matrix movies watched ?,order matrix movie series ?,0,0.0,0.0,7,0.896551724137931
402119,girls usually mean say `` 'll kill '' ( without emoticon ) . thought behind ? best replies ?,mean girl says 'll probably sex ?,0,0.0,0.0,74,0.7272727272727273
402120,indicative someone borderline personality disorder ?,distinct symptoms borderline personality disorder ?,1,0.0,0.0,12,0.9714285714285714
402121,"student applicant successfully sued university incompetence , unprofessionalism , mishandling academic administrative matters ?",engineering college plays important role doesnt matter path making successful career ( cse student ) ?,0,0.0,0.0,96,0.8888888888888888
402122,2010 's worst decade since 1900 ? ?,2000s good fashion back ?,0,0.0,0.0,23,0.6470588235294118
402123,kind accent jodie foster ?,"mgr died riots tamil nadu , expected jayalalitha dies . people want express rioting ?",0,0.0,0.0,67,0.6666666666666666
402124,could contact specific user quora ?,directly contact person quora ?,1,0.0,0.0,17,0.9411764705882353
402125,major social faux pas avoid visiting syria ?,major social faux pas avoid visiting sweden ?,0,0.0,0.0,5,0.9302325581395349
402126,remedies weak sun vedic astrology ?,rahu vedic astrology ?,0,0.0,0.0,14,0.8648648648648649
402127,is/are middle name ( ) ?,"middle name , significance ?",1,0.0,0.0,20,0.7142857142857143
402128,u.s. kept making dividisons philippines neighbouring countries ?,u.s. always make deep division philippines neighbouring countries ?,1,0.0,0.0,15,0.9565217391304348
402129,take back ex boyfriend ?,ask ex get back together ?,1,0.0,0.0,18,0.7333333333333333
402130,set profile picture quora ?,add change quora profile picture ?,0,0.0,0.0,21,0.8484848484848485
402131,fill upsc 2016 form ?,fill cap form mba cet 2016 ?,0,0.0,0.0,18,0.8235294117647058
402132,best places visit coimbatore ?,best places see around coimbatore ?,1,0.0,0.0,10,0.875
402133,women like men sucking cocks ?,women like hairy men ?,0,0.0,0.0,15,0.7142857142857143
402134,commit suicide ?,best surest ways commit suicide ?,1,0.0,0.0,17,0.8148148148148148
402135,delete picture instagram ?,possible delete pictures deactivated instagram account ?,0,0.0,0.0,30,0.9142857142857143
402136,clean life ?,penis size ( length girth ) permanently increased ?,0,0.0,0.0,42,0.5517241379310345
402137,start sophomore would look good college application ?,"sophomore studying tier3 engineering college india . starting scratch , learn selected gsoc ?",0,0.0,0.0,68,0.8571428571428571
402138,burning coconut oil good bad ?,incomplete love stories ?,0,0.0,0.0,21,0.6428571428571429
402139,concrete specific benefits tony robbins seminars ?,tony robbins scam con artist ?,0,0.0,0.0,36,0.896551724137931
402140,bipolar disorder cured ?,"bipolar disorder treated ? , ?",1,0.0,0.0,9,0.8571428571428571
402141,duty lieutenant indian army ?,duties lieutenant indian army ?,1,0.0,0.0,3,0.9629629629629629
402142,donald trump better choice hillary clinton ?,hillary clinton better choice donald trump ?,1,0.0,0.0,26,1.0
402143,legacy donald trump 's 2016 presidential campaign ?,donald trump 's legacy ?,1,0.0,0.0,30,0.8780487804878049
402144,protein synthesis occur ?,describe role transfer rna protein synthesis ? important ?,0,0.0,0.0,37,0.7878787878787878
402145,democratic society look like ? examples ?,examples inequality society today ?,0,0.0,0.0,31,0.8571428571428571
402146,introduction people matrimonial sites ?,safe marry someone random matrimony site ?,0,0.0,0.0,25,0.8
402147,accurately hacksaw ridge depict wwii warfare ?,british biggest empire ?,0,0.0,0.0,32,0.6451612903225806
402148,never signed quora account . delete account ?,"’ delete quora account , ?",1,0.0,0.0,26,0.7878787878787878
402149,best hollywood actor time ?,best actor hollywood industry ?,1,0.0,0.0,15,0.9142857142857143
402150,clues knowing greek fire made ?,could possibly composition greek fire ?,0,0.0,0.0,25,0.8421052631578947
402151,"5,000 usd invest yield 5-10 % per month ?","$ 10,000 usd want invest , yield 5-10 % per month ?",1,0.0,0.0,11,0.9387755102040817
402152,13 year old either wants iphone 6s 7. one get ?,13 year old daughter either wants iphone 6s 7. gets good grades 's responsible . one get ?,1,0.0,0.0,43,0.9361702127659575
402153,"ca n't get angry , ?",ca n't get angry ?,1,0.0,0.0,2,0.9565217391304348
402154,muslim names suggest baby ? urdu origin quran .,"`` come baby , wo n't regret boy single . '' 's name song ?",0,0.0,0.0,46,0.8
402155,best triller books ?,good books ?,0,0.0,0.0,12,0.631578947368421
402156,start business ?,exactly start business ?,1,0.0,0.0,8,0.8461538461538461
402157,knowing play chords guitar enough ?,practice f chord guitar ?,0,0.0,0.0,19,0.8
402158,find purpose life ?,find aim life ?,1,0.0,0.0,7,0.6956521739130435
402159,interesting social networks ?,top social networks country ?,0,0.0,0.0,18,0.875
402160,best day timetable class 12 commerce student maths ?,student class 12 commerce maths . drop maths take physical education month august ?,0,0.0,0.0,60,0.8837209302325582
402161,plus 4 zip code 80721 ?,find zip code plus four ?,0,0.0,0.0,15,0.7272727272727273
402162,terra nova cancelled season 2 ?,terra nova renewed another season 2014 ? ?,0,0.0,0.0,17,0.7741935483870968
402163,inverted rotor-fed induction motor work ?,rotor fed induction motor work ?,1,0.0,0.0,10,0.9375
402164,difference following sentences `` would/could '' `` will/can '' ?,difference following sentences `` '' `` '' ?,0,0.0,0.0,21,0.918918918918919
402165,"division states basis religion , caste , ethnicity good ?",reservation system indian education system justified ?,0,0.0,0.0,38,0.7567567567567568
402166,"windows smart , connected things ?",bad windows 10 ?,0,0.0,0.0,28,0.6206896551724138
402167,good books preparing ssc cgl ?,books ssc cgl ?,1,0.0,0.0,15,0.72
402168,baseball created created ? sport affect u.s. ?,modern baseball created ?,1,0.0,0.0,34,0.8
402169,corporate culture like west pharmaceuticals ? culture different companies ?,corporate culture like raptor pharmaceuticals ? culture different companies ?,0,0.0,0.0,5,0.9743589743589743
402170,get rid stage fear ?,get rid stage fear ?,1,0.0,0.0,0,1.0
