id,question1,question2,is_duplicate,CosineSimilarity,JaccardSimilarity,Levenshtein,DiceSimilarity
79002,would good way promote small hotel ?,inexpensive ways increase business small hotel tourist town ?,0,0.0,0.0,40,0.7894736842105263
79003,best poetry authors ?,good poetry authors ?,0,0.0,0.0,4,0.8888888888888888
79004,sslc marksheet number board ?,happened debbie wasserman-schultz ? done democrat party ?,0,0.0,0.0,43,0.8205128205128205
79005,average salary cloud support associate amazon aws ?,average salary amazon cloud support engineer ii ( level 5 ) amazon cape town ?,0,0.0,0.0,35,0.9333333333333333
79006,lesser known important historical figures brunei people know ?,lesser known important historical figures palestine people know ?,0,0.0,0.0,8,0.975609756097561
79007,star wars : force awakens ( 2015 movie ) : finn 's parents ?,star wars : force awakens ( 2015 movie ) : [ spoilers ] rey 's parents ? luke 's daughter ?,0,0.0,0.0,34,0.8620689655172413
79008,contact yahoo ! customer service ?,contact yahoo customer service usa yahoo help ?,1,0.0,0.0,17,0.9142857142857143
79009,survive new york city making $ 18.00 hour ?,"17 basket contains 25 apples 15 oranges 10 mangoes . take 5 fruits , probability wiil get . ?",0,0.0,0.0,75,0.7692307692307693
79010,clear hotmail inbox ?,one still create hotmail account ?,0,0.0,0.0,19,0.8666666666666667
79011,must places visit kerala ( 6-7 days ) ?,best places visit kerala college students ?,1,0.0,0.09999999999999998,17,0.7317073170731707
79012,device driver programming good career setting ?,good generic scanner driver ?,0,0.0,0.0,35,0.896551724137931
79013,least patriotic countries europe ?,people country patriotic ?,0,0.0,0.0,23,0.9285714285714286
79014,add pdf button webpage ?,use php get pdf print webpage ?,0,0.0,0.0,16,0.8387096774193549
79015,freedom important ?,freedom important ?,1,0.0,0.0,0,1.0
79016,best way become freelancer ?,happens cellular respiration ? best describe step ?,0,0.0,0.125,39,0.7272727272727273
79017,"humans developed monkeys/apes ? n't something like evolved ( thinking ) tigers , crocodiles speices ?",apes evolve humans ? could n't species like reptiles evolve intelligent versions ?,0,0.0,0.0,66,0.8936170212765957
79018,"people consider one race , might many ? dna test ancestry ?",think saying `` '' referring race might ultimately futile ?,0,0.0,0.0,46,0.7692307692307693
79019,deemed cultural appropriation poc wear weaves ?,"cultural appropriation black women straighten hair , dye blonde , wear blue contacts ?",1,0.0,0.07692307692307687,56,0.8292682926829268
79020,best way kiss ?,makes bad kissers good kissers ?,0,0.0,0.0,22,0.6666666666666666
79021,cyrus mistry sacked sudden ?,cyrus mistry removed chairman tata sons ?,1,0.0,0.0,22,0.875
79022,recover data broken iphone ?,recover data broken iphone 5 ?,1,0.0,0.0,2,0.9696969696969697
79023,way decrypt .crypt12 whatsapp files without key ?,read whatsapp database messages ( crypt8 ) without rooting phone ?,0,0.0,0.0,48,0.7111111111111111
79024,"instant support @ ! 1800 : ||:2,5.1 : ||:49.1,9 avg antivirus tech support phone number ?",fix @ ~ 1.8009315079 avg antivirus technical support phone number ?,1,0.0,0.0,43,0.8064516129032258
79025,full form s.h.i.e.l.d ?,full form pro e ?,0,0.0,0.0,10,0.75
79026,best colleges aerospace engineering india ?,best aerospace engineer college india ?,1,0.0,0.11111111111111116,16,1.0
79027,"significance battle somme , battle compare contrast battle port arthur ?","significance battle somme , battle compare contrast battle eslands river ?",1,0.0,0.0,11,0.9
79028,unique identification number medicine ?,unique numbers program java ?,0,0.0,0.0,26,0.7272727272727273
79029,people share important divides ?,boost youtube views ?,0,0.0,0.0,21,0.5714285714285714
79030,fire emit light ?,fire emits light ?,1,0.0,0.0,1,0.9565217391304348
79031,best laptop 30k ?,best laptops available inr 30000 ( 30k ) ?,1,0.0,0.09999999999999998,25,0.8125
79032,syllabus fiitjee aits 2016–17 ?,data berkeley earth made available ?,0,0.0,0.0,30,0.5294117647058824
79033,build pc ?,build first pc ?,1,0.0,0.0,6,0.8181818181818182
79034,voodoo doll ?,voodoo dolls real ?,0,0.0,0.0,6,0.75
79035,reasons hdmi vga cable might work ?,make vga component cable ?,0,0.0,0.0,25,0.8
79036,safe hotels unmarried couples ahmedabad ?,safe hotels goa unmarried couples ?,0,0.0,0.0,14,0.9473684210526315
79037,like live hawaii ?,'s like live hawaii ?,1,0.0,0.0,3,0.9090909090909091
79038,iran 's leaders trusted ?,saudi arabia says 's willing take military action iran without u.s. support wake iran deal . saying ? implications ? mean deal kind iran ?,0,0.0,0.0,117,0.7027027027027027
79039,india win 20+ medals tokyo 2020 olympic ?,india win 10 gold medals 2020 ?,0,0.16518267266949663,0.09999999999999998,20,0.7777777777777778
79040,real tips improve work life balance ?,best ways create work life balance ?,1,0.0,0.09999999999999998,12,0.8888888888888888
79041,reason behind abrupt removal cyrus mistry ?,reason behind removal cyrus p. mistry position chairman tata group ?,1,0.0,0.0,39,0.9523809523809523
79042,train flight deck ?,train people work flight deck aircraft carrier ?,1,0.0,0.0,29,0.9090909090909091
79043,get rid depression ?,get rid depressing job ?,0,0.0,0.0,5,0.9230769230769231
79044,programming languages best learn ?,important programming languages learn nowadays ?,1,0.0,0.0,21,0.8823529411764706
79045,india pakistan go nuclear war ?,likely india-pakistan nuclear war ?,1,0.0,0.0,11,0.8888888888888888
79046,airbnb competitors ?,airbnb rivals ?,1,0.0,0.0,9,0.6666666666666666
79047,"everything spies , secret agents , assassinations secret , really know ? ever find ? found ?","real spy agents exist like indian movies ? , remain anonymous work secretly major issues ?",0,0.0,0.0,74,0.8936170212765957
79048,"'m 136 pound male , 19 years old , 5 ' 7 '' ! 10.5 % body fat , still extra fat stored belly , lower back , chest . ?","best ways reduce eliminate belly , abdominal , thigh fat ?",0,0.0,0.11111111111111116,91,0.7368421052631579
79049,bake pork chops oven long bake ?,"long take cook , shake , bake pork chops ?",0,0.0,0.0,28,0.9090909090909091
79050,algebra important ?,algebra important ?,1,0.0,0.0,0,1.0
79051,best way reduce weight ?,best ways lose weight ?,1,0.0,0.125,6,0.8
79052,"clinton drops due health problems , would replace ?",possible democrats find another candidate replace mrs. clinton due health issue ?,1,0.0,0.0,57,0.9
79053,problem getting attached people short span time always end hurting feeling n't reciprocated ?,mysql : avoid reading stale data slaves ? always need read master ?,0,0.0,0.0,63,0.7619047619047619
79054,jimmy wales make money ?,"jimmy wales make money , earning money wikipedia ? side business ?",1,0.0,0.0,42,0.8
79055,maxwell 's equations establish ?,maxwell 's equations ?,0,0.0,0.0,10,0.9411764705882353
79056,'s difference official language national language ?,difference official language national language ?,1,0.0,0.0,3,0.9375
79057,application mathematics various field ?,2 year experience mainframe storage administrator salary expect ibm ?,0,0.0,0.0,52,0.8
79058,population india increase 1947 ?,indian population increase independence ?,1,0.0,0.0,22,0.8823529411764706
79059,build girl 's trust ?,best way win girl 's trust ?,1,0.22634541416009382,0.4285714285714286,11,0.7857142857142857
79060,people think new macbook pro touch bar ?,review macbook pro ( 2016 ) ?,1,0.0,0.0,21,0.6842105263157895
79061,metals shiny ?,heaviest metals ?,0,0.0,0.0,12,0.8695652173913043
79062,top candidates us presidential election 2020 ?,would barack obama allowed run 2020 presidential election ?,0,0.0,0.0,33,0.8947368421052632
79063,symptoms snow allergy ?,symptoms tree allergies ?,0,0.0,0.0,7,0.896551724137931
79064,"eat stems weed , get high ?",'s best way get high eating weed ?,1,0.0,0.2222222222222222,24,0.7857142857142857
79065,java applet code calculator multiple numbers ?,java applet code calculator ?,0,0.0,0.0,17,0.8484848484848485
79066,feel like committing suicide ?,causes mind generate idea committing suicide ?,0,0.0,0.0,21,0.8387096774193549
79067,angle hour hand minute hand 12:30 pm ?,angle minute hand hour hand 11:59 ?,0,0.0,0.0,16,0.85
79068,transfer youtube videos downloaded android phone laptop ?,download youtube videos phone storage ?,0,0.0,0.0,33,0.95
79069,whos best rock band ?,best rock band time ?,1,0.0,0.125,10,0.8666666666666667
79070,best mobile 3000 ?,"india : best phone buy ( rs , inr ) 11-12k ?",0,0.0,0.09090909090909094,33,0.4444444444444444
79071,"christianists perceive , feel , understand , view , believe , and/or opine , dalits , shudras , dasa ?","nepalese perceive , feel , understand , view , believe , and/or opine , dalits , shudras , dasa ?",0,0.0,0.0,11,1.0
79072,husband ca n't cum even dontchaveceex almost 2xweeks ?,husband ca n't cum even dont sex almost 2 weeks ?,1,0.0,0.0,8,1.0
79073,take trump supporters realize got conned ?,trump supporters beginning realize 've conned ?,0,0.0,0.0,18,0.9
79074,ever used airbnbmultichat.com ?,ever used dropshipper.com ?,0,0.0,0.0,13,0.8235294117647058
79075,earn money online ?,earn money online easily ?,1,0.0,0.0,7,0.9565217391304348
79076,send letters kpop stars ?,pass kpop trainee korea ?,0,0.0,0.0,21,0.88
79077,movies entertainment make us learn something ? movie changed way thinking ?,line movie impressed almost changed way thinking ?,0,0.0,0.09090909090909094,40,0.9523809523809523
79078,good landing page conversion rates ?,mobile app landing pages good conversion rates ?,0,0.0,0.0,15,0.9411764705882353
79079,long would take learn programming well enough would able write apps like snapchat ?,long would take learn java ?,0,0.0,0.0,57,0.7567567567567568
79080,would best classification group dolphin ?,dolphins smarter humans ?,0,0.0,0.0,31,0.8333333333333334
79081,best web host starters ?,best web hosting ?,0,0.0,0.1428571428571429,9,0.782608695652174
79082,"considering getting pokémon game 3ds , get x/y , oras await sun/moon ?",get bottle caps pokemon sun moon ?,0,0.0,0.0,49,0.7
79083,effective krav maga self-defense compared martial arts ?,martial art better real-world scenario : muay thai krav maga ?,0,0.0,0.0,47,0.8181818181818182
79084,"drive edmonton auckland described , history cities compare contrast ?","ow drive edmonton auckland described , history cities compare contrast history ottawa ?",1,0.0,0.0,18,0.9777777777777777
79085,feel watch ravish kumar reporting news story brilliantly see journalists behaving like idiots news channels ?,best news channel watch ?,0,0.0,0.125,89,0.6486486486486487
79086,good books read time management ?,best books time management ?,1,0.0,0.125,9,0.9285714285714286
79087,countries easy live expatriates ?,countries american expatriates live ?,0,0.0,0.0,13,0.9411764705882353
79088,question marked `` needs improvement ? '',question marked needing improvements ?,1,0.0,0.0,10,0.918918918918919
79089,’ easiest way learn javascript ?,easiest way learn javascript ?,1,0.0,0.125,2,0.9696969696969697
79090,transfer money one bank another ?,transfer money one country another country ?,0,0.0,0.0,14,0.8666666666666667
79091,movie impressed ? ?,movie impressed ?,0,0.0,0.0,2,1.0
79092,pornography bad ?,bad watch porn ?,1,0.0,0.0,14,0.8
79093,ca n't obama re-elected ?,ca n't obama re-elect president ?,1,0.0,0.0,8,0.9090909090909091
79094,'s difference turnover sales ?,differences turnover sales ?,1,0.0,0.0,4,0.9696969696969697
79095,choke packets internet terminology ?,"best , complete , & accurate accounting business terminology app itunes ?",0,0.0,0.09090909090909094,48,0.8421052631578947
79096,electronic signal travels speed light ?,degree actuarial science want pursue career statistics possible ?,0,0.0,0.0,45,0.8571428571428571
79097,interview questions civil engineer ?,questions civil engineer interview ?,1,0.0,0.0,20,1.0
79098,best way learn stock markets ?,learn stock market investing ?,1,0.0,0.0,18,0.8125
79099,get invitations show 'comedy nights kapils ' ?,see comedy nights kapil live show ?,0,0.0,0.0,29,0.975609756097561
79100,fedex corporation 's ipo price ? would 100 shares worth today ?,cintas corporation 's ipo price ? would 100 shares worth today ?,0,0.0,0.0,6,0.9545454545454546
79101,use simultaneous equations ?,simultaneous equations used ?,1,0.0,0.0,9,0.9629629629629629
79102,extraordinary human abilities : professional regurgitation work ?,one work like professional ?,0,0.0,0.0,43,0.7368421052631579
79103,best hackathon prizes ?,'s largest hackathon ever held ?,0,0.0,0.0,14,0.7272727272727273
79104,best way prevent cancer ?,prevent cancer ?,1,0.0,0.0,9,0.8333333333333334
79105,makes virat kohli consistent ?,much money virat kohli make year ?,0,0.0,0.0,17,0.9090909090909091
79106,"actors actresses really sex shooting scene ? , make real ?",actors slower actions shooting scenes look normal camera ?,0,0.0,0.0,32,0.8888888888888888
79107,get hiv infrcted blood dropping eyes ?,"eyes started getting red wearing new glasses , particularly two sides iris . two red hands holding iris . using cylindrical lens ? see clearly eyes , blood vessels started appearing eyes . ?",0,0.0,0.0,158,0.8571428571428571
79108,function eyepiece lens ?,functions eyepiece microscope ?,1,0.0,0.0,10,0.896551724137931
79109,causes dry vagina ?,causes dry heaving dogs ?,0,0.0,0.0,9,0.9333333333333333
79110,"could think one sentence whole life , would ?",explain life one sentence ?,0,0.0,0.0,29,0.7096774193548387
79111,red flags ignored initial stages eventual failed romantic relationships ?,"deceitful befriend someone hopes would eventually become attracted , especially say n't want romantic relationship ?",0,0.0,0.0,71,0.8636363636363636
79112,'s best news site ?,best news site ?,1,0.0,0.1428571428571429,3,0.9473684210526315
79113,possible 'trans-species ' way people transgender ?,two different species offspring zootopia ? see future sequels ?,0,0.0,0.0,42,0.8
79114,japan 's internet censored ?,internet censored japan ?,1,0.0,0.0,15,0.9655172413793104
79115,non-us citizen start business us ?,non-us citizen start small business us ?,1,0.0,0.0,6,0.9375
79116,one earn money home online india ?,home businesses india earn money home ?,0,0.0,0.0,28,0.8571428571428571
79117,train memory ?,ways train memory ?,1,0.0,0.0,5,0.9166666666666666
79118,course best nowdays ?,course best nowaday ?,1,0.0,0.16666666666666663,2,1.0
79119,chance hillary clinton conceding nomination bernie sanders ?,chances bernie sanders winning democratic nomination hillary clinton ?,0,0.0,0.0,40,0.972972972972973
79120,like flying bangkok manila touristic cities compared kolkata ?,like flying bangkok manila touristic cities compared dhaka ?,0,0.0,0.0,5,0.9767441860465116
79121,differences battlefield main series bad company spinoffs ?,final fantasy ? main story series ? different characters every new game series ? even related ?,0,0.0,0.0,71,0.8421052631578947
79122,"makes short , skinny guys attractive women ?",guys approach girls looks ?,0,0.0,0.0,34,0.7428571428571429
79123,usa next president ?,"usa next president , trump clinton ?",1,0.0,0.0,16,0.8387096774193549
79124,people actively control emotions ?,much control one one 's emotions ?,1,0.0,0.0,21,0.7741935483870968
79125,lose weight 1 months ?,best ways lose weight ?,0,0.0,0.125,16,0.7857142857142857
79126,method unlock icloud id lock anything ?,unlock icloud lock iphone ?,1,0.0,0.0,16,0.8
79127,get rid acne scars ?,get rid acne effect ?,1,0.0,0.0,6,0.9166666666666666
79128,singapore antagonising china south china sea given even claimant territories ?,singapore mishandle south china sea issue given recent tussle words two countries ?,0,0.0,0.0,44,0.9473684210526315
79129,learn turkish language ?,learn turkish ?,1,0.0,0.0,9,0.9629629629629629
79130,france 's economic activities compare contrast mexico ?,france 's economic activities compare contrast india ?,0,0.0,0.0,5,0.9411764705882353
79131,situations teenagers go pregnancy ?,situations teenager goes pregnancy ?,0,0.0,0.0,3,1.0
79132,`` transabled '' people affirmed desire become disabled ?,disabled people friendly strangers ?,0,0.0,0.0,34,0.8333333333333334
79133,long crystal meth stay system ?,long meth detected urine drug screen ?,1,0.0,0.0,25,0.8387096774193549
79134,"every day life , whatever happens either positive negative , keep mind cool situation ?","everyday think changing life , inside dying every day . work 10 hours day . life become unbearable . 25 , single , unhappy , unhealthy , lazy negative person . ?",0,0.0,0.0,114,0.8727272727272727
79135,true 1 year human equal 7 years dog ?,true dogs age 7 years every one human year ?,1,0.0,0.0,29,0.8888888888888888
79136,'s mac-friendly way reformat 1:1 video 16:9 ?,best bank opening account online ?,0,0.0,0.125,33,0.55
79137,south korean culture become popular across asia ? helped become ?,korean wave become popular ?,0,0.0,0.0,40,0.8
79138,determine molarity concentrated nitric acid ?,measure molarity concentrated nitric acid ?,1,0.0,0.0,7,0.9333333333333333
79139,phrase `` 're getting last nerve '' means ?,`` glide '' mean phrase ?,0,0.0,0.0,31,0.9090909090909091
79140,person always appear top likers instagram pictures ?,instagram top search listed account ( person ) n't searched ?,0,0.0,0.0,47,0.8
79141,things new employees know going first day merchants bancshares ?,things new employees know going first day trico bancshares ?,0,0.0,0.0,8,1.0
79142,war happen india pakistan ?,"disaster effect , nuclear war breaks india pakistan ?",1,0.0,0.0,31,0.7878787878787878
79143,uses nonmetals ?,nonmetals conduct heat ? ?,0,0.0,0.0,17,0.88
79144,social service children norway strict ?,women attracted men attractive faces little muscle height ?,0,0.0,0.09090909090909094,44,0.8648648648648649
79145,science papers written differently papers journals ?,many journal papers senia sheydvasser written phd far ?,0,0.0,0.0,42,0.9
79146,learn english ?,ways improve english ?,1,0.0,0.0,11,0.7857142857142857
79147,fighting : larger men necessarily harder knock smaller men ?,"jaime lannister vs. legolas greenleaf fight ( open field ) , would win ?",0,0.0,0.09999999999999998,56,0.7111111111111111
79148,melania trump work us illegally ?,melania trump work us illegally ?,1,0.0,0.0,0,1.0
79149,top hedge funds hong kong ?,top quant hedge funds hong kong ? prop trading firms ?,0,0.0,0.0,27,0.8484848484848485
79150,track someone using phone number ?,find someone using cell phone number ?,0,0.0,0.0,10,0.8333333333333334
79151,review micromax canvas engage ?,review micromax canvas 5 ?,0,0.0,0.0,6,0.9333333333333333
79152,get followers quora ?,get quora followers ?,1,0.0,0.0,12,1.0
79153,many times bank exams conducted year ?,many times banking exams conducted year ?,0,0.0,0.0,3,0.972972972972973
79154,safe invest bitcoin 2016 ?,wise invest bitcoins 2016 ?,0,0.0,0.0,4,0.9090909090909091
79155,increase organic traffic websites ?,increase traffic blog ( www.midnightexpressions.wordpress.com ) ?,1,0.0,0.0,44,0.7692307692307693
79156,"job opportunities pune mechanical engineer fresher , better bangalore core industry ?",fresher . chance getting mechanical engineering job bangalore ?,0,0.0,0.0,51,0.8571428571428571
79157,mentoring helped integym ?,mick allow trump use rolling stones music ?,0,0.0,0.0,31,0.7272727272727273
79158,employability skills mnc ?,employable skills ?,0,0.0,0.0,8,0.896551724137931
79159,get high quality weed ( marijuana ) kerala ?,like high marijuana sources thc ?,0,0.0,0.0,29,0.7692307692307693
79160,found best quality freshest meat sydney ?,found high quality meats sydney ?,1,0.0,0.0,14,0.918918918918919
79161,easiest question ever asked jee ?,easiest questions asked jee ?,1,0.0,0.0,5,0.9333333333333333
79162,hollywood actors actresses really engage sexual intercourse shooting sex scenes ?,actors really sex filming hollywood bollywood movie ?,1,0.0,0.0,57,0.8780487804878049
79163,women : girls wish girls knew ?,l see viewed videos instagram ?,0,0.0,0.0,25,0.7741935483870968
79164,"'beti bachao , beti padhao ' ?","objectives 'beti bachao , beti padhao ' abhiyaan pm modi ?",1,0.0,0.0,28,0.8235294117647058
79165,websites similar ebay ?,websites similar ebay ?,1,0.0,0.0,0,1.0
79166,"think narendra modi 's decision banning 500rs & 1000rs notes ? effects , make corruption free india ?",think rbi 's new move banning 500 1000 notes ?,1,0.0,0.0,63,0.8085106382978723
79167,get bollywood actor/actress 's mobile number ?,bollywood actresses sex producers actors promoting movies getting chance chief roles movies ?,0,0.0,0.0,67,0.8444444444444444
79168,procedure/step step open company india ?,steps start company india ?,1,0.0,0.0,18,0.9375
79169,get better grades mathematics ?,get better grades maths ?,1,0.0,0.0,6,0.9230769230769231
79170,best institute piping courses provides best placements assurance ?,best institute piping engineering ?,1,0.0,0.125,36,0.7741935483870968
79171,attributes scientist name sir johann heinrich lambert ?,anyone give write information graphic card ? graphic card name zotac 210 synergy edition tc1g 64bit ddr3,0,0.0,0.0,82,0.6222222222222222
79172,dont hate parents make eat ?,"dont hate , relatives force eat ?",1,0.0,0.0,11,0.7096774193548387
79173,jerry garcia die ?,jerry garcia experience ?,0,0.0,0.0,8,0.8333333333333334
79174,suitable inpatient drug alcohol rehab center near bond county il ?,suitable inpatient drug alcohol rehab center near morgan county il ?,0,0.0,0.0,5,0.9743589743589743
79175,connect iphone samsung smart tv ?,connect cpu smart tv ?,0,0.0,0.0,12,0.9032258064516129
79176,prepare cat 2017 ?,prepare cat 2017 august ?,1,0.0,0.0,7,0.8888888888888888
79177,difference insurgency insurrection ?,difference insurgency terrorism ?,0,0.0,0.0,9,0.967741935483871
79178,one improve his/her decision making skills ?,improve quick decision making skills ?,1,0.0,0.0,11,0.8947368421052632
79179,become porn star ?,become pornographic actor ?,1,0.0,0.0,11,0.8571428571428571
79180,remove screen overlay j7 2016 ?,turn screen overlay detected samsung galaxy j7 prime ?,1,0.0,0.0,35,0.7317073170731707
79181,improve writings quora ?,improve quora writing skills ?,0,0.0,0.0,13,0.9444444444444444
79182,"study , remember everything . exam , forget everything . ca n't remember word properly everything shuffled mind . improve memory ?",going write cat 2018 wanted start preparing . topic need start preparation ? books need refer ?,0,0.0,0.0,92,0.72
79183,'s quickest painless way commit suicide ?,insane ways commit suicide ?,1,0.0,0.0,16,0.8571428571428571
79184,installed update galaxy j5 pc ( smart switch ) try power starts go green nothing shows . ?,"using quora app iphone try click new notifications n't respond , 's going ?",0,0.0,0.0,67,0.76
79185,happen fbi director james comey election ?,'s going happen fbi director james comey ?,1,0.0,0.0,18,0.926829268292683
79186,determines amount shares company ?,value shares company determined ?,0,0.0,0.0,26,0.9444444444444444
79187,worst experiences travelling ?,worst experiences travelling alone train ?,0,0.0,0.0,12,1.0
79188,non disclosure agreement ?,must disclosure agreement instead non disclosure agreement ?,0,0.0,0.0,34,1.0
79189,buy photo los angeles city sign wildfire background hangs office tnt 's `` closer '' ?,los name los angeles city means ?,0,0.0,0.0,61,0.6842105263157895
79190,napoleon lose battle waterloo ?,napoleon lose battle waterloo ?,1,0.0,0.0,0,1.0
79191,worth studying abroad indian students ?,would cost studying mbbs abroad indian students ?,0,0.0,0.0,13,0.8888888888888888
79192,mind-blowing vehicle accessories exist people n't know ?,best new car technology people n't know ?,1,0.0,0.09999999999999998,31,0.8372093023255814
79193,give example much work law students university get ?,android application developer 2.8 years experience . know programming get android job mnc companies ?,0,0.0,0.0,80,0.8571428571428571
79194,uggs still style ?,uggs ?,1,0.0,0.0,12,0.6666666666666666
79195,"vector zero magnitude , meaningful call vector ?",zero vector magnitude direction . even vector ? mean vector without magnitude direction ?,1,0.0,0.0,59,0.8421052631578947
79196,"icloud , delete photos phone ?","upload iphone 5s photos icloud , delete iphone 5s ?",1,0.0,0.0,31,0.9375
79197,macbook pro 2016 worth ?,think new macbook pro apple announced 2016 ?,1,0.0,0.0,28,0.85
79198,implementation next mbbs good bad ?,national exit test ( next ) implemented medical students ?,0,0.0,0.0,41,0.8235294117647058
79199,marvel superheroes technically mutants ?,marvel character admire ?,0,0.0,0.0,25,0.7741935483870968
79200,score neet get 100 % scholarship manipal ? even scholarships year ?,much marks score neet 2 get scholarship kmc manipal ?,1,0.0,0.0,46,0.8
79201,medical internships cambodia ?,good medical internships ?,0,0.0,0.0,14,0.9411764705882353
79202,quora definable censorship mechanism ?,"quora censor questions answers , ?",0,0.0,0.0,25,0.7058823529411765
79203,molecular mass caffeine ?,molecular mass ?,0,0.0,0.0,9,0.88
79204,seo ranking benefit keyword rich anchor text footer websites pointing site ?,seo benefits adding events google calendar website ?,0,0.0,0.0,50,0.8205128205128205
79205,find apple imei number iphone ?,imei check iphone ?,1,0.0,0.0,17,0.6666666666666666
79206,ever lose weight life ?,best way 've ever lost weight ?,0,0.0,0.2222222222222222,19,0.8387096774193549
79207,virus cause infection ?,"amnesty blue cross , peta , one needed world ?",0,0.0,0.0,35,0.6666666666666666
79208,call person 's face want see voice want hear long tiring day ?,apply summer research program high school students already lab access personally emailing ?,0,0.0,0.0,68,0.8292682926829268
79209,indians love porn stars ?,"indian view porn star , view ?",0,0.0,0.0,12,0.896551724137931
79210,mean someone says feelings degree ?,mean someone says `` feelings '' ?,0,0.0,0.0,9,0.8666666666666667
79211,"signs observe , tell girl single ?",could meet find girls date bangalore ?,0,0.17291311558793077,0.0,27,0.75
