id,question1,question2,is_duplicate,CosineSimilarity,JaccardSimilarity,Levenshtein,DiceSimilarity
400864,much possible get home state posting tax assistant ssc cgl ?,possible get home state postings ssc cgl ?,0,0.0,0.0,18,0.9411764705882353
400865,fatal pneumonia ?,pneumonia diagnosed ?,0,0.0,0.0,16,0.7692307692307693
400866,c++ python technical interviews ?,country doesnot astronomical courses ?,0,0.0,0.0,25,0.7647058823529411
400867,improve indian education system ?,india revamp education system ?,1,0.0,0.0,12,1.0
400868,overcome insomnia ?,get rid insomnia ?,1,0.0,0.0,7,0.8
400869,crazy prison stories ?,prison smell like ?,0,0.0,0.0,14,0.6923076923076923
400870,keep relationships ?,best way keep relationship ?,0,0.0,0.0,10,0.9032258064516129
400871,get journalism internship ?,best way get journalism ?,0,0.0,0.0,20,0.8571428571428571
400872,best movies patriotism ?,best movies depicting patriotism ?,1,0.0,0.0,10,0.8666666666666667
400873,biological needs pilots met long distance jet fighter missions ?,fighter jet pilots pee poop ?,1,0.0,0.0,46,0.8235294117647058
400874,best new feature iphone 6 ?,best features iphone 6 ?,1,0.0,0.0,5,0.9696969696969697
400875,"searching way increase likes instagram pictures , anyone help ?",good substitute thyme leaves recipe ?,0,0.0,0.0,50,0.8292682926829268
400876,hapen india prints lot naotes ?,ca n't government print money resolve debts ?,0,0.0,0.0,29,0.7647058823529411
400877,procedure change address driver 's license ?,renew indian license issued delhi rta ( due expire ) change address ( another state ) ?,0,0.0,0.0,61,0.8205128205128205
400878,get meth system 3 days ?,milk flush meth system ?,1,0.0,0.0,17,0.64
400879,widely accepted holographic principle among today 's respected physicists ?,holographic principle accepted physicists ?,1,0.0,0.0,34,0.918918918918919
400880,software support engineer 's role ?,role software support engineer ?,1,0.0,0.0,13,0.9696969696969697
400881,best way avoid business failure ?,prevent business failure ?,1,0.0,0.0,13,0.8484848484848485
400882,frangible ammo good ?,frangible ammo ?,1,0.0,0.0,5,0.9629629629629629
400883,"wake , work , eat , rest , repeat . watch people , make judgments , learn , move . silent watcher . happy life anymore ?","`` looking water '' non-restrictive clause sentence , `` 'm desert , looking water '' ? comma go `` looking '' ?",0,0.0,0.0,91,0.8163265306122449
400884,ca n't u.s. government print money address poverty ?,ca n't government print money resolve debts ?,0,0.0,0.0,16,0.9
400885,delete yahoo account permanently ? delete yahoo account temporary ?,disable yahoo account ?,0,0.0,0.0,47,0.8125
400886,fall love ?,think people fall love ?,1,0.0,0.0,13,0.7272727272727273
400887,industrial mindset reforms also needed implement reforms engineering education india ?,much would collector pay michael phelp 's olympic medals ?,0,0.0,0.0,68,0.8108108108108109
400888,hard educated liberals empathize trump supporters ?,hard evidence supports claims trump corrupt ?,0,0.0,0.0,29,0.8888888888888888
400889,one prepare gmat preparing cat ?,prepare cat ?,0,0.0,0.0,19,0.7619047619047619
400890,happens n't swing hands walk ?,people move arms walking ?,0,0.0,0.0,20,0.75
400891,convertible debt equity super-angel round ?,difference equity seed round convertible debt round ?,0,0.0,0.0,34,0.8717948717948718
400892,akshay kumar canadian citizenship ?,akshay kumar take canadian citizenship ?,0,0.0,0.0,5,1.0
400893,"phosphorescence : dry semen really glow black light like show csi ? , work ?",materials time fluorescent phosphorescent depending wavelength light used excite electrons ?,0,0.0,0.0,67,0.8
400894,searching engine marketing ?,search engine ?,0,0.0,0.0,13,0.88
400895,differences similarities indonesia india ?,india good sports china ?,0,0.0,0.0,30,0.7586206896551724
400896,best friends episodes ?,best episode friends ?,1,0.0,0.0,10,1.0
400897,"value addition micromaster course edx , apart learning ?",get course catalogue online course provider ? [ apart coursera ],0,0.0,0.0,43,0.8717948717948718
400898,'s new year 2017 resolution improve daily life routine ?,'s new year resolutions 2017 accomplish goal ?,1,0.0,0.0,27,0.875
400899,avoid depression anxiety ?,overcome anxiety ?,1,0.0,0.0,13,0.8275862068965517
400900,mormons baptize dead catholics already baptized ?,say 'm `` helping '' someone cyber-stalk shame beyond anonymous identity . kind `` help '' ? imaginary ?,0,0.0,0.0,83,0.8181818181818182
400901,bad put almond extract baking section face ?,almonds bad environment/water-hungry ?,0,0.0,0.0,36,0.7441860465116279
400902,get pink lips like girls natural ones ?,naturally get pink lips ?,1,0.0,0.0,29,0.9333333333333333
400903,boost youtube videos 5000 youtube views free ?,boost youtube videos 5000 youtube views ?,0,0.0,0.0,5,0.9375
400904,"key differences business intelligence ( bi ) , business analytics big data ?","difference data science , data analytics business intelligence ?",1,0.0,0.0,46,0.9230769230769231
400905,wrong parents treat kids friends ?,parents think 's wrong beat kids ?,0,0.0,0.0,24,0.8823529411764706
400906,origin saying `` knock wood '' ?,origin `` knocking wood '' ?,1,0.0,0.0,10,0.896551724137931
400907,list waterfalls india ?,top 5 waterfalls india ?,1,0.0,0.0,5,0.896551724137931
400908,bichon frise lick much ?,would dog lick crate ?,0,0.0,0.0,16,0.6451612903225806
400909,learn sanskrit ?,best way learn sanskrit ?,1,0.0,0.0,9,0.88
400910,diabetes cause erectile dysfunction ?,stress one cause erectile dysfunction ?,0,0.0,0.0,10,0.9696969696969697
400911,think 2016 us presidential election ?,win 2016 u.s. presidential election ?,0,0.0,0.0,5,0.9047619047619048
400912,ten things president trump first 100 days ?,best guess donald trump attempt get done first 100 days president ?,1,0.0,0.0,41,0.9
400913,men take much time accepting marriage ? even physical relationship ?,men : hurt much get kicked balls ?,0,0.0,0.0,48,0.8205128205128205
400914,play nds files ubuntu ?,rename c++ file linux ubuntu ?,0,0.0,0.0,14,0.7096774193548387
400915,best kannada movies time ?,think best kannada director time ?,0,0.0,0.0,14,0.8666666666666667
400916,men likely assholes compared women ?,men egoistical compared women ?,0,0.0,0.0,13,0.8571428571428571
400917,people think america ?,people really think america ?,1,0.0,0.0,7,0.967741935483871
400918,power supply need power 25 chips 5w 12v smd leds ?,"'m trying apply masters public policy , less 3.0 gpa . still get ?",0,0.0,0.0,47,0.6363636363636364
400919,okay physical relationship indian girl ?,stage relationship indian girl decide go physical boyfriend ?,0,0.0,0.0,41,0.918918918918919
400920,universe come existence ?,everything universe come exist ?,1,0.0,0.0,15,0.9032258064516129
400921,main reasons students stony brook university n't graduate time ?,"main reasons students universities us n't graduate time ( , within four years ) ?",0,0.0,0.0,41,0.8095238095238095
400922,non-metals periodic table ?,non-metals periodic table ?,1,0.0,0.0,0,1.0
400923,get online mobile income ?,get mobile income online ?,1,0.0,0.0,13,1.0
400924,sats ?,sat exam ?,0,0.0,0.0,5,0.7692307692307693
400925,would tackle fear vast size chemistry jee adv . 2017 ?,ant start power bank business.what procedures ? much money needed start ?,0,0.0,0.0,55,0.75
400926,things one know starting startup ?,learn entrepreneur start startup ?,0,0.0,0.0,18,0.7407407407407407
400927,death negative connotation ? ?,`` wannabe '' negative connotation ?,0,0.0,0.0,14,0.7857142857142857
400928,data structures ?,data structures ?,0,0.0,0.0,0,1.0
400929,post google streetview image facebook ?,safe use app images app review posts play store ?,0,0.0,0.0,35,0.8648648648648649
400930,start studying usmle mbbs india ? exact procedure applying usmle ?,ok start preparing usmle year complete mbbs ?,0,0.0,0.0,44,0.9230769230769231
400931,popular writer quora ?,followed/popular writer quora ?,1,0.0,0.0,9,0.896551724137931
400932,best mosquito repellent ?,good mosquito repellents dogs ?,0,0.0,0.0,10,0.9032258064516129
400933,possible access ( api ) watch-history videos youtube people permissions granted ?,possible grant access private youtube video someone else ?,0,0.0,0.0,47,0.8888888888888888
400934,green tea help reduce belly fat ?,green tea reduce weight ? work ? many glasses daily ?,1,0.0,0.0,34,0.7567567567567568
400935,"teacher , worst parent-teacher conference endured ?","parent , worst parent teacher conference endured ?",0,0.0,0.0,7,0.9714285714285714
400936,ways using microsoft excel people n't usually know get confused ?,fun facts big technology companies people n't know ?,0,0.0,0.0,46,0.8888888888888888
400937,people swear ? ca n't stop ?,people swear ?,1,0.12981847270170024,0.0,14,0.8333333333333334
400938,zyropathy ?,lucid dreaming people ?,0,0.0,0.0,19,0.48
400939,501st always sent suicidal missions succeded ?,pakistan really preparing war neighbor country india ?,0,0.0,0.0,41,0.75
400940,job scope tendering engineer ?,scope electrical engineering jobs abroad ?,0,0.0,0.0,27,0.9375
400941,people believe life ends death ?,suppose mother loved much . went heaven damned hell . could happy knowing loved one hell ?,0,0.0,0.0,70,0.717948717948718
400942,"philosophy , pure introspection ever replace science means know universe ?",philosophy science : empirical ( scientific ) method validate means know understand world ?,0,0.0,0.0,53,0.8695652173913043
400943,mechanic engineer . ?,mechanical engineers ?,0,0.0,0.0,4,0.88
400944,article 43 indian constitution say ?,meant article 18 indian constitution ?,0,0.0,0.0,12,0.8235294117647058
400945,"'m 20s , $ 1 million invest . bad idea put & p 500 ?",'ve 1 million dollars . invest buy business ( possibly restaurant ) ?,0,0.07955734128325527,0.0,48,0.7916666666666666
400946,"could change one feature , would ?",could change one thing would ?,1,0.0,0.0,8,0.875
400947,best adult hollywood movie dubbed hindi ?,company dubbed hollywood movies hindi ?,0,0.0,0.0,19,0.918918918918919
400948,views moms sex sons ?,"adopted son says , '' feeling mom ?",0,0.0,0.0,26,0.5517241379310345
400949,stop recurring negative thoughts ?,fight negative thoughts ?,0,0.11265815519880608,0.0,14,0.8666666666666667
400950,best ways gain weight healthy way ?,best weight gain treatment gaining weight ?,1,0.0,0.0,24,0.8571428571428571
400951,hate salman khan much ?,classic indian movies watch ?,0,0.0,0.0,19,0.7586206896551724
400952,cure vitiligo ?,cure vitiligo ?,1,0.0,0.0,0,1.0
400953,view shared preferences data android studio ?,`` food ingredient hate ? share interesting experience consuming ? `` ?,0,0.0,0.0,54,0.8421052631578947
400954,tech mahindra good company fresher ?,good tech mahindra freshers ?,1,0.0,0.0,19,0.9411764705882353
400955,examples e=mc2 ?,good examples [ math ] e=mc^2 [ /math ] ?,1,0.0,0.0,25,0.7272727272727273
400956,hide app phone ?,app hide images photos android phone ?,0,0.0,0.0,23,0.8
400957,brain transplant done ?,brain transplant really possible ?,1,0.0,0.0,13,0.9285714285714286
400958,prefer : job study ?,prefer job study ?,1,0.0,0.0,2,0.9655172413793104
400959,believe individual ’ right firearms ?,individuals right gun ?,1,0.0,0.0,18,0.8484848484848485
400960,busy people make time exercise ?,busy person make time exercise ?,1,0.0,0.0,4,0.9444444444444444
400961,living organisms made ?,observed malpractice school.write letter headmaster discussing least 3 suggest 2 ways check ?,0,0.0,0.0,79,0.7
400962,better laptop : hp g6 asus k53e ?,"better , asus x550ld-xx301h hp pavilion 15-p077tx ?",0,0.0,0.0,35,0.6818181818181818
400963,lose weight reduce waist quickly ?,lose weight fast perfect weight loss plan ?,1,0.0,0.0,21,0.7777777777777778
400964,android ( operating system ) : best root apps oneplus one running cm12.1 later ?,"kingroot root sony xperia z2 , app use root phone without using pc ? running lollipop 5.1.1 .",0,0.0,0.0,63,0.7450980392156863
400965,best things cancun ?,cool things cancun ?,1,0.0,0.0,4,0.8461538461538461
400966,best free video editing software ?,free best video editing software ?,1,0.0,0.0,8,1.0
400967,make girlfriend happy ?,beautiful thing make girlfriend happy ?,0,0.0,0.0,16,0.9142857142857143
400968,fiit-jee patna olympiad preparation kvpy ?,best coaching patna iit-jee ?,0,0.0,0.0,32,0.6285714285714286
400969,best thing lucid dreaming ?,best thing lucid dreaming ?,0,0.0,0.0,0,1.0
400970,"chances clearing rbi grade b , depr ro first attempt , masters economics ? work experienc interview hurdle ?",attempt hit ball cricket ball goes boundary without touching batsman 4 byes dead ball ?,0,0.0,0.0,85,0.875
400971,airtel voice call 4g prepaid plans ?,girl 's hostels near made easy hyderabad ? kindly suggest good girl 's hostel preferably single rooms near premises ( walkable distance ) .,0,0.0,0.0,115,0.6818181818181818
400972,phone best buy 15k ?,best phone 15000 ?,1,0.0,0.0,14,0.8571428571428571
400973,even realistic expect man wo n't cheat ? ( emotionally/physically/flirting online/flirting talking exes ) ?,anything real ?,0,0.0,0.0,94,0.631578947368421
400974,best books java beginners ?,best java books ?,1,0.0,0.0,13,0.8461538461538461
400975,"sahara , average temperatures compare ones antarctica ?","sahara , average temperatures compare ones great sandy desert ?",1,0.0,0.0,16,0.918918918918919
400976,examples naturalistic observation research title ?,naturalistic observation ? examples naturalistic observation research title ?,1,0.0,0.0,27,1.0
400977,best sites download movies ?,best sites downloading movies ?,1,0.0,0.0,3,0.967741935483871
400978,must places visit kerala ( 6-7 days ) ?,places visit going kerala week friends ?,1,0.0,0.0,23,0.6829268292682927
400979,siblings tend hate ?,indigo girls secretly hate ?,0,0.0,0.0,16,0.8275862068965517
400980,"zeus rule family kind relationship dionysus , son ?","zeus rule family kind relationship hermes , son ?",0,0.0,0.0,7,1.0
400981,much pure wool pashmina shawl cost india ?,animals killed pashmina wool ?,0,0.0,0.0,28,0.8484848484848485
400982,improve speaking ?,get better public speaking ?,1,0.0,0.0,16,0.7333333333333333
400983,read harry potter series considering fact already seen movies numerous times ?,one read harry potter series ? worth reading ?,0,0.0,0.0,47,0.8108108108108109
400984,"meaning `` 'd '' english ? `` '' , `` '' , `` would '' `` could '' ?",胖口 mean english ?,0,0.0,0.0,57,0.6875
400985,wear underwear ?,wear underwear ?,1,0.0,0.0,0,1.0
400986,cotton hill die ?,cotton hill die ?,1,0.0,0.0,0,1.0
400987,people make money quora ?,people making money quora ?,1,0.0,0.0,3,0.9333333333333333
400988,get job ibm ?,ways get job ibm ?,1,0.0,0.0,5,0.8333333333333334
400989,cope loss husband ?,cope loss parent ?,0,0.0,0.0,6,0.7692307692307693
400990,develop good-looking websites ?,'s good front-end web developer 's resume look like ?,0,0.0,0.0,42,0.8717948717948718
400991,eat gain weight ?,best weight gain treatment gaining weight ?,1,0.0,0.0,26,0.8333333333333334
400992,people write right hand write left hand ?,dose people writing left hand ?,1,0.0,0.0,21,0.9696969696969697
400993,video personalization changed field video production ? change ?,videos change views talent ? ?,0,0.0,0.0,40,0.8333333333333334
400994,ut dallas ms computer science ? india pursue ms course fall 2014. internship prospects full-time job prospects graduation ?,job opportunities someone graduates ms power electronics universities like ut dallas texas & ?,0,0.0,0.0,89,0.7450980392156863
400995,statement sentence ? examples ?,statement sentences ? examples ?,1,0.0,0.0,1,1.0
400996,worst crime committed ?,worst crimes committed atheists ?,0,0.0,0.0,10,0.9230769230769231
400997,anyone share translation wakhra swag hindi english ?,funniest english translation hindi lyrics ?,0,0.0,0.0,32,0.8571428571428571
400998,"laws regarding speed limit enforced florida , differ enforced oregon ?","laws regarding speed limit enforced florida , differ enforced wisconsin ?",0,0.0,0.0,7,1.0
400999,approach friend sex ?,approach ex-girlfriend sex ?,0,0.0,0.0,7,0.9090909090909091
401000,"25 years old 2.8 years experience mobile game designer project coordinator . sudden feeling able explore new game idea . stage really worried job , getting new good offers also . ?",1 year late joining . 2 years sector . 25 years old . improve future ?,0,0.0,0.0,139,0.8679245283018868
401001,improve technical sketching skills ?,improve sketching skill ?,0,0.0,0.0,11,0.9714285714285714
401002,n't prince philip king england wife queen ?,queen currently ruling england king ?,0,0.0,0.0,28,0.8333333333333334
401003,car colour choose ? pearl white premium silver ?,pearl white cars trendy ?,0,0.0,0.0,33,0.7878787878787878
401004,prophecies world war 3 actually happen ?,soon world war iii ?,1,0.0,0.0,26,0.7333333333333333
401005,make $ 1 billion $ 1 ?,make $ 1 billion $ 100 ?,0,0.0,0.0,2,0.9629629629629629
401006,new year resolution 2017 goal 2017 ?,'s new year 's resolution 2017 ?,1,0.0,0.0,16,0.9473684210526315
401007,"want independently create distribute fashion designs , would go ?","design world , would ?",0,0.0,0.0,48,0.7777777777777778
401008,make blush smiley face facebook ?,insert dead smiley face facebook ?,0,0.0,0.0,10,0.8235294117647058
401009,lookalike model : best algorithm use large datasets ?,measure lookalike-ness sameness data modeling ?,0,0.0,0.0,41,0.8571428571428571
401010,salary varun shipping junior engineer 2015 ?,average salary ( +bonus ) equity software engineer round promising tech startup sillicon valley ( december 2015 ) ?,0,0.0,0.0,84,0.7692307692307693
401011,fix iphone 3g wo n't connect wifi ?,connect wifi kindle 3g ?,0,0.0,0.0,26,0.7741935483870968
401012,implications india long coastline ?,long coastline india advantageous ?,1,0.0,0.0,23,0.8666666666666667
401013,sherlock ( bbc series ) vs elementary : better re-write original ?,would say ( bbc ) sherlock introvert ?,0,0.0,0.0,48,0.8695652173913043
401014,jon lajoie really everyday normal guy ?,guys thoughts trevor noah ?,0,0.0,0.0,29,0.7333333333333333
401015,babies born grey eyes ?,babies born grey eyes ?,1,0.0,0.0,0,1.0
401016,going america protest pipelines ?,best university germany ms mechanical engineering ?,0,0.0,0.0,38,0.7878787878787878
401017,easy way make money online ?,easiest ways make good money using internet ?,1,0.0,0.0,20,0.8
401018,develop presence mind ?,one develop presence mind ?,1,0.0,0.0,4,1.0
401019,best book understand human nature ?,best books read human nature ?,1,0.0,0.0,8,1.0
401020,apply internship codenation ?,get internship codenation ?,1,0.0,0.0,5,0.9032258064516129
401021,biggest regret life ?,think biggest mistake life ?,1,0.0,0.0,13,0.7692307692307693
401022,much weight one lose ome month ?,best way lose weight month ?,1,0.0,0.0,18,0.8387096774193549
401023,change hosted network supported yes ? windows 10 installed hp ab-035tx .,installing windows 10 hp pavillion dv6 laptop running windows 7 slow ?,0,0.0,0.0,63,0.7346938775510204
401024,senticnet wordnet-affect ?,c- affect law school application ?,0,0.0,0.0,26,0.8387096774193549
401025,techniques used seo website ?,best techniques off-page seo ?,0,0.0,0.0,19,0.7878787878787878
401026,get famous musical.ly ?,get number famous people ?,0,0.0,0.0,14,0.75
401027,rank needed get cse iit bombay ?,lowest gate rank one could get admission m.tech iit bombay cse ?,1,0.0,0.0,36,0.8717948717948718
401028,stages evolution public administration ?,public administration ? main principle ?,0,0.0,0.0,33,0.9444444444444444
401029,lockheed martin 's chris kubasik caught cheating ?,lockheed martin f-22 raptor best fighter jet world ?,0,0.0,0.0,28,0.8181818181818182
401030,"currently €500 , way double 1-3 months ?","engineer ( female ) currently job hand ctc 3.3lpa . apparently cabin crew fly emirates amazing pay , around 1.4l/month grade 2 crew , basic salary double monthly salary . take ?",0,0.09811170549365225,0.0,147,0.711864406779661
401031,ancient akkadians scientifically tested ?,ancient aztecs scientifically tested ?,1,0.0,0.0,7,0.9285714285714286
401032,"boyfriend saves pictures girls phone , worried ?",boyfriend keeps girls ' photos phone . think 's normal ?,1,0.0,0.0,31,0.8
401033,feel stupid college ?,feel stupid ?,0,0.0,0.0,8,0.88
401034,toppings red mango ?,cheapest healthy fatty food ?,0,0.0,0.0,22,0.6428571428571429
401035,good book 'networking & algorithms computer games ' jouni smed & harri hakonen ?,book 'networking & algorithms computer games ' jouni smed & harri hakonen ?,1,0.0,0.0,5,1.0
401036,suppose gathered approximately 1 billion usd cash illegal means . next steps ensure well-being ?,"studying mba college , need put business 3 days campus . suggestions ?",0,0.0,0.0,72,0.8260869565217391
401037,people ever go gay straight ?,someone gay confided asking become straight . person wants switch gay straight . advice give person ?,0,0.0,0.0,77,0.7368421052631579
401038,"airlines provide flights leeds ibiza , destinations popular ?","non-stop flights leeds ibiza , leeds main tourist attractions ?",1,0.0,0.0,36,0.9090909090909091
401039,lecturedekho.com reliable ?,reliable flightstats.com ?,0,0.0,0.0,23,0.8235294117647058
401040,one earn money amidst lack opportunity ?,start revision neet aiims ?,0,0.0,0.0,30,0.7333333333333333
401041,good inpatient drug alcohol rehab center near clearwater county id ?,good inpatient drug alcohol rehab center near benewah county id ?,0,0.0,0.0,7,1.0
401042,story behind creation laptop ?,story behind creation zappos ? created accident design ?,0,0.0,0.0,29,0.9142857142857143
401043,write effective statement purpose ( sop ) masters mechanical engineering ?,statement purpose ( sop ) admission master 's program ?,0,0.0,0.0,41,0.8
401044,hair transplant cost dubai ?,much cost get hair transplant usa ?,0,0.0,0.0,22,0.8484848484848485
401045,men cheat beautiful wife girlfriend ugly less attractive woman ?,possible man love wife/girlfriend still cheat ?,0,0.0,0.0,39,0.9090909090909091
401046,sociopaths wear mask sociopaths ?,sociopaths recognize sociopaths ?,0,0.0,0.0,8,0.8
401047,would compare united states ' euthanasia laws switzerland ?,would compare united states ' euthanasia laws canadas ?,0,0.0,0.0,10,0.9743589743589743
401048,former presidents unrestricted access white house without ids checked ?,united states build white house president live ?,0,0.0,0.0,45,0.8108108108108109
401049,"person knowingly decides live commitment , party neglected ?",centriole present cyton ?,0,0.0,0.0,45,0.7647058823529411
401050,one thing world would like ?,one thing 'd like change world ?,0,0.0,0.0,17,0.875
401051,strongest majors terms job prospects weakest majors lee university ?,strongest majors terms job prospects weakest majors vanderbilt university ?,0,0.0,0.0,9,0.9777777777777777
401052,delusional disorder ?,delusional disorder ?,1,0.0,0.0,0,1.0
401053,right age girl get married india ? ?,age girl become woman india ?,0,0.0,0.0,18,0.7857142857142857
401054,deer make sounds ?,"deer make sounds ? , noises make ?",0,0.0,0.0,16,0.9230769230769231
401055,famous indian people never married ?,want india officially declared hindu rashtra ?,0,0.0,0.0,33,0.7647058823529411
401056,best questioned asked quora ?,important question asked quora ?,1,0.0,0.0,10,0.9032258064516129
401057,"could time travel , would travel ?",would time travel could ?,0,0.0,0.0,11,0.967741935483871
401058,good gifts foreign visitor bring 're invited someone 's home syria first time ?,good gifts foreign visitor bring 're invited someone 's home turkey first time ?,0,0.0,0.0,5,0.9230769230769231
401059,people use quora instead google find answers questions ?,"quora coexist google world , many answers simple search away ?",1,0.0,0.0,45,0.8292682926829268
401060,perfect sites freelancers ?,best freelancing sites ?,0,0.0,0.0,18,0.8888888888888888
401061,world war going happen ?,heading toward world war 3 ?,1,0.0,0.0,19,0.896551724137931
401062,"iphone 5s , iphone 6 iphone 6 plus really worth price ? using google nexus 5 go upgrade ?",iphone really worth price ?,1,0.0,0.0,62,0.7894736842105263
401063,like work faurecia mechanical engineer `` engineer-cad '' profile ? drafting ?,mechanical engineer master 's cad/cam . would like work towards tackling climate change . path take ?,0,0.0,0.0,81,0.8695652173913043
401064,people ready invest big brother africa hosted nigeria ?,c programming language important future ?,0,0.0,0.0,41,0.7777777777777778
401065,safer deal cash cashier 's check craigslist ?,quora safer way date craigslist ?,0,0.0,0.0,24,0.7647058823529411
401066,energy photons ?,"autoencoder trained images features , happen output input image without features ?",0,0.0,0.0,69,0.6875
401067,long new bike india need emission certificate ?,best bike india 1.5 lakh long highway cruising ?,0,0.0,0.0,34,0.8095238095238095
401068,guys stare girls public ?,guys stare girls ?,1,0.0,0.0,7,0.8888888888888888
401069,examples sentences using word `` incredulously '' ?,examples sentences using word `` misconstrue '' ?,0,0.0,0.0,11,0.9767441860465116
401070,n't irctc ticket confirmation departure time mentioned ?,"rlwl ticket confirmed till departure train , get automatic refund file tdr ?",0,0.0,0.0,41,0.8648648648648649
401071,would impact 500 & 1000 rs ban india ?,impact banning ₹1000 ₹500 india ?,1,0.4270415547083574,0.2222222222222222,20,0.7567567567567568
401072,lose weight without stopping ?,lose 5 kg weight within 7 days ?,1,0.0,0.0,16,0.75
401073,recover deleted photos app lock ?,recover deleted pics app lock ?,0,0.0,0.0,4,0.9333333333333333
401074,"invariably drawn attracted villains heroes ; eg : joker , hannibal lecter , lord voldemort , bane , darth vader , ra 's al ghul india 's biggest villain gabbar singh ?","best villain , apart joker ?",0,0.0,0.0,145,0.7272727272727273
401075,topless sunbathing illegal australia ?,australia like ?,0,0.0,0.0,30,0.7407407407407407
