id,question1,question2,is_duplicate,CosineSimilarity,JaccardSimilarity,Levenshtein,DiceSimilarity
267035,study become good computer programmer ?,laptop programmers use work ?,0,0.0,0.0,30,0.7741935483870968
267036,benefits filling nitrogen gas instead air tubeless tires ?,nitrogen good tires ?,1,0.0,0.0,39,0.8148148148148148
267037,best family business management program certification offered india ?,everyone ignores rock ?,0,0.0,0.0,55,0.6666666666666666
267038,comprehensive list tech ipos ever ?,ideal tech company enter ipo market ? ?,0,0.0,0.0,29,0.8125
267039,best career option +2 non medical stream ?,best career options 10th ?,0,0.22341386784296952,0.0,20,0.7647058823529411
267040,take home salary probationary officers nationalized banks 7th pay commission hike ?,would salary income tax officer 7th pay commission ?,0,0.0,0.0,45,0.8636363636363636
267041,"access gps location ( latitude , longitude ) programmatically android ?",one get latitude longitude ip address ?,0,0.0,0.0,40,0.8333333333333334
267042,gate exam ?,gate exam engineering ?,0,0.0,0.0,12,0.8421052631578947
267043,contribution humanity ?,'s contribution humanity far ?,1,0.0,0.0,7,0.9032258064516129
267044,convert aup file ( audacity file ) mp3 wav file ?,use audacity convert mp3/wav 24-bit i2s format ?,0,0.0,0.0,39,0.8085106382978723
267045,’ see bookmarked answers quora ?,ca n't find bookmarked answers quora ?,1,0.0,0.0,10,0.8333333333333334
267046,law conservation energy relative concept ?,significance law conservation energy ?,0,0.0,0.0,30,0.9411764705882353
267047,people allowed steering wheels right side cars u.s. ?,mercedes cars steering wheel slightly offset left ?,0,0.0,0.0,29,0.8421052631578947
267048,get paid speak ?,allen ?,0,0.0,0.0,12,0.47058823529411764
267049,best books improve math skills ?,could improve skills math ?,0,0.0,0.0,19,0.8823529411764706
267050,would life without internet ?,life would beyond internet ?,0,0.0,0.0,15,0.896551724137931
267051,mute quora user ?,hide user quora feed ?,0,0.0,0.0,10,0.75
267052,top degree program botanical illustration uk us ?,'ve read esther perel 's `` breeding captivity '' think women simply get tired sex man ?,0,0.0,0.0,66,0.8181818181818182
267053,take masters economics engineering ?,nth roots unity form abelian group ordinary multiplication ?,0,0.0,0.0,46,0.7428571428571429
267054,paprika easy grow home ?,chili powder paprika used ?,0,0.0,0.0,21,0.7741935483870968
267055,many free kick goals scored messi ronaldo la liga ?,players scored goals direct free-kicks premiership ? ( top leagues ),0,0.0,0.0,48,0.8
267056,proofs aliens really exist ?,know aliens exist ?,1,0.0,0.0,12,0.7857142857142857
267057,bake frozen burgers ?,grill frozen burgers ?,0,0.0,0.0,5,0.8571428571428571
267058,"achieve goals , avoid distractions hold back ?",stay focused avoid distractions achieve goal ?,0,0.0,0.0,22,0.8421052631578947
267059,"given chance , 's one question would ask god ?","given chance , would demand god ?",1,0.0,0.0,21,0.8421052631578947
267060,better ? neuer de gea ?,thibaut courtois vs david de gea : better goalkeeper ?,0,0.0,0.0,40,0.6451612903225806
267061,word `` kindle '' used sentence ?,word 'countermand ' used sentence ?,0,0.0,0.0,13,0.8125
267062,life like prison ?,like prison ?,1,0.0,0.0,5,0.9565217391304348
267063,make world better place today ?,make world better place live future generations ?,1,0.0,0.0,21,0.7894736842105263
267064,'s difference 64 bit android operating system 64 bit windows operating system ?,difference microsoft windows 32-bit 64-bit architecture ?,0,0.0,0.0,50,0.8
267065,integrate [ math ] \int { \frac { x^2 } { ( a^2-x^2 ) ^ { 3/2 } } dx } [ /math ] ?,integrate [ math ] \int \frac { x^ { 2 } +3 } { x^ { 6 } ( x^ { 2 } +1 ) } dx [ /math ] ?,0,0.0,0.0,28,0.9285714285714286
267066,know girl love ?,tell girl love ?,1,0.0,0.0,4,0.8181818181818182
267067,inspirational songs ?,great inspirational songs ?,1,0.0,0.0,6,0.96
267068,"multiverse , could multiverses multiverse ?",multiverse multiverse ?,0,0.0,0.0,20,0.8461538461538461
267069,read ruin k.a . tucker ?,tucker carlson ?,0,0.0,0.0,19,0.7692307692307693
267070,take overly long install visual studio need restart ?,visual studio code ? used ?,0,0.0,0.0,36,0.8
267071,best fairness cream men india ?,best fairness creams men india ?,1,0.0,0.0,1,1.0
267072,experienced software developer switch career data science ?,would software developer approach learning data science ?,1,0.0,0.0,22,0.9230769230769231
267073,watch tv ?,watch tv ?,0,0.0,0.0,0,1.0
267074,video bloggers make money youtube ?,make money youtube video ?,0,0.0,0.0,21,0.8823529411764706
267075,stop text message sending iphone got sent ?,time stamp iphone show receiving text message ?,0,0.0,0.0,35,0.8484848484848485
267076,good cheap hotels hostels within walking distance train station venice ?,good cheap hotels hostels within walking distance train station ljubljana ?,0,0.0,0.0,9,0.9
267077,delete instagram account without password email ?,delete instagram account without password email ?,1,0.0,0.0,0,1.0
267078,systems engineer ?,systems engineer ?,1,0.0,0.0,0,1.0
267079,organized religion create lack critical thinking ?,religion make lack minded ?,1,0.0,0.0,29,0.8666666666666667
267080,'s best way learn chess ?,learn play chess ?,1,0.0,0.0,14,0.8148148148148148
267081,get mortgage 640 credit score ?,kind benefits get credit score 640 ?,0,0.0,0.0,19,0.8235294117647058
267082,find lost iphone imei number ?,"recover lost iphone 4s , using imei number ?",1,0.0,0.0,18,0.8108108108108109
267083,best places visit solo travel india ?,best places travel alone india ?,1,0.0,0.0,14,1.0
267084,think holberton school ?,think holberton school accept international students ?,0,0.0,0.0,30,0.875
267085,pm modi correct thing 500 1000 rs notes ?,think ban rs . 500 rs . 1000 currency notes ?,1,0.0,0.0,30,0.7368421052631579
267086,best wine 've ever tasted ?,best wine 've ever ?,1,0.0,0.0,7,0.9230769230769231
267087,many points gram meth ?,long meth stay detectable body testing ?,0,0.0,0.0,30,0.8125
267088,n't philippine request un courts instead permanent court arbitration territory disputes philippines & china ?,"n't philippines ask un backed courts , instead permanent court arbitration water territorial disputes china ?",1,0.0,0.0,38,0.8636363636363636
267089,teenage mutant ninja turtles aliens ?,teenage mutant ninja turtles live ?,0,0.0,0.0,4,0.9655172413793104
267090,install windows 8 pen drive ?,uninstall windows 8.1 install windows 7 ?,0,0.0,0.0,19,0.75
267091,organisms ?,'exponential organization ' ?,0,0.0,0.0,21,0.64
267092,pros cons implementing uniform civil code india ?,uniform civil code ? necessary implement country like india ?,1,0.0,0.0,40,0.9230769230769231
267093,large cities harsh cold climates ?,animals hot cold climates live longer ?,0,0.0,0.0,25,0.9375
267094,best comic ever written/drawn ?,best comic book ?,1,0.0,0.0,18,0.7142857142857143
267095,best religion men ?,best religion ?,0,0.0,0.0,4,0.96
267096,good ways spend weekends bengaluru ?,good way spend long weekend around bangalore ?,1,0.0,0.0,16,1.0
267097,best movie bollywood 2016 ?,best bollywood movie 2016 ?,1,0.0,0.16666666666666663,12,1.0
267098,recommendations self-studying machine learning ?,"recommendations ( books , ) self-studying deep learning ?",1,0.0,0.0,19,0.8444444444444444
267099,people evil ?,why/how people become ignorant ?,0,0.0,0.0,21,0.5185185185185185
267100,know infj bored ?,know infj ?,0,0.0,0.0,6,0.8181818181818182
267101,entrepreneurship taught innate skill ?,entrepreneurship taught entrepreneurs born particular traits ?,1,0.0,0.0,30,0.875
267102,would happen delete `` data device `` whatsapp .. taking much space ?,whatsapp consuming much data ?,0,0.0,0.0,48,0.8421052631578947
267103,"donald trump president , forced release tax returns ?","donald trump become president , required law make public 2017 tax return ?",1,0.0,0.0,32,0.8
267104,best programs mechanical engineerings ?,'s best choice mechanical engineer ?,0,0.0,0.0,14,0.9411764705882353
267105,best videocon service center hyderabad ?,best videocon service center hyderabad ?,1,0.0,0.0,0,1.0
267106,catch oddish pokémon go ?,catch porygon pokémon go ?,0,0.0,0.0,6,0.8387096774193549
267107,new inventions electrical engineering engineers related field must aware ?,hard electrical engineering ?,0,0.0,0.0,49,0.75
267108,"significance battle somme , battle compare contrast battle bataan ?","significance battle somme , battle compare contrast battle rostov ?",1,0.0,0.0,6,0.972972972972973
267109,quora apparently satisfied providing complete clearer answers improving application moderation policies ?,quora answers moderation process lacking logic incomplete ?,1,0.0,0.0,70,0.9047619047619048
267110,samsung better apple ?,apple 's a9 better snapdragon 810 ?,0,0.0,0.0,22,0.7272727272727273
267111,want remembered ?,want remembered die ?,1,0.0,0.0,4,0.9565217391304348
267112,treat strep throat ?,get rid strep throat ?,1,0.0,0.0,6,0.8695652173913043
267113,'s 's like sexually attracted children ?,'s like sexually attracted children ?,1,0.0,0.0,3,1.0
267114,"best ( physical design , custom layout , rtl verification ) terms jobs , future growth , package less stress ?","best physical design , custom layout rtl verification terms jobs , future growth , package less stress ?",1,0.0,0.0,6,0.9629629629629629
267115,pakistan occupy kashmir ?,ca n't pakistan occupy kashmir ?,0,0.0,0.0,7,0.9696969696969697
267116,unroll safe ?,"consider unroll.me full b2c saas solution ? , would define unroll.me ?",0,0.0,0.0,57,0.6875
267117,'s best way break dog fights ?,best way break fight two dogs without hurting ?,1,0.0,0.0,26,0.918918918918919
267118,angular 2 available bower ?,get angular 2 work eclipse ?,0,0.0,0.0,17,0.7878787878787878
267119,strategy preparing gate 3rd year b . tech . ?,iphone 7 must ios developers ?,0,0.0,0.0,36,0.6285714285714286
267120,many keywords actionscript programming language latest version ?,many keywords a.p.l . programming language latest version ?,0,0.0,0.0,11,0.9523809523809523
267121,feel like father social anxiety disorder child children also social anxiety disorder ?,feel like mother social anxiety disorder child children also social anxiety disorder ?,0,0.0,0.0,2,0.972972972972973
267122,change life ?,best way change life ?,1,0.0,0.0,9,0.8148148148148148
267123,one thing men life women every day ?,"one thing miss living , life ends ?",0,0.0,0.0,19,0.8235294117647058
267124,"aryan invasion theory debunked , india still studying history books ?","aryan invasion theory still debated , indian school textbooks propagating truth ?",1,0.0,0.0,38,0.9302325581395349
267125,get update lollipop htc 820g+ dual ?,lollipop marshmallow update htc desire 820g+ dual sim ?,1,0.0,0.0,33,0.9
267126,"investment bankers get paid , much ?",much investment banker get paid ?,1,0.0,0.0,13,0.9743589743589743
267127,differences western chinese food ?,differences chinese food japanese food ?,0,0.0,0.0,14,0.8275862068965517
267128,many quora users ask questions could look online ?,"many people ask soppy questions quora , easily googled ?",1,0.0,0.0,30,0.8947368421052632
267129,love working mcdonald 's cook . rest life live comfortably ?,"introduced modern day food ( cereal , caesar salad , mcdonald 's , etc . ) town existed medieval europe , would citizens react ?",0,0.0,0.0,95,0.8
267130,"better , east coast west coast travelling ?",place better live : east coast west coast ?,0,0.0,0.0,23,0.8484848484848485
267131,find cost benefit analysis examples data analytics solution retail companies ?,linux software cost benefit analysis ?,0,0.0,0.0,57,0.8947368421052632
267132,trademarks : legal implications using customer company 's logo marketing materials without express consent ?,use company logos article cover image ?,0,0.0,0.0,79,0.8095238095238095
267133,benefits drinking hot green tea ?,benefits drinking green tea twice day ?,1,0.0,0.0,14,0.8484848484848485
267134,prepare works applications take home assignment ?,minimum score amcat exam interview process ?,0,0.0,0.0,37,0.8
267135,skunks make good pets ? ?,dumbo rats make good pets ? ?,0,0.0,0.0,9,0.896551724137931
267136,know best guy friend crush ?,know guy crush ? friend thinks likes n't seem interact much . get know feelings ?,0,0.0,0.0,62,0.8571428571428571
267137,married man get married another woman ?,married man meet another woman ?,0,0.0,0.0,9,0.9629629629629629
267138,wmp lags srs wow effect enabled ?,"'m talking mcsa : windows server 2016 , find learning materials ?",0,0.0,0.11111111111111116,48,0.7272727272727273
267139,major finance computer engineering ?,"someone took sleeping pills take hospital , would suicide case ? police handle case ?",0,0.0,0.0,67,0.7222222222222222
267140,prepare google interview ?,prepare google internship interview ?,1,0.0,0.0,11,0.9333333333333333
267141,difference love crush ? true mentally mature person experience love whereas others ( like kids teenagers ) experience love ?,ordinary individual know difference real love false love ? person know whether one 's love real false ?,0,0.0,0.0,93,0.875
267142,saddest thing ever found online ?,saddest thing ever seen internet ?,1,0.0,0.0,9,0.8666666666666667
267143,history legislation concerning protective orders united states ?,two states india special legislation protect elderly ?,0,0.0,0.0,48,0.8888888888888888
267144,oligosoft ? review experience oligosoft pl share .,2 years experience oracle sql & pl/sql . possible move another field ?,0,0.0,0.0,55,0.782608695652174
267145,best sex position ?,best sex position heterosexual intercourse ?,0,0.0,0.0,25,0.7857142857142857
267146,evosys recruitment process ?,recruitment process evosys ?,1,0.0,0.0,14,1.0
267147,would close front teeth gap ?,close gap front teeth ?,1,0.0,0.0,14,0.9090909090909091
267148,hair falling age 17 ?,avoid hair fall age 20 ?,0,0.0,0.0,11,0.7142857142857143
267149,switch job sales fmcg supply chain management ?,switch job industry supply chain management without mba ?,0,0.0,0.0,21,0.9302325581395349
267150,people dislike photographed ?,n't people like photographed ?,1,0.0,0.0,7,0.9032258064516129
267151,write script short film ?,write script short film ?,1,0.0,0.0,0,1.0
267152,unblock someone facebook ?,unblock facebook page previously blocked ?,0,0.0,0.0,24,0.7647058823529411
267153,mean ? au temps pour moi .,mean au ?,0,0.0,0.0,18,0.6666666666666666
267154,want re-architect monolithic application microservices . ?,refactor monolithic application microservices ?,1,0.0,0.0,14,0.8888888888888888
267155,many potatoes mccain 's process year ?,many eggs eat day ?,0,0.0,0.0,25,0.6923076923076923
267156,"older parents ( 40 ) kids 3-6 , manage exhaustion ?",apps 3- 6-year-old german kids like ?,0,0.0,0.0,40,0.782608695652174
267157,symbol mean anything ?,symbol mean anything ?,0,0.0,0.0,0,1.0
267158,okay pulse rate 102 beats per minute normal pulse rate ?,normal pulse rates ?,0,0.0,0.0,38,0.7878787878787878
267159,destroy earbuds without visible physical damage ?,could infrasound damage human brain and/or destroy ?,0,0.0,0.0,44,0.8571428571428571
267160,interesting people banned quora ?,therapy effective teenagers older adults ? ( esp . b/c teens lower emotional intelligence ),0,0.0,0.0,73,0.7272727272727273
267161,bad social smoking ?,bad passive smoking ?,0,0.0,0.0,6,0.8275862068965517
267162,sangam ?,much valuable developer know regex ?,0,0.0,0.0,31,0.4444444444444444
267163,"asked friend like said someone , wo n't tell tho , friends think might like wo n't tell ?",semilunar valve called cuspid valve ?,0,0.0,0.0,71,0.6285714285714286
267164,lower sex drive ?,reduce sex interest ?,1,0.0,0.0,13,0.6666666666666666
267165,common required elective courses chemistry ?,common required elective courses biology ?,0,0.0,0.0,8,0.918918918918919
267166,air conditioner airplane work ?,air conditioner work ?,0,0.0,0.0,9,0.9285714285714286
267167,36 year old date 17 year old ?,14 year old date ?,0,0.0,0.0,14,0.8461538461538461
267168,possible get pregnant period ?,possible get periods pregnant ?,0,0.0,0.0,12,1.0
267169,one prefer instead cse bit mesra ?,choose : iiit allahabad cse bit mesra ?,0,0.0,0.0,17,0.8125
267170,inspirational people spectrum ?,inspiring people ?,0,0.0,0.0,14,0.7692307692307693
267171,`` adventures huckleberry finn '' mark twain considered good book ?,inspired `` adventures huckleberry finn '' mark twain ?,0,0.0,0.0,30,0.9387755102040817
267172,many hours successful people sleep ?,many hours successful people sleep per day ?,0,0.0,0.0,8,0.9696969696969697
267173,average time takes letter travel across country via usps ?,many days usps priority mail take ?,0,0.0,0.0,44,0.8888888888888888
267174,practical way earn money staying hostels mba ?,stay pursuing ms u.s.a ? far know universities provide hostel facilities,0,0.0,0.0,53,0.8372093023255814
267175,"cope estranged half-sister ’ murder , committed husband committed suicide ?","sister depression feeling stressed . lost interest studying learning , well used enjoy . get interested studying ? get cope depression stress ?",0,0.0,0.0,103,0.8
267176,best programming language beginners learn ?,best programming language beginner learn ?,1,0.0,0.0,1,1.0
267177,pythagurus gmat classes ?,"best coaching gmat ? byju ’ , jamboree , manya princeton , pythagurus , crackverbal , meritnation edushastra ?",0,0.0,0.0,91,0.75
267178,right arm bears ?,right arm bears ?,1,0.0,0.0,0,1.0
267179,sole purpose existence ?,purpose existence ? mean exist ?,1,0.0,0.0,18,0.896551724137931
267180,"find affordable patent attorney , one defer cost equity ? looking file uspto aerospace patents .",looking someone knows servers . creating video hosting website need provide projection costs . find ?,0,0.0,0.0,79,0.8085106382978723
267181,many bank employees going retaired banking industory 2019 ?,aggregate 61 % got 320 gre want pursue ms computer science . good universities try ?,0,0.0,0.0,65,0.7755102040816326
267182,pit beat wolf ?,would wolf beat pit bull ?,1,0.0,0.0,17,0.9230769230769231
267183,uninstall youmail ?,uninstall youmail ?,1,0.0,0.0,0,1.0
267184,"sealed room , would die first due lack oxygen , candle flame person ?",first person trying cow 's teat ? would someone drink came ( milk ) ? scientists think healthy humans ?,0,0.0,0.0,75,0.875
267185,ever faced discrimination atheist ?,atheists ever experienced discrimination based solely fact atheist ?,1,0.0,0.0,35,0.8648648648648649
267186,delete yahoo account ?,terminate yahoo e-mail account ?,1,0.0,0.0,13,0.8275862068965517
267187,[ math ] 1\circ4=5 [ /math ] [ math ] 2\circ5=12 [ /math ] [ math ] 3\circ6=21 [ /math ] [ math ] 8\circ11 [ /math ] ? fun…,math religion ?,0,0.0,0.0,113,0.47368421052631576
267188,could psychopath know ?,psychopaths know psychopaths ?,0,0.0,0.0,19,0.896551724137931
267189,change separator comma excel millions lakhs ( vice versa ) ?,use excel cross-reference cells separate spreadsheets ?,0,0.0,0.0,45,0.717948717948718
267190,"placements iim indore , mumbai campus ?",iim indore campus mumbai ?,0,0.0,0.0,23,0.9090909090909091
267191,powerful sultan ottoman empire ?,sultan potential save ottoman empire ?,0,0.0,0.0,17,0.9032258064516129
267192,people believe world flat ?,people currently believe earth flat ?,1,0.0,0.0,14,0.7878787878787878
267193,meaning quora ?,basic meaning quora ?,1,0.0,0.0,6,0.8888888888888888
267194,resigning employer . options 401k use india ?,"avoid payroll taxes reduce overall taxes , contribute $ 53,000 business roth 401k withdraw months later ?",0,0.0,0.0,80,0.7692307692307693
267195,wear solid colors camo ?,us navy wear camouflage ?,0,0.0,0.0,19,0.7333333333333333
267196,remainder 2^33 divided 27 ?,remainder 2^33is divided 27 ?,1,0.0,0.0,2,0.9655172413793104
267197,jim webb ?,jim webb democrat ?,0,0.0,0.0,9,0.7272727272727273
267198,interesting paper ijcai'2016 ?,interesting paper aaai'2016 ?,0,0.0,0.19999999999999996,3,0.9411764705882353
267199,use monies instead money ?,better words use instead word `` things '' ?,0,0.0,0.0,27,0.7096774193548387
267200,was/is love life ?,find love life ?,0,0.0,0.0,6,0.7272727272727273
267201,one watch game thrones ?,game thrones ? ? people watch ?,1,0.0,0.0,25,0.9333333333333333
267202,makes feel happy city also general ?,make woman happy sad ?,0,0.0,0.0,21,0.7272727272727273
267203,would sex considered `` conjugal duty '' modern china ?,formula calculating area rectangle ?,0,0.0,0.0,45,0.7368421052631579
267204,initiate sex chat girl facebook ?,impress girl facebook ?,0,0.0,0.0,14,0.8235294117647058
267205,openstack built using python c/c++ ?,version python required run openstack ?,0,0.0,0.0,31,0.7692307692307693
267206,new year resolution ?,2017 new year ’ resolution ?,1,0.0,0.0,7,0.8484848484848485
267207,rest india think kannadigas ?,people states think kannadigas ?,1,0.0,0.0,11,0.8571428571428571
267208,best app finding name song ?,best app download songs iphone ?,0,0.0,0.0,16,0.8387096774193549
267209,know found right partner ?,", always wonder 's worse : emotional betrayal physical betrayal ?",0,0.0,0.0,50,0.6666666666666666
267210,way scrape data linkedin public profile ?,legally scrape google+ public profile data ?,0,0.0,0.0,21,0.8717948717948718
267211,tried death wish coffee feel afterwards ?,cooking : family ; many pots pans usually wash afterwards many remain unwashed coffee served ?,0,0.0,0.0,73,0.75
267212,yawn sleep ?,yawn sleeping ?,0,0.0,0.0,3,0.9090909090909091
267213,obsessed older boyfriend ?,attracted older men ?,1,0.0,0.0,14,0.64
267214,improve machine drawing ?,improve machine drawing ?,1,0.0,0.0,0,1.0
267215,person runs weyland-yutani 's main competitor xenomorph ( science division d15 ) aliens universe ?,mistakes marines make aliens ?,0,0.0,0.0,76,0.5641025641025641
267216,ways american lawyer practice law living abroad ?,lawyer remain lawyer even n't practiced law years ? example politicians n't courtroom decades .,0,0.0,0.0,61,0.8571428571428571
267217,cute baby pictures ?,adorable pics animal babies ?,0,0.0,0.0,21,0.7142857142857143
267218,things new employees know going first day exact sciences ?,things new employees know going first day monsanto ?,0,0.0,0.0,12,0.9523809523809523
267219,aircraft altitude determined ?,highest altitude passenger aircraft safely fly ?,0,0.0,0.0,30,0.8125
267220,last longer sex ?,men last longer bed ?,1,0.0,0.0,6,0.8461538461538461
267221,train german shepherd/mastiff mix ?,train german shepherd/pitbull mix ?,0,0.0,0.0,7,0.8888888888888888
267222,video chat rooms language learn ?,video chat apps ipad connect random chat partners ?,0,0.0,0.0,30,0.8823529411764706
267223,far back forward iphone calendar go ?,one let go necessity back options ?,0,0.0,0.0,31,0.7647058823529411
267224,best online courses digital marketing india ?,digital marketing colleges india ?,1,0.0,0.0,29,0.9411764705882353
267225,take interest studies ?,become interested studies ?,1,0.0,0.0,7,0.7692307692307693
267226,people hate accounting ?,many people hate gay people ?,0,0.0,0.0,15,0.8148148148148148
267227,osho true saint ?,osho die ?,0,0.0,0.0,9,0.7
267228,watch breaking bad season 5 online ?,way stream breaking bad season 5 online ?,1,0.0,0.0,7,0.8947368421052632
267229,people obsessed gopro cameras ?,gopro camera ?,1,0.0,0.0,17,0.8333333333333334
267230,"block number phone sending message , still see message ?",see messages number blocked iphone ?,0,0.0,0.0,41,0.95
267231,wind generated ?,wind generated ?,1,0.0,0.0,0,1.0
267232,aws certification worth ?,best way get aws associate certificate ?,0,0.0,0.0,30,0.8275862068965517
267233,go ivy league school ?,like go ivy league school ?,0,0.0,0.0,5,0.9655172413793104
267234,get rid bad habbit ?,could get rid bad habits like porn thoughts ?,1,0.0,0.0,26,0.7333333333333333
267235,commuting milpitas san francisco employee shuttle 20 % pay increase worth ?,"private collection favorite cars ( drive sometimes ) , daily commuting vehicle , pay insurance cars daily commuter ?",0,0.0,0.0,81,0.8085106382978723
267236,biggest culture shocks people face coming kazakhstan ?,biggest culture shocks people face coming russia ?,0,0.0,0.0,8,0.975609756097561
267237,richard pipes ' opinion trotsky russian civil war ?,russian leader world war 2 ?,0,0.0,0.0,40,0.7428571428571429
267238,"many 3 digit even numbers formed 0 , 1 , 2 , 3 , 4 , 5 6 repetition ?","many even numbers three digits formed using digits 1 , 2 , 3 , 4 , 5 6 digit used ( least ) ?",0,0.0,0.0,50,0.8928571428571429
267239,"live manhattan yearly salary $ 240,000 ?",much someone make live comfortably manhattan ?,0,0.0,0.0,36,0.717948717948718
267240,make anonymous question 've promoted ( seemingly 'publicly ' ) ?,public participation promote integrity india ?,0,0.0,0.0,44,0.8372093023255814
267241,functions investment banking ?,function investment bank ?,0,0.0,0.0,4,0.9696969696969697
267242,budget airlines make money ?,could airlines make money flew faster ?,0,0.0,0.0,18,0.8648648648648649
267243,improve english skills everyday ?,improve english skills ?,1,0.0,0.0,9,0.9090909090909091
267244,"cold gobi desert get , average temperatures compare ones simpson desert ?","cold gobi desert get , average temperatures compare ones sonoran desert ?",1,0.0,0.0,5,1.0
267245,"black skin around forehead , chin jawlines . already one year . could n't able see much improvement . suggest ?",iron non magnetic nature even temperature 1070 ?,0,0.0,0.0,85,0.6521739130434783
267246,essential skills java developer ?,essential skills java web developer ? jquery jsf ?,0,0.0,0.0,17,0.8421052631578947
267247,recently started therapy university need talk painful past experiences ( child abuse ) ?,done everybody family ( including ) depressed ?,0,0.0,0.0,66,0.8444444444444444
267248,often bed sheets changed ?,often change bed sheets ?,1,0.0,0.0,15,1.0
267249,hack clash clans without uninstalling ?,hack clash clans game ?,1,0.0,0.0,19,0.7407407407407407
267250,get someone honest ?,honest ?,0,0.0,0.0,12,0.8888888888888888
