id,question1,question2,is_duplicate,CosineSimilarity,JaccardSimilarity,Levenshtein,DiceSimilarity
339092,n't get job campus placements ?,get job campus placements ?,0,0.0,0.0,4,0.9696969696969697
339093,theories caused big bang ?,theories could 've precipitated big bang ?,1,0.0,0.0,18,0.8888888888888888
339094,age first realize gay/bisexual realize ?,when/how realize gay/bisexual ? denial ?,1,0.0,0.0,15,0.8108108108108109
339095,phonegap still uses web sql even deprecated ?,prerequisite use adobe phonegap ?,0,0.0,0.0,30,0.8947368421052632
339096,kind antivirus use lot torrent downloading internet browsing ?,download series without using torrent ?,0,0.0,0.0,44,0.8823529411764706
339097,believe soul mate everyone world ?,believe every person soul mate ?,1,0.0,0.0,20,0.9142857142857143
339098,"found briefcase money street , would keep ?",find money street would ?,0,0.0,0.0,19,0.8421052631578947
339099,convert watt ampire ?,convert ohms watts ?,0,0.0,0.0,10,0.8571428571428571
339100,earn money internet ?,earn money online home ?,1,0.0,0.0,9,0.8695652173913043
339101,something never ?,something never done ?,1,0.0,0.0,5,0.9629629629629629
339102,quora say question needs improvement n't say actually needs improved ?,"quora says answer needs improved , keep saying even improve ?",0,0.0,0.0,30,0.8
339103,become expert front end development ?,best way become expert css front-end development ?,0,0.0,0.0,14,0.8648648648648649
339104,enjoy masturbation ?,maximize pleasure masturbating ?,0,0.0,0.0,18,0.75
339105,"remember cricket shots ( e.g . cover drive , drive ) fielding positions ( e.g . deep square , cover ) ?",difficult cricket shot ? ?,0,0.0,0.0,88,0.7142857142857143
339106,bf excuse cheating time ?,boyfriend never compliments . used hook lot girls noticed phone would always compliment . says sex still feel like 'm pretty enough . says start complimenting never . n't compliment ?,0,0.0,0.0,159,0.7441860465116279
339107,make girlfriend 's birthday special n't much money ?,money girlfriend 's birthday coming ?,1,0.0,0.0,22,0.9302325581395349
339108,root sony xperia m2 ?,root sony xperia e ?,0,0.0,0.0,2,0.9285714285714286
339109,start daily routine professional ?,ideal daily routine ?,0,0.0,0.0,18,0.896551724137931
339110,living california ( around sunnyvale ) feel like ?,good salary live bay area ( sunnyvale / mountain view ) family 3 ?,0,0.0,0.0,43,0.8181818181818182
339111,india introduce 2000 rupee note ?,rbi issuing 2000 rupee notes ?,1,0.0,0.0,13,0.8
339112,best seasonings ground beef ?,good seasonings ground beef ?,1,0.0,0.0,4,0.9655172413793104
339113,personal trainer ?,personal trainer certificate ?,0,0.0,0.0,12,0.9230769230769231
339114,"continents named ? asia africa , names ?",continents named ?,1,0.0,0.0,22,0.8888888888888888
339115,good irc channels talk experienced computer security researchers hackers ?,find exhaustive list irc channels ?,0,0.0,0.0,54,0.7894736842105263
339116,"cold gobi desert get , average temperatures compare ones simpson desert ?","cold gobi desert get , average temperatures compare ones deserts ?",1,0.0,0.0,9,1.0
339117,much think domain xbeard.com worth ?,much domain topperheadon.com worth ?,0,0.0,0.0,16,0.8888888888888888
339118,ex gf hasnt texted back confirm meet drinks . going see switch work shift sun . text ?,girlfriend got arranged marriage months ago . still loves talks . planned meet well . suddenly changed mind said forget meet . told leave texts day call week . mean ?,0,0.0,0.0,124,0.8936170212765957
339119,international space station ( iss ) always occupied ?,large international space station ( iss ) ?,0,0.0,0.0,22,0.8571428571428571
339120,stick time table ?,habit procrastinating things . stick time table made ?,0,0.0,0.0,36,0.75
339121,scares people close ?,teachers : think getting close student admired 3 years ?,0,0.0,0.0,43,0.5806451612903226
339122,mechanical engineer join isro ?,mechatronics engineer join isro ?,0,0.0,0.0,5,0.9333333333333333
339123,think multi-billionaire would rather stay home work go vip high-end parties hang rich people ?,"low-level manager large consulting firm , feel strong connection director determines promotion , salary increase , opportunities , etc . less n't appear take interest work , goals motivations . suggestions would leaving ?",0,0.0,0.04347826086956519,171,0.88
339124,best tools finding instagram influencers ?,find instagram story ?,0,0.0,0.0,24,0.8125
339125,take apart fujifilm x10 digital camera ?,take apart broken fujifilm x10 digital camera ?,1,0.16159625443366793,0.125,7,0.9302325581395349
339126,"penis tiny , stop sex ?","penis tiny , stop trying sex die virgin ?",1,0.0,0.0,18,0.8571428571428571
339127,purpose life ? ?,wan na ask someone please . life ? purpose life ?,1,0.0,0.0,37,0.7857142857142857
339128,branding marketing activities done instagram ?,branding marketing activities done facebook ?,0,0.0,0.0,9,0.9714285714285714
339129,meant phrase `` rock '' ?,meaning phrase `` rock '' ?,1,0.0,0.0,3,0.9090909090909091
339130,worst could happen trump president ?,worst thing could happen donald trump presidency ?,1,0.0,0.0,15,0.9473684210526315
339131,pros cons oligopoly ?,disadvantages oligopoly economy ?,0,0.0,0.0,19,0.7586206896551724
339132,innovate ?,one become innovative person ?,0,0.0,0.0,20,0.75
339133,trademark made word ?,trademark word made ?,1,0.0,0.0,8,1.0
339134,intuitive explanation eulers identity ?,intuitive explanation euler 's identity ?,1,0.0,0.0,2,0.9714285714285714
339135,ocd cause depression ?,ocd cause depression ?,1,0.0,0.0,0,1.0
339136,2014 satellite 's camera capable many megapixels ? long need capture image ? long take transmit picture back earth ?,photography : best examples prove n't need better camera take better pictures ?,0,0.1005558056047194,0.09999999999999998,80,0.8846153846153846
339137,least common favorite color ?,common favorite color world ?,0,0.0,0.0,12,0.9032258064516129
339138,"mobile phones : difference gsm , wcdma , cdma umts sim slots ?",wcdma different cdma ?,0,0.0,0.0,46,0.7222222222222222
339139,unipolar neurons axon hillock ?,nervous cell carry function ?,0,0.0,0.0,25,0.75
339140,scope electronics engineering india ?,b.tech ece future next 4 years ?,0,0.0,0.0,28,0.5625
339141,hillary clinton parkinson 's disease ?,hillary clinton parkinson 's ?,1,0.0,0.0,8,0.9411764705882353
339142,dead body suspended free space remain forever ?,dead body decompose outer space ?,1,0.0,0.0,28,0.8484848484848485
339143,best ways start writing story ?,good ways start story ?,1,0.0,0.0,12,0.8
339144,"hotel thiruvambadi hill-station would safe unmarried couples , without harassment police , hotel staff , moral police ?","hotel sivalik hills hill-station would safe unmarried couples , without harassment police , hotel staff , moral police ?",0,0.0,0.0,12,0.9565217391304348
339145,satanism evil ?,satan evil ?,0,0.0,0.0,3,0.9523809523809523
339146,prepare ssc cgl 2016 tiers working 9 hours job ?,prepare english ssc cgl tier 1 ?,0,0.0,0.0,30,0.75
339147,microsoft really steal apple inc. ideas ?,apple inc. really like hitler stated chinese ceo ?,0,0.0,0.0,33,0.8888888888888888
339148,macromolecules ? examples ?,macromolecule examples ?,1,0.0,0.0,3,1.0
339149,founder patnabeats.com ?,founder jugaadugar.com ?,0,0.0,0.0,9,0.8125
339150,"best foreign language learn , ?",best foreign language learn ?,1,0.0,0.0,2,0.967741935483871
339151,"wanted read feminist book every country earth , book read country ?","wanted read book every country earth , book read country ?",0,0.0,0.0,9,0.9
339152,best ways lose weight ?,one change diet lose weight ?,1,0.0,0.0,13,0.8275862068965517
339153,charlie chaplin like person ?,charlie chaplin like ?,1,0.0,0.0,7,0.9230769230769231
339154,information police officers look pull ?,interact police officer vehicle pulled ?,0,0.0,0.0,17,0.8235294117647058
339155,good add sugar green tea ?,smoking green tea good idea ? effects ? side effects ?,0,0.0,0.0,42,0.7857142857142857
339156,fitbuyfollower.com best website buy instagram followers likes ?,certain websites like best buy amazon ask add products cart showing price ?,0,0.0,0.0,58,0.8636363636363636
339157,women find attractive men ?,guys find attractive girl ?,0,0.0,0.0,9,0.75
339158,non-technical interview facebook like ?,like attend non-technical interview amazon hyderabad ? roles ?,0,0.0,0.0,31,0.85
339159,canadians think indians ?,americans ( us ) think indians ?,0,0.0,0.0,12,0.7857142857142857
339160,"oldest book history , still available ?",oldest book history mankind someone tell ?,1,0.0,0.0,17,0.8823529411764706
339161,sap exam ?,sap ?,0,0.0,0.0,5,0.7692307692307693
339162,germans proud german ?,non-germans cook german food ?,0,0.0,0.0,13,0.7857142857142857
339163,old people set good examples society ?,old people set good exanplae society ?,1,0.0,0.0,3,0.9375
339164,important question world ?,skills take less 5 minutes learn everyone know ?,0,0.0,0.125,36,0.8
339165,vote hard brexit ?,52 % british voted brexit ?,0,0.0,0.0,15,0.8275862068965517
339166,accenture next batch december 16th 2016 ?,"western countries much higher rapes per capita india ? sweden 60 times rate , low reporting problem everywhere .",0,0.0,0.0,93,0.6818181818181818
339167,insights infp personality type ?,insights infp myers-briggs type indicator personality type ?,0,0.0,0.0,28,0.8648648648648649
339168,"best argument bernie supporters , disillusioned democrats , independents millennials vote clinton ?",n't know want life ? n't know success life ? ask get answer want everybody happy & proud ?,0,0.0,0.0,79,0.8
339169,bus directly mumbai international airport pune especially around midnight ?,red bus named red bus ?,0,0.0,0.0,61,0.7096774193548387
339170,uses ultraviolet radiation ?,ultraviolet radiation used ?,1,0.0,0.0,10,1.0
339171,change suitecrm 's default font font size new emails ?,start business architecture draft man 's field ?,0,0.0,0.0,40,0.8717948717948718
339172,"us president declare martial law , would power dissolve congress stay office two terms ?","bernie sanders elected 45th president united states , chance pass away office ?",0,0.0,0.0,65,0.8444444444444444
339173,things java python node.js ?,node.js killing php ?,0,0.0,0.0,23,0.8125
339174,best graphics card rs.7000 ?,graphics card buy rs . 7000 ?,1,0.0,0.0,11,0.8823529411764706
339175,"field , bioinformatics biomedical engineering biggest effect treatment mental illnesses ?",rolex submariner 1st copy ?,0,0.0,0.0,72,0.7567567567567568
339176,lift elevator 'hacks ' people n't know ?,little hacks know give big advantage people specific situations ?,0,0.0,0.0,46,0.85
339177,clean air conditioner coils ?,clean air conditioner 's evaporator coils ?,1,0.0,0.0,14,0.896551724137931
339178,dulagarh riots getting attention indian media intellectuals ?,"50+ year old , greatest regrets looking back life ?",0,0.0,0.0,48,0.717948717948718
339179,product marketing : much cost run full front page ad campaign national newspaper like times india ?,instance full front page newspaper ad individual company/organisation ?,0,0.0,0.0,68,0.8636363636363636
339180,tell difference crush love ?,difference crush love ?,1,0.0,0.0,5,0.967741935483871
339181,unexpected things first-time visitors ethiopia notice ?,unexpected things first-time visitors australia notice ?,0,0.0,0.0,7,0.9767441860465116
339182,true morning person becomes successful life ?,attributes person become successful life ?,0,0.0,0.0,13,0.9411764705882353
339183,get started machine learning ?,start learning machine learning ?,1,0.0,0.0,10,0.9655172413793104
339184,true obama could done help black americans time office ?,right wing theory true biden planning run barack obama vice president barack obama holds power 8 years ?,0,0.0,0.0,77,0.8636363636363636
339185,best places honeymoon february ?,best place honeymoon february ?,1,0.0,0.0,1,1.0
339186,different grefide marble rock ?,build website class 11th 12th without affecting studies ?,0,0.0,0.0,47,0.7567567567567568
339187,best gift recieved someone ?,best gift ever received ?,1,0.0,0.0,11,0.896551724137931
339188,named dhoni 's shot helicopter shot ?,dhoni 's helicopter shot get 's name ?,1,0.0,0.0,23,0.9714285714285714
339189,usually writes titles newspaper articles ?,get articles printed newspapers ?,0,0.0,0.0,24,0.8666666666666667
339190,whose voice hindi tv advertisement ?,get tv advertisement writing job ?,0,0.0,0.0,28,0.8484848484848485
339191,rbi increase repo rate inflation decrease deflation ?,impact employment repo rate decrease ?,0,0.0,0.0,35,0.875
339192,martian manhunter ?,martian manhunter 's weakness ?,0,0.0,0.0,12,0.8461538461538461
339193,best online grocery store chennai ? list ?,best online grocery store chennai ?,1,0.0,0.0,7,1.0
339194,best book ias exam preparation ?,best book preparations ias exam ?,1,0.0,0.0,19,1.0
339195,chances getting pregnant birth control ?,chances getting pregnant birth control ?,1,0.0,0.0,0,1.0
339196,long looks matter marriage ?,looks beauty matter arranged marriage ?,0,0.0,0.0,18,0.875
339197,bran mapping ?,repository mind maps ?,0,0.0,0.0,17,0.6666666666666666
339198,train brain ?,train brain multitask ?,0,0.0,0.0,10,0.7619047619047619
339199,quora grow user base ?,quora plan growing user base ?,1,0.0,0.0,8,0.8571428571428571
339200,indian youth learn katrina kaif ?,indian youth learn poonam pandey ?,1,0.0,0.0,11,0.875
339201,theme time travel fascinating ?,time travel fascinating ?,1,0.0,0.0,6,0.967741935483871
339202,earn living quora ?,earn money quora ?,1,0.0,0.0,6,0.75
339203,whatsapp make money ?,messaging apps whatsapp make money ?,1,0.0,0.0,15,0.9333333333333333
339204,grumman f-14 tomcat designed ?,grumman f-14 tomcat perform combat ?,0,0.0,0.0,13,0.8648648648648649
339205,best ways understand people ?,best way understand peoples ’ behavior ?,1,0.0,0.0,13,0.8888888888888888
339206,best way reduce belly arm fat ?,best way reduce abdominal fat ?,1,0.0,0.0,8,0.9142857142857143
339207,"think kobe better lebron , think kobe better ?","better , kobe lebron , ?",0,0.0,0.0,31,0.9166666666666666
339208,trump 's popularity tell us america country ?,donald trump 's popularity tell us american values ?,1,0.0,0.0,15,0.9444444444444444
339209,0 positive negative number ?,significance fact ' 0 neither positive negative number ?,0,0.0,0.0,28,0.8947368421052632
339210,feel sentenced death ?,feel like sentenced death ?,1,0.0,0.0,5,0.9230769230769231
339211,underweight 5 ' 5.5 female ?,110 pounds underweight 5 ' 5.5 female ?,0,0.0,0.0,11,0.8837209302325582
339212,happens periods 5 days late ?,14 days late period without pregnant ?,0,0.0,0.0,26,0.8333333333333334
339213,like work vanguard group ?,review vanguard group ?,0,0.0,0.0,8,0.9333333333333333
339214,china pakistan proposed india join cpec . india join project ?,india join cpec ?,1,0.0,0.0,45,0.7857142857142857
339215,animals humans talk language ?,animals humans produce music ?,0,0.0,0.0,12,0.7333333333333333
339216,get 330 gre ?,get 330 gre ?,1,0.0,0.0,0,1.0
339217,facebook choose shows chat sidebar ?,facebook categorize chat column ?,0,0.0,0.0,17,0.7428571428571429
339218,percentage romantic relationships long-distance ?,"met person broke heart , would say ?",0,0.0,0.0,36,0.7368421052631579
339219,much typically cost image print holographic images ?,"holograms exist ? , much space require function ?",0,0.0,0.0,43,0.8717948717948718
339220,life mars ?,think life mars ?,1,0.0,0.0,6,0.8333333333333334
339221,best ways teach kids read ?,best way teach child read ?,1,0.0,0.0,5,0.9333333333333333
339222,could bombing dresden considered war crime ?,allied bombing dresden possible war crime ?,1,0.0,0.0,11,0.9411764705882353
339223,review kannadasan ( tamil poet lyricist ) ?,tamil poet kannadasan overrated ?,1,0.0,0.0,28,0.8648648648648649
339224,effective indirect ways flirting girl ?,flirting : 's good way hit single girls twitter ?,0,0.0,0.0,32,0.8333333333333334
339225,manaphy angsty throughout pokemon ranger temple sea ?,manaphy angsty pokemon ranger temple sea ?,1,0.0,0.0,11,0.9696969696969697
339226,frequent masturbation affect sperm quality ?,excessive masturbation lead low sperm count ?,1,0.0,0.0,21,0.8205128205128205
339227,best free app use track somebody 's phone ?,best app track someone 's phone location without person 's device ?,1,0.0,0.0,44,0.8571428571428571
339228,print progress report edx ?,print report without printer ?,0,0.0,0.0,19,0.72
339229,'s worst hotel málaga ?,'s worst hotel paris ?,0,0.0,0.0,6,0.8275862068965517
339230,place learn black magic ?,overcome black magic ?,0,0.0,0.0,10,0.8571428571428571
339231,grateful moment ?,"things grateful , moment ? would consider greatest blessing ?",1,0.0,0.0,44,0.7647058823529411
339232,salary new graduates starting google 2016 ?,non computers/it graduates apply google apac 2016 ?,0,0.0,0.0,27,0.8837209302325582
339233,meditate ?,best way meditate ?,1,0.0,0.0,9,0.8
339234,ravana really ten heads ?,king ravana ten heads ?,1,0.0,0.0,10,0.8148148148148148
339235,legit www.magnumcashadvance.com ?,legit www.wtsof.com ?,0,0.0,0.0,16,0.7878787878787878
339236,one get prepared campus placement ?,prepare campus placement ?,1,0.0,0.0,9,0.896551724137931
339237,scarlett kennedy enjoy using manipulation ?,people focusing passion instead behaving victims rat race ?,0,0.0,0.0,44,0.8292682926829268
339238,"best adfly , bitly , google , link bucks tiny url ? make money ?",much money google make per hour ?,0,0.0,0.0,47,0.7567567567567568
339239,subjects syllabus 4th grade usa ?,joined ace acdemy july upto course wil sequence subjects follow completing syllabus ?,0,0.0,0.0,69,0.75
339240,nikola tesla 's iq ?,killed nikola tesla ?,0,0.0,0.0,13,0.88
339241,study history ?,learn history ?,1,0.0,0.0,5,0.75
339242,current products facilitate community engagement ?,build q & community internet products . need ?,0,0.0,0.0,38,0.8205128205128205
339243,us government forbid polygamy muslim americans legalized marriages homosexuals ?,polygamy illegal u.s. ?,0,0.0,0.0,61,0.6842105263157895
339244,best software structural engineers analyse structures ?,names structural analysis software programs ?,1,0.0,0.0,34,0.918918918918919
339245,find specific person tinder ?,"see person liked tinder , mean person n't like ?",0,0.0,0.0,33,0.7333333333333333
339246,gift gf birthday ?,.wpl file ?,0,0.0,0.0,13,0.38095238095238093
339247,"iphone 6 broke , quickly replace ?",use gestures iphone 6 plus quickly hide 'm ?,0,0.0,0.0,27,0.7804878048780488
339248,"good , realistic thriller anime like `` monster `` ?",someone quit violent past ?,0,0.0,0.0,39,0.6470588235294118
339249,"chinese really hate vietnamese ? yes , ?",vietnamese hate chinese ?,0,0.0,0.0,25,0.8571428571428571
339250,want buy smart watch ? one buy ?,want buy smart watch . one buy ?,1,0.0,0.0,1,0.9696969696969697
339251,implications banning 500 1000 rupees currency notes indian economy ?,impact indian economy sudden 500 & 1000 rupee notes withdrawal government ?,1,0.0,0.0,48,0.8936170212765957
339252,retrieve deleted messages messenger ?,retrieve deleted messages hangout ?,0,0.0,0.0,8,0.9032258064516129
339253,instagram choose 15 second duration videos ?,bbc producing great 15 second shorts instagram ?,0,0.0,0.0,31,0.9230769230769231
339254,lose weight quickly 2 weeks ?,lose 10 kgs 2 week ?,1,0.0,0.0,13,0.6896551724137931
339255,evolved apes apes around us ?,human beings evolved apes apes still found everywhere ?,1,0.0,0.0,30,0.7428571428571429
339256,"algorithms like intuitive subject ? something like , n't intuition wo n't able think beyond one level ? definitely learn , learning take certain level , 's intuition imagination ?","true keep visualizing thinking something , wont able attain ? professor said research supports .",0,0.08196690616965197,0.0,132,0.8846153846153846
339257,cap table ?,cap table twitter look like ?,0,0.0,0.0,18,0.782608695652174
339258,n't windows file names contain special characters ?,way decrypt special characters ssl log file ? ( image included ),0,0.0,0.0,50,0.8571428571428571
339259,would doctor prescribe promethazine codeine bad cough bronchitis instead simply prescribing robitussin codeine instead ?,states allow buy codeine cough syrup otc ?,0,0.0,0.0,92,0.9523809523809523
339260,best methods study high schooler ?,good studying methods high school students ?,1,0.0,0.0,25,0.9090909090909091
339261,repercussions banning rs 500 rs 1000 notes indian economy ?,effects demonetisation 500 1000 notes indian economy ?,1,0.0,0.0,23,0.8421052631578947
339262,astronauts use quora space ?,astronauts former astronauts quora ?,0,0.0,0.0,18,0.8461538461538461
339263,best indian short film ?,best indian ( hindi & languages ) short films ?,1,0.0,0.0,23,0.8648648648648649
339264,better get ms computer science ms finance ?,"ms better , ms finance ms computer science ?",0,0.0,0.0,26,0.9411764705882353
339265,model song closer chainsmokers ?,"song similar , terms melody chorus , closer chainsmomers ?",0,0.0,0.0,32,0.8571428571428571
339266,wear sports bra gym ?,wear sports bra sports ?,0,0.0,0.0,6,0.88
339267,get list individual telephone numbers ?,directory landline individual phone numbers ?,1,0.0,0.0,17,0.9230769230769231
339268,tip uber driver without cash ?,uber offer way book round trip ?,0,0.0,0.0,23,0.7647058823529411
339269,best vps hosting ?,need dedicated server/vps/cloud hosting ?,0,0.0,0.0,25,0.75
339270,zycus infotech gd topic fresher ?,account manager report ?,0,0.0,0.0,24,0.7096774193548387
339271,average salary stc world bank eastern europe central asia ?,travel world average salary twenties ?,0,0.0,0.0,38,0.8648648648648649
339272,lifeproof warranty cover damaged phone ?,price damage phone ?,0,0.0,0.0,21,0.8235294117647058
339273,orthodox jews believe hell ?,ignored orthodox jews ?,0,0.0,0.0,21,0.8387096774193549
339274,could jfk appoint rfk attorney general president today ? would ethics laws rules nepotism prohibit ?,pretend jfk 's presidency instead '60s . party would identify ? would policies look like today ?,0,0.0,0.0,72,0.8333333333333334
339275,registering ibps accidentally clicked n't hold aadhar card . going affect registration ?,find rise run graph ?,0,0.0,0.0,73,0.7222222222222222
339276,parents vowed never kids ?,things parents never kids future kids ?,1,0.0,0.0,20,0.8125
339277,preservatives present liquids polypacks ? ( diary products like milk liquids usually packed polypacks ),nice python 2.x projects beginners ?,0,0.0,0.0,83,0.5853658536585366
339278,quora mark questions needing improvement ?,people still see questions marked needing improving ?,1,0.0,0.0,25,0.972972972972973
339279,keep old whatsapp number phone without old sim card ?,reuse old sim card new phone ?,0,0.0,0.0,36,0.918918918918919
339280,possible get rid cellulite ?,get rid upper arm cellulite ?,1,0.0,0.0,14,0.8275862068965517
339281,best book learn angular 2 ?,best book angular 2 ?,1,0.0,0.0,6,1.0
339282,south china sea dispute ?,south china sea dispute ?,1,0.0,0.0,0,1.0
339283,superior alternatives tripadvisor ?,like work tripadvisor ?,0,0.0,0.0,18,0.8666666666666667
339284,makes difference job interview ?,much difference make professional world job interviews b-tech degree 5 years backlogs ?,0,0.0,0.0,60,0.8260869565217391
339285,is/are new year resolutions 2017 ?,new year 's resolutions 2017 ?,1,0.0,0.0,10,0.9473684210526315
339286,widely accepted credit cards small businesses restaurants palestine ?,widely accepted credit cards small businesses restaurants israel ?,0,0.0,0.0,8,1.0
339287,main ingredients sandwich ?,ingredients used make vodka ?,0,0.0,0.0,18,0.7741935483870968
339288,sidewalks sparkling finish ?,big metal grates see city sidewalks ?,0,0.0,0.0,26,0.7272727272727273
339289,edgar allan poe 's tell-tale heart mean ?,think edgar allan poe 's dark story ?,0,0.0,0.0,23,0.8571428571428571
339290,stop global islamic terrorism ?,globalization affect islamic extremism global terrorism bad way measures solve ?,0,0.0,0.0,57,0.7368421052631579
339291,feel like jealous person ?,jealous person ?,0,0.0,0.0,10,0.8888888888888888
339292,new gibson les pauls really bad ?,"human rights , using health social care services ?",0,0.0,0.0,38,0.6857142857142857
339293,best topic make report electronics communication ?,make best use summer vacation 12th learning electronics want electronics communication engineering ?,0,0.0,0.0,59,0.8205128205128205
339294,see private account instagram ?,view someone 's profile private instagram ?,1,0.0,0.0,23,0.8235294117647058
339295,ionic bonds ?,characteristics ionic bonds ?,0,0.0,0.0,16,0.782608695652174
339296,career ladder look like industry research positions ?,career path research position company ?,0,0.0,0.0,31,0.8484848484848485
339297,native americans never widely enslaved america despite coloured ?,native american soldiers killed serving america war whose bodies turned museums instead returned families burial ?,0,0.0,0.0,72,0.8292682926829268
339298,iphone better android ?,iphone better normal android phone ?,1,0.0,0.0,13,0.9285714285714286
339299,people minimal personal life start working architectural firm ?,architecture firm give work internship ?,0,0.0,0.0,46,0.95
339300,know girl interested ?,know girl interested ?,0,0.0,0.0,0,1.0
339301,`` ends justify means '' mean ?,meaning `` means ends '' ?,0,0.0,0.0,21,0.7857142857142857
339302,problems hybrid cars ?,hybrid cars ?,0,0.0,0.0,9,0.8148148148148148
339303,'s review “ ok jaanu ” trailer featuring shraddha kapoor & aditya roy kapoor ?,review karisma kapoor ( actor ) ?,0,0.0,0.0,50,0.6046511627906976
339304,best divorce lawyer bangalore ?,find good lawyer good legal adviser cases related divorce bangalore ?,0,0.0,0.0,46,0.972972972972973
339305,quora change font ?,font quora changed ?,1,0.0,0.0,10,0.9655172413793104
339306,get rich right matter days ?,get rich `` right '' ?,1,0.0,0.0,14,0.72
339307,delete pictures instagram ?,delete pictures instagram ?,1,0.0,0.0,0,1.0
