id,question1,question2,is_duplicate,CosineSimilarity,JaccardSimilarity,Levenshtein,DiceSimilarity
77921,share link answer got maximum upvotes ever quora ?,answer got upvotes quora ?,1,0.0,0.0,24,0.8333333333333334
77922,find adwords interview questions ?,common errors made answering java interview questions ?,0,0.0,0.0,27,0.8571428571428571
77923,avoid sex ?,avoid sex someone soon ?,0,0.0,0.0,13,0.9090909090909091
77924,start learning passionate programming `` zero '' abilities ?,start learning programming beginner expert ?,1,0.0,0.0,29,0.8823529411764706
77925,many times ( real average ) man sex ( orgasm ) night day ( 12 hours ) ?,many times one sex day ?,0,0.0,0.0,49,0.7222222222222222
77926,`` mobile '' `` home '' mean whatsapp contacts page ?,whatsapp contact 's last seen time differ whatsapp web mobile app ?,0,0.0,0.0,45,0.8717948717948718
77927,'s best way get pudong airport bund 7pm ?,best way get shanghai pudong airport bund 5:30am ?,0,0.0,0.19999999999999996,17,0.8372093023255814
77928,gk book best ?,best gk book ?,1,0.0,0.1428571428571429,9,1.0
77929,say `` 形から入る '' english ?,could say `` 也是醉了 '' english ?,0,0.0,0.0,11,0.6666666666666666
77930,believe soul mate ? believe looking one,believe soul mate everyone world ?,1,0.0,0.0,16,0.8235294117647058
77931,"iims aim one 92.5 percentile cat , 87.4 10th , 92.4 12th distinction ?","percentile would needed cat 2015 get call top iims ( , b , c , l ) credentials ?",0,0.0,0.0,61,0.7692307692307693
77932,best ios online training institute ?,best android online training institutes ?,0,0.0,0.11111111111111116,7,0.9655172413793104
77933,women feel different penis size ?,penis long ?,0,0.0,0.0,25,0.6923076923076923
77934,change accent google maps voice navigation ?,google maps use female voice ?,0,0.0,0.0,28,0.8387096774193549
77935,food try india ?,best food try visiting india ?,1,0.0,0.11111111111111116,14,0.8148148148148148
77936,need `` never give '' ?,never give ?,0,0.0,0.0,11,0.8421052631578947
77937,"actors praised movie , rest cast including producers , writers , vfx team , camera crew stuntmen ?","documentaries : movie act killing , one producers number camera-men recorded `` anonymous '' credits ?",0,0.0,0.0,72,0.7916666666666666
77938,make friends people ?,make friend ?,1,0.0,0.0,8,0.8461538461538461
77939,wrote snl sketch “ close encounter ” ?,writes sketches snl ?,0,0.0,0.0,21,0.8275862068965517
77940,would say based birth chart ?,say based birth chart ?,0,0.0,0.0,6,0.8666666666666667
77941,start gyming ?,start gyming home ?,0,0.0,0.0,5,0.88
77942,kind people oral examiners ielts ?,qualifications need become ielts examiner ?,0,0.0,0.0,32,0.8
77943,medical tests undergo marriage ?,medical tests couple undergo getting married ?,1,0.0,0.0,18,0.9696969696969697
77944,overrated movies 2016 ? ?,overrated movie 2015 ?,0,0.0,0.0,4,0.9032258064516129
77945,pancetta prepared ? pancetta substituted ?,pancetta prepared ?,1,0.0,0.0,23,0.8333333333333334
77946,second year graduation n't like course life city ( delhi ) . return hometown join college ?,"second year graduation , n't like course life city ( delhi ) . return hometown join college ?",1,0.0,0.0,2,0.9811320754716981
77947,kind programming language learn want debug game-making website like zondle.com ?,best programming language learn order rapidly develop video games ?,1,0.0,0.08333333333333337,40,0.8095238095238095
77948,programming language best nowadays ?,best computer programming language learn first ?,1,0.0,0.09999999999999998,25,0.8648648648648649
77949,"make 10,000 week betting horses ?","make 30,000 week betting horses ?",1,0.0,0.0,1,0.9473684210526315
77950,think india 's surgical strikes pakistan ?,view/opinion surgical strike indian army ?,1,0.0,0.0,22,0.8
77951,superheating done rankine cycle ?,reason behind efficiency rankine cycle low ?,0,0.0,0.0,24,0.8108108108108109
77952,turkish men marry arabs ?,israeli men like arab women ? kind arab women like ?,0,0.0,0.09999999999999998,37,0.7333333333333333
77953,"interest studies , concentration , get concentration studies ?",get interest studies ?,0,0.0,0.0,43,0.8461538461538461
77954,crack iphone 6 screen increase ?,crack iphone screen ?,0,0.0,0.0,11,0.9629629629629629
77955,main inspiratory muscles ?,main muscles body ?,0,0.0,0.0,17,0.8387096774193549
77956,fun classes lessons adults try ?,2 months teaching class computers adults . 'm 16. 2 one hour lectures . best way teach ?,0,0.0,0.1428571428571429,64,0.6829268292682927
77957,recover gmail password without recovery phone number email ?,instagram set email longer access . change password instagram without email password ?,0,0.0,0.0,63,0.9047619047619048
77958,result banning 500 1000 rupees note india ?,effect demonetization 500 1000 rupees note ?,1,0.0,0.0,23,0.8205128205128205
77959,troubleshoot windsheild washer ?,much laundry detergent use top loading regular washer ?,0,0.0,0.0,37,0.8333333333333334
77960,torrents blocked ?,torrent blocked ?,0,0.0,0.0,1,0.96
77961,painless peaceful way kill ?,best painless way kill ?,1,0.0,0.2857142857142857,13,0.8275862068965517
77962,"donald trump , really ?",donald trump ?,1,0.0,0.0,9,0.8888888888888888
77963,scored 70 % marks fiitjee ftre 2016. good score ? much scholarship get ?,got mark 41 % fiitjee ftre admission test - get scholarship ?,0,0.0,0.0,37,0.8235294117647058
77964,hypocrites ? really ?,hypocrites ? justify ?,1,0.0,0.0,6,0.8275862068965517
77965,people addicted cell phones/smart phones ?,people bathroom phones ?,0,0.0,0.0,23,0.8387096774193549
77966,newton 's third law love ?,love follow newton 's third law motion ?,0,0.0,0.0,17,0.9411764705882353
77967,disease ? epidemic ?,disease ? epidemic ?,1,0.0,0.0,0,1.0
77968,anyone two salary accounts one bank ?,anyone open swiss bank account ?,0,0.0,0.0,22,0.875
77969,kvpy sa 2016 ?,cut-off kvpy sa stream 2016 ?,1,0.0,0.0,15,0.7272727272727273
77970,learn circuit designing ?,learn circuit design ?,0,0.0,0.0,3,1.0
77971,mobile number ?,t-mobile numbers begin ?,0,0.0,0.0,9,0.8461538461538461
77972,really important learn history ?,important learn history ?,1,0.0,0.0,7,1.0
77973,difference public limited company private limited company ?,safe invest public limited company ?,0,0.0,0.0,32,0.9473684210526315
77974,find ip address facebook user ?,find email address facebook user quora user ? need contact one person asap,0,0.0,0.0,44,0.8888888888888888
77975,money necessary every person world ?,every person running money today 's world ?,1,0.0,0.0,28,0.8333333333333334
77976,arranged marriages successful ?,successful arranged marriages ?,0,0.0,0.0,22,1.0
77977,o.j simpson 's kid 's ?,j simpson ?,0,0.0,0.0,12,0.8181818181818182
77978,worth moving new zealand leaving well settled software engineer life india ?,new zealand 3-5 years behind software engineering technology trends ?,0,0.0,0.0,46,0.8095238095238095
77979,awesome hologram tools exist people n't know ?,mind-blowing hologram tools people n't know ?,1,0.0,0.0,17,0.9
77980,obtain maximum marks 12th board exams ?,score good marks class 12th board exams ?,1,0.0,0.0,18,0.8421052631578947
77981,"dislike hilary clinton ? , please could explain ?",many people hate hilary clinton ?,1,0.0,0.0,36,0.8
77982,format specifier ?,format specifiers c ?,0,0.0,0.0,3,1.0
77983,block messages school ?,block messages college ?,1,0.0,0.0,6,0.96
77984,happen electrons get crashed nucleus ?,n't electrons crash nucleus ?,1,0.0,0.0,12,0.8666666666666667
77985,’ diameter biggest known black hole ?,distribution networks blackholes ?,0,0.0,0.0,22,0.8947368421052632
77986,pushes people suicide ?,people commit suicide ?,1,0.0,0.0,11,0.88
77987,problem hernia operation early age ?,big problem moral hazard healthcare would right let over-spend pay under-spend ?,0,0.0,0.0,58,0.8
77988,best gaming laptop rs 60000 ?,best 2-in-1 laptop rs . 50k ?,0,0.0,0.11111111111111116,9,0.7567567567567568
77989,cancel quora ?,one withdraw quora ?,1,0.0,0.0,12,0.72
77990,guidelines norms villages provisions different infrastructure facilities ?,various guidelines norms villages provisions different infrastructure facilities ?,1,0.0,0.0,8,1.0
77991,best way oats breakfast ?,breakfast ?,0,0.0,0.0,14,0.8695652173913043
77992,deal stage fright ?,stage fright ? overcome ?,1,0.0,0.0,16,0.7857142857142857
77993,procedure start country ?,start country ?,1,0.0,0.0,10,0.88
77994,risks jg bar-10 airsoft ?,risks using parts made airsoft real firearms ?,0,0.0,0.0,26,0.6470588235294118
77995,pgcil hire managers laterally ?,"depressed person remember loved care , pushed away ? try reach initiate contact ?",0,0.0,0.0,66,0.7894736842105263
77996,famous hackers/hacker groups india ? things done ?,india famous ?,0,0.0,0.0,41,0.7096774193548387
77997,difference immigration emigration ?,difference migrant immigrant ?,0,0.0,0.0,12,0.9629629629629629
77998,nike 's marketing strategy ?,thinking reebok great marketing strategy ? people choose nike adidas reebok ?,0,0.0,0.0,52,0.7647058823529411
77999,safe eat food ants gotten ?,know food eating 'safe eat ' ?,0,0.0,0.0,22,0.8461538461538461
78000,major drug targets leukemia ?,major drug targets diabetes ?,0,0.0,0.0,7,0.9032258064516129
78001,speed light limit ?,universe speed limit ?,1,0.0,0.0,12,0.7692307692307693
78002,best twitter accounts follow interested digital humanities ?,review circle ( 2017 movie ) ?,0,0.0,0.0,46,0.5405405405405406
78003,meaning life ?,think ultimate meaning life ?,1,0.0,0.0,15,0.8333333333333334
78004,reason air moves areas high low pressure ?,could air pressure room get high could n't breathe ?,0,0.0,0.0,33,0.8108108108108109
78005,would earth like humans never existed ?,"humans never existed , would earth look like ?",1,0.0,0.0,37,0.9743589743589743
78006,chances trump able bring back manufacturing work & industry ?,trump supporters think going bring manufacturing back america ?,0,0.0,0.0,38,0.8837209302325582
78007,chances nuclear war india pakistan ?,happen war india pakistan ?,1,0.0,0.0,11,0.9032258064516129
78008,one earn money online without investment home ?,earn money online home ?,1,0.0,0.0,23,0.8275862068965517
78009,joe lonsdale think buzzfeed 's inside palantir article ?,palantir employees think buzzfeed 's article ?,0,0.0,0.0,32,0.9333333333333333
78010,really need love ?,people really need love ?,1,0.0,0.0,7,0.9565217391304348
78011,instagram ( product ) : get verified account instagram ?,verify instagram account without phone number ?,1,0.0,0.0,40,0.8095238095238095
78012,ncert enough qualifying marks jee mains ?,subjectwise qualifying marks jee main ?,0,0.0,0.0,13,0.9047619047619048
78013,become veterinarian ?,become veterinarian ?,0,0.0,0.0,0,1.0
78014,improve power ?,improve remembering power ?,0,0.0,0.0,12,0.8695652173913043
78015,get reliable professional services envelope printing sydney ?,get professional reliable envelope printing service sydney ?,1,0.0,0.0,24,1.0
78016,bad bumps head caused football helmet ?,normal bumps head ?,0,0.0,0.0,28,0.8387096774193549
78017,talk girls talking guys ?,tell talking guys ?,0,0.0,0.0,7,0.9230769230769231
78018,people us decision power president ?,worst president u.s. history ?,0,0.0,0.0,27,0.8387096774193549
78019,car luxurious also fastest ?,fastest programming language considering platforms ?,0,0.0,0.0,41,0.8125
78020,english official language india ?,corporate conspiracy blame trash ?,0,0.0,0.0,28,0.6875
78021,japanese guys try look feminine ? n't girls find gross ?,guys like `` neg '' girls ? 's really annoying hurts feelings . let negging bother ?,0,0.0,0.0,63,0.8095238095238095
78022,things new employees know going first day blue bird ?,things new employees know going first day blue nile ?,0,0.0,0.0,3,1.0
78023,remove `` quora community '' topic applied incorrectly ?,ca n't topic `` quora community '' removed question ?,0,0.0,0.0,32,0.95
78024,"coursera , difference due date hard deadline ?","got high scores , missed deadline , retake exam next year due nature exam , need spend whole year studying ?",0,0.0,0.0,76,0.8
78025,hot glass break comes contact cold water ?,happens put cold water hot glass ?,0,0.0,0.0,29,0.8571428571428571
78026,expected cut neet 2016 manipur ?,expected cut neet 2016 ?,0,0.0,0.0,8,0.875
78027,top five albums time ?,top five music albums ?,1,0.0,0.0,11,0.967741935483871
78028,learn speak poetically ?,learn speak eloquently ?,0,0.0,0.0,8,0.8666666666666667
78029,manage health anxiety ?,manage anxiety ?,1,0.0,0.0,7,0.9166666666666666
78030,"mars earth 's moon , would apollo program ended early 70 's ?","apollo 13 returned earth 's orbit unable re-enter safely , would nasa able mount rescue ? would contingency plan could rescued ?",0,0.0,0.0,93,0.8163265306122449
78031,good inpatient drug alcohol rehab center near marion county ia ?,good inpatient drug alcohol rehab center near kossuth county ia ?,0,0.0,0.0,7,0.9230769230769231
78032,movie best plot twist ?,best movies without plot twists ?,0,0.0,0.125,13,0.9285714285714286
78033,got injury august 5 forehead . reduce scarring long take scar go away completely ?,many tiny pimples entire face except nose skin beside eyes . get rid ?,0,0.0,0.0,63,0.851063829787234
78034,criteria follow test cricket ?,follow cricket ?,1,0.0,0.0,14,0.9230769230769231
78035,justify appointment mr. urjit patel next rbi governer ?,urjit patel right person rbi governor ?,1,0.0,0.0,29,0.85
78036,"bill gates donates much money , still one top three richest people world ?",come bill gates still richest man world despite giving away much money foundation ? much richer would n't ?,1,0.0,0.0,71,0.9130434782608695
78037,conspiracy isro founder dr. vikram sarabhai 's death ?,mind-blowing facts isro nasa ?,0,0.0,0.0,41,0.6829268292682927
78038,"dung beetles live , ?",dung beetles live ?,1,0.0,0.0,2,0.9629629629629629
78039,good song lyric prank best friend ?,good prank lyric text text friend ?,1,0.0,0.0,11,0.918918918918919
78040,"gst bill , passed rajyasabha yesterday , boost indian economy ?",advantages gst indian economy ?,1,0.0,0.0,37,0.7777777777777778
78041,cottontail rabbits look like ?,cottontail rabbits found ?,0,0.0,0.0,8,0.8275862068965517
78042,badass thing anyone ever done ?,badass thing ever done ?,0,0.0,0.0,7,0.967741935483871
78043,impress girl like ?,impress girl crush ?,1,0.24684766597121466,0.0,5,0.8333333333333334
78044,best colleges electronics instrumentation engineers abroad ?,best colleges electronics instrumentation engineers want study abroad ?,0,0.0,0.08333333333333337,11,0.9444444444444444
78045,good evidence logical argument concerning whether universe finite infinite ?,universe finite infinite ? imaginary boundary ?,1,0.0,0.0,57,0.8421052631578947
78046,share internet pc via usb cable android phone ?,use pc internet via usb android phone without rooting ?,0,0.0,0.0,30,0.918918918918919
78047,"differences ionic , covalent , hydrogen bonds ?",potassium chloride ionic covalent ?,0,0.0,0.0,36,0.7894736842105263
78048,risk factors laundromat business ?,one minimize risk starting business ?,0,0.0,0.0,24,0.8235294117647058
78049,ipad pro really pc replacement ?,ipad pro replace laptop ?,1,0.0,0.0,14,0.8888888888888888
78050,wo n't iphone charger charge ?,fix iphone wo n't charge ?,1,0.0,0.0,13,0.9375
78051,'s best way stop procrastinating ?,best way stop procrastinating become disciplined vision ?,1,0.0,0.2222222222222222,29,0.8648648648648649
78052,good hospitals india ?,top hospitals india cardiology ?,0,0.0,0.0,14,0.896551724137931
78053,cool python tricks ?,best python tricks come across ?,0,0.0,0.11111111111111116,16,0.8387096774193549
78054,many gb intel hd graphics 620 ?,play fifa 17 laptop intel integrated 620 graphics card ?,0,0.0,0.0,34,0.8636363636363636
78055,people like wear designer clothes ?,young people wear fashionable clothes ’ want judged . ?,0,0.0,0.0,34,0.8095238095238095
78056,cheese never made without rennet ?,buy rennet ?,0,0.0,0.0,24,0.5384615384615384
78057,irritate girl ?,girls really crazy iitians ?,0,0.2701803011581539,0.0,20,0.782608695652174
78058,"like work nov tuboscope , singapore ?",worth taking degree social work singapore ?,0,0.0,0.0,26,0.8421052631578947
78059,"charge 12 volt , 2 amp battery 12 volt , 5 amp charger ?",charge car battery w/a 12 volt 4.5 amp charger ?,0,0.0,0.0,20,0.8837209302325582
78060,recover gmail account ?,recover gmail ?,1,0.0,0.0,8,0.8888888888888888
78061,louis vuitton burn unsold bags ? proof ?,true louis vuitton burns unsold bags ?,1,0.0,0.0,14,0.9090909090909091
78062,"suggest boutique names ? going home based facebook page sending images whatsapp , name would apt ?",name facebook page ?,0,0.0,0.0,78,0.7222222222222222
78063,best docker book ?,would explain dockers 10-year-old kid ?,0,0.0,0.0,26,0.5625
78064,prepare phone interview google role technical program manager ? questions expect ?,prepare technical program manager interview google ?,1,0.0,0.0,43,0.8947368421052632
78065,arnab goswami resign times ? start entrepreneurs . ?,arnab goswami left et ?,1,0.0,0.0,31,0.8484848484848485
78066,download full-sized image lingerie website gets zoomed mouse hovering ?,get right image size screen background ?,0,0.0,0.0,50,0.8292682926829268
78067,deal friend-zoned ?,deal friend zone ?,1,0.0,0.0,2,0.96
78068,female porn stars moan unbelievably loudly ?,beautiful porn stars ?,0,0.0,0.0,33,0.8823529411764706
78069,genius ?,take `` genius '' ?,0,0.0,0.0,11,0.7619047619047619
78070,best coaching mumbai isi entrance exam next year exam ?,choose best blackout curtains ?,0,0.0,0.16666666666666663,43,0.8235294117647058
78071,fat girl sex appeal ?,improve sex appeal fat girl cute face ?,0,0.20205462881169114,0.0,27,0.8387096774193549
78072,symptoms mild schizophrenia ?,symptoms schizophrenia ?,1,0.0,0.0,5,0.9411764705882353
78073,earn living quora ?,earn money quora ?,1,0.0,0.0,6,0.75
78074,n't anyone answer questions ?,nobody answer questions quora ?,1,0.0,0.0,14,0.9032258064516129
78075,make money ?,make money ?,0,0.0,0.0,0,1.0
78076,man wife becomes lesbian marriage ?,touch elder brother marriage . wife like ?,0,0.0,0.0,30,0.7777777777777778
78077,take mass gainers ?,take mass gainers ?,1,0.0,0.0,0,1.0
78078,tips gain weight teenager ?,gain weight 18 year old ?,1,0.0,0.0,15,0.7333333333333333
78079,prepare gate ?,tips prepare gate ?,1,0.0,0.0,5,0.8888888888888888
78080,"'s difference analogy , metaphor simile ?",think metaphor simile describe pure thing midst filth evil ?,0,0.0,0.0,47,0.8372093023255814
78081,many gods take create universe ?,"one god created universe , many gods take make multiverse ?",1,0.0,0.0,34,0.9473684210526315
78082,animal win : squirrel scorpion ?,animal win fight : squirrel frog ?,0,0.2050210976186351,0.125,12,0.8333333333333334
78083,japanese teach children pearl harbor ?,japanese people believe reasons nation ’ bombing pearl harbor ww2 ?,0,0.0,0.0,37,0.7894736842105263
78084,sell runescape gold accounts online ?,securely sell runescape accounts ?,0,0.0,0.0,21,0.8666666666666667
78085,anyone household possess gun ?,owning gun important americans ? americans feel must gun ?,0,0.0,0.0,44,0.6875
78086,"trying simulate dialysis system membrane separation using aspen hysys , recommended fluid package use simulation ?","jobs/industries use aspen hysys real world applications ? hysys n't common , software use simulation processes ?",0,0.0,0.0,78,0.875
78087,political constitutional role queen britain ?,role queen britain ?,1,0.0,0.0,25,0.896551724137931
78088,trading available pokémon go ?,trading coming pokemon go ?,1,0.0,0.0,9,0.8484848484848485
78089,best line/phrase/para madhushala harivansh rai bachchan ?,urdu poetry : best two liner rahat indori ?,0,0.0,0.125,44,0.7894736842105263
78090,iphone 7 come ?,apple launch iphone 7 ?,1,0.0,0.0,16,0.8333333333333334
78091,fastest way make $ 1 million dollars week ?,make 1 million dollars 1 year ?,0,0.0,0.0,19,0.8823529411764706
78092,anyone hack clash clans ?,hack clash clans ?,1,0.0,0.0,7,0.8571428571428571
78093,"maternal grandfather count , mother inherit title , would considered noble birth ?","count , duke , titles come old title lord ?",0,0.0,0.0,54,0.8108108108108109
78094,dictates strong neural connections one 's brain ?,eis stream tcs electronics communication engineering fresher ?,0,0.0,0.0,42,0.8235294117647058
78095,mba nanyang technological university valued india ?,indians get job mba national university singapore nanyang technological university ?,0,0.0,0.0,59,0.9523809523809523
78096,cycling helpful weight loss ?,cycling help weight loss ?,0,0.0,0.0,3,0.9375
78097,best gaming laptop good graphics rs . 30000 ?,gaming laptop buy 30000 ?,1,0.0,0.0,23,0.7567567567567568
78098,reality bhopal simi encounter ?,encounter simi terrorists bhopal fake ?,1,0.0,0.0,32,0.918918918918919
78099,indian know indian railways facts ?,amazing facts indian railways ?,1,0.0,0.0,17,0.8484848484848485
78100,happens soul leaves body ?,life death ?,0,0.0,0.0,20,0.56
78101,enhance english writing skills ?,improve english writing skills ?,1,0.0,0.0,6,0.8125
78102,discovered wave-particle duality ?,wave-particle duality demonstrated ?,0,0.0,0.0,24,0.9473684210526315
78103,borneo pygmy elephants die malaysian government collapses ?,parameters consider linear regression someone explain significance output parameter ?,0,0.0,0.0,63,0.8205128205128205
78104,college best mechanical branch ipu ?,mechanical engineering college ipu ?,1,0.0,0.0,27,0.9090909090909091
78105,"end luffy end one piece , boa hancock nami ?","think luffy , zoro sanji end marrying ?",0,0.0,0.0,30,0.7804878048780488
78106,people commit suicide ?,peope commit suicide ?,1,0.0,0.0,1,0.96
78107,advantage pc gaming vs console gaming ? best different computers different uses ?,pc gaming better ?,1,0.0,0.0,63,0.7878787878787878
78108,give online offline jee main paper ?,mode best jee main 2017 online exam offline ?,1,0.0,0.08333333333333337,32,0.6285714285714286
78109,become cricketer ?,became cricketer ?,1,0.0,0.0,1,0.9090909090909091
78110,feel receiving compliment ? ?,feel giving compliment ? ?,0,0.0,0.0,4,0.9655172413793104
78111,mobile phone best 15k ?,best phone ₹15000 ?,1,0.0,0.1428571428571429,13,0.8
78112,least harmful cigarette ?,makes cigarettes harmful ?,0,0.0,0.0,20,0.967741935483871
78113,"software testing professional 8.5yrs experience . salary 3.8lpa.can still hope survive , progress earn good field ?",23-year-old girl working reputed company good salary package easy work-life balance ( 8 months work experience ) . past 2-3 months feeling like interested . options career ( work field change/higher studies ) ?,0,0.0,0.0,154,0.8135593220338984
78114,like appear `` kaun banega crorepati '' ?,"episodes kbc ( kaun banega crorepati ) i.e . indian version `` wants millionaire '' , scripted ?",0,0.0,0.0,68,0.8
78115,different types coffee drinks ?,often pee drink coffee tea ?,0,0.0,0.0,19,0.896551724137931
78116,start preparing ias exam ? much time spend subject ?,start preparing civil services ?,1,0.0,0.0,28,0.7272727272727273
78117,hire high pressure cleaning service sydney ?,get quality pressure cleaning services sydney ?,1,0.0,0.0,11,0.9142857142857143
78118,islamic people allowed enter mecca ?,muslims allowed mecca medina ?,1,0.0,0.0,20,0.8666666666666667
78119,make dream come true ?,dreams come true ?,0,0.0,0.0,6,0.9166666666666666
78120,prostate orgasm thing ?,'s difference normal orgasm prostate orgasm ?,0,0.0,0.0,31,0.8125
78121,cancel wrong transaction paytm ?,many transactions happen via paytm qr code ?,0,0.0,0.0,29,0.8
78122,common example prop stilt root ?,common examples viroids ?,0,0.0,0.0,13,0.9032258064516129
78123,login snapchat ?,get familiar computer terms quickly ?,0,0.0,0.0,30,0.6875
78124,reason concrete stones railway track ?,see stones railway tracks ?,1,0.0,0.0,13,1.0
78125,example template saas pricing model ?,pricing model ?,0,0.0,0.0,22,0.8666666666666667
78126,choose electrical engineering mechanical engineering ?,"choose , electrical mechanical engineering ?",0,0.0,0.0,14,0.967741935483871
78127,okay 16 year old 18 yer old together ?,stress make want eat everything sight ( nothing ) ?,0,0.0,0.0,40,0.6285714285714286
78128,best singer/band time ?,best singer/band country ?,0,0.0,0.125,7,0.8387096774193549
78129,quora make mandatory put question mark end question ? n't redundant ?,quora insist putting question mark end question ?,1,0.0,0.0,33,0.9142857142857143
78130,compass work smart phones ? sensors used show correct directions ?,compass phone work magnetism gps ?,0,0.0,0.0,43,0.9142857142857143
78131,iphone 8 usb type c port ?,iphone 7 usb type c port ?,0,0.0,0.0,1,0.9375
78132,leading blogs covering italian web industry ?,leading blogs covering web industry germany ?,0,0.0,0.0,16,0.9743589743589743
78133,characterizes albanian wedding ?,albanian wedding customs ?,1,0.0,0.0,22,0.8235294117647058
78134,linux distro best ?,top linux distros ?,1,0.0,0.0,8,0.8888888888888888
78135,safe singapore tsunami natural disasters ?,singapore natural disasters often ?,0,0.0,0.0,19,0.9696969696969697
78136,best scripting language automation testing ?,automate running test scripts hp alm ?,0,0.0,0.0,35,0.9411764705882353
78137,europeans emigrate america numbers ?,difficult emigrate america without degree ?,0,0.0,0.0,20,0.7272727272727273
78138,best interview question ever ?,'s best question ever asked interview ?,1,0.0,0.11111111111111116,23,0.875
78139,best interview questions needs great presence mind ?,best tricky interview questions ?,1,0.0,0.1428571428571429,33,0.8108108108108109
78140,advertise blog ?,best way advertise blogs ?,1,0.0,0.2857142857142857,10,0.9333333333333333
78141,would marry girl boyfriend past ?,indian guy marry girl knowing physical relation ex bf ?,0,0.19150472098440677,0.0,36,0.9090909090909091
78142,upload speed affect downloading speed utorrent ?,increase download speed utorrent ?,0,0.0,0.0,19,0.9411764705882353
