id,question1,question2,is_duplicate,CosineSimilarity,JaccardSimilarity,Levenshtein,DiceSimilarity
265950,subject wise schedule follow preparation upsc-2017 ? going prepare self study mainly .,preparing iit self-study . able 40 % questions maths physics able understand solutions . weak subjects happen everyone prepares iit self-study ?,0,0.0,0.0,109,0.8666666666666667
265951,learn machine learning ?,"non programming background , learn machine learning self ?",1,0.0,0.0,34,0.7272727272727273
265952,'s happening syria russia involved ?,war happening syria ? involved ?,0,0.0,0.0,9,0.9142857142857143
265953,black hole ? understand ?,understand black holes ?,1,0.0,0.0,22,1.0
265954,beautiful movies ?,beautiful movies ?,1,0.0,0.0,0,1.0
265955,"indian combat army commit atrocities india-occupied-kashmir , pakistan implements economic projects pakistan-occupied-kashmir ?","india combat army commit atrocities india-occupied-kashmir , pakistan implements development projects pakistan-occupied-kashmir ?",1,0.0,0.0,9,0.9787234042553191
265956,marry take legal responsibility indian married/un-divorced woman daughter living separately husband last 15 years ?,feel relationship married woman seriously happy husband two great ?,0,0.0,0.0,71,0.8333333333333334
265957,favourite fashion designers bollywood celebs ?,adhd simply nothing ?,0,0.0,0.0,36,0.7222222222222222
265958,"'m 13 mom n't let wear makeup , ?",asked mom wear makeup said angry . convince let wear makeup ?,0,0.0,0.0,39,0.7
265959,hydronium ions form ? form ?,hydronium ion formed ?,1,0.0,0.0,8,0.9230769230769231
265960,add friend back snapchat ?,get old friends snapchat back ?,0,0.0,0.0,16,0.9142857142857143
265961,best way woman gain weight order 'round ' stick-like skinny frame ?,gaining much weight hardly eat anything ?,0,0.0,0.0,49,0.8292682926829268
265962,pan number state bank mysore ?,pan number state bank travancore ?,0,0.0,0.0,7,0.9032258064516129
265963,stop eating much ?,keep over-eating ?,0,0.0,0.0,13,0.6896551724137931
265964,make get early morning ?,wake easily morning ?,1,0.0,0.0,7,0.896551724137931
265965,better : uber ola ? ?,uber ola actually looting ?,0,0.0,0.0,19,0.7692307692307693
265966,want backup phone contacts gmail account . free android app use ?,limitation use purchase free account gmail drive ?,0,0.0,0.0,44,0.8837209302325582
265967,2008 financial crisis occur ?,happened 2008 financial crisis ?,1,0.0,0.0,15,0.8125
265968,donald trump win election ?,donald trump win election ?,1,0.0,0.0,0,1.0
265969,strep throat contagious without fever ?,strep throat contagious without fever ?,1,0.0,0.0,0,1.0
265970,advantages file sharing ? disadvantages ?,benefits file sharing ?,1,0.0,0.0,24,0.896551724137931
265971,cool things bangalore ?,one unique thing bangalore must visit non-bangalorean ?,0,0.0,0.0,36,0.8235294117647058
265972,sizes papa john 's pizzas ?,papa john 's improved ?,0,0.0,0.0,13,0.8275862068965517
265973,hostel fee structure amity gurgaon ?,average estimated hostel fee structure various indian universities ?,0,0.0,0.0,40,0.918918918918919
265974,meaning `` vital force theory '' organic chemistry ?,`` organic compound '' mean chemistry ?,0,0.0,0.0,29,0.85
265975,need learn product design ?,like process server ?,0,0.0,0.0,18,0.7142857142857143
265976,"formal leather shoes buy amazon india flipkart , would make noise walking tile floor . ?",buy stuff flipkart/amazon.in us ?,0,0.0,0.0,67,0.8444444444444444
265977,state called “ rice bowl india ” ?,states india called north india ?,0,0.0,0.0,19,0.8387096774193549
265978,would like long distance relationship without sending photos video call till meet ?,ways programming homework ?,0,0.0,0.0,68,0.8108108108108109
265979,find hacker ?,l contact hacker ?,1,0.0,0.0,8,0.75
265980,color nostalgia ?,muslims eat pork ?,0,0.0,0.0,14,0.6923076923076923
265981,things need know petting dealing stray dog ?,better pets : dogs cats ?,0,0.0,0.0,32,0.6875
265982,much easy/difficult branch change iitb ?,one change branch nits ?,0,0.0,0.0,26,0.7647058823529411
265983,get cell phone tower property ?,one go installing cell tower property ?,1,0.0,0.0,17,0.8666666666666667
265984,upgrade android 2.3 gingerbread jelly bean ?,upgrade android 2.3.6 4.0 lenovo a269i ?,0,0.0,0.0,22,0.8
265985,favorite psychological thriller films ?,top 10 psychological thriller films ?,1,0.0,0.0,7,0.918918918918919
265986,"cheapest , painless , easiest way commit suicide ?",go hell commit suicide ?,0,0.0,0.0,31,0.7878787878787878
265987,prove independence product random variables ?,suppose nxn matrix whose entries independent random variables mean 0 variance σ^2 . mean variance x = det ( ) ?,0,0.0,0.0,79,0.7659574468085106
265988,"raised $ 100 vc startup , pocketed $ 20 use . would charged anything ?","working startup also employed fortune 20 company , get trouble employer ?",0,0.0,0.0,59,0.8461538461538461
265989,know crush girl ?,know girl crush ?,0,0.0,0.0,10,1.0
265990,deal heartbreak ?,deal heartbreak ?,1,0.0,0.0,0,1.0
265991,many days take pan card arrive printing ?,many days take dispatch pan card application received income tax office processing ?,1,0.0,0.0,47,0.8717948717948718
265992,arnold h. glasow accomplish lifetime ?,many books igor markov read lifetime ?,0,0.0,0.0,23,0.7692307692307693
265993,ways make money online home ?,make easy money online ?,1,0.0,0.0,11,0.9230769230769231
265994,become multi-millionaire within years ?,become millionaire 5 years ?,1,0.0,0.0,12,0.8235294117647058
265995,review class ( 2007 movie ) ?,review look ( 2007 movie ) ?,0,0.0,0.0,4,0.8823529411764706
265996,difference infectious non-infectious diseases ?,"circumstances different types grenades employed , especially concussion vs. fragmentation ?",0,0.0,0.0,67,0.7567567567567568
265997,best alarm clock ?,best alarm clocks buy ?,1,0.0,0.0,5,0.9285714285714286
265998,five guys give customers twice amount fries order ?,happens try take five guys ' free peanuts restaurant ?,0,0.0,0.0,39,0.7567567567567568
265999,could message put surface atom ?,could put message surface atom ?,1,0.0,0.0,8,1.0
266000,"'ve watching videos/reading lot conspiracy theories ( illuminati , new world order , fema camps , etc. ) . grain truth ?","conspiracy theories regarding new world order , illuminati , one world government true today 's context ?",1,0.0,0.0,70,0.8846153846153846
266001,computational power matter translated quantization life ?,processor differentiates character image file stored bits ( 0 1 ) ?,0,0.0,0.0,52,0.7441860465116279
266002,get citizenship every country ?,b.des india want arch us . licensed architect india well ?,0,0.0,0.0,45,0.6470588235294118
266003,learn mathematics ?,learn mathematics beginner ?,1,0.0,0.0,9,0.9285714285714286
266004,'indian regional navigation satellite system ( irnss ) ' available use public ?,current gps devices make use new irnss ( indian regional navigation satellite system ) ?,1,0.0,0.0,71,0.9130434782608695
266005,"scientifically , lose fat gain muscle time ?",best workout plan beginner ( male ) wants loose fat build lean muscle time ?,1,0.0,0.0,44,0.75
266006,trustable home based data entry job ?,legitimate home-based data entry job providing companies india ?,0,0.0,0.0,35,0.8205128205128205
266007,"prisons schools us ? , ?","crime statistics : us comparatively prisons , prisoners , prison spending countries ? ?",0,0.0,0.0,71,0.7058823529411765
266008,supreme court 's decision playing national anthem movie screenings affect patriotism ?,views supreme court decision must national anthem movies ?,1,0.0,0.0,44,0.8780487804878049
266009,"shrinking black money , aggregate demand get effected ?",moon nearest earth 13 dec 2016 @ 04:20 ?,0,0.0,0.125,43,0.6190476190476191
266010,"earth universe 6000 years old , creationists believe , measure millions stars several billion years old , old 13.4 billion years old ?","creationists explain universe 6,000 years old see light stars 6,000 light years away ?",1,0.0,0.0,94,0.8
266011,benefits ppf account india ?,ppf account ?,1,0.0,0.0,15,0.8
266012,hardest nick drake song play guitar ?,gandalf recognize go moria ?,0,0.0,0.0,25,0.7058823529411765
266013,police officers ride segways ?,police officers pull police officers duty ?,0,0.0,0.0,21,0.8387096774193549
266014,'s worst thing ever done one ?,worst thing done ?,0,0.0,0.0,12,0.9285714285714286
266015,increase traffic website ?,increase traffic blog ( www.midnightexpressions.wordpress.com ) ?,1,0.0,0.0,41,0.7027027027027027
266016,find free online air conditioning course ?,find free online courses ?,0,0.0,0.0,18,0.896551724137931
266017,best online drawing courses ?,best online drawing course ?,1,0.0,0.0,1,1.0
266018,go research studying mbbs ?,full procedure research mbbs ?,1,0.0,0.0,19,0.7647058823529411
266019,hr people mean employees ?,employees managers companies low opinion hr department people ?,0,0.0,0.0,49,0.8125
266020,make money online student ?,make money online college student ?,0,0.0,0.0,8,0.9375
266021,work home options english literature post graduate india ?,work home options post-graduate mcom women ?,0,0.0,0.0,30,0.9230769230769231
266022,living life ?,live life ?,1,0.0,0.0,3,0.875
266023,never met girl truly connect yet 23. normal ?,get girl 've never met personally ?,0,0.0,0.0,28,0.7777777777777778
266024,’ funniest thing seen dog ?,'s craziest/funniest thing dog ?,1,0.0,0.0,16,0.7878787878787878
266025,ashton kutcher write code real life ?,value ashton kutcher add company ?,0,0.0,0.0,22,0.8108108108108109
266026,farting releases stress agree ?,look someone 's private instagram account without following ?,0,0.0,0.0,50,0.7058823529411765
266027,like high marijuana sources thc ?,little amount thc marijuana smoke cause massive dehydration ?,0,0.0,0.0,36,0.8947368421052632
266028,`` moonrise kingdom '' filmed ? affect movie 's setting ?,exactly theme behind `` moonrise kingdom ?,0,0.0,0.0,45,0.8292682926829268
266029,multiply segment address 10h 8086 microprocessor 16 ?,conclusion slum upgrade urbanization ?,0,0.0,0.0,43,0.8095238095238095
266030,best lake tahoe ski resort ?,best worst ski resorts around lake tahoe ?,1,0.0,0.0,27,0.8666666666666667
266031,invest 1000 dollars ?,twenty year old get started investing first savings ?,0,0.0,0.0,42,0.8125
266032,educational toys helpful kids ?,best educational toys kids ?,0,0.0,0.0,13,0.8823529411764706
266033,delete account ? please answer,unsubscribe delete quora account ?,1,0.0,0.0,31,0.8387096774193549
266034,find `` part number electoral roll '' `` serial number '' voter id card india ?,serial number part voter card ?,0,0.0,0.0,54,0.9230769230769231
266035,purpose `` views '' section quora ?,increase existing iq ?,0,0.0,0.0,25,0.7096774193548387
266036,"indian aspirants go us masters , affected trump presidency ?",safe indians migrate us trump becoming president ?,0,0.0,0.0,36,0.918918918918919
266037,banda singh bahadur surrender mughals ? call weak general warrior opted surrendering fight die ?,mughal empire fall ?,0,0.0,0.0,81,0.7428571428571429
266038,lingua franca philippines ?,lingua franca india ?,0,0.0,0.0,9,0.8148148148148148
266039,"meaning pqwl , rlwl , gnwl , rlgn , rswl , ckwl , railway waiting list ?",rlwl railways ?,0,0.0,0.0,57,0.6428571428571429
266040,come ?,come ?,1,0.0,0.0,0,1.0
266041,best laptop 30k students ?,best laptop buy 30k ?,1,0.0,0.0,11,0.9032258064516129
266042,makes urine smell like fish ?,urine smell like rancid tuna ?,1,0.0,0.0,16,0.8275862068965517
266043,trusted sources news ?,reliable news source ?,0,0.0,0.0,18,0.7692307692307693
266044,driving rules georgia versus montana ?,driving rules georgia versus colorado ?,0,0.0,0.0,6,0.9032258064516129
266045,kind jobs get bachelors biology ?,kind job get bachelor 's finance ?,0,0.0,0.0,9,0.9230769230769231
266046,sell anything buying anything commodity market ?,'s strategy trade commodity market ?,0,0.0,0.0,23,0.8333333333333334
266047,best video editing software ?,best software use video editing ?,1,0.0,0.0,22,0.9696969696969697
266048,best cross platform mobile development tool 2016 ?,titanium known top cross-platform mobile development tool ?,0,0.0,0.0,23,0.8181818181818182
266049,much human excreta create single person ?,full featured game ( browser otherwise ) created single person ?,0,0.0,0.0,33,0.8292682926829268
266050,supposed get back facebook forgot email & password ? want deleted ?,forgot email password ?,0,0.0,0.0,44,0.8421052631578947
266051,want acquire farmer land according land acquisition 2013 act ?,"modi ji confident land acquisition act 2013 detrimental india 's progress , n't fight 2014 election plank amending act ? hid real intentions ?",0,0.0,0.0,109,0.8461538461538461
266052,benefits learning python programming ?,benefit learning python language ?,1,0.0,0.0,10,0.9142857142857143
266053,"true government forbids us collecting rain water consumption ? , ?",store rain water ?,0,0.0,0.0,49,0.6666666666666666
266054,'s difference radial axial good examples ?,bearing take axial radial load ?,0,0.0,0.0,26,0.7272727272727273
266055,best stream post graduation civil engineering ? india,best stream post graduation civil engineering ?,0,0.2222804325344993,0.0,6,1.0
266056,much barber make per cut chicago ?,online communities full navel-gazers ?,0,0.22861093227420443,0.0,32,0.6857142857142857
266057,killer whale eat stingray ?,killer whales eat ?,0,0.0,0.0,10,0.8888888888888888
266058,start building website ?,build website ?,0,0.0,0.0,9,0.8461538461538461
266059,n't present change detective eddie thawne killed ?,possibility eddie thawne alive become super villain future flash series ?,0,0.0,0.0,55,0.7804878048780488
266060,"india end muslim majority future ? social , economical political consequences happens ?",major future programs india ?,0,0.0,0.0,65,0.8205128205128205
266061,normalize data ?,"calculate compound interest 15625 3 years 4 % per annum , compounded annually ?",0,0.0,0.0,69,0.631578947368421
266062,get friend take shower without offending ?,e-aadhar card valid proof irctc e-ticket travel train ?,0,0.0,0.0,40,0.7428571428571429
266063,"game thrones , dragons kill white walkers ? , ?",dragons threat white walkers ?,1,0.0,0.0,25,0.9411764705882353
266064,like work microsoft india ?,like work microsoft india ?,1,0.0,0.0,0,1.0
266065,character analysis quote `` voice full money '' ?,character analysis consist ?,0,0.0,0.0,25,0.8
266066,medical profession paid nepal ?,medical profession paid ?,0,0.0,0.0,6,1.0
266067,lexicographical order mean ?,lexicographic order mean ?,1,0.0,0.0,2,1.0
266068,"os better , windows , mac os x , linux ?",os cool windows linux mac os x ?,1,0.0,0.0,21,0.8484848484848485
266069,charlie chaplin important ?,charlie chaplin important ?,1,0.0,0.0,0,1.0
266070,would doctor prescribe vitamin d2 50000 units ?,"vitamin pills get absorbed human body , many say , doctors prescribe vitamin pills pregnant women ?",0,0.0,0.0,66,0.8444444444444444
266071,stocks great multibagger stocks ?,internship training needs academic mark qualifications ?,0,0.0,0.0,43,0.8108108108108109
266072,ca n't people shut ?,ever shut ?,1,0.0,0.0,12,0.6086956521739131
266073,remove malware pc ?,remove malware browser ?,0,0.0,0.0,7,0.8333333333333334
266074,sell car 'm making payments transfer ownership ?,someone else sell car ? still making payments car moving country may sell time .,0,0.0,0.0,46,0.8292682926829268
266075,proof ghosts really exist ?,spirits really exist ?,1,0.0,0.0,10,0.8571428571428571
266076,marathon runners allowed hypnotize feel pain/fatigue ?,future charted accountant ?,0,0.0,0.0,41,0.6857142857142857
266077,extent clouds ?,call door surrounded glass ?,0,0.0,0.0,21,0.8
266078,tourist attractions scandinavian highlands compare attractions iceland ?,tourist attractions scandinavian highlands compare attractions albania ?,0,0.0,0.0,6,0.9743589743589743
266079,become vegetarian ?,vegetarian ? ? advantages disadvantages ?,0,0.0,0.0,31,0.7692307692307693
266080,percentage muslims indian army ?,many muslims indian defence forces ?,1,0.0,0.0,22,0.8484848484848485
266081,pyrazole less basic pyridine ?,pyridine basic aniline ?,0,0.0,0.0,13,0.9333333333333333
266082,illegal immigrant cross us border ?,illegal immigrants crossing us border ?,0,0.0,0.0,4,1.0
266083,places visit pakistan ?,beautiful places pakistan ?,1,0.0,0.0,14,0.8571428571428571
266084,upload photos n't show wallpaper subreddit ?,mechanical engineering job links ?,0,0.0,0.0,38,0.6857142857142857
266085,planets named ?,planets get names ?,1,0.0,0.0,5,0.9090909090909091
266086,rules yahoo 's fantasy hockey ?,join yahoo ! fantasy football 2013 ?,0,0.0,0.0,19,0.6111111111111112
266087,"best worst things public transit saitama , japan ? could improved ?","best worst things public transit kumagaya , saitama , japan ? could improved ?",0,0.0,0.0,11,0.9583333333333334
266088,"girlfriend emotionless feeling discussions , ?",dating advice : girlfriend always wants invite friends dates . feel out-of-place sometimes . ?,0,0.0,0.0,66,0.7804878048780488
266089,get someone else 's snapchat without password verification ?,get someone 's snapchat password ?,0,0.0,0.0,26,0.8717948717948718
266090,fed dont job n lots responsibilities ?,"100,000 canadian dollars enough last 4 years canada new immigrant ?",0,0.0,0.0,50,0.5789473684210527
266091,"best laptop buy around 60000 rupees , best configuration ?",best gaming laptop buy 60000 india ?,1,0.0,0.0,38,0.8780487804878049
266092,may declare copyright work ?,copyright work ?,1,0.0,0.0,12,0.8387096774193549
266093,franklin veaux think consensual incest ?,"anyone situation waiter accidentally dropped food ? yes , react ?",0,0.0,0.0,49,0.7567567567567568
266094,countries ever attacked occupied japan past 200 years ?,countries bombed occupied japan past 200 years ?,1,0.0,0.0,11,0.9
266095,"improve note-taking ? 'm trying write main concepts , still end nearly everything said textbook .",prepared 3 years upsc write mains diagonsed neurological disease . see everything coming end life.how come ?,0,0.0,0.0,76,0.8235294117647058
266096,come different 220v countries different plug types ?,come different countries different electrical plug sockets better ?,0,0.0,0.0,28,0.8292682926829268
266097,makes angry ? interview question,types people make angry ?,0,0.0,0.0,26,0.7878787878787878
266098,pass exams ?,easiest way pass exam ?,1,0.0,0.0,13,0.8
266099,hurt people love ( parents best friends ) notbe nice everyone else ?,hurt people loved ?,0,0.0,0.0,49,0.7058823529411765
266100,best sports man world till ?,best sports person world till ?,1,0.0,0.0,5,0.9333333333333333
266101,new year 's resolutions ?,new year 's resolutions 2017 ?,1,0.0,0.0,5,0.8823529411764706
266102,views regarding ?,views ?,0,0.0,0.0,10,0.7368421052631579
266103,buy cheap rims ?,best place buy cheap apple iphones ?,0,0.0,0.0,22,0.8
266104,win 2017 uttar pradesh election ?,win next election state uttar pradesh ?,1,0.0,0.0,28,0.8717948717948718
266105,indian state jammu kashmir two capitals ?,jammu kashmir worst state india ? disrupt peace india ?,0,0.0,0.0,41,0.9743589743589743
266106,monitory policy fiscal policy related ?,quality education good faculty & lab facilities mmm gorakhpur ?,0,0.0,0.0,49,0.8292682926829268
266107,wifi masterkey work ?,wifi router work ?,0,0.0,0.0,6,0.8
266108,tea management ?,tea ?,0,0.0,0.0,11,0.7692307692307693
266109,meaning reminiscing ?,meaning word `` reminiscence '' ?,1,0.0,0.0,14,0.8148148148148148
266110,major difference ms - office 2007 2013 ?,get ms office 2007 mac ?,0,0.0,0.0,21,0.7428571428571429
266111,know funny limericks ?,favorite limericks ?,0,0.0,0.0,10,0.7741935483870968
266112,best programming language know ?,'s good easy programming language learn ?,1,0.0,0.0,15,0.8
266113,car maintenance : replace full windshield wiper blades rubber refill ?,people keep windshield wipers raised cars parked ?,0,0.0,0.0,43,0.7777777777777778
266114,"3offers -sr ba socitie generale , sr ba bnp paribas , consultant cognizant business consulting . 1to choose ? ( almost pay )","republican party nominated someone else , would defeated clinton ?",0,0.0,0.0,95,0.7755102040816326
266115,top ten hindi movie actresses time ?,top ten hindi movie actors time ?,0,0.0,0.0,5,1.0
266116,meaning syllable ?,syllable ?,1,0.0,0.0,8,0.8
266117,people make money uploading videos primewire ?,make money youtube without uploading videos ?,0,0.0,0.0,31,0.9
266118,palms hands sweat ?,hands sweat lot ?,1,0.0,0.0,10,0.88
266119,lewis structure c4h8 ? determined ?,lewis structure asf5 ? determined ?,0,0.0,0.0,4,0.8235294117647058
266120,"best time study , day night ?",'s best time study ?,1,0.0,0.0,15,0.7857142857142857
266121,understand business companies n't get ?,idea business n't know much . get know business ?,0,0.0,0.0,33,0.8421052631578947
266122,'s argument legalizing prostitution ?,"good arguments legal prostitution ? , criminalizing prostitution ?",1,0.0,0.0,31,0.8888888888888888
266123,best way make intense scene without music ?,cut short scene movie use video ?,0,0.0,0.0,31,0.75
266124,many christian groups support donald trump clearly displays unchristian attitudes behaviour ?,merits demerits company registration ?,0,0.0,0.0,70,0.8648648648648649
266125,increase traffic soon blog ?,increase traffic website ?,1,0.0,0.0,9,0.8571428571428571
266126,get penis bigger ?,make penis thicker ?,1,0.0,0.0,8,0.72
266127,"mother 21 years older child . exactly 6 years , mother exactly 5 times old child . 's father ?",mother 21 years older child . exactly 6 years mother exactly 5 times old child . 's father ?,1,0.0,0.0,2,0.9787234042553191
266128,"race exist , social construct ?",race social construct ?,1,0.0,0.0,8,0.9285714285714286
266129,true concept karma ?,concept karma ?,0,0.0,0.0,5,0.96
266130,ca n't phosphors fluorescent lamps used electroluminescent lights ?,principle carbon lamp ? carbon filament light ?,0,0.0,0.0,41,0.8648648648648649
266131,girl wo n't leave boyfriend keeps saying loves needs time ?,"girl met boyfriend , kissed couple times , wo n't leave . leading ?",0,0.0,0.0,46,0.9166666666666666
266132,use bank baroda international debit card paypal payment ?,use bank baroda debit card paypal payment ?,1,0.0,0.0,14,1.0
266133,best implementing cisco secure access solutions online training ?,good switch job frequently ?,0,0.0,0.0,54,0.7368421052631579
266134,best 10 books human psychology ?,top ten books psychology ?,1,0.0,0.0,13,0.8571428571428571
266135,"really get someone romantically , without using person entirely ? first love .",successfully imported tuk-tuk similar electric rickshaw u.s. ?,0,0.0,0.0,62,0.8444444444444444
266136,reduce belly fat 2 months ?,reduce belly fat minimal time ?,1,0.0,0.0,10,0.8571428571428571
266137,like work google ?,work google ?,0,0.0,0.0,5,0.9473684210526315
266138,n't vote hillary clinton ?,vote hillary clinton ?,0,0.0,0.0,4,0.9655172413793104
266139,like work rolls-royce ?,like work rolls-royce ?,1,0.0,0.0,0,1.0
266140,know guy loves ?,bollywood movie critics judge movie fare multiplexes single screens ?,0,0.0,0.0,59,0.6486486486486487
266141,v vendetta thriller ?,v vendetta quotable ?,0,0.0,0.0,7,0.72
266142,tips hacks new ride-sharing drivers manhattan ?,tips hacks new ride-sharing drivers atlanta ?,0,0.0,0.0,5,0.9473684210526315
266143,learn learn confident trait ?,achieve confident trait ?,1,0.0,0.0,9,0.8888888888888888
266144,many times 8800 mah power bank charge iphone 6s ?,"legal consequences driving expired drivers license texas , procedure renew ?",0,0.0,0.0,57,0.6511627906976745
266145,get rid loneliness ?,could get rid loneliness ?,1,0.0,0.0,6,0.9230769230769231
266146,best way reduce belly arm fat ?,reduce belly fat since young ?,1,0.0,0.0,22,0.8235294117647058
266147,best quotes ?,best quote apps ?,0,0.0,0.0,4,0.9
266148,"pm narendra modi scrapped rs 500 , rs 1000 notes ? helps india ?",mr. narendra modi banned ₹ 1000 500 notes india ? exchange small denominations ?,1,0.0,0.0,46,0.8372093023255814
266149,appear moon stars move sky ?,stars move ( describe movement stars night sky ) ?,1,0.0,0.0,30,0.7428571428571429
266150,young people find attractive joining isis ?,people join isis ?,0,0.0,0.0,25,0.6666666666666666
266151,like military intelligence officer ?,"pay , differences military government intelligence officers information ?",0,0.0,0.0,39,0.8333333333333334
266152,taxes pay employed non-us company ?,need pay tax non us citizen ?,0,0.0,0.0,19,0.8484848484848485
266153,become solutions architect ?,steps undergraduate become cloud solution architect ?,0,0.0,0.0,27,0.9142857142857143
266154,people say nice guys finish last . would nice girls ?,would true say '' nice girl '' myth ?,0,0.0,0.0,39,0.8780487804878049
266155,stop comparing others ?,stop comparing life people better ?,1,0.0,0.0,15,0.875
266156,"next number sequence : 1 , 2 , 2,4 , 2,4 , 2 , 4 , 6 , 2 , 6 , 4 ?","next number sequence 0 , 1 , 1 , 2 , 0.5 , 2 , 2 , 4 , 2 , 2 , 4 , 3 , 7 , 2 ?",0,0.0,0.0,20,0.8292682926829268
266157,hornaday make ammunition bolt action rifle ?,sniper rifles : long range shooting bipod - ideal barrel length ?,0,0.0,0.0,50,0.7368421052631579
266158,recover deleted data android mobiles ?,recover deleted data android ?,1,0.0,0.0,8,0.896551724137931
266159,lose weight quickly ?,best ways lose weight ?,0,0.0,0.0,17,0.8
266160,textbooks prescribed undergraduate course physics caltech ?,textbooks prescribed undergraduate courses physics harvard ?,0,0.0,0.0,7,0.9523809523809523
266161,'s happening turkey ?,problem turkey ?,1,0.0,0.0,11,0.6206896551724138
266162,start learning data science ?,start learning data science become master ?,1,0.0,0.0,14,0.896551724137931
266163,linux distribution best begginers ?,'s best linux operating system distro beginners ?,1,0.0,0.0,29,0.8571428571428571
266164,increase followers likes instagram ?,look someone 's private instagram account without following ?,0,0.0,0.0,46,0.8717948717948718
