id,question1,question2,is_duplicate,CosineSimilarity,JaccardSimilarity,Levenshtein,DiceSimilarity
403039,sex important love love important sex ?,"important , love sex ?",1,0.0,0.0,18,0.967741935483871
403040,lose weight ?,reduce body weight ?,1,0.0,0.0,10,0.6923076923076923
403041,"likely find older man affair teenage girl , instead reverse : grown woman teenage boy ?",hairstyles teenage guys like girls ?,0,0.0,0.0,67,0.7027027027027027
403042,simplify square root 15 ?,simplify square root 4/3 ?,0,0.0,0.0,3,0.8648648648648649
403043,ever seen person die ?,ever seen anyone die ?,1,0.0,0.0,5,0.8695652173913043
403044,stop hard ?,stop hard ?,1,0.1892176424689731,0.0,0,1.0
403045,get internet browser roku ?,get smart tv streamer like roku ?,0,0.0,0.0,17,0.7586206896551724
403046,favorite classic literature books ?,favorite modern literature book ? ?,0,0.0,0.0,9,0.8484848484848485
403047,think best book algorithms beginner ?,best books algorithms data structures ?,0,0.0,0.0,21,0.8823529411764706
403048,better send thank email write thank letter job interview ?,send thank letter interview ?,1,0.0,0.0,29,0.8823529411764706
403049,"one happy profit 10 points daily , nifty futures , trade daily profits ?",many futures contracts traded daily ?,0,0.0,0.0,48,0.8108108108108109
403050,responsible chemicals affinity particular neurotransmitter receptor active different parts brain ?,high school toppers ? early success mean anything long run ?,0,0.0,0.0,74,0.8717948717948718
403051,recover data formatted drive ?,recover data formated f drive free ?,0,0.0,0.0,8,1.0
403052,important things living good life ?,life advice : important things informed life ?,0,0.0,0.0,22,0.9473684210526315
403053,best indian fielder ever ?,time best fielder indian cricket team ?,1,0.0,0.0,23,0.8666666666666667
403054,owns white house ?,bathrooms like white house ?,0,0.0,0.0,12,0.7407407407407407
403055,tell somebody intelligent ?,tell somebody 's coming room 'm gone ?,0,0.0,0.0,18,0.9032258064516129
403056,history indian currency ?,competitive getting phd position astronomy univ arizona univ virginia ?,0,0.0,0.0,55,0.8571428571428571
403057,cephalopods considered advanced mollusks ?,main differences mollusk fish ?,0,0.0,0.0,27,0.9142857142857143
403058,mind-boggling facts rich people ?,mind boggling facts billionaires ?,1,0.0,0.0,11,0.918918918918919
403059,confident around new people ?,get confident around new people ?,1,0.0,0.0,4,0.9696969696969697
403060,use curly braces c programming ?,c program binary search using link list ?,0,0.0,0.0,30,0.918918918918919
403061,improve presence mind ?,person build his/her presence mind ?,1,0.0,0.0,18,0.8
403062,mass follow instagram ?,get free instagram followers fast ?,0,0.0,0.0,24,0.9655172413793104
403063,'s like working peter thiel ?,like work peter thiel ?,0,0.0,0.0,6,0.8571428571428571
403064,ever caught sex ?,ever caught sex ?,1,0.0,0.0,0,1.0
403065,hide friend list facebook ?,hide facebook feed friend ?,0,0.0,0.0,16,0.9032258064516129
403066,spy whatsapp samsung ?,best method spying whatsapp ?,0,0.0,0.0,21,0.8
403067,feel like receive blowjob ?,normal guy desire/want sex ?,0,0.0,0.0,22,0.48484848484848486
403068,protect php website spam hacker ?,protect php website hackers ?,1,0.0,0.0,6,0.967741935483871
403069,know nothing programming . best way best language start learning program ?,best way learn code ? best language learn ?,1,0.0,0.0,45,0.7894736842105263
403070,improve pronunciation english ?,improve spoken english ?,1,0.0,0.0,11,0.8484848484848485
403071,much real money would cost upgrade archer queen level 1 level 40 ?,upgrade town hall level 7 ?,0,0.0,0.0,46,0.7804878048780488
403072,blind patriotism un-american ?,un-american america ?,0,0.0,0.0,17,0.7586206896551724
403073,best book brand startup ?,best book startup branding ?,1,0.0,0.0,13,0.9333333333333333
403074,start learning java without c++ ?,learn java without learning c++ ?,1,0.0,0.0,18,0.972972972972973
403075,"240p , 360p , 480p , 720p , 1080p units videos ? 's basic idea behind ?","render video youtube shoot half 1080p half 720p , choose render 1080p 720p ?",0,0.0,0.0,61,0.8461538461538461
403076,get job india ?,get job india teen ?,0,0.0,0.0,5,1.0
403077,best seo ‪company‬ ‪delhi‬ ?,best seo services provider company delhi ?,1,0.0,0.0,21,0.8947368421052632
403078,know someone genius ?,know whether genius ?,0,0.0,0.0,6,0.8461538461538461
403079,best movies ever watch ?,five best movies time ?,1,0.0,0.0,15,0.7692307692307693
403080,verilog code 4-bit updown counter synchronous clear ?,get types verilog codes ?,0,0.0,0.0,41,0.7894736842105263
403081,possible dream long time ago ?,friends dream ?,0,0.0,0.0,22,0.7407407407407407
403082,much time leaving train person book sleeper class ticket ?,much time pass person express relationship someone else ?,0,0.0,0.0,39,0.8648648648648649
403083,like moving usa canada ?,like moving canada usa ?,0,0.0,0.0,8,1.0
403084,legacy mode bios ? difference legacy uefi ? safe use legacy mode ?,install different os legacy wi-fi mode simultaneously loading per requirement ?,0,0.0,0.0,57,0.85
403085,legal judge sign court order children services enter home speak children said could n't ?,determine lateral strain formulas ?,0,0.0,0.0,67,0.7567567567567568
403086,much equity ( % ) employee pool early stage ( angel round ) company ?,employee equity pool product startup generally ?,0,0.0,0.0,48,0.9047619047619048
403087,`` curious case benjamin button '' filmed ?,curious case benjamin button moral ?,0,0.0,0.0,11,0.8888888888888888
403088,"differences solutions , suspensions , colloids , pure substances chemistry ?",table salt compound ?,0,0.0,0.0,63,0.8333333333333334
403089,people try ask silly questions quora rather googling ?,many people ask things quora could easily google ?,1,0.0,0.0,33,0.9230769230769231
403090,become charming girl ?,charm girls ?,0,0.0,0.0,11,0.8
403091,"reviewmycdr.com legit scam , please advice ?","people use domino build computer ? , ?",0,0.0,0.0,35,0.7567567567567568
403092,percentile need score get calls iims ?,percentile need get call iims ?,1,0.0,0.0,7,0.967741935483871
403093,remove wisdom teeth ?,wisdom tooth removed ?,1,0.0,0.0,17,1.0
403094,days hindi news channels ' anchors seen walkie talkie hands ? n't get point .,air india connecting flight mumbai dubai.can leave mumbai airport layover time ?,0,0.0,0.0,62,0.7906976744186046
403095,examples racism white people ?,common racism white people ?,0,0.0,0.0,7,0.9375
403096,best laptop 60k ?,best laptop rs60000 ?,1,0.0,0.0,5,0.9230769230769231
403097,happens remove cold sore scab ?,anime creepiest scariest soundtrack ?,0,0.0,0.0,26,0.75
403098,controlling anger ?,best way control anger ?,1,0.0,0.0,13,0.8148148148148148
403099,pakistan india enemies ?,india pakistan enemies ?,1,0.0,0.0,12,1.0
403100,reviews series salem ?,"review salem , ?",0,0.0,0.0,10,0.9565217391304348
403101,buy flexible transparent oled displays ?,find 8.0 inch flexible oled prototype ?,0,0.0,0.0,29,0.7894736842105263
403102,katrina kaif deserve smita patil award according ?,n't ridiculous katrina kaif going receive smita patil memorial award ? needless mention fine actor smita patil .,1,0.0,0.0,70,0.9302325581395349
403103,download photos icloud ?,retrieve photos icloud ?,1,0.0,0.0,8,0.8
403104,"religion kurt cobain ? born christian , 've heard atheist . ?",kurt cobain overrated ?,0,0.0,0.0,40,0.8108108108108109
403105,benjamin netanyahu ?,benjamin netanyahu famous ?,1,0.0,0.0,7,0.896551724137931
403106,first amendment important ?,first amendment u.s. constitution important amendment ? ?,1,0.0,0.0,30,0.9032258064516129
403107,"best way lose belly fat ? ( workout , natural remedies pills )",lose belly fat ?,1,0.0,0.0,46,0.6470588235294118
403108,good career digital marketing ?,learning digital marketing good ?,1,0.0,0.0,15,0.9655172413793104
403109,lose energy pass bowel movement ? ( go toilet . 2 ),"desperately need break wind , 's toilet around , 'm sure outcome gaseous ?",0,0.0,0.0,56,0.7555555555555555
403110,costume ideas 7 deadly sins ?,juri costume ideas ?,0,0.0,0.0,19,0.8
403111,okay treat brahmins evil ?,brahmins brilliant ?,0,0.0,0.0,18,0.8275862068965517
403112,ios 10 upgrade ios 9.x pre-ios 9 never done ?,best gate coaching greater noida ?,0,0.0,0.0,31,0.6285714285714286
403113,check viewing facebook profile ?,see someone visited facebook profile ?,1,0.0,0.0,15,0.8108108108108109
403114,improve grades school ?,improve grades ?,0,0.0,0.0,7,0.896551724137931
403115,use inheritance programming ?,main use inheritance programming ?,1,0.0,0.0,5,1.0
403116,one best current affair app iphone ?,best current affairs app ?,0,0.0,0.0,12,0.9333333333333333
403117,ever backstabbed ?,ever backstabbed friend ?,0,0.0,0.0,7,0.8888888888888888
403118,feel lonely even 'm around many people ?,feel lonely 'm around people ?,1,0.0,0.0,10,0.967741935483871
403119,come everytime try lose weight like pilates pay $ 60 personal trainer n't lose weight ?,packages philippines tracking updated olmost month .. ?,0,0.0,0.0,67,0.7727272727272727
403120,much improved neet 2 neet 1 ?,much improved neet 2 neet 1 score ?,1,0.0,0.0,6,0.9714285714285714
403121,overcome fear time ?,overcome fear ?,0,0.0,0.0,5,0.9090909090909091
403122,"top canadian universities offering courses data science/machine learning , along respective job prospects ?",top universities offering masters data science canada gre ?,0,0.0,0.0,58,0.8571428571428571
403123,epilepsy : like epileptic seizure ?,feel like seizure ?,1,0.0,0.0,19,0.7692307692307693
403124,popular sport usa ?,popular sport america ?,1,0.0,0.0,6,0.8333333333333334
403125,yellow taxis face competition ola uber ?,biggest secret ?,0,0.0,0.0,32,0.6
403126,interesting concept ?,interesting concepts science ?,0,0.0,0.0,9,1.0
403127,meditation make grow taller teen ?,meditation make grow taller ?,0,0.0,0.0,5,1.0
403128,loose weight ?,best ways lose weight ?,1,0.0,0.0,11,0.88
403129,best books read automated reasoning program verification ?,best books read evolution ?,0,0.0,0.0,34,0.8333333333333334
403130,worst thing ever happened ?,'s worst thing 's ever happened ?,1,0.0,0.0,6,0.9696969696969697
403131,men attracted teen girls ?,men attracted slutty women ?,0,0.0,0.0,11,0.8
403132,u.s. government borrow monry pay bills ?,u.s. government borrow money pay bills ?,1,0.0,0.0,1,1.0
403133,meaning story behind starbucks logo ?,people like new starbucks logo ? why/why ?,0,0.0,0.0,26,0.8780487804878049
403134,found best quality walk wardrobes sydney ?,find best quality wardrobes sydney ?,1,0.0,0.0,7,0.972972972972973
403135,opinions modi pamela anderson ?,"episcopalians pray rosary , mean ?",0,0.11533749450236269,0.0,24,0.8571428571428571
403136,best advice give 17-year-old girl ?,advice would give 17 year old girl ?,1,0.0,0.0,13,0.8333333333333334
403137,differences transact-sql sql ?,sql : difference transaction query ?,0,0.0,0.0,16,0.8484848484848485
403138,united states america ever golden age ?,one reason persuade anti-bjps bear ?,0,0.0,0.0,28,0.7272727272727273
403139,would trump encourage supporters revolt loses election ?,would happen trump rallied supporters storm white house loses election ?,1,0.0,0.0,29,0.918918918918919
403140,best college india pursue cse ?,best college chennai pursue cse ?,0,0.0,0.0,6,0.9411764705882353
403141,different types pit bulls ?,one subdue guard dogs pit bulls ?,0,0.0,0.0,19,0.8387096774193549
403142,basic rule reach certain heights life ?,important thing need teach children early life ?,0,0.0,0.0,30,0.7647058823529411
403143,successful life ?,get success life ?,1,0.0,0.0,7,0.9
403144,scenario ramsay gets eaten dogs realistic plausible ?,real scenario ramsay bolton eaten dogs ?,1,0.0,0.0,30,0.9444444444444444
403145,"homeschooling , homeschooled share pros cons ?",pros cons homeschooled ?,1,0.0,0.0,28,0.8666666666666667
403146,"much fluoride absorbed bloodstream brush teeth , compare amount fluorine would found normally n't use fluoride toothpaste mouthwash drink fluoridated water ?","oral health benefits using fluoride-free toothpaste , equivalent brushing ?",0,0.0,0.0,116,0.782608695652174
403147,good effective alternatives porn ?,mitigate negative effects porn generation ?,0,0.0,0.0,29,0.9090909090909091
403148,question contains assumptions : women emotional men ?,question contains assumptions : guys like french kiss girls ?,0,0.0,0.0,24,0.8205128205128205
403149,add topics upon asking question quora ?,add one topic question quora ?,1,0.0,0.0,14,0.9375
403150,best yoga studio bangkok ?,best yoga studio l.a. ?,0,0.0,0.0,7,0.8666666666666667
403151,best books learning data structures algorithms ruby ?,best books learn data structures algorithms ?,0,0.0,0.0,8,0.9743589743589743
403152,safety precautions handling shotguns proposed nra south carolina ?,safety precautions handling shotguns proposed nra oklahoma ?,1,0.0,0.0,10,0.95
403153,wear toe closed shoes without socks ?,wear toe closed shoes without socks ?,1,0.0,0.0,0,1.0
403154,reselling tickets illegal ?,reselling tickets illegal ?,0,0.0,0.0,0,1.0
403155,particular reason behind launch 2000 rs notes ?,point rs . 2000 notes ?,1,0.29446066228094714,0.11111111111111116,28,0.75
403156,could cause peach fuzz grow longer one side face ?,beard grow chin n cheeks ? facial hair face ? related human evolution ?,0,0.0,0.0,55,0.8292682926829268
403157,tu darmstadt shut english taught epe program ?,kind english taught spain ?,0,0.0,0.0,26,0.875
403158,"mexican citizen becomes us citizen , long wait sponsor spouse become us citizen ?","sea citizens need visa visit singapore ? n't , long stay ?",0,0.0,0.0,52,0.7804878048780488
403159,marriage rates declining scandinavia ?,`` biglaw '' continuing raise prices smaller firms actually experiencing rate declines ?,0,0.0,0.0,67,0.717948717948718
403160,base moon ?,"best worst things public transit soweto , gauteng , south africa ? could improved ?",0,0.0,0.0,74,0.5625
403161,competitive hiring process life technologies ?,shall start completing r programming course one e-learning site ?,0,0.0,0.0,44,0.8571428571428571
403162,places visit visit kerala july ?,places visit honeymoon kerala ?,1,0.0,0.0,14,0.8235294117647058
403163,eat protein bars even n't work ?,"vegans eat working ? get enough protein , n't eat way ?",0,0.0,0.0,37,0.8333333333333334
403164,cutest mistake ’ ever seen someone make ?,'s worst thing 've seen ?,0,0.0,0.0,29,0.6666666666666666
403165,next evolution stage human ?,next major step evolution human species ?,1,0.0,0.0,23,0.8571428571428571
403166,happy ?,happy ?,1,0.0,0.0,0,1.0
403167,learn photography ?,learn professional photography ?,0,0.0,0.0,13,0.896551724137931
403168,many centimeters one meter ?,many centimetres one inch ?,0,0.0,0.0,7,0.9629629629629629
403169,log facebook without password ?,find old password log facebook gmail account ?,1,0.0,0.0,32,0.926829268292683
403170,tectonic plate interact ?,tectonic plates collide ?,0,0.0,0.0,9,0.88
403171,best training institutes ccna certification bangalore ? personal insights appreciated .,best training institute ccna placement bangalore ?,1,0.0,0.0,45,0.8648648648648649
403172,learn martial arts ?,learn martial arts ?,0,0.0,0.0,0,1.0
403173,primary demographic difference republicans democrats ?,'s difference republicans democrats usa politics ?,1,0.0,0.0,32,0.9
403174,possible install ubuntu external hard disk used alternative operating system ?,mount external hard disk ubuntu 14.04 ?,0,0.0,0.0,48,0.8181818181818182
403175,quora used ?,quora useful ?,1,0.0,0.0,3,0.8571428571428571
403176,president obama win nobel peace prize ?,likely win 2013 nobel prize peace ?,0,0.0,0.0,22,0.7368421052631579
403177,get best asbestos remediation demolition services sydney ?,get best services sydney garage asbestos demolishing ?,0,0.0,0.0,38,0.972972972972973
403178,genre kill la kill ?,kill la kill end ?,0,0.0,0.0,10,0.8421052631578947
403179,successes articles confederation ?,successes articles confederation ?,1,0.0,0.0,0,1.0
403180,merge data multiple data sources feed business dashboards ?,circuit designed pull tens/hundreds data points multiple sources continuously ?,0,0.0,0.0,57,0.9
403181,"chapters important/not important jee 2017 ? shm , solids , fluid mechanics , wave optics gravitation ?",important chapters jee main examination ?,0,0.0,0.0,72,0.6818181818181818
403182,"significance battle somme , battle compare contrast battle borodino ?","significance battle somme , battle compare contrast battle singapore ?",1,0.0,0.0,9,0.972972972972973
403183,difficult kvpy sx 2016 ?,kvpy 2016 ? much scoring ?,1,0.0,0.0,21,0.717948717948718
403184,review skins ( uk tv series ) ?,review office ( uk tv series ) ?,0,0.0,0.0,5,0.8666666666666667
403185,"ideas celebrate turning 40 , besides birthday party ?",examples power-hungry leaders history ?,0,0.0,0.0,37,0.7619047619047619
403186,n't internet free ?,internet free ?,0,0.0,0.0,4,0.9411764705882353
403187,"mahabharata real , corrected history ( timeline ) look like ?",would guy feel crush thought n't interested dated another girl realized like back ?,0,0.0,0.0,62,0.7727272727272727
403188,much astronaut working iss get paid ?,much someone get paid working cruise ship ?,0,0.0,0.0,22,1.0
403189,allowed answer questions quora ?,ca n't answer questions comment quora ?,1,0.0,0.0,15,0.8387096774193549
403190,"habits , develop avoid procrastination ?",overcome procrastination ?,1,0.0,0.0,19,0.8125
403191,"income paid/credited showing 26as statement rs . 1,25,367.44 ( salary income ) form 16 , total income shown rs 1,33,209 ( deducting pf ) . one show itr 1 'income chargeable salaries ' ?","spend 1/10 income house rent , 1/10 remainder conveyance 1/3 remainder children 's education rs.648 left . income ?",0,0.15914389909342216,0.0,139,0.835820895522388
403192,jk rowling knighted ?,"knighthood : , entertainment industry , knighted ( received title sir dame ) living today ?",0,0.0,0.0,76,0.6666666666666666
403193,earth flat ?,evidence makes people say earth flat ?,1,0.0,0.0,26,0.6206896551724138
403194,miranda rights ?,miranda rights called ?,1,0.0,0.0,7,0.8888888888888888
403195,much cost sponsor serial ?,much cost become corporate sponsor v & ?,0,0.0,0.0,22,0.8484848484848485
403196,see views twitter ?,l see viewed videos instagram ?,0,0.0,0.0,17,0.72
403197,news important ?,news important ?,0,0.0,0.0,0,1.0
403198,get ip email address ?,track ip address email ?,1,0.0,0.0,16,0.8888888888888888
403199,countries indian travel without visa ?,countries indians allowed work legally without sponsorship ?,0,0.0,0.0,28,0.8648648648648649
403200,"say , `` n't scare '' spanish , french italian ?",learn french spanish ?,0,0.0,0.0,33,0.8387096774193549
403201,"people adore celebrities intellectuals like scientists , researchers , etc . ?","lifestyle : best examples people whose parent ( ) celebrities ( actors , models , etc ) chose different career path ?",0,0.0,0.0,84,0.7555555555555555
403202,find force hydraulic jack working angle ?,great examples automation ?,0,0.0,0.0,32,0.6285714285714286
403203,"cold gobi desert get , average temperatures compare ones dasht-e margo ?","cold gobi desert get , average temperatures compare ones thar desert ?",1,0.0,0.0,11,0.9767441860465116
403204,strengths weaknesses advising system harvard ?,strengths weaknesses advising system texas & ?,0,0.0,0.0,7,0.9444444444444444
403205,lose weight effectively ?,lose fats excessive weight body ?,1,0.0,0.0,21,0.8823529411764706
403206,embarrassing thing kid ?,embarrassing things kids ever done ?,0,0.0,0.0,12,0.9375
403207,redmi note 3 get marshmallow update ?,redmi note 3 support volte ?,0,0.0,0.0,18,0.8571428571428571
403208,morally obligated report cheaters encounter ?,morally obligated report cheater encounter ?,1,0.0,0.0,1,0.9743589743589743
403209,calico cat tortoiseshell cat differ ?,difference tortoiseshell calico cats ? examples ?,1,0.0,0.0,27,0.875
403210,cows really exhale oxygen ?,cows moo ?,0,0.0,0.0,19,0.5454545454545454
403211,waze remember park ?,buy waze ?,0,0.0,0.0,15,0.7
403212,hillary clinton still become president united states ?,godmother hillary clinton still become president ?,1,0.0,0.0,24,0.9473684210526315
403213,know playschool organizes interesting events kids kolkata howrah ?,"best coaching institute ca-cpt howrah , kolkata ?",0,0.0,0.0,45,0.8095238095238095
403214,"greenbow , alabama forrest gump real city ?",disability forrest gump ?,0,0.0,0.0,26,0.8717948717948718
403215,think fall person trump ’ alleged russian scandal ?,russians think donald trump 's victory ?,0,0.0,0.0,39,0.8292682926829268
403216,"graduate harvard law ( pass american bar ) 'm canadian , practice law france england ?",happened porus alexander left ?,0,0.0,0.0,69,0.6829268292682927
403217,one would better choice -- intel i5 4th generation amd quad-core a8 ?,"better gaming , high-end intel core i5 low-end intel core i7 , 4th generation ?",0,0.0,0.0,60,0.8888888888888888
403218,employees heritage insurance good work-life balance ? differ across positions departments ?,employees white mountains insurance good work-life balance ? differ across positions departments ?,0,0.0,0.0,11,1.0
403219,"world tattoos , much full sleeve cost ?",much one tattoo arm sleeve usually cost ?,1,0.0,0.0,25,0.8235294117647058
403220,qualities great mentor ?,qualities good mentor ?,1,0.0,0.0,4,0.967741935483871
403221,biggest video game ever terms file size ?,darkest video game ever made ?,0,0.0,0.0,17,0.8387096774193549
403222,"hotel srinagar hill-station would safe unmarried couples , without harassment police , hotel staff , moral police ?","hotel pahalgam hill-station would safe unmarried couples , without harassment police , hotel staff , moral police ?",0,0.0,0.0,6,1.0
403223,think win presidency 2016 ?,think win us presidency ?,1,0.0,0.0,8,0.8571428571428571
403224,benefits/discounts given family members pilots travel airline employs pilot ?,possible fly airliner one pilot ?,0,0.0,0.0,53,0.8108108108108109
403225,"sun disappeared , would earth continue orbit 8½ minutes ?",earth continue revolve around sun 8 minutes sun happens disappear suddenly ?,1,0.0,0.0,57,0.8571428571428571
403226,worst thing teacher ?,worst things teacher n't anticipate ?,0,0.0,0.0,16,0.9333333333333333
403227,take real iq test ?,iq testing : go take legitimate iq test ?,1,0.0,0.0,24,0.7692307692307693
403228,bionic-turtle prepsmarter ? one better frm preparation ? totally confused ,someone finance background prepare frm level 1 2 months ?,0,0.0,0.0,54,0.8
403229,best movie ?,time best movies watch ?,1,0.0,0.0,12,0.8333333333333334
403230,self publish book iceland ?,'s best way self publish e-book ?,0,0.0,0.0,22,0.7777777777777778
403231,highest temperature human survive ?,'s highest temperature someone lived ?,0,0.0,0.0,13,0.8823529411764706
403232,apple allow users delete built-in apps ios devices ?,legal apple n't allow users uninstall certain ios apps ?,0,0.0,0.0,34,0.8333333333333334
403233,"never see bodies shipwreck photos ? everything including bones decomposed , respect dead remains shown ?",bone ( part body ) live dead ?,0,0.0,0.0,82,0.7317073170731707
403234,"want quit job . examples excellent , respectful resignation letters ?",would polite job resignation letter like ? include reason choosing leave company ?,0,0.0,0.0,57,0.7916666666666666
403235,hillary push forward progressive agenda gop secures congressional majority ?,hilary push forward progressive agenda gop secures congressional majority ?,1,0.0,0.0,1,1.0
403236,possible stop masturbating ?,stop masturbating ?,1,0.14621992536245715,0.0,9,0.9333333333333333
403237,different kinds media make press ?,make press pass ?,0,0.0,0.0,25,0.782608695652174
403238,linux good ?,linux good ?,1,0.0,0.0,0,1.0
403239,best baseball team world ?,best baseball team history ?,0,0.0,0.0,6,0.8148148148148148
403240,drug quit caffeine ?,quit caffeine ?,0,0.0,0.0,5,0.88
403241,would one use “ sort ” sentence ?,use `` become '' sentence ?,0,0.0,0.0,17,0.6428571428571429
403242,okay parents forbid reading certain genres books ?,"best books , genre , people reading 2009 ?",0,0.0,0.0,38,0.7894736842105263
403243,trace phone call 's origin cellphone location ?,find phone number ’ location ?,1,0.0,0.0,27,0.7428571428571429
403244,body gain weight death ?,people gain weight surgery ?,0,0.0,0.0,12,0.7741935483870968
403245,examples petrochemical products ?,unusual facts egyptian army ?,0,0.0,0.0,27,0.7647058823529411
403246,best smartphone ever ?,best smartphone 2016 ?,0,0.0,0.0,4,0.8387096774193549
403247,transfer money credit card prepaid card ?,load prepaid card credit card ?,1,0.0,0.0,21,0.7857142857142857
403248,"iraq quagmire , would sending us troops syria put usa another quagmire ?",else required apart cracking gre toefl ms ?,0,0.0,0.0,55,0.8292682926829268
403249,"advice every young , aspiring writer know ?",'s best advice young aspiring writers ?,0,0.0,0.0,19,0.9
403250,restore deleted emails gmail account ?,recover emails gmail account ?,1,0.0,0.0,11,0.9375
403251,world famous astrologer india ?,famous astrologers india ?,1,0.0,0.0,7,0.9696969696969697
403252,best institute gmat preparations delhi ?,best gmat coaching institutes delhi/ncr ?,1,0.0,0.0,27,0.918918918918919
403253,done india uri attack tackle pakistan ?,india respond uri attacks ?,1,0.0,0.0,26,0.967741935483871
403254,earn youtube ?,make money youtube ?,1,0.0,0.0,8,0.8695652173913043
403255,review 2016 macbook pro ?,developers think new macbook pro ?,1,0.0,0.0,16,0.7368421052631579
403256,swimming pools srm ? much extra money need pay ?,much time take swim one mile freestyle swimming ? swimming 6 months 50 meters pool 30 years old .,0,0.0,0.0,72,0.8333333333333334
403257,27 able grow moustache middle moustache line nose . way get rejuvenated regrow ?,indian women like indian men mustaches ?,0,0.0,0.0,61,0.7619047619047619
403258,song plays end credits 2002 movie summer things ?,song plays end credits 2002 movie may ?,0,0.0,0.0,12,0.9523809523809523
