id,question1,question2,is_duplicate,CosineSimilarity,JaccardSimilarity,Levenshtein,DiceSimilarity
325908,common people photographic memory ?,like artist photographic memory ?,0,0.0,0.0,12,0.9090909090909091
325909,examples subsistence economy ?,examples subsistence economy ?,1,0.0,0.0,0,1.0
325910,'s best differentiate girls ' boys ' names chinese ?,之与 girl 's name boy 's name chinese ?,0,0.0,0.0,27,0.8717948717948718
325911,looking original source quote ( mandarin ) `` correct mind rest life fall place '' . please help ?,much make full time uber driver ?,0,0.0,0.0,81,0.6976744186046512
325912,way individually hide instagram photo ?,instagram deleting accounts ?,0,0.0,0.0,27,0.8333333333333334
325913,fair electorate candidate clinton avoid questions several open press conference ?,much hillary clinton 's credibility hurt voters press conferences ?,0,0.0,0.0,47,0.85
325914,kaley cuoco related william shatner ?,william shatner jewish ?,0,0.0,0.0,27,0.7878787878787878
325915,correct procedure replace battery fossil watch ?,correct procedure change battery fossil watch ?,1,0.0,0.0,6,0.95
325916,civil building activities safety hazard one working height ?,breathe air breathe gases well happens harmful gases ?,0,0.0,0.0,46,0.7804878048780488
325917,find sexual orientation ?,someone help find sexual orientation ?,0,0.0,0.0,13,0.9090909090909091
325918,check counterfeit indian rupee note ?,mechanism print currency country ? much currency country print time ?,0,0.0,0.0,49,0.8125
325919,sleep air condition fever ?,much sleep teenager ?,0,0.13943568655696265,0.0,20,0.7096774193548387
325920,using star -delta connections 5hp ?,'s star/delta starter ?,0,0.1349836995021381,0.0,20,0.6
325921,best way represent india model united nations ?,best way represent russia model united nations ?,0,0.04832377325206763,0.0714285714285714,4,1.0
325922,individuals events history source pride são tomé príncipe ?,individuals events history source pride sweden ?,0,0.0,0.0,15,0.8780487804878049
325923,happens `` count monte cristo '' ?,count monte cristo long ?,0,0.0,0.0,15,0.7741935483870968
325924,super 16 lenses compatible canon 5d mark iii ?,better choice canon 6d 5d mk iii ?,0,0.0,0.0,25,0.8421052631578947
325925,white people hates black people ?,"whites hate , demonize , fear look blacks ? white self image ?",0,0.0,0.0,39,0.7567567567567568
325926,jawaharlal nehru die ? really sexually transmittable disease ?,nehru die ?,1,0.0,0.0,51,0.6428571428571429
325927,"suppose rich investing stocks , would get money everyday spending assets n't liquid ?",invest swiss real estate indirectly ?,0,0.0,0.0,62,0.75
325928,fun games group people play google+ hangout ?,ideas fun farewell party games 12th graders ?,0,0.0,0.0,36,0.8205128205128205
325929,develop brain become like jeff bezos ?,"preparing bitsat 2017 , need know exemplar class 12th 11th plus arihant good maths .",0,0.0,0.0,69,0.6382978723404256
325930,alia bhatt `` maria sharapova '' russia ?,maria sharapova `` alia bhatt '' russia ?,0,0.0,0.0,18,1.0
325931,prepare bitsat 2017 seriously ?,prepare bitsat examination 2017 ?,1,0.0,0.0,14,0.8333333333333334
325932,difference `` complete '' `` finish '' ?,difference complete finish ?,1,0.0,0.0,12,0.9411764705882353
325933,start mutual fund sip india ?,best way start sip ?,0,0.051954074242251194,0.09090909090909094,20,0.6153846153846154
325934,hair curly front straight everywhere else . get keratin straightening treatment ?,best way make straight hair curly ?,0,0.0,0.07692307692307687,61,0.85
325935,accurate thanksgiving books available children ?,liposuction safe right way remove excessive fat ?,0,0.0,0.0,42,0.7804878048780488
325936,trump bad ?,would trump make good president ?,1,0.0,0.08333333333333337,23,0.6428571428571429
325937,increase online store sale ?,improve online store sale ?,0,0.0,0.0,5,0.8461538461538461
325938,r : b1/b2 us visa 10 years . visit united states tourism ? combined business ?,visiting us b1/b2 visa valid 5 years decided study converted f1 status . left us completion i-20 terminated . still visit us b1/b2 visa still valid ?,0,0.0,0.0,101,0.8627450980392157
325939,longest roller coaster united kingdom compare longest roller coaster australia ?,longest roller coaster united kingdom compare longest roller coaster germany ?,0,0.0,0.0,8,0.972972972972973
325940,find someone 's name picture ?,find downloaded picture facebook page ?,0,0.0,0.0,24,0.7777777777777778
325941,universities store capital recruit new grads ? majors looking ?,universities burlington stores recruit new grads ? majors looking ?,0,0.0,0.0,16,0.9523809523809523
325942,good parts introvert ?,good things introverts ?,1,0.06894607025301973,0.0,6,0.8888888888888888
325943,got iiser bhopal.can tell little campus life faculty ?,foreign friend want send money india paypal limit indian government would ask anything ?,0,0.0,0.050000000000000044,68,0.8372093023255814
325944,pornography involve objectification women ?,pornography increasing objectification women ?,1,0.0,0.0,8,0.926829268292683
325945,could watch xyz pokémon series get full team flare story portrayed anime ?,find counselor studying germany ?,0,0.0,0.0,56,0.8372093023255814
325946,"hotel valparai hill-station would safe unmarried couples , without harassment police , hotel staff , moral police ?","hotel gangtok hill-station would safe unmarried couples , without harassment police , hotel staff , moral police ?",0,0.0,0.052631578947368474,7,0.9333333333333333
325947,happens die ? ( human ),happens die ? ( religion ),1,0.0,0.0,7,0.8
325948,find dumps ocjp 1.7 version ?,find ocjp 1.7 dumps ?,1,0.0,0.0,13,0.9142857142857143
325949,best movie 2016 ?,best movies 2016 ? ?,1,0.0,0.09999999999999998,3,1.0
325950,people pakistan 1971 feel react military surrendered india bangladesh ?,reading quota seems 1971 bangladesh libration war world india even shri lanka also ?,0,0.038831678617703085,0.0,56,0.8571428571428571
325951,watching streamed video consume less data downloading full video ?,uses internet data : buffering video watch downloading seeing ?,0,0.0,0.0,44,0.926829268292683
325952,sweeteners found pepsi max ? long-term effects ?,"custom gtx 1060 6gb buy ( asus rog strix , zotac , msi , gigabyte ) considering 'd like rgb lights sort ?",0,0.0,0.0,82,0.68
325953,permanent income hypothesis true ?,permanent income hypothesis ?,0,0.0,0.0,5,0.967741935483871
325954,pakistan become safe global terrorism ?,pakistan supporting terrorism ?,1,0.0,0.0,17,0.8484848484848485
325955,best free animation software ?,good free animation software ?,1,0.0,0.0,4,0.896551724137931
325956,systems development life cycle phases vs software development life cycle ?,difference software development life cycle system development life cycle ?,0,0.0,0.0,32,0.9743589743589743
325957,cause low blood pressure ?,causes low blood pressure ?,1,0.0,0.0,1,1.0
325958,longest joke ever ? ( except life ),longest joke ever ?,1,0.0,0.0,16,0.7878787878787878
325959,countries armies defend ?,countries armies defend ?,1,0.0,0.0,0,1.0
325960,"'s difference facial features chinese , japanese , korean people ?",'s difference facial features chinese men white men ?,0,0.0,0.0,21,0.8205128205128205
325961,best method learn language ?,best method learn new language ?,1,0.0,0.08333333333333337,4,0.9696969696969697
325962,jake williams ’ favourite movie ?,favorite movies ?,0,0.0,0.0,18,0.8
325963,"logic behind rac ( reservation cancellation ) seats indian railways , already system waitlisted tickets ?",reserve eq railway ticket ?,0,0.0,0.0,79,0.717948717948718
325964,council nicaea accomplish ?,council nicaea supposed resolve ?,1,0.0,0.0,14,0.8275862068965517
325965,able change birth date facebook since 2 years ? change ?,changed twitter facebook name . twitter feed connect facebook . ?,0,0.0,0.0,45,0.8205128205128205
325966,best city world live ?,best city live ?,1,0.0,0.09999999999999998,6,0.8461538461538461
325967,n't rosalind franklin get credit discovery structure dna ?,rna single stranded general double stranded like dna ?,0,0.0,0.0,39,0.8333333333333334
325968,upnp ?,'s difference upnp dlna ?,0,0.0,0.0,19,0.5
325969,start wholesale cloth business bangalore ?,bad character qualities ?,0,0.0,0.0,31,0.8125
325970,doctors call `` practice '' ?,doctor start practicing ?,0,0.0,0.0,12,0.7857142857142857
325971,"good solar panel installation provider near marysville , california ca ?","suitable solar panel installation provider near lindsay , california ca ?",0,0.039718971767795735,0.0,17,0.9
325972,got facebook account hacked . recover i.d . ?,facebook account hacked . recover facebook account ?,1,0.0,0.0,19,0.9444444444444444
325973,recover deleted browser history ?,recover deleted website browsing history ?,1,0.0,0.0,11,0.9411764705882353
325974,much ad revenue 100k uniques/month website generate ?,"much ad revenue expected 100,000 monthly visitors website ?",1,0.0,0.0,29,0.8163265306122449
325975,demographics : many households europe ?,demographics : many households world ?,0,0.0,0.0,5,0.9743589743589743
325976,iot transform daily life human ?,big influence iot going make life style human beings could opportunities provided iot ?,0,0.0,0.0,70,0.85
325977,quora secretly target users ’ like limited distribution content ?,much millions keep savings account ?,0,0.0,0.0,48,0.7692307692307693
325978,translate “ 膜 ” english ?,translate 意思意思 english ?,0,0.0,0.0,5,0.8275862068965517
325979,safety precautions handling shotguns proposed nra washington ?,safety precautions handling shotguns proposed nra rhode island ?,1,0.0,0.0,11,0.9743589743589743
325980,password open e-aadhaar card ?,process getting aadhaar card ?,0,0.0,0.0,15,0.8275862068965517
325981,different breeds dog taste different humans consume ?,grief loss dog differ grief loss human friend ?,0,0.0,0.0,34,0.8823529411764706
325982,cool facts russia ?,interesting facts russia ?,1,0.0,0.0,11,0.8
325983,business development executive ?,exactly business development executive ?,1,0.0,0.0,8,0.9444444444444444
325984,one better hdmi component ?,one better : cmc niit ?,0,0.0,0.0,9,0.8461538461538461
325985,zika virus affect pakistan ?,zika virus affect dogs ?,0,0.0,0.0,7,0.8484848484848485
325986,learn spoken english ?,improve fluency english ?,1,0.0,0.0,12,0.75
325987,china 's unemployment rate low ?,u.s. cities lowest unemployment rate 2014 ?,0,0.0,0.0,18,0.8292682926829268
325988,metals besides gold copper close color ?,"sports tournament , first , second , third designated gold , silver , bronze respectively order preciousness . bronze used copper ?",0,0.0,0.0,100,0.7804878048780488
325989,good video lectures available java beginners ?,best video lecture java beginners ?,1,0.050441208269149405,0.09090909090909094,15,1.0
325990,good hobbies interests put resume ?,"mention failed startup/business resume ? yes , ? , ?",0,0.048794058830750775,0.0,38,0.7777777777777778
325991,crack talati kam mantri exam ?,prepare talati exam ?,0,0.0,0.0,16,0.8333333333333334
325992,exams take engineering ?,exams take engineering job ?,0,0.0,0.0,4,0.896551724137931
325993,clean ears safely ?,clean ear ?,0,0.0,0.0,8,0.8421052631578947
325994,justin bieber video many dislikes ?,justin bieber 's song `` baby '' many views youtube ?,0,0.0,0.0,28,0.8205128205128205
325995,lyrics feels like reeps one english beatboxer ?,lyrics song “ feels like ” reeps one beatboxer ?,1,0.0,0.0,17,0.926829268292683
325996,best investments ?,best investment plans ?,1,0.0,0.09999999999999998,5,0.8695652173913043
325997,find active members facebook group ?,find active users facebook page ?,0,0.0,0.0,9,0.9743589743589743
325998,administrators see private messages sent slack ?,see reading slack messages ?,0,0.0,0.0,33,0.875
325999,safety precautions handling shotguns proposed nra florida ?,safety precautions handling shotguns proposed nra montana ?,1,0.0,0.0,6,0.9743589743589743
326000,pilots know speed flying airplane ?,happened jio sim 31december ?,0,0.0,0.0,28,0.6111111111111112
326001,best compliment ever got anyone ?,best compliment ever received ?,1,0.0,0.09090909090909094,10,0.8823529411764706
326002,"fungi get kingdom , instead filed plants ?",arm 's used shikh militants blue water operations funded pak themself ?,0,0.0,0.0,52,0.8205128205128205
326003,cheaper mumbai : uber ola ?,app better ola uber ?,0,0.0,0.0,18,0.7692307692307693
326004,squats daily increase size muscle ?,gain size lean muscle ?,0,0.0,0.0,20,0.8
326005,easter bunny give eggs ?,easter bunny give away chocolate eggs ?,1,0.0,0.0,15,0.8484848484848485
326006,much better 1tb storage 500gb ?,"ssds use less power hdds , much ?",0,0.0,0.0,27,0.625
326007,2008 financial crisis simple terms ?,happened 2008 financial crisis ?,1,0.0,0.0,22,0.8823529411764706
326008,four types dna monomers ?,four types mutations differ ?,0,0.0,0.0,12,0.967741935483871
326009,combined length lord rings extended editions ?,weirdest things people noticed lord rings ?,0,0.0,0.0,33,0.8484848484848485
326010,slowly lose weight ?,lose 4kg weight ?,1,0.0,0.0,8,0.88
326011,major social faux pas avoid visiting iraq ?,major social faux pas avoid visiting malta ?,0,0.0,0.0,5,0.975609756097561
326012,best way learn master computer programming language ?,best way learn computer programming languages ?,1,0.0,0.07692307692307687,8,1.0
326013,smartest thing 've seen animal ?,smartest thing 've seen child ?,0,0.0,0.0,5,0.9375
326014,best ways burn belly fat ?,exercises decrease belly fat ?,1,0.0,0.0,15,0.7586206896551724
326015,hard get uc berkeley ?,hard get uc berkeley ?,1,0.0,0.0,0,1.0
326016,"student , trust tim kaine together join forces help get bill congress ease cost college ?",able join u.s. air force ged 27 college credits 51 asvab ?,0,0.0,0.0,63,0.7659574468085106
326017,token programming ?,'s best place learn hack ?,0,0.0,0.09090909090909094,20,0.6428571428571429
326018,find tutor india ?,tutor ?,0,0.07328130741264252,0.0,11,0.7058823529411765
326019,biggest failures ?,greatest failures ?,1,0.0,0.0,5,0.96
326020,"yale wants interview , mean passed first round admission admission office interview random applicant ?",prepare interview harvard admission officer ?,0,0.0,0.0,65,0.8717948717948718
326021,best memory boosting techniques ?,best memory techniques ?,1,0.0,0.09999999999999998,9,0.9696969696969697
326022,n't suparco successful isro ?,'s next big thing expect isro ?,0,0.0,0.0,21,0.75
326023,personal message quora ?,send messeges quora ?,1,0.0,0.0,8,0.8888888888888888
326024,android apps ask updates many times ?,android apps update often ?,0,0.0,0.0,13,0.8666666666666667
326025,computer science engineer statistics courses learn data scientist ?,u.s. military health services structured separate joint branch armed forces ?,0,0.0,0.0,59,0.8
326026,like work virtusa bangalore ?,"like work hp labs , bangalore ?",0,0.0,0.0,8,0.8235294117647058
326027,"summarize situation syria since crisis , timeline ?",nehru brought end feudalism india partition ?,0,0.0,0.0,38,0.7222222222222222
326028,make money online india ?,'s easiest way make money online india ?,1,0.08044335643163042,0.0,15,0.8571428571428571
326029,monomers carbohydrates ?,many carbohydrates banana ?,0,0.0,0.0,13,1.0
326030,entrepreneurial passion ?,passion ?,0,0.0,0.0,16,0.7619047619047619
326031,square root negative numbers imaginary ?,square roots negative numbers always imaginary ?,1,0.0,0.0,8,0.9444444444444444
326032,us much debt ?,us much debt ?,0,0.0,0.0,0,1.0
326033,possible eat flour right bag ?,like eat lot ?,0,0.0,0.0,18,0.64
326034,else get disqualified neet 2017 ?,form neet aiims going 2017 fill ?,0,0.0,0.0,24,0.8333333333333334
326035,good facebook page name entertainment fun ?,suggest funny facebook page name ?,1,0.04945778025043453,0.0,30,0.8571428571428571
326036,person act someone else ?,'s like related someone committed terrible act ?,0,0.0,0.0,33,0.8
326037,fake iphone location without jailbreaking ?,incentive jailbreak iphones anymore ?,0,0.0,0.0,33,0.8
326038,views governments decision stop flow 1000 500 rupee notes . ?,opinion discontinuation 500 1000 rupee notes ?,1,0.0,0.0,32,0.8
326039,"venture capital investor , opportunity invest google passed , rationale ?","venture capital investor , opportunity invest cloudera passed , rationale ?",0,0.0,0.0,6,0.972972972972973
326040,best quickbooks technical support number ?,best quickbooks support number arkansas ?,1,0.0,0.08333333333333337,19,0.9444444444444444
326041,earn money easily online ?,easiest ways earn money online ?,1,0.0,0.0,16,0.9230769230769231
326042,review flying jatt ( 2016 movie ) ?,review flying jatt movie ?,1,0.0,0.0,9,0.85
326043,easy ways earn money online ?,ways earning money online ?,1,0.0,0.0,8,0.9629629629629629
326044,things new employees know going first day starwood hotels & resorts ?,things new employees know going first day host hotels & resorts ?,0,0.0,0.0,7,1.0
326045,status gender inequality india ? differ countries ?,causes gender inequality india ?,0,0.04699659655233396,0.0,24,0.9411764705882353
326046,much cost maintain roller coaster ?,much roller coaster cost build ?,0,0.0,0.0,23,0.9032258064516129
326047,consumptive needs activities impacts environment ?,consumptive needs activities impacts environment ?,1,0.0,0.0,0,1.0
326048,edit svg files ?,someone become billionaire 20s ?,0,0.0,0.0,23,0.46153846153846156
326049,n't daniel ek brought spotify india ?,daniel ek : spotify available india ?,1,0.048101820246870604,0.0,21,0.8205128205128205
326050,many calories burn per day healthy ?,average many calories normal person burn day ?,0,0.0,0.0,24,0.8947368421052632
326051,turkey safe ?,turkey safe given recent bombings protests ?,1,0.0,0.0,31,0.7096774193548387
326052,"hotel mussoorie hill-station would safe unmarried couples , without harassment police , hotel staff , moral police ?","hotel topslip hill-station would safe unmarried couples , without harassment police , hotel staff , moral police ?",0,0.0,0.052631578947368474,7,1.0
326053,"fiance ' comes royal family . 's 6 years younger . love much , relationship 3 years . want get married , father n't approve relationship . get father accept ?",boyfriend comes royal family . love much even planning get married . father n't approve royalty wants son marry cousin . n't want lose . ?,0,0.0,0.0,89,0.9230769230769231
326054,good youtube channel learning science ?,best sites/youtube channels science ?,1,0.05965986521926846,0.08333333333333337,19,0.8823529411764706
326055,"usa japan become allies , given japanese bombed pearl harbour usa nuked japan ?",japan usa good relations japanese killed thousands innocent people pearl harbor usa bombed japan nukes ?,1,0.0,0.0,58,0.9302325581395349
326056,prevent hard stools eating pizza ?,prevent food poisoning eating ?,0,0.0,0.0,17,0.875
326057,arvind kejriwal 's view ban 500 1000 rupee notes ?,arvind kejriwal opposing scrapping rs500 rs1000 notes scheme modi government ?,0,0.0,0.0,41,0.851063829787234
326058,fall love ?,fall love ?,1,0.0,0.0,0,1.0
326059,best movies 2016 ?,best latest movie ?,1,0.0,0.09999999999999998,10,0.7692307692307693
326060,individuals events history source pride somalia ?,individuals events history source pride india ?,0,0.0,0.0,5,0.972972972972973
326061,"cement , sand , aggregate ratios concrete mixing ?",calculate cement quantity 1:5:10 concrete mix ?,0,0.0,0.0,30,0.6666666666666666
326062,"5 ' 8 '' , 5 ' 9 '' 200 lbs big transsexual ? feet size 8 3/4 size 9 .",hard date transsexual woman ?,0,0.0,0.0,55,0.5116279069767442
326063,fairness law ?,`` fairness '' ?,0,0.0,0.0,6,0.8181818181818182
326064,overcome schizotypal personality disorder ?,schizotypal personality disorder ?,0,0.0,0.0,9,0.9444444444444444
326065,lucy killed assassins creed brotherhood ?,"think movie , assassin 's creed ?",0,0.0,0.0,25,0.7777777777777778
326066,suitable solvent wet teflon besides surfactant solution ?,water polar solvent ? ?,0,0.0,0.0,45,0.7741935483870968
326067,fix err_connection_refused chrome ?,fix err_connection_refused problem websites browsers mac ?,0,0.0,0.0,26,0.8421052631578947
326068,start business ?,start new business ?,1,0.0,0.0,4,0.9565217391304348
326069,best hangover cures ?,happen drink 500 ml beer daily ?,0,0.0,0.0,25,0.5
326070,graduate student get disseminating research grad students n't research area ?,"new graduate student , one become absorbed details research ( i.e . getting lost , track thesis ) ?",0,0.0,0.0,56,0.75
326071,quit smoking ?,quit smoking,1,0.0,0.0,2,0.9565217391304348
326072,business start 50000 rupees india ?,best idea start business capital 50000 ?,1,0.05567856947495229,0.07692307692307687,25,0.9375
326073,"differences dna , rna , atp ?",differences similarities dna rna ?,0,0.0,0.0,16,0.8571428571428571
326074,"kind economy switzerland , austria 's different ?","kind economy switzerland , netherland 's different ?",0,0.0,0.0,8,0.9545454545454546
326075,good project topic virtualization ?,good project topics ?,0,0.056016909424060256,0.0,15,0.7741935483870968
326076,essay writing services fake ?,essay writing services ethical ?,0,0.0,0.0,7,0.875
326077,eukaryotic prokaryotic cells differ ?,difference eukaryotic prokaryotic cell ?,1,0.0,0.0,19,0.9411764705882353
326078,shopmitr.com ?,graffittibooks.com ?,0,0.0,0.0,12,0.7407407407407407
326079,solutions hard water hair loss problem ?,ways one care hair water hard ?,0,0.0,0.0,25,0.7878787878787878
326080,startup success ?,age jesus first day first month ad ?,0,0.0,0.0,29,0.5714285714285714
326081,ancient egyptians bore holes solid granite without electric tools ?,ancient egyptians treat tumors ?,0,0.0,0.0,38,0.8333333333333334
326082,best high-end preschools atlanta ? makes good special ?,best high-end preschools houston ? makes good special ?,0,0.04323375997340171,0.0714285714285714,7,0.975609756097561
326083,get accepted harvard ?,done get admission harvard ?,1,0.0,0.0,13,0.7407407407407407
326084,usa allow national flag ’ design undergarments ? n't consider insult national flag ?,"question marked needing improvement . n't see flag marking . editing question , know flag removed ?",0,0.0,0.0,75,0.8181818181818182
326085,arnab goswami quitted times ?,arnab goswami resigned ?,1,0.0,0.0,11,0.9032258064516129
326086,work culture pay sophos ?,review sophos ahmadabad ?,0,0.0,0.0,22,0.6451612903225806
326087,best gifts come heart ?,domestic team ever beaten international team tour match cricket ?,0,0.0,0.0,51,0.7647058823529411
326088,find beginner nodejs tutorials use bootstrap admin templates ?,difference tankoscope explosimeter ?,0,0.0,0.0,44,0.8108108108108109
326089,advantages disadvantages working multi-level marketing/network marketing company ?,people say multi level marketing bad thing ?,0,0.0,0.0,50,0.8636363636363636
326090,universities germany offer undergraduate programs english ?,universities germany teach undergraduate english ?,1,0.0,0.0,14,0.8947368421052632
326091,considered old dating men reach 30s ?,beautiful men date average women ?,0,0.0,0.0,28,0.7222222222222222
326092,nihilists atheists ?,dangerous could nihilist person society ?,0,0.0,0.0,28,0.7142857142857143
326093,book review marketing ?,book review ?,0,0.0,0.0,10,0.8
326094,gate preparation possible 3 months ?,strategies get good score gate ee 2016 two digit rank within 3 months ?,1,0.0,0.0,49,0.717948717948718
326095,would happen swallowed bleach ?,happen drink glass bleach ?,1,0.0,0.0,17,0.7741935483870968
326096,celebrity find sexiest ?,celebrities use pinterest ?,0,0.0,0.0,12,0.7857142857142857
326097,kim jong un gout ?,kim jong un obese ?,0,0.0,0.0,5,0.8333333333333334
326098,arrange marriage rich woman ?,get rich woman ?,1,0.0,0.0,14,0.9629629629629629
326099,indifferent people think ?,ignore people think ?,1,0.0,0.0,8,0.8888888888888888
326100,navy 's seal mean ?,navy seals requirements ?,0,0.0,0.0,13,0.7692307692307693
326101,account good .net developer tcs ( pune sahyadri park ) work-life balance ?,good work-life balance life marketing employee bank india ?,0,0.03607632017750759,0.0,57,0.8333333333333334
326102,classic indian recipes chicken ?,classic indian recipes chicken ? c,1,0.0,0.0,2,1.0
326103,worst thing happened nice ?,worst thing ever happened nice ?,1,0.0,0.0,5,0.9696969696969697
326104,biggest problems u.s. education compared globally ?,needs change order u.s education # 1 globally ?,0,0.0,0.0,26,0.8780487804878049
326105,long ham corned beef last refrigerator goes bad ?,long dak canned ham last opening ?,0,0.0,0.0,27,0.8571428571428571
326106,gniit course use ?,value course gniit ?,1,0.0,0.0,10,0.8888888888888888
326107,benefit high cheekbones ?,makes woman girl unattractive ?,0,0.0,0.0,25,0.6875
326108,popular forum useful research ?,people dont want listen random bullshit ?,0,0.0,0.0,31,0.75
326109,daily lifetime follow limit pinterest ?,pinterest : see/edit list pinners follow ?,0,0.0,0.0,31,0.8484848484848485
326110,majority indian people brown ?,deacon lowest rank catholic hierarchy read gospel ?,0,0.0,0.0,40,0.7777777777777778
326111,greatest thriller movies languages english ?,top movies watch languages english ?,0,0.0,0.0,19,0.8823529411764706
326112,famous story iitian cheated iit-jee ?,"iitians cheat exams ? yes , ?",0,0.0,0.0,26,0.7272727272727273
326113,best life lessons ?,learnt life ?,0,0.0,0.0,12,0.7619047619047619
326114,views ban rs 500 rs 1000 notes indian government ? pros cons ?,views pm modi 's decision discontinuing 500 & 1000 rs notes ?,1,0.0,0.0,43,0.8837209302325582
326115,meaning love ?,true meaning love ?,1,0.0,0.0,5,0.88
326116,log instagram email ?,log instagram forgot email ?,0,0.0,0.0,7,0.9629629629629629
326117,facebook admin hide posts ?,hide admin facebook page ?,0,0.0,0.0,18,0.9090909090909091
326118,consequences northward movement indian plate physical environment india ?,important consequences northward movement indian plate ?,0,0.03847129912827758,0.0,37,0.975609756097561
326119,mind-blowing inventions tools people n't know ?,mind blowing tools things people n't know ?,1,0.0,0.0,12,0.918918918918919
