id,question1,question2,is_duplicate,CosineSimilarity,JaccardSimilarity,Levenshtein,DiceSimilarity
249953,corporate culture like united therapeutics ? culture different companies ?,corporate culture like united online ? culture different companies ?,0,0.0,0.0,11,0.972972972972973
249954,advantages disadvantages tampons sanitary napkins ?,use pad mma ?,0,0.0,0.0,42,0.6153846153846154
249955,common grammatical structure chinese sentences ?,common grammatical structure russian sentences ?,0,0.0,0.0,7,0.967741935483871
249956,describe `` quiet '' borderline depth ? might symptoms expressed ?,symptoms borderline autism ?,0,0.0,0.0,46,0.8
249957,'s best way learn japanese ?,easiest way learn japanese ?,1,0.0,0.0,4,0.896551724137931
249958,"major contributions political leaders ww1 , compared ones arab-israeli war ?","major contributions political leaders ww1 , compared ones major armed conflicts ?",0,0.0,0.0,17,0.9545454545454546
249959,armenians think arabs ?,turks think arabs ?,0,0.0,0.0,8,0.88
249960,minimum possible wavelength electromagnetic radiation ? corresponding 'maximum possible energy ' said radiation ?,highest possible frequency/shortest possible wavelength known electromagnetic radiation ?,1,0.0,0.0,75,0.88
249961,get beef jerky biltong london ?,hindus get offended eat beef india ?,0,0.0,0.0,27,0.7096774193548387
249962,"novoed : please list mooc providers like udacity , edx , coursera , etc ?",popular moocs edx coursera ?,0,0.0,0.0,49,0.7777777777777778
249963,possible fall love 16 yrs age ?,one fall love age 30 ?,0,0.0,0.0,15,0.6206896551724138
249964,okay wear black shirt khaki pants ?,pant wear white shirt ?,0,0.0,0.0,21,0.8
249965,best smartphone security apps ?,one best security software smartphones tablets ?,1,0.0,0.0,31,0.918918918918919
249966,commodity market work ?,commodity markets work ?,0,0.0,0.0,1,0.9655172413793104
249967,judges go pubs social events india ?,help india indo-americans ( probably india-diasporans countries ) avoid going massive social upheaval related feminist thought us went 1960s 1970s ?,0,0.0,0.0,121,0.6938775510204082
249968,people check bank details ?,create product n't right skills make ? ( check details ),0,0.0,0.0,39,0.7894736842105263
249969,much costs petrol pump ?,cost petrol pump ?,1,0.0,0.0,6,0.96
249970,courses instrumentation engineer better job ?,best job instrumentation engineer ?,0,0.0,0.0,19,0.967741935483871
249971,atheists believe jesus existed ?,n't atheists believe jesus ?,0,0.0,0.0,12,0.8666666666666667
249972,"'m 35 years old $ 100,000 savings . 's best way invest ?","'m 33 years old recently hit goal saving $ 100,000 . rather leave savings account , would good course action ?",0,0.0,0.0,70,0.9056603773584906
249973,n't want go back college home staying diwali weekend ? ps feel sad . ?,work 3 jobs ?,0,0.0,0.19999999999999996,61,0.42424242424242425
249974,find ifsc code using bank account number ?,find post office saving bank ifsc code ?,0,0.12515356600530528,0.09999999999999998,23,0.8571428571428571
249975,universities liberty broadband recruit new grads ? majors looking ?,universities liberty media recruit new grads ? majors looking ?,0,0.0,0.0,7,1.0
249976,differentiate l ? ( lower case l upper case ),gifts start letter j ?,0,0.0,0.0,34,0.6451612903225806
249977,movie phrase `` easy peasy lemon squeezy '' come ?,phrase `` shut '' come ?,0,0.0,0.0,28,0.7777777777777778
249978,trouble concentrating . get distracted easily even l simple tasks . l fix problem ?,get distracted easily improve concentration ?,1,0.0,0.0,54,0.8571428571428571
249979,cain get wife ?,"according genesis god created adam eve , gave birth cain abel cain killed brother . cain get wife ?",1,0.0,0.0,84,0.6470588235294118
249980,t20 format completely washed away love odi test cricket brains indian people ?,"funniest moments cricket 2015 ? ( test + odi + t20 + ipl , type format )",0,0.0,0.0,60,0.7843137254901961
249981,beginner network programming project ideas ?,find ideas good quality linux/c/c++/networking projects ?,0,0.0,0.09999999999999998,44,0.7727272727272727
249982,kind music like ?,kind music love ?,1,0.0,0.0,2,0.9230769230769231
249983,underrated movies imdb ?,movies undeserved low ratings imdb ?,1,0.0,0.0,19,0.9090909090909091
249984,increase traffic website ?,get traffic website ?,1,0.0,0.0,7,0.9230769230769231
249985,write funky message best friend going abroad studies ?,write long nice message best friend ?,0,0.0,0.0,29,0.8648648648648649
249986,people get paid write answers quora ?,still way get paid quora ?,1,0.0,0.0,22,0.9411764705882353
249987,new years resolution ?,2017 new year ’ resolution ?,1,0.0,0.0,7,0.8484848484848485
249988,long take stress fracture heal ?,long take fracture heal ?,0,0.0,0.0,7,0.967741935483871
249989,opt bsc life sciences bsc ( honors ) botany dehli university ?,course opt bsc. ( hons . ) order compete ias passed 12 class science stream ?,0,0.0,0.0,58,0.8444444444444444
249990,best sap online training institute hyderabad ?,best sap workflow online training institute hyderabad ?,0,0.0,0.0,9,0.9230769230769231
249991,worst things bollywood ?,dislike bollywood ?,1,0.0,0.0,10,0.7407407407407407
249992,sum ?,sum 2+3+4+ .. +100 ?,0,0.0,0.0,15,0.5882352941176471
249993,incognitovpn.com legit ?,informer.com legit ?,0,0.0,0.0,9,0.8571428571428571
249994,find best plaster paris india ?,best plaster paris india ?,1,0.15003613887499198,0.0,5,0.9629629629629629
249995,worst things doctor n't anticipate ?,worst things physiotherapist n't anticipate ?,0,0.0,0.0,13,0.9411764705882353
249996,differences orange kinnow ?,leave orange desk work dries . tangerine ( broadly conditions ) goes mouldy decomposes drying . different orange ?,0,0.0,0.0,95,0.7317073170731707
249997,employees c & j energy services good work-life balance ? differ across positions departments ?,employees superior energy services good work-life balance ? differ across positions departments ?,0,0.0,0.0,8,0.9387755102040817
249998,file public interest litigation ( pil ) issue/person/organisation india ? anyone quora filed one ? issues ? experience ? benefited public ?,"would help one puts pil ( public interest litigation ) increase number courts india , 1 court/judge per 10,000 people district level ?",0,0.0,0.0,100,0.7692307692307693
249999,"given choice , would one thing past would change/remove ?",could change one thing past would ? ?,1,0.0,0.0,29,0.8717948717948718
250000,would win war russia us ?,would win war united states russia ?,1,0.0,0.0,15,0.9230769230769231
250001,"planning retirement , rate inflation assume play safe ?",feel like retire extremely early ?,0,0.0,0.0,37,0.7096774193548387
250002,space time yield chemical reactor ?,greeks conquer egypt ?,0,0.1175846287380092,0.0,27,0.6451612903225806
250003,unknown facts lord shiva ?,interesting facts shiva ?,0,0.0,0.0,14,0.75
250004,donald trump likely win 2016 election ( late 2015 / early 2016 ) ?,donald trump 's response n't win 2016 presidential election ?,0,0.0,0.0,43,0.8333333333333334
250005,countries blasphemy laws ?,countries blasphemy laws ?,0,0.0,0.0,0,1.0
250006,ca n't harness earth 's rotational energy generate perpetual energy ?,ca n't harness energy rotation earth ?,1,0.0,0.0,37,0.9090909090909091
250007,strengths weaknesses advising system western connecticut state ?,strengths weaknesses advising system connecticut college ?,0,0.0,0.0,14,0.975609756097561
250008,neutron star ?,neutron star ?,1,0.0,0.0,0,1.0
250009,best hotel booking api ?,top hotel apis/xmls ?,0,0.0,0.0,14,0.7586206896551724
250010,"prepare writing sections ielts , 6 days ?",improve ielts writing 6 7 ? tried crazy hard somehow 'm stuck band 6 .,0,0.0,0.0,49,0.7659574468085106
250011,skills hone get onto google file system team ? expect person interviews google fs team ?,"technical factors affect choice cloud service provider ? dependent type applications , parallelization support ( terms sophistication api ) , performance file systems ( data access ) , something else ?",0,0.0,0.0,155,0.8085106382978723
250012,mean kitten kneading ?,kitten kneading ?,1,0.0,0.0,5,0.9523809523809523
250013,"language closer latin , romanian italian ?",romanian similar latin italian ?,1,0.0,0.0,23,0.8148148148148148
250014,people stay unhealthy abusive relationships ?,people abusive relationships reluctant leave ?,1,0.0,0.0,30,0.9411764705882353
250015,velocity bullet fired ?,much speed bullet lose fired water ?,0,0.0,0.0,21,0.7647058823529411
250016,best home workout reduce waist fat ?,best home remedy reducing belly fats ?,1,0.0,0.0,16,0.8421052631578947
250017,one learn dance ?,learn dancing home ?,1,0.0,0.0,11,0.8333333333333334
250018,earn money online ?,easy way make money online ?,1,0.0,0.0,11,0.8333333333333334
250019,increase willpower ?,best way increase willpower ?,1,0.0,0.0,9,0.896551724137931
250020,best guided meditations ?,guided meditation best ?,1,0.0,0.0,9,1.0
250021,'s name film ?,name movie ?,0,0.0,0.0,8,0.7
250022,best romantic movies ?,best romantic movie time ?,1,0.0,0.1428571428571429,5,1.0
250023,apply internship dell ?,apply internship dmrl hyderabad .,0,0.0,0.0,13,0.8666666666666667
250024,$ 15 hour minimum wage really mean u.s. economy ?,outcome $ 15 minimum wage u.s. ?,1,0.0,0.0,31,0.8717948717948718
250025,get fact 'll never able afford buying house anywhere near london ?,good houses near hospital delhi ? much would cost buy one ?,0,0.0,0.0,49,0.8837209302325582
250026,'s good excuse make contest parking ticket got parking far away curb ( back car far ) ?,self-driving cars available consumers ?,0,0.0,0.0,69,0.7272727272727273
250027,"taking meth rectal , better high ?",differences behavior noticed others high meth ?,0,0.0,0.0,32,0.7647058823529411
250028,find median four numbers ?,find median two numbers ?,0,0.14308456091592026,0.1428571428571429,4,0.9333333333333333
250029,"know , people know ?",want know people ?,0,0.0,0.0,12,0.8571428571428571
250030,boiling water better using water purifiers ?,steam hotter boiling water ?,0,0.0,0.0,28,0.8484848484848485
250031,advice help ! think go abroad ms establish good life get married ( much time take ? ) good job home town friends/family urge get married age 30 pakistan ( within 1-2yrs ) . still double minded ! .,long 'leave without pay ' government job grounds transferred home town ?,0,0.0488720738001508,0.0,156,0.7796610169491526
250032,rediscounting bills context central banks ?,commercial bank deposit central bank ?,0,0.0,0.0,23,0.8571428571428571
250033,questions quora need improving ?,quora quote improvements needed questions marked 'needing improvement ' ?,1,0.0,0.0,46,0.9444444444444444
250034,greatest regret life ?,’ biggest regret life ?,1,0.0,0.0,6,0.8695652173913043
250035,review park ( 2006 movie ) ?,review ( 2006 movie ) ?,0,0.0,0.0,5,0.9032258064516129
250036,wi-fi internet access airplane work ?,"wi-fi work even airplane mode , data connection n't ?",0,0.0,0.0,35,0.8421052631578947
250037,one become badass felicity smoak ( dc character ) ?,major items imported bangladesh ?,0,0.0,0.0,40,0.7692307692307693
250038,count facebook messages ?,facebook remove 'seen ' mark message unread ?,0,0.0,0.0,30,0.8484848484848485
250039,like homeless ?,feel like homeless ?,1,0.0,0.0,5,0.9523809523809523
250040,colors pride flag represent ?,gross national happiness ?,0,0.0,0.0,20,0.8666666666666667
250041,best resources learning node.js ?,node.js declining already ?,0,0.0,0.0,22,0.8823529411764706
250042,much groupon pay new grad software engineers ?,much box pay new grad software engineer ?,0,0.0,0.0,7,0.9523809523809523
250043,best answer asked interviewers hire ?,best answers `` hire '' ?,1,0.0,0.0,19,0.8275862068965517
250044,fundamental weaknesses arab armies caused give poor showing israelis ( least 1974 ) ?,arab leaders incompetent 1948 1967 wars israel ?,0,0.0,0.0,62,0.8076923076923077
250045,"dog difficult time standing due weak hind legs , bladder problems . ?",dog suddenly could n't walk hind legs . seems fine . 's wrong ?,0,0.08057187600176821,0.0,46,0.8936170212765957
250046,follow quora facebook ?,follow quora ?,0,0.0,0.0,9,0.8333333333333334
250047,linguistic different language ?,see many visitors reddit question received ?,0,0.0,0.0,32,0.75
250048,skills self-taught programmers commonly lack ?,feel like self-taught programmer ?,0,0.0,0.0,22,0.9230769230769231
250049,hinduism : world end according hinduism ?,happens death according hinduism ?,0,0.0,0.0,16,0.8571428571428571
250050,turn 21 today . advice would give lucrative future ?,turning 21 months . advice would give ?,1,0.0,0.0,25,0.8837209302325582
250051,"lot accounting software , detailed books teach make ?",somebody please recommend great dwi attorney southwest louisiana ?,0,0.0,0.0,51,0.8837209302325582
250052,got seat engineering management kettering university . good go ? build career ? opportunities course ?,petroleum engineer . got offer scotland university energy economics course . go ? job opportunities ?,0,0.0,0.0,60,0.9333333333333333
250053,best earbuds $ 40 ?,best earbuds $ 50 ?,0,0.0,0.0,1,0.9230769230769231
250054,'s main reason warriors losing spurs home court gsw 's first game 2016-17 nba season ?,get permanent residency usa completing masters degree ?,0,0.0,0.0,67,0.7111111111111111
250055,good alternatives google adsense adult sites ?,mechanical engineering fresher company good start career ust global quest global ?,0,0.0,0.0,60,0.7567567567567568
250056,hemingway state : `` happiness intelligent people rarest thing know . '',"money really buy happiness ? yes , , bring happiness ?",0,0.0,0.0,48,0.717948717948718
250057,boot camp ?,boot camps nigeria ?,0,0.0,0.0,9,0.75
250058,hide comments likes friends facebook ?,stop things friends like comment showing facebook news feed ?,0,0.0,0.0,37,0.9230769230769231
250059,entjs think intjs ?,"person intj , intp entj personality ?",0,0.0,0.0,24,0.64
250060,american honey ( 2016 movie ) get greenlit ? 's backstory movie got made ?,american pastoral ( 2016 movie ) get greenlit ? 's backstory movie got made ?,0,0.0,0.0,7,0.9629629629629629
250061,"suitable solar panel installation provider near south gate , california ca ?","suitable solar panel installation provider near nicasio , california ca ?",0,0.0,0.0,10,0.95
250062,advisable give 2 month old prune juice help constipation ?,3 months old pigeon eat ?,0,0.0,0.0,39,0.7894736842105263
250063,experiences using ioffer.com ?,'s experience using hackhands.com ?,0,0.0,0.0,13,0.8333333333333334
250064,premium version wordpress profitable ? premium wordpress charges monthly ? yearly plans ?,write full marks best 4/5 calculate isce isc srcc gbo application form ?,0,0.0,0.0,70,0.8260869565217391
250065,"glycolysis , total many molecules atp synthesized ?",many atp get c22:4 fatty acid ?,0,0.0,0.0,38,0.7027027027027027
250066,ca n't comment answers anymore ?,comment section answers ?,1,0.0,0.0,18,0.8888888888888888
250067,people ask questions quora easily answerable via quick internet search ?,"people quora still ask questions already answered somewhere else , found easily using google search ?",1,0.0,0.0,56,0.8444444444444444
250068,ca n't decide career path ?,decide career pursue ? indicators ?,1,0.0,0.0,23,0.8148148148148148
250069,examples sentences word `` enervate '' ?,examples sentences word `` paralysis '' ?,0,0.0,0.0,9,0.9230769230769231
250070,vodka preferred alcoholic drink women ?,vodka whiskey good drink ?,0,0.0,0.0,21,0.7647058823529411
250071,better replacement ms dhoni captain indian cricket team ?,better replacement ms dhoni limited-overs captain indian cricket team ?,1,0.0,0.0,14,0.9473684210526315
250072,doctor poor memory ?,feel poor memory ?,0,0.0,0.0,6,0.7619047619047619
250073,would united states look like today george washington accepted kingship country ?,different would united states washington accepted king ?,1,0.0,0.0,45,0.95
250074,errors occur c programming language ?,legally immigrate america colombia ? ease process ?,0,0.0,0.0,39,0.8387096774193549
250075,better college mait ( cse ) dcrust ( cse ) ?,better college cse ?,0,0.0,0.0,24,0.7586206896551724
250076,liberals ?,liberal socialists ?,0,0.0,0.0,10,0.8571428571428571
250077,zara stores put cashiers back store ?,chances getting nfl 'm good ?,0,0.0,0.0,27,0.6060606060606061
250078,best book become familiar basic computer science algorithms ?,best book learn algorithms computer science ?,0,0.0,0.0,27,0.9743589743589743
250079,`` faithless '' electors election ?,"many , , faithless electors election ?",1,0.0,0.0,11,0.8484848484848485
250080,ipod nano ?,ipod nano camera ?,0,0.0,0.0,7,0.8
250081,cif army ?,chinese army better indian army ?,0,0.0,0.0,24,0.6666666666666666
250082,attract ex come back ?,get ex boyfriend back ?,1,0.0,0.0,13,0.7586206896551724
250083,possible time travel past ?,possibility time travel becoming reality ?,1,0.15907162445029854,0.1428571428571429,18,0.875
250084,would new year resolutions 2017 ?,new year resolutions upcoming year 2017 ?,1,0.0,0.0,20,0.8780487804878049
250085,"comedy youtube channel work hard videos barely get views subscribers , anyone help ? channels name mighty",overwatch tf2 fans review youtube channel ?,0,0.0,0.0,76,0.8181818181818182
250086,causes nocturnal flowers bloom night ? internal mechanism behind ? please n't answer external factors like pollinators .,external internal factors caused roma people europe suffer consistently high rates poverty `` natives '' thrive ?,0,0.0,0.0,96,0.8571428571428571
250087,men cheat ?,men like cheat ?,1,0.0,0.0,5,0.8571428571428571
250088,end-stage dementia patients stop eating ?,eat early stages pregnancy ?,0,0.0,0.0,29,0.6666666666666666
250089,steps take become pregnant ?,woman become pregnant ?,1,0.0,0.0,9,0.896551724137931
250090,top 10 authors world ?,top 10 novelists world ?,1,0.0,0.0,8,0.7741935483870968
250091,one change choose personality ?,change personality ?,1,0.0,0.0,11,1.0
250092,"social media play role egypt 's revolution ? ? , ?",social media play role egypt 's recent political uprisings ?,1,0.0,0.0,19,0.95
250093,tackle questions like `` banking engineering '' bank interviews ?,software engineering problems banks tackle everyday ?,0,0.0,0.0,50,0.7906976744186046
250094,train dog perfectly ?,train white pitbulls ?,1,0.0,0.0,12,0.6451612903225806
250095,transfer old clash clans account new phone ?,"much money would cost start clash clans account , use gems everything , max town hall level 8 ?",0,0.0,0.0,61,0.75
250096,is/was evil person ?,evil person ever knew personally ?,1,0.0,0.0,20,0.896551724137931
250097,difference anise fennel seeds ?,anise seeds fennel seeds differ ?,1,0.0,0.0,20,0.9565217391304348
250098,best inspiration quote life ?,"best inspiring quote , changed life ?",1,0.0,0.0,14,0.8648648648648649
250099,jake williams think indians ?,think indians/ indian culture ?,0,0.0,0.0,22,0.7741935483870968
250100,three positive consequences treaty versailles ?,significant consequences treaty versailles ?,0,0.0,0.0,13,0.8888888888888888
250101,comes mind hear word `` fitness '' ?,comes mind hear word 'pakistan ' ?,0,0.0,0.0,10,0.8888888888888888
250102,lesser known important historical figures palestine people know ?,lesser known important historical figures india people know ?,0,0.0,0.0,8,0.975609756097561
250103,first person land mars ?,first person mars ?,1,0.0,0.0,5,0.9285714285714286
250104,improve sexual stamina ?,increase sexual stamina ?,1,0.0,0.0,5,0.8666666666666667
250105,chemical formula diamond ?,chemical formula diamonds ?,1,0.0,0.0,1,0.967741935483871
250106,effects demonitization 500 1000 rupees notes real estate sector ?,real estate prices get affected indian government 's decision de-monetize 500 1000 notes ?,1,0.0,0.0,69,0.8888888888888888
250107,"suitable solar panel installation provider la grange , california ca ?","good solar panel installation provider la crescenta , california ca ?",0,0.0,0.0,15,0.9473684210526315
250108,one web-scrape list bioinformatics programs processing ( preferably metadata possible ) ?,one web-scrape list windows programs processing ( preferably metadata possible ) ?,0,0.0,0.0,10,1.0
250109,cheap healthy diet keep eat every day ?,healthy eat tomato every day ?,1,0.0,0.0,16,0.7857142857142857
250110,recruiters indicate net gross income job ads uk ?,job positions europe mentioned salary net gross basis ?,0,0.0,0.0,42,0.8648648648648649
250111,best book cover come across ?,"best book cover pages ? ( pictures , please )",1,0.0,0.0,22,0.7272727272727273
250112,find rich woman marry ?,marry rich woman ?,1,0.15519574401108466,0.0,11,0.9230769230769231
250113,difference psychopathology clinical psychology ?,difference clinical psychology psychiatry ?,0,0.0,0.0,24,1.0
250114,best company tibco businessworks 6 job support india ?,best company tibco businessworks 6 online job support india ?,1,0.0,0.0,7,0.9767441860465116
250115,automatically following people instagram never chose follow ?,thousands people following instagram never requested ?,1,0.0,0.0,32,0.9047619047619048
250116,art marketable ?,art marketing work ?,0,0.0,0.0,8,0.6956521739130435
250117,best evidence support alien intelligent life visited planet ?,evidence aliens visited planet ?,1,0.0,0.0,30,0.8125
250118,see dad naked ?,world end ?,0,0.0,0.0,10,0.5882352941176471
250119,examples failed democracies ?,examples democracy failing ?,0,0.0,0.0,15,0.9090909090909091
250120,need create whatsapp group wwe fans ?,"manager created whatsapp group , nobody active . 'm hesitant come group since created manager . ?",0,0.0,0.0,65,0.7804878048780488
250121,behind cheapoair.com ?,behind truththeory.com ?,0,0.0,0.0,10,0.8387096774193549
250122,books entrepreneurs read starting business ?,great books read starting first business motivation ?,0,0.0,0.0,33,0.8823529411764706
250123,reliable moderate news sources ?,foxnews reliable source news ?,0,0.0,0.0,21,0.8484848484848485
250124,important person 've met anywhere ?,badass person 've ever met/known ?,0,0.0,0.0,20,0.8
250125,"family live comfortably making $ 250,000 year new york city ?","family live comfortable $ 150,000 year new york city ?",0,0.0,0.0,9,0.9361702127659575
250126,best internet service provider san antonio ?,'s best internet service provider san diego ?,0,0.0,0.0,9,0.9375
250127,"220 lb , wana lose 80 lb , walk 30 mins + climb 150 stairs ( keep increasing mins+nos ) . eat fruits , veggies protiens . right track ?",17 years old 280 lb . love life 'm actually quite popular ! 'm ready overcome obesity . keep falling wagon . help ?,0,0.0,0.0,98,0.8181818181818182
250128,"main important points , impress one , corrects anatomy question paper medical field ?","impression give professor evaluating exam , 3-question exam , first question detailed correctly answered , analyzed , organized written , rest two proceed degrading ?",0,0.0,0.0,119,0.851063829787234
250129,good site share get feed back short stories ?,good short term courses aspiring chartered accountant enhances job prospects ?,0,0.0,0.0,51,0.8
250130,food eaten tasted best ?,best food tasted ?,0,0.0,0.0,14,0.9523809523809523
250131,social skills programmers commonly lack ?,programmer 's life like ?,0,0.0,0.0,26,0.8387096774193549
250132,ca n't anymore… fantasy never lives reality . ?,good thesis self driving cars management information systems class ?,0,0.0,0.0,52,0.8421052631578947
250133,better pro monitors presonus eris 4.5 krk rokit 6 g3 ?,setup 5.1 speaker ?,0,0.0,0.0,43,0.6666666666666666
250134,backend programming language best learn ?,back-end programming language learn & program month basic knowledge front-end programming ?,1,0.0,0.0,53,0.8837209302325582
250135,canada 's healthcare system national program run government ?,u.k. healthcare system national program run government ?,0,0.0,0.0,9,0.9047619047619048
250136,one better ? ai machine learning nanodegree udacity ?,"machine learning nano-degree ( udacity ) worth , given bs computer science ?",0,0.0,0.0,55,0.8181818181818182
250137,hashing method context radial basis functions ( rbf ) ?,radial basis function ( rbf ) network universal approximator ?,0,0.0,0.0,50,0.8695652173913043
250138,'s definition `` friends '' ?,exactly definition friend ?,1,0.0,0.0,14,0.7142857142857143
250139,compiler ?,compiled code ?,0,0.0,0.0,6,0.9
250140,people use quora could easily find answer quick google search ?,people ask quora questions answered easily google ?,1,0.1084129587741176,0.0,29,0.9
250141,probiotics taken anti biotics ?,probiotics taken answer biotics ?,1,0.0,0.0,4,0.9655172413793104
250142,favorite video game genres ?,'s favorite video game genre ?,1,0.0,0.0,4,0.967741935483871
250143,unexplored consumer markets india ?,unexplored consumer markets india ?,1,0.0,0.0,0,1.0
250144,opinion korean rap music ?,opinion rap music ?,0,0.0,0.0,7,0.9230769230769231
250145,amazing instagram bios ?,amazing instagram bios ?,1,0.0,0.0,0,1.0
250146,calculus : difference differentiation integration ?,integral calculus used psychology ?,0,0.0,0.0,44,0.8571428571428571
250147,beautiful moment life ?,beautiful moment life ?,1,0.0,0.0,0,1.0
250148,difference icu ccu hospital ?,differences sensed going chinese hospital going american hospital ?,0,0.0,0.0,41,0.9142857142857143
250149,weirdest question someone ever asked ?,weirdest question asked someone ?,0,0.0,0.0,15,0.9696969696969697
250150,airsoft ksc glock 26 expensive ?,compare glock models ?,0,0.0,0.0,20,0.7058823529411765
250151,difference x-ray gamma ray photon 1 angstrom wavelength ? differentiated ?,similarities differences x-rays ct scans ?,0,0.0,0.0,62,0.8292682926829268
250152,correct spelling variant : boss 's boss ' ?,`` manoeuvred boss making manager particular project '' . use `` manoeuvre '' correct ?,0,0.0,0.0,64,0.8095238095238095
250153,loose weight ?,easiest way loose weight ?,1,0.0,0.0,12,0.9166666666666666
250154,best book learning java ?,book buy learn java ?,1,0.0,0.0,9,0.8
250155,always fall guys n't like ?,always attracted guys n't like ?,1,0.0,0.0,8,0.8823529411764706
