id,question1,question2,is_duplicate,CosineSimilarity,JaccardSimilarity,Levenshtein,DiceSimilarity
76000,best way win women 's heart ?,win girl 's heart ?,1,0.6737556639717492,0.33333333333333337,14,0.8
76001,taboo ?,"taboos , , mathematics ?",0,0.0,0.0,17,0.631578947368421
76002,best phones gadgets ?,best gadget get ?,0,0.0,0.16666666666666663,9,0.8181818181818182
76003,difference lte volte ?,lte phones volte phones ? spot volte phone looking specs ?,0,0.0,0.0,45,0.7142857142857143
76004,improve english mail writing skills ?,improve english writing skills ?,1,0.0,0.0,5,0.9714285714285714
76005,clean small pool ?,clean pool ?,0,0.0,0.0,6,0.9
76006,accurate carbon dating ?,legit carbon dating ?,1,0.0,0.0,7,0.9285714285714286
76007,sony 123 cm ( 49 inches ) bravia kd-49x8300d 4k hdr android led tv ?,sony 123 cm ( 49 inches ) bravia kd-49x8300d 4k hdr android led tv whether worth buying ?,0,0.0,0.0,21,0.9523809523809523
76008,possible moon moon ?,moon moon ?,1,0.0,0.0,9,0.625
76009,consequences caused water pollution ?,examples water pollution ?,0,0.0,0.0,16,0.8484848484848485
76010,one become barney stinson ?,become legendary barney stinson ?,1,0.0,0.0,12,0.9032258064516129
76011,study biology get ?,study biology online ?,0,0.0,0.0,6,0.9629629629629629
76012,selling amazon great career start 20 year old wants become multi millionaire ?,benefits mba/pgdm iims ?,0,0.0,0.0,65,0.6486486486486487
76013,"19th century europe , jews treated regard emigration ? forced allowed emigrate ?",popular public executions entertainment europe 19th century ?,0,0.0,0.0,61,0.8260869565217391
76014,mother cristiano ronaldo 's child ?,cristiano ronaldo tattoo ?,0,0.0,0.0,15,0.8571428571428571
76015,best digital marketing company ?,companies best digital marketing ?,1,0.0,0.125,18,0.972972972972973
76016,documents required establish title land ?,documents required establish title land india ?,0,0.0,0.0,6,1.0
76017,ban rs 500 rs 1000 notes affect people ’ lives ?,modi 's decision curbing 500 1000 rupees notes affect daily lives middle class lower class people ?,1,0.0,0.0,65,0.8260869565217391
76018,many people slept ?,many partners slept ?,1,0.0,0.0,6,0.9166666666666666
76019,"indians , know china ?",know china？,0,0.0,0.0,12,0.782608695652174
76020,make love girl ?,make love ?,0,0.2929690435461665,0.0,5,0.8571428571428571
76021,good options mobile phones 15000 ?,best phone buy price 15000 ?,1,0.0,0.11111111111111116,17,0.7777777777777778
76022,"porn stars actually swallow cum ? yes , n't harmful ?",swallow cum blowjob ?,0,0.0,0.0,39,0.625
76023,review ms dhoni trailer ?,say ms dhoni 's biopic `` ms dhoni -the untold story '' trailer ?,1,0.0,0.0,45,0.7368421052631579
76024,masters.gg ?,gg mean ?,0,0.0,0.0,9,0.7058823529411765
76025,cse jbit ?,carbon bond metals ?,0,0.0,0.0,15,0.6086956521739131
76026,got offer microsoft amazon seattle upon ms cs graduation . salaries pretty similar . offer take ?,"renege offer one big 4 ( amazon , google , facebook microsoft ) ?",0,0.0,0.0,71,0.7727272727272727
76027,get cheap accommodation goa ?,find hotels rs.500 goa ?,0,0.0,0.0,22,0.6875
76028,even odd number ?,odd odd numbers ?,0,0.0,0.0,5,0.9090909090909091
76029,company best aerospace engineering ?,college best aerospace engineering ?,0,0.0,0.125,5,0.9032258064516129
76030,list waterfalls india ?,best waterfall india ?,1,0.0,0.16666666666666663,3,0.9629629629629629
76031,companies would pay someone athlete ?,chinese people like mexican and/or tex-mex food ?,0,0.0,0.0,37,0.7692307692307693
76032,study 12–14 hrs day 1 year iitjee ?,study 14 hrs day 2 years ?,0,0.0,0.0,11,0.9032258064516129
76033,different types computer clusters ?,types computer mouse ?,0,0.0,0.0,15,0.8275862068965517
76034,best get started freelancing web developer and/or telecommute web developer ?,start freelancing web developer ?,1,0.0,0.0,44,0.926829268292683
76035,suggested people direct message ?,send direct message twitch ?,0,0.0,0.0,20,0.7741935483870968
76036,best paying job ?,best job pays almost nothing ?,0,0.0,0.125,18,0.9032258064516129
76037,kind interfaces used connect display panel embedded system board ?,n't music painting flourish britain neighbouring france netherlands ?,0,0.0,0.0,59,0.8780487804878049
76038,quora employee ?,quora employees singapore ?,0,0.0,0.0,11,0.8571428571428571
76039,break fiancé ?,break girlfriend ?,1,0.0,0.0,8,0.8
76040,statistics prove holiday homework important ?,summer holidays important ?,0,0.0,0.0,23,0.8648648648648649
76041,filling ibps application put martial status married 4 months got divorced problem job ?,horrifying dream one experienced sleep paralysis ? get rid ?,0,0.0,0.0,67,0.8372093023255814
76042,recognized institute learn german mumbai ?,best way/place/institute learn rudimentary german mumbai ?,1,0.0,0.19999999999999996,26,0.8421052631578947
76043,word wrap feature default notepad ?,run code written notepad++ ?,0,0.0,0.0,23,0.8275862068965517
76044,girl know whether boy likes ?,girl know boy likes ?,1,0.18551148527914157,0.0,8,0.9333333333333333
76045,safe eat food ants gotten ?,safe use sugar ants gotten ?,1,0.0,0.0,8,0.8695652173913043
76046,aricent online training ( fmfp ) 2016 batch begin ?,tests aricent technologies online ?,0,0.0,0.0,40,0.7027027027027027
76047,effective r.a. drug ?,effective drug ?,0,0.0,0.0,5,0.9230769230769231
76048,latino men sometimes call `` ese '' ?,exactly latino/hispanic ?,0,0.0,0.0,30,0.7333333333333333
76049,people become selfish selfish day day ?,people selfish ?,0,0.0,0.0,23,0.7692307692307693
76050,urban planner basically ?,like urban planner ?,0,0.0,0.0,15,0.8461538461538461
76051,indian muslims empathy towards palestine killings share posts social media n't share single post unrest kashmir ?,n't indian muslims show solidarity kurdistan baloachistan like palestine ?,0,0.0,0.0,76,0.9545454545454546
76052,"drive edmonton auckland described , cities ' attractions compare vancouver ?","drive edmonton auckland described , history cities compare contrast history vancouver ?",1,0.0,0.0,27,0.9302325581395349
76053,cipla stock today closed 566 good buy short-term dec futures ?,"2016 q2 : stocks would buy today , short term and/or long term ?",0,0.0,0.0,41,0.7307692307692307
76054,cream used remove pimples ?,remove pimples ?,0,0.0,0.0,11,0.8461538461538461
76055,restroom facility asians use segregation era ?,many indians using bank facility ?,0,0.0,0.0,33,0.8235294117647058
76056,open cd drive ?,open stuck cd drive ?,0,0.0,0.0,6,0.8461538461538461
76057,"simply run mile day eat well , lose weight ?",running twice day help lose weight ?,0,0.0,0.0,21,0.9230769230769231
76058,improve english speaking ?,ways improve english ?,1,0.0,0.0,14,0.9090909090909091
76059,review iphone 7 ?,reviews iphone 7 ?,1,0.0,0.0,1,0.96
76060,informations need client build website ?,questions need ask client build first website ?,1,0.0,0.0,17,0.918918918918919
76061,quora mark many questions needing improvement ?,quora always mark answer need improvement ?,1,0.0,0.0,18,0.9230769230769231
76062,real life examples “ karma '' ?,real life karma police ?,1,0.0,0.0,17,0.7857142857142857
76063,"us school grades go , b , c , , f. `` e '' ?","us education system use grades , b , c , f grade e ?",1,0.0,0.0,29,0.7368421052631579
76064,mystery behind lal bahadur shashtri 's death ?,reason lal bahadur shastri ’ death ?,1,0.0,0.0,15,0.8484848484848485
76065,introvert become salesman ?,introvert become extrovert & vice-versa ?,0,0.0,0.0,21,0.875
76066,vulva look like ?,normal vulva look like ?,1,0.0,0.0,7,0.8695652173913043
76067,innovative mechanical component designs ?,innovation design ?,0,0.0,0.0,22,0.8275862068965517
76068,good idea get mom vape ?,many marks want get rank 2000 gate ?,0,0.0,0.0,24,0.5185185185185185
76069,organisational objectives ?,safe medicine control phantom limb pain paralysed arm ?,0,0.0,0.0,45,0.7428571428571429
76070,best pharma companies work india ?,pharma companies work ?,0,0.0,0.0,11,0.9090909090909091
76071,"one better learn , british english american english ?","better learn , american english british english ?",1,0.0,0.0,18,0.9696969696969697
76072,view move scrap 500 1000 rupee notes ? effects ?,views pm modi 's decision discontinuing 500 & 1000 rs notes ?,1,0.0,0.0,43,0.8571428571428571
76073,cbse calculate sa grades 9th 10th classes ?,cbse board calculate 9th sa exams grade ?,0,0.0,0.0,27,0.8571428571428571
76074,characteristics intp woman ?,intp 'm smart . says one smartest type . 's wrong ?,0,0.0,0.0,39,0.8125
76075,process rent land host mobile tower india ?,procedure get mobile signal tower constructed barren land india ?,1,0.0,0.0,40,0.918918918918919
76076,quickest way become succesful affiliate marketer ?,quickest way become successful affiliate marketer ?,1,0.0,0.09999999999999998,1,1.0
76077,pokémon go officially released china ?,pokémon go released china ?,1,0.0,0.0,11,0.9473684210526315
76078,would basic benefit demonetizing 500 1000 rs currency ?,repercussions banning rs 500 rs 1000 notes indian economy ?,1,0.0,0.0,45,0.8888888888888888
76079,good cheap hotels hostels within walking distance train station stockholm ?,good cheap hotels hostels within walking distance train station marseille ?,0,0.0,0.0,8,1.0
76080,"much singaporean people know russia , people culture ? image russia singapore ?",people want migrate singapore ?,0,0.0,0.0,53,0.8571428571428571
76081,right age getting pregnant ?,good age get pregnant ?,1,0.0,0.0,9,0.8181818181818182
76082,mind-blowing gadgets tools people n't know ?,mind blowing technology tools people n't know ?,1,0.0,0.0,11,0.8717948717948718
76083,gst tax ?,gst affect indians ?,1,0.0,0.0,12,0.631578947368421
76084,long take fix forward neck rounded shoulders posture ?,anyone forward neck syndrome able improve posture ?,0,0.0,0.0,29,0.8372093023255814
76085,difference direct subsidy indirect subsidy ?,difference tax subsidy ?,0,0.0,0.0,22,0.9333333333333333
76086,"use macbook pro want practice c programming , ?",best compiler c & c++ programming ?,0,0.0,0.1428571428571429,27,0.8108108108108109
76087,"one better , mba us india ?",better : mba us india ?,1,0.0,0.0,5,0.896551724137931
76088,hack hay day game unlimited gems ?,get unlimited diamonds hay day ?,1,0.0,0.0,29,0.9090909090909091
76089,would best name cartoon studio makes fantasy novels wacky zany animated movies ?,would best name animation studio makes books movies ?,1,0.0,0.08333333333333337,38,0.8717948717948718
76090,really happened flight mh370 ?,happened mh370 ?,1,0.0,0.0,14,0.7741935483870968
76091,features looking forward ios 8 ?,use swype feature ios 8.1.3 free ?,0,0.0,0.0,27,0.7222222222222222
76092,output force ?,output ?,0,0.0,0.0,6,0.75
76093,international olympic committee funded ?,olympics funded ?,1,0.0,0.0,24,0.875
76094,"adobe effects , system requirements install computer ?",whatcha doin bro ?,0,0.0,0.0,46,0.6470588235294118
76095,arnab goswami resign times ?,arnab goswami resigned ?,1,0.0,0.0,5,0.9285714285714286
76096,fastest effective treatment impotence ?,overcome impotence ?,1,0.0,0.0,22,0.8888888888888888
76097,mastermind behind idea banning 500 1000 rs note india ?,came idea demonetizing rs 500 rs 1000 notes ?,1,0.0,0.0,34,0.8888888888888888
76098,think industries ripe disruption ?,industries ripe disruption ?,1,0.0,0.0,6,0.9230769230769231
76099,'s good number fill blank questions foreign language homework assignment done students via iphone ( smartphone ) ?,correct word fill blank sentence : `` heart surrounded thin layer tissue called ___________ heart sac . `` ?,0,0.0,0.06666666666666665,86,0.72
76100,ascii thing work different characters ?,people create ascii pictures ?,0,0.0,0.0,31,0.6666666666666666
76101,"concept , fact , explanation ?",bilaterian animals true coelomates ?,0,0.0,0.0,27,0.6896551724137931
76102,know nothing travel faster speed light ?,ca n't anything go faster light ?,1,0.0,0.0,19,0.7777777777777778
76103,new years resolution ?,new year 's resolutions ?,1,0.0,0.0,3,0.9655172413793104
76104,voting jill stein ?,'s voting jill stein ?,1,0.0,0.0,3,0.96
76105,would martin luther king jr. malcom x react 9/11 alive today ?,would dr. martin luther king jr. use quora address current domestic global challenges ?,0,0.0,0.0,46,0.8163265306122449
76106,clear ssb screening personal interview ?,steps ssb interview ?,0,0.0,0.0,23,0.8275862068965517
76107,"paint damage fender car , correct way repair paint entire quarter panel ?",would work sealed wood panel gel medium glued watercolor paper painting ?,0,0.0,0.0,56,0.85
76108,"20 year old international freshman dream university us . , ever since got lost motivation work hard fun even . advice 've met lots people feel lonely ?","everybody says find love , know . advice ? one ?",0,0.0,0.0,116,0.7916666666666666
76109,know basic pragramming languages ( like c c++ ) . study next ? java python ?,"know c programming language yet . language study next , java , ruby , python ?",1,0.0,0.0,31,0.9285714285714286
76110,new macbook pro rumored release ?,apple release new macbook pro 2016 ?,1,0.0,0.0,29,0.8333333333333334
76111,often fbi special agents actually get firefights ?,fbi special agents trained ?,0,0.0,0.0,25,0.8571428571428571
76112,nikon d5200 want buy first tripod . one would best ?,want buy dslr 50k . nikon d5200 good option ?,0,0.0,0.0,38,0.9333333333333333
76113,tips socializing grad student parties ?,like date grad student ?,0,0.0,0.0,21,0.8387096774193549
76114,speed planes usually take ?,"plane fire speeding runway v1 , captain abort take continue rotation ?",0,0.0,0.0,54,0.7027027027027027
76115,athletes olympics days 're competing ?,many athletes competing olympics year ?,0,0.0,0.0,27,0.9444444444444444
76116,guys stare girls n't know ?,guys stare girls ?,1,0.0,0.0,9,0.8275862068965517
76117,`` absolute '' world ?,absolutism ?,0,0.0,0.0,13,0.6923076923076923
76118,inside black hole ?,know living black hole ?,1,0.0,0.0,9,0.8275862068965517
76119,future india ?,future $ india ?,0,0.0,0.0,2,0.9565217391304348
76120,well paid government jobs mechanical engineers ?,best government jobs mechanical engineer ?,1,0.0,0.11111111111111116,9,0.9230769230769231
76121,alpha beta glucoses different ?,characteristics alpha glucose beta glucose ?,1,0.0,0.0,30,0.9142857142857143
76122,html5 exactly ?,html ?,0,0.0,0.0,9,0.6666666666666666
76123,different mudras help us ?,important mudras yoga ?,0,0.0,0.0,13,0.7741935483870968
76124,kite runner kite runner book ?,read 'the kite runner ' ?,0,0.0,0.0,13,0.75
76125,possible cheat ielts test ?,seperate ielts test study uk ?,0,0.0,0.0,20,0.6666666666666666
76126,get list available jobs bpo services hcl northern ireland ?,"easy/hard international students get job dublin , ireland ?",0,0.0,0.0,43,0.8205128205128205
76127,plan preparation cat 2017 onwards ?,prepare cat 2017 august ?,1,0.0,0.0,17,0.7647058823529411
76128,buy cigars ?,buy cigars chennai ?,0,0.0,0.0,8,0.88
76129,everyone college sleep late ?,people stay late night likely intelligent go bed early . true ?,0,0.0,0.0,45,0.7428571428571429
76130,psychopaths narcissists manipulate differently ?,quickly recognize manipulative person ?,0,0.0,0.0,30,0.8
76131,one better - crh ( china railway high-speed ) shinkansen ( japanese super express ) ?,china railway high-speed named order words ( grammatically ) ?,0,0.0,0.0,53,0.875
76132,"higher iq , hillary clinton donald trump ?",barack obama allowed run trump could defeated real opponent whimp like clinton ?,0,0.0,0.0,64,0.8
76133,stalk people facebook ?,people stalk facebook quora ?,0,0.0,0.0,16,0.896551724137931
76134,know many users connected wifi router ?,know devices connected wifi router ?,0,0.0,0.0,8,0.8823529411764706
76135,computer language better javascript ?,javascript go computer language trend within next 10 years ?,0,0.0,0.0,37,0.8181818181818182
76136,indians survive australia ?,australia attracting many indian immigrants ?,0,0.0,0.0,34,0.7857142857142857
76137,falklands war ( 1982 ) : argentina dare attack great britain ?,argentina declare war britain ?,1,0.0,0.0,37,0.7368421052631579
76138,trump hillary clinton ?,hillary clinton election ?,0,0.0,0.0,15,0.8571428571428571
76139,"snapstreak hourglass emoji appears , long streak end ?","snapchat , remove streaks ?",0,0.0,0.0,34,0.7777777777777778
76140,download music straight android phone free ?,android app download unlimited music free ?,0,0.0,0.0,30,0.9473684210526315
76141,dog depressed ! ?,depressed ? ?,0,0.0,0.0,5,0.8235294117647058
76142,"every company india , terms salary , work culture , growth opportunity . company best work fresher ?","cvent , india terms work culture ?",0,0.0,0.0,70,0.8444444444444444
76143,"different types dirt bike racing , differ ?",different types dirt bikes differ ?,1,0.0,0.0,9,0.875
76144,hindi songs someone sing without music functions/parties ?,good hindi song sing founder 's day school ?,0,0.0,0.0,39,0.7894736842105263
76145,programming language codecademy use ?,programming language codecademy written ?,1,0.0,0.0,6,0.9142857142857143
76146,develop positive attitude ?,develop positive attitude towards everything ?,1,0.0,0.0,19,0.8125
76147,alma mater matters getting considered admission top bschools across world ?,call college alma mater ? university ?,0,0.0,0.0,60,0.7777777777777778
76148,lollipop update available asus zenfone 5 model t00j ?,use jio sim asus zenfone 5 t00j ?,0,0.0,0.0,27,0.8648648648648649
76149,tips making job interview process real industry ?,tips making job interview process chart industries ?,0,0.0,0.0,7,0.9333333333333333
76150,earn money internet ?,'s easiest way make money online ?,0,0.0,0.11111111111111116,22,0.7692307692307693
76151,goals students taught `` common core '' . different learning techniques past ?,recurrent uti ? done defluxe surgery n't works ?,0,0.0,0.0,57,0.7441860465116279
76152,doctors hate patients ?,people hate doctors ?,0,0.0,0.0,14,0.8888888888888888
76153,best house design indian standard sides 52 x 22 feet . door either 52 22 side ?,"eastern catholic western catholics theology , doctrine tradition ?",0,0.0,0.0,60,0.6842105263157895
76154,"major effects cambodia earthquake , effects compare lima-callao earthquake 1746 ?","major effects cambodia earthquake , effects compare banda sea earthquake 1938 ?",1,0.0,0.0,12,0.8301886792452831
76155,"western civilization superior militarily , culturally , technologically culture today ?","think western culture superior ( inferior ) terms morals , values , science , philosophy , innovation cultures ?",1,0.0,0.0,73,0.851063829787234
76156,'s 5 1 vaccine dogs ?,vaccinations necessary dog ?,0,0.0,0.0,21,0.8
76157,best pokemon go hack ?,best pokemon hacks ?,1,0.0,0.1428571428571429,4,0.9655172413793104
76158,reputation svnit colege engg . india surat ?,"following colleges good terms faculty competitive coding culture undergraduates , svnit surat , bits goa , iiit allahabad ?",0,0.0,0.0,98,0.8095238095238095
76159,audio/video recording taken without permission presented evidence court ?,allowed keep video evidence without telling without permission commit crime ?,1,0.0,0.0,49,0.9523809523809523
76160,one go finding probability using mean standard deviation ?,ways measure area pressure ?,0,0.0,0.0,46,0.6451612903225806
76161,common college professors find students coming advice student hard time ? issues unrelated school .,common misconceptions many students professors ?,0,0.0,0.0,68,0.8421052631578947
76162,smart mcc ?,cm pondicherry ?,0,0.0,0.0,12,0.47619047619047616
76163,"differences ketogenic , atkins , paleo diets ?",eat ketogenics diet ?,0,0.0,0.0,27,0.8387096774193549
76164,cats brown-black discharge eyes/nose . ? sign illness ?,cats black eye boogers ?,0,0.0,0.0,35,0.7777777777777778
76165,delete questions asked quora ?,delete question quora ?,1,0.0,0.0,7,0.9655172413793104
76166,much muscle drumming build ?,joining drum classes ?,0,0.0,0.0,21,0.8387096774193549
76167,labs working evolutionary algorithms harvard ?,labs working evolutionary algorithms berkeley ?,0,0.0,0.0,7,0.975609756097561
76168,move ?,move california ?,0,0.0,0.0,11,0.631578947368421
76169,best place learn guitar jaipur affordable price ?,best place learn guitar chennai affordable price ?,0,0.0,0.09090909090909094,7,0.9473684210526315
76170,donald trump get impeached ?,quickly donald trump impeached ?,1,0.0,0.0,12,0.8888888888888888
76171,causes pain chest ( front lung ) ?,causes pain left lung ?,0,0.0,0.0,12,0.8484848484848485
76172,people countries think indian caste system ?,world think indian caste system ?,1,0.0,0.0,14,0.918918918918919
76173,tie rod influences vehicle 's steering angle ?,tell bad inner tie rod ?,0,0.0,0.0,32,0.7096774193548387
76174,best offline games played android ?,best offline rpg games android ?,0,0.0,0.125,9,0.9714285714285714
76175,upgrade lenovo k3 note android nougat 7.0 ?,earphones compatible lenovo k3 note ?,0,0.0,0.0,32,0.717948717948718
76176,reset kitchenaid dishwasher wo n't start ?,dishwasher robot ?,0,0.0,0.0,27,0.8275862068965517
76177,hexadecimal numbers called ?,hexadecimal numbers ?,0,0.0,0.0,7,1.0
76178,sat ?,sat ?,1,0.0,0.0,0,1.0
76179,share internet pc via usb cable android phone ?,share pc ( windows 10 ) internet connection android 5.1 ( moto g 1'st gen ) lollipop smartphone via usb cable without rooting phone ?,0,0.0,0.0,91,0.782608695652174
76180,"john apostle , john evangelist , john baptist person ?",know significance john baptist ?,0,0.0,0.0,33,0.7777777777777778
76181,nosb trains ?,amtrak trains work ?,0,0.0,0.0,11,0.8181818181818182
76182,best way earn money studying ?,best way earn money study ?,1,0.0,0.25,3,0.9375
76183,increase page rank website ?,tips increase rank search engines ?,1,0.0,0.0,18,0.896551724137931
76184,n't evgeni plushenko win 2010 winter olympics gold medal men 's figure skating successfully completing quadruple toe loop combination ?,anyone ever killed someone using olympic gold medal ?,0,0.09619393267880107,0.0,102,0.7916666666666666
76185,credit hour ?,understand credit hours ?,1,0.0,0.0,12,0.88
76186,slab ?,slab ?,1,0.0,0.0,0,1.0
76187,humans born ?,humans born ?,1,0.0,0.0,0,1.0
76188,best tv series 2016 ?,best tv shows 2016 ?,1,0.0,0.125,4,0.8148148148148148
76189,spices use spaghetti sauce ?,spices go well spaghetti sauce ?,1,0.0,0.0,6,0.8888888888888888
76190,favourite pokémon ?,catch squirtle pokémon go ?,0,0.0,0.0,13,0.7777777777777778
76191,rank gate ece expect call barc interview ?,"expecting 68 marks ( without normalization ) gate 2015 , ece , 31st afternoon session . rank get ? get call psus iits ?",0,0.0,0.0,96,0.6
76192,kite runner organized ?,kite runner kite runner book ?,0,0.0,0.0,14,0.8
76193,israel safe travel ?,stay safe israel ?,1,0.0,0.0,7,0.9090909090909091
76194,hashtag use get likes instagram ?,best hashtags use clothing brand instagram ?,1,0.0,0.11111111111111116,18,0.8484848484848485
76195,government old 500/1000 notes deposited banks everyday ?,government old notes rs 500 rs 1000 ?,1,0.0,0.0,29,0.8205128205128205
76196,future offline payment startups like paynearme.com india ?,startup future india ?,0,0.0,0.0,40,0.7878787878787878
76197,first year undergraduate student coding background . aiming gsoc 2018. suggest get started easy language ?,prepare google summer code ( gsoc ) ?,0,0.0,0.0,84,0.6341463414634146
76198,touch girlfriend 's boob first time making without making seem awkward ?,girlfriend n't reply texts hours even though see gone phone check facebook ? bother ?,0,0.0,0.0,63,0.8695652173913043
76199,mika mean japanese ?,`` chokuzen '' mean japanese ?,0,0.0,0.0,13,0.7142857142857143
76200,marxist paradigm ?,god marxist ?,0,0.0,0.0,12,0.9166666666666666
76201,military technology : best fighter jet air-to-air combat ?,last air-to-air combat involved us ?,0,0.0,0.0,46,0.7692307692307693
76202,aap delete donor list website ?,aam aadmi party 's donation list missing website ?,1,0.0,0.0,25,0.8823529411764706
76203,anyone suggest best source learning stocks analysis ?,graduate working rural place . move metro work ?,0,0.0,0.0,44,0.7567567567567568
76204,differences radix sort bucket sort ?,difference bucket sort radix sort integers ?,0,0.0,0.0,20,0.9714285714285714
76205,comcast become largest internet service provider usa spite horrible customer service ?,comcast customer service bad ?,1,0.0,0.0,61,0.8571428571428571
76206,best place visit goa ?,plan trip days goa ?,0,0.0,0.0,14,0.7142857142857143
76207,`` road damascus '' moment ? refer ?,`` take something road '' mean ?,0,0.0,0.0,25,0.7878787878787878
76208,link download qtp crack version ?,link download qtp 10 crack version ?,0,0.0,0.0,3,0.9473684210526315
76209,"would win fight , great-white shark short-finned pilot whale ?",would win fight : killer whale great white shark ?,0,0.13615533550899778,0.08333333333333337,33,0.9
76210,differences chinese culture western culture ?,major differences chinese western cultures ?,1,0.0,0.0,15,0.8823529411764706
76211,start learning passionate programming `` zero '' abilities ?,start learning programming language ? one start ?,1,0.0,0.0,29,0.8484848484848485
76212,medical student says love ?,best companies data scientist work ?,0,0.0,0.11111111111111116,25,0.7272727272727273
76213,become great web ux designer ?,learn become ux designer multimedia artist great interest field ?,0,0.0,0.0,45,0.918918918918919
76214,best way scrape facebook data ?,way scrape websites like facebook ?,1,0.0,0.11111111111111116,23,0.9090909090909091
76215,favorite book stephen king wrote coauthored ?,favorite stephen king book ?,1,0.0,0.0,19,0.8947368421052632
76216,"recognize people chinese , korean , japanese , thai vietnamese origins ?","recognize japanese , chinese korean ?",0,0.0,0.0,40,0.8947368421052632
76217,meant voltage regulation ?,mean voltage regulation ?,1,0.0,0.0,1,1.0
76218,instagram notify users account hacked ?,hack instagram account ? someone using identity posting inappropriate post ?,0,0.0,0.0,53,0.9473684210526315
