id,question1,question2,is_duplicate,CosineSimilarity,JaccardSimilarity,Levenshtein,DiceSimilarity
136001,survive long distance relationship ?,long distance relationship work ?,1,0.7326878312629173,0.6,13,0.8888888888888888
136002,time travel possible ?,time travel really possible ? know ?,1,0.0,0.0,14,0.875
136003,sheryl sandberg : opinion better : rolling free service increase user base rolling paid service user value product ?,quora simulator dishes questions via fake user accounts machine learning algorithms understand user behavior ?,0,0.0,0.0,86,0.8636363636363636
136004,favourite tv serial ?,favourite tv show ?,1,0.0,0.0,5,0.8888888888888888
136005,long take average man achieve orgasm ?,male orgasms intense female orgasms ?,0,0.1639820106985517,0.0,26,0.8387096774193549
136006,best anime op ed songs ?,best anime op/ed songs ?,1,0.0,0.0,1,0.9655172413793104
136007,post question quora ?,edit question quora ?,0,0.0,0.0,3,0.9230769230769231
136008,best hindi romantic serial ?,best tv serial hindi language ?,0,0.0,0.0,20,0.8125
136009,many women fdny firefighters ?,"average , long take form cuso ( credit union service organization ) ?",0,0.0,0.09090909090909094,54,0.7
136010,check purity milk home ?,easiest ways test milk purity home without lactometer ?,1,0.0,0.0,37,0.9090909090909091
136011,take build virtual bank russia ?,take build virtual bank ?,0,0.0,0.0,7,0.9655172413793104
136012,bad examples content marketing ?,content essential marketing ?,0,0.0,0.0,15,0.8823529411764706
136013,wrong someone guessing age ?,people really mean say someone ( mostly celebrity ) `` aged well '' ?,0,0.0,0.0,50,0.6666666666666666
136014,much minecraft realms cost ?,much minecraft realms cost ?,1,0.0,0.0,0,1.0
136015,main function protons nucleus ?,main function nucleus ?,0,0.0,0.0,8,0.9333333333333333
136016,competitor analysis analyze competitor website ?,competitors website analysis ?,0,0.0,0.0,27,0.9714285714285714
136017,couples sex fights ?,anyone help understand sext ?,0,0.0,0.0,22,0.7096774193548387
136018,5 ' 7 '' short height men ?,5 ' 6 '' considered short average height guys ? make guy less attractive short ?,0,0.0,0.0,55,0.7368421052631579
136019,america going wake admit president obama born kenya muslim,barack obama born raised muslim ?,1,0.0,0.0,39,0.8333333333333334
136020,compounds oxygen chlorine form ?,compounds calcium chlorine form ?,0,0.0,0.0,7,0.8888888888888888
136021,would guy try kiss text right first date fun polite interested ?,would guy try kiss first date text fun night disappear never answer text days ?,1,0.0,0.0,42,0.9767441860465116
136022,indiape pm modi pay many delete true & factual comments indiape quora ?,"quora delete comments attacking atheists , comments questions attacking christianity ?",0,0.0,0.0,66,0.8292682926829268
136023,max tegmark 's multiverse theory mathematical universe hypothesis considered real physics ?,"newer theories origins universe becoming increasingly abstract ( e.g . multiverses , spontaneous generation , measurement affecting reality , model based reality , etc ) , physics philosophy beginning merge ?",0,0.0,0.0,151,0.8
136024,important lessons learned life learn ?,important lesson learned life ?,1,0.0,0.0,7,1.0
136025,film aa gun thaam ?,genres film aa gun thaam ?,0,0.0,0.0,7,0.8888888888888888
136026,n't make diet . bulletproof coffee worth ?,bulletproof coffee good ?,1,0.0,0.0,20,0.7222222222222222
136027,typical tasks hadoop developer ? much java coding involved hadoop development job ?,much java knowledge required hadoop developer ?,0,0.0,0.0,53,0.8636363636363636
136028,things new employees know going first day lifetime brands ?,things new employees know going first day dunkin ' brands ?,0,0.0,0.0,8,0.9545454545454546
136029,world war two start ?,world war one start ?,0,0.0,0.0,3,0.9090909090909091
136030,oscar judges ?,many oscars johnny depp ?,0,0.0,0.0,15,0.7407407407407407
136031,significantly improve grades ?,get better grades ?,1,0.0,0.0,18,0.6206896551724138
136032,"flipkart afford sell one plus 3 18,999₹ low cost ?",flipkart sell oneplus 3 19999 rs ?,1,0.0,0.0,18,0.8571428571428571
136033,best adventure movies ?,best adventure movie ever made ?,1,0.0,0.0,10,1.0
136034,"got mait , migrate usict second year ?",one migrate mait usict second year ?,1,0.0,0.0,14,0.9696969696969697
136035,sprite coke pepsi product ?,"standard 250ml versions coke , fanta , sprite , pepsi dew , least amount sugar ?",0,0.0,0.0,61,0.6842105263157895
136036,major reasons prevalance child labour various parts world ?,major reasons prevalence child labour parts world ?,1,0.0,0.0,9,1.0
136037,rust go compare ?,promising gui framework rust ?,0,0.0,0.0,21,0.8
136038,travelled back time carrying something present changes would notice object ?,"think trump idiot said would blown iranians , circling american ship , water ?",0,0.0,0.0,66,0.9130434782608695
136039,paragraph tense problems ?,psi fluid amniotic sac ?,0,0.0,0.0,21,0.6666666666666666
136040,side effects using ouija board ?,anyone experienced effects using ouija board ?,1,0.0,0.0,16,0.918918918918919
136041,one find party registered vote ?,find party registered vote ?,0,0.0,0.0,4,1.0
136042,atmosphere gets rough terms storms wind speeds would better build colony domes underwater underground cities ?,determine average speed wind ?,0,0.0,0.0,90,0.7777777777777778
136043,comfort father visibly ( read extremely ) distressed/depressed settled yet ?,idea apply n.o.c ( objection certificate ) flying quadcopter india ?,0,0.0,0.0,62,0.7391304347826086
136044,"high level , key algorithms behind adobe 's content aware fill ?",windows adobe photoshop cs5 cd key work os x ?,0,0.0,0.0,46,0.7727272727272727
136045,ever asked question already know answer ? ?,ever asked question despite knowing answer ?,1,0.0,0.0,12,0.8888888888888888
136046,best proffesors material science iitb ?,okay 16 year old friends benefits 13 year old ?,0,0.0,0.0,36,0.7428571428571429
136047,could ?,convice parents get kitten ?,0,0.0,0.0,24,0.36363636363636365
136048,god create big bang ?,could god created big bang ?,1,0.0,0.0,7,0.9285714285714286
136049,win year 's isl ?,win isl 2016 ?,1,0.0,0.0,10,0.6086956521739131
136050,lose weight fast ?,lose 30 kilos fast ?,1,0.0,0.0,7,0.7692307692307693
136051,best institute embedded systems among cdac ( desd ) vector india ?,best training center embedded systems india ?,0,0.0,0.0,38,0.8571428571428571
136052,in-n-out open sunday ?,in-n-out ever closed ?,0,0.0,0.0,9,0.7586206896551724
136053,madam possible sell subway surfer coins real cash money ?,one ruppee coin indian 1947. sell coin ?,0,0.0,0.0,42,0.717948717948718
136054,many italians smoke ?,"stop smoking many failed attempts years ? recent attempt lasted 2 months , started smoking past 2 weeks .",0,0.0,0.0,87,0.7027027027027027
136055,blue tick mark beside names instagram mean ?,instagram get name ?,0,0.0,0.0,33,0.7857142857142857
136056,"subscribe youtube channel , owner channel know ?",get many subscribes channel youtube ? channel 6–12 months & 9 subs help ! ! !,0,0.0,0.0,45,0.7111111111111111
136057,incident changed life ?,one incident life completely changed ?,1,0.0,0.0,23,0.8666666666666667
136058,pills kill appetite safe consume weight loss program ?,phenq weight loss pills work ?,1,0.0,0.0,38,0.8333333333333334
136059,benefits reading writing ?,benefits reading books ?,0,0.0,0.0,7,0.896551724137931
136060,get old south korean serial emperor sea . ?,think meghan trainor pretty ?,0,0.0,0.0,30,0.8235294117647058
136061,confessed love crush . rejected n't talk . ? way fix ?,confessed crush n't want relationship . confession ok lately sometimes n't reply messages . ?,0,0.0,0.08333333333333337,63,0.875
136062,"toothpaste brand , available india , zero fluoride content ?",patanjali `` dant kanti '' toothpaste better fluoride toothpastes ?,0,0.0,0.0,44,0.8095238095238095
136063,aurangzeb ?,killed aurangzeb ?,0,0.0,0.0,7,0.8333333333333334
136064,shy person study paris semester ?,currently cgpa 5.5 6th semester . go higher studies try get job first ?,0,0.0,0.0,54,0.7804878048780488
136065,according best innings played odi cricket ?,greatest innings odi cricket according ?,1,0.0,0.0,27,0.875
136066,best brand puppy food bulldogs ?,best puppy food ?,1,0.0,0.0,15,0.8275862068965517
136067,"stock market data delayed 20 minutes ( nyse , nasdaq ) general public ?",nasdaq stocks transfers nyse ?,0,0.0,0.0,57,0.6829268292682927
136068,best phone 15000 rs . ?,best mobile 15000 ?,1,0.0,0.0,10,0.7142857142857143
136069,good programmer marissa mayer ?,marissa mayer good programmer ?,1,0.0,0.0,24,1.0
136070,difficult get iit ?,difficult get iits ?,0,0.0,0.0,1,0.9565217391304348
136071,indian government opposing triple talaq polgyny supporting polyandry child support ? indians solve ?,general normal guy normal marks chance get selected iim ?,0,0.0,0.0,76,0.9
136072,embarrassing moment life ?,embarrassing moment life ?,1,0.0,0.0,0,1.0
136073,'s favorite song ?,favorite song time ?,1,0.0,0.0,8,0.9285714285714286
136074,delete suggestion search instagram ?,blocked users still show top instagram search suggestions ?,0,0.0,0.0,39,0.8947368421052632
136075,happy life ?,person need happy ?,0,0.0,0.0,16,0.6363636363636364
136076,scary batman ?,scary batman ? brutal could ?,1,0.0,0.0,15,0.8461538461538461
136077,earn respect ?,earn respect prison ?,0,0.0,0.0,7,0.9090909090909091
136078,feel alone lonely ?,"feel sad , alone , frustrated ?",0,0.0,0.0,18,0.6956521739130435
136079,corporations backing hillary even though wants overturn citizens united ?,placebo drummer sent back us even though lived britain married british citizen ?,0,0.0,0.0,55,0.9333333333333333
136080,"techniques , social tricks , hacks psychology tricks useful know ?",physiological tricks useful know ?,1,0.0,0.0,37,0.9523809523809523
136081,data warehouse normalized denormalized ? ?,data validation data warehouses used ?,0,0.0,0.0,29,0.9090909090909091
136082,things one know urjit patel ?,unknown excellent facts urjit patel ?,1,0.0,0.0,19,0.8648648648648649
136083,earth gravity ?,would water going drain behave precisely equator ?,0,0.0,0.0,40,0.6666666666666666
136084,best phone buy 15000 ?,smartphone best buy rs . 15000 ?,1,0.0,0.0,15,0.8823529411764706
136085,happens look microwave ?,actual danger standing near looking microwave oven ?,1,0.0,0.0,32,0.8333333333333334
136086,treat yellow discharge odor itching ?,causes yellow discharge odor itching ?,0,0.0,0.0,6,0.9714285714285714
136087,one value used oriental rug ?,much worth paying new rug carpet ?,0,0.0,0.0,27,0.6875
136088,'s like dating gold-digger ?,like dating gold digger ?,1,0.0,0.0,4,0.896551724137931
136089,immigration policy : ( electorate ) want citizens usa ?,immigration policy usa ?,0,0.0,0.0,31,0.8421052631578947
136090,philosophy everyday life : anyone betray us trust ?,philosophy everyday life : want take hinduism religion . ?,0,0.0,0.0,24,0.8636363636363636
136091,percentage criteria ?,percentage criteria mnc ?,0,0.0,0.0,4,0.9565217391304348
136092,mother 's mother get pregnant father 's father child ?,mother 's mother get pregnant father 's father baby ?,1,0.0,0.0,5,0.8333333333333334
136093,answers collapse quora ?,quora 's answer collapse policy ? types answers reviews n't allowed quora ?,0,0.0,0.0,53,0.8235294117647058
136094,best chinese restaurants gurgaon ?,best chinese restaurants s.f . ?,0,0.0,0.0,7,0.8666666666666667
136095,best classic rock songs ?,best classic rock songs great lyrics ?,1,0.0,0.0,13,0.967741935483871
136096,would n't someone buy virtual good ?,would someone buy virtual good ?,0,0.0,0.0,4,0.9743589743589743
136097,writing minimal ammount code complex project . tricks use language features reduce lot work know open source examples implements tricks ?,effective probiotics could take ?,0,0.07278598990811384,0.0,116,0.7804878048780488
136098,best book digital marketing ?,best books digital marketing ?,1,0.0,0.0,1,1.0
136099,argument use people say push christian morals ?,argument use people say morals atheist agnostic ?,0,0.0,0.0,17,1.0
136100,"beginner athelete , would best buy treadmill within 10k india ?",type reservation us uk ?,0,0.0,0.0,50,0.6842105263157895
136101,best seo strategies ?,top three seo strategies ?,0,0.0,0.0,8,0.8695652173913043
136102,super smash bros. brawl : best wario strategy ?,super smash bros. brawl : best strategy wario ?,1,0.0,0.0,12,1.0
136103,difference active immunity passive immunity ? similarities ?,differences active passive immunity ?,1,0.0,0.0,25,0.9714285714285714
136104,women multiple orgasms ever satisfied bed ?,feel like woman orgasm ?,0,0.0,0.0,30,0.8
136105,bernie sanders still win election 09/16/2016 ?,"bernie sanders still win democratic nomination march 23 , 2016 ?",0,0.0,0.0,26,0.8636363636363636
136106,get girlfriend 're disabled depressed ?,get girlfriend 're disabled ?,1,0.0,0.0,10,0.967741935483871
136107,blessed ?,death curse blessing ?,0,0.0,0.0,15,0.6086956521739131
136108,quora change views format ?,features would make quora better ?,0,0.0,0.0,27,0.7222222222222222
136109,retail buyers prefer print digital trade magazine ?,"movie theatre wants show old movie , use retail blu-ray use old 35mm reel remastered digital print ?",0,0.0,0.0,75,0.7727272727272727
136110,best book data structures ?,best book data structures algorithms beginers ?,1,0.0,0.0,20,0.8125
136111,lightning arrester work ?,lightning arresters work ?,1,0.1824628900054094,0.0,1,1.0
136112,recent evidence extraterrestrial life ?,extraterrestrial life : undeniable evidence ufo ever seen ?,1,0.0,0.0,43,0.8823529411764706
136113,10 letter words repeating letters ?,first letter five letter word meaning pace ?,0,0.0,0.0,28,0.8333333333333334
136114,bad health eat eggs every day ?,"peanuts healthy , especially eat every day ?",1,0.0,0.0,20,0.75
136115,weirdest thing ever walked child ?,weirdest funniest thing ever done brain n't co-operating ?,0,0.0,0.0,32,0.7692307692307693
136116,narrow piece land connects two land masses called ?,ways make money empty piece land ?,0,0.0,0.0,36,0.9090909090909091
136117,download playlist pornhub ?,download playlist pornhub ?,1,0.0,0.0,0,1.0
136118,comes girls ejaculate ?,comes vagina girls orgasm ?,1,0.0,0.0,15,0.8275862068965517
136119,wowecoin legal india ?,ubermoto legal india ?,0,0.0,0.0,7,0.7407407407407407
136120,best book prepare gre exams .. ?,best book study gre ?,1,0.0,0.0,16,0.7142857142857143
136121,coolest thing c ?,coolest thing c++ ?,0,0.0,0.0,2,0.96
136122,world war iii inevitable ?,close world war iii ?,1,0.0,0.0,17,0.7692307692307693
136123,difference docker vagrant ? use one ?,"difference docker , puppet , chef vagrant ?",0,0.0,0.0,17,0.8888888888888888
136124,mean see shivling dream ?,always see snake dream . mean ?,0,0.0,0.0,19,0.7142857142857143
136125,travis bickle attempt kill presidential candidate palantine movie taxi driver ?,travis bickle try kill senator ?,1,0.0,0.0,49,0.8571428571428571
136126,critical thinking ?,critical thinking mean ?,1,0.0,0.0,5,0.9230769230769231
136127,traffic monsoon scam ?,traffic monsoon scam ?,1,0.0,0.0,0,1.0
136128,effect trump 's presidency us green card backlogs ?,worried trump presidency ?,0,0.0,0.0,33,0.7894736842105263
136129,best memory life ? ?,best memory life ?,1,0.0,0.0,2,1.0
136130,best cell phone family plan ?,best family cell phone plans ?,1,0.0,0.0,15,1.0
136131,judgement day according islam ?,signs judgement day according islam ?,1,0.0,0.0,6,1.0
136132,electric force one charge exerts another charge charge brought nearby ?,electric force one charge exerts another changed charges brought nearby ?,1,0.0,0.0,3,0.9743589743589743
136133,active transport examples ?,examples active transport ?,1,0.0,0.0,18,1.0
136134,like work company ?,like work mnc ?,1,0.25827932206938736,0.0,5,0.8888888888888888
136135,treat dimples shoulders ?,dimples popping shoulders ?,0,0.0,0.0,13,0.8666666666666667
136136,seattle good city ?,uk pension qrops india ?,0,0.0,0.0,18,0.5925925925925926
136137,best laptops within 30000 ?,best laptops available inr 30000 ( 30k ) ?,1,0.0,0.0,18,0.8
136138,ionic bonds formed ?,ionic bond ?,0,0.0,0.0,8,0.7619047619047619
136139,'aachar sanhita ' ( code conduct ) means indian politics ?,india good indians leave india ?,0,0.0,0.0,38,0.625
136140,would find interesting know topic work/life balance ?,indian girls really interested sexting strangers ?,0,0.1372798396950047,0.0,41,0.6857142857142857
136141,best orphanages bangalore spend birthday ?,best birthday wish ever ?,0,0.0,0.0,29,0.7741935483870968
136142,best way get customers email ?,create custom email address ?,0,0.0,0.0,21,0.8387096774193549
136143,best electric toothbrush 2016 ?,best electric toothbrush kids ?,0,0.0,0.0,4,0.8125
136144,someone tell fallen love ?,know 're love ?,0,0.0,0.0,16,0.6086956521739131
136145,solve given physics question ?,solve physics question given ?,0,0.0,0.0,12,1.0
136146,ssc cgl tier 2 results declared ?,ssc cgl 2016 tier 2 results declared ?,1,0.0,0.0,5,0.9032258064516129
136147,way watching youtube videos higher 2x speed ?,speed youtube videos ?,0,0.0,0.0,28,0.7428571428571429
136148,solutions problems street children ?,5 year old girl problem day wetting . could possible reason solution ?,0,0.0,0.0,49,0.8205128205128205
136149,one get good internship prefinal year engineering career good company ?,grandfather central government employee.he wife gets monthly pension.how much pension wife get grandfather 's death . ?,0,0.0,0.0,87,0.8837209302325582
136150,type 1 diabetes cured ?,diabetes curable ?,1,0.0,0.0,11,0.8571428571428571
136151,n't facebook messages delivered ?,message facebook messenger marked delivered even devices dead ?,0,0.0,0.0,35,0.9473684210526315
136152,republicans ( democrats ) want move us embassy israel jerusalem ?,consequences moving united states embassy tel aviv jerusalem ?,0,0.0,0.0,38,0.8636363636363636
136153,prevent neighbors connecting bluetooth speaker ?,install bluetooth laptop connect speaker ?,0,0.0,0.0,32,0.9444444444444444
136154,best treatment white hair ?,best treatment dry hair ?,0,0.0,0.0,5,0.8888888888888888
136155,learn ethical hacking beginner ?,"learn ethical hacking , free course ?",0,0.0,0.0,11,0.8125
136156,'s best way stop procrastination ?,stop procrastinating programming ?,0,0.0,0.0,24,0.7586206896551724
136157,best smartphones available buy market ?,smartphones : best phone buy 10k rupees ?,0,0.0,0.0,24,0.8421052631578947
136158,"seems interested text , never texts first . ?",inspired cai lun make paper ?,0,0.0,0.0,33,0.6
136159,'s best way simulate sexual intercourse 're alone household goods ?,sex feel like women ?,0,0.0,0.0,53,0.6285714285714286
136160,finance companies hedge fund firms use java ?,internet companies use java ?,0,0.0,0.0,23,0.8571428571428571
136161,tell someone unfollows instagram ?,know unfollowed instagram ?,1,0.0,0.0,13,0.9411764705882353
136162,electrical engineer searching job . good job consultancies pune ?,electrical engineer searching job . good job consultancies bangalore ?,0,0.0,0.0,7,0.9743589743589743
136163,effects docking dog 's tail ?,ethical issues relating docking dog 's tail ?,1,0.0,0.0,20,0.8823529411764706
136164,saltwater taffy candy imported mexico ?,saltwater taffy candy imported mongolia ?,1,0.0,0.0,7,0.9473684210526315
136165,n't human red blood cells nuclei ?,nucleus red blood cell ?,1,0.0,0.0,15,0.8
136166,on-air retail marketing ?,role 4p retail marketing ?,0,0.0,0.0,6,0.896551724137931
136167,ever dream sleeping changed life ?,private investigator trace missing person ?,0,0.0,0.0,35,0.8125
136168,ideal waiter table ratio restaurant ?,waiters restaurant staff eat ?,0,0.0,0.0,23,0.8148148148148148
136169,"hotel vadodara would safe unmarried couples , without harassment police , hotel staff , moral police ?","hotel chandigarh would safe unmarried couples , without harassment police , hotel staff , moral police ?",0,0.0,0.0,6,0.9523809523809523
136170,"common traffic convictions arkansas , severity convictions differ arizona ?","common traffic convictions arkansas , severity convictions differ indiana ?",0,0.0,0.0,5,0.972972972972973
136171,best movie year 2016 ?,movies best 2016 ?,1,0.0,0.0,9,0.9032258064516129
136172,book set box ?,"go setting box demandware sitegenesis store ? how-to page , necessary downloads/resources ?",0,0.0,0.0,81,0.47058823529411764
136173,un security council ?,security counsel ?,1,0.0,0.0,5,1.0
136174,causes sleep paralysis every night ?,causes constant sleep paralysis ?,1,0.0,0.0,21,0.875
136175,top ps vita rpg games ?,"ps vita 's safe mode function , rebuild database always removes game . game risk ?",0,0.0,0.0,64,0.6666666666666666
136176,zero gravity created earth ?,train astronauts zero gravity situations ? zero gravity created earth ?,1,0.0,0.0,43,0.9090909090909091
136177,best way market first novel ?,market novel ?,1,0.0,0.0,15,0.8
136178,like insurance underwriter ?,'s process insurance underwriting ?,0,0.0,0.0,12,0.8125
136179,socialtrade.biz running ponzi scheme ?,make good ponzi scheme ?,0,0.0,0.0,20,0.8108108108108109
136180,"layman 's terms , exactly greece crisis 'resolved ' ?",reason behind greece 's financial debacle ? lead bankruptcy ? eu withdrawn support ?,0,0.0,0.0,64,0.7441860465116279
136181,happens eyeball comes socket ?,might cause bump eyeball ?,0,0.0,0.0,25,0.8125
136182,lewis dot diagram bromine ?,lewis dot diagram carbon dioxide ?,0,0.0,0.0,10,0.9411764705882353
136183,difference agreement contract ?,difference contract agreement ?,1,0.0,0.0,16,1.0
136184,safety precautions handling shotguns proposed nra new hampshire ?,safety precautions handling shotguns proposed nra entire u.s. including ’ territories possessions ? 3,1,0.0,0.0,43,0.8837209302325582
136185,daily routine introvert ?,daily routine ?,0,0.0,0.0,10,0.9629629629629629
136186,"best possible gaming pc configuration assemble ₹60,000 ?","best desktop configuration 60,000 inr gaming ?",1,0.0,0.0,33,0.9090909090909091
136187,best film 2016 ?,awaited movies 2016 ?,0,0.0,0.0,11,0.7333333333333333
136188,play music skype ?,app allows listen music without wifi internet ?,0,0.0,0.0,35,0.7096774193548387
136189,best free instagram analytics tool ?,best free analytic tools instagram ?,1,0.0,0.0,20,1.0
136190,keyword stemming ?,long keywords help boost small keywords ?,0,0.0,0.125,28,0.8235294117647058
136191,good time invest mutual funds due sensex falling ?,sensex slumped 25k+ value . right time invest money mutual fund ?,1,0.0,0.0,49,0.7906976744186046
136192,skydiving ?,skydivers think ?,0,0.0,0.0,7,0.782608695652174
136193,misconceptions others ?,misconceptions got watching porn ?,0,0.0,0.0,13,0.896551724137931
136194,best car 300k ?,"'s best car $ 20,000 ?",0,0.0,0.0,9,0.7692307692307693
136195,sitting india sell us ?,"would us government ever consider selling retired a-10s india ? , ?",0,0.0,0.0,53,0.7058823529411765
136196,scientific name existed big bang ?,void exist big bang ?,1,0.0,0.0,16,0.8275862068965517
136197,"calculate cement aggregate sand kg knowing ratio , say 1:2:4 ?","calculate quantity cement , sand aggregate steel 100 cubic feet ?",0,0.0,0.0,41,0.782608695652174
136198,fill address line 1 address line 2 ?,amazon address line 1 ?,0,0.0,0.0,18,0.8148148148148148
136199,favourite book ?,favorite book ? author ?,1,0.0,0.0,10,0.9629629629629629
136200,prevent morning nose bleeds ?,ways prevent nose bleeds every morning ?,1,0.0,0.0,26,0.9142857142857143
136201,buy best quality cupcakes parties corporate events gold coast ?,find delicious cupcakes gold coast ?,0,0.0,0.0,39,0.8421052631578947
136202,get better grades maths high school ?,study maths get better grades high school ?,1,0.0,0.0,18,0.9411764705882353
136203,difference western culture chinese culture ?,major differences chinese western culture ?,1,0.0,0.0,24,0.8823529411764706
136204,consequences taking expired lortab ?,reason india related sal forest ?,0,0.0,0.0,27,0.7272727272727273
136205,want lose lot weight ?,actually lose weight ?,1,0.0,0.0,9,0.8571428571428571
136206,stay calm difficult situations ?,best way keep calm tough situations ?,1,0.0,0.0,17,0.7428571428571429
136207,best sites watch documentaries ?,good websites watch documentaries ?,1,0.0,0.0,7,0.9714285714285714
136208,"mean , `` authorized work united states without sponsorship ? ''",proper answer `` legally authorized work united states ? `` ?,0,0.13413498240402633,0.0,39,0.8571428571428571
136209,would mr. trump 's wall feasible ?,would trump 's proposed wall plan work ?,1,0.0,0.0,21,0.8333333333333334
136210,"happen value money excess notes 1000 's deposited , due black money . ?",give idea online business marketing without spending money ?,0,0.0,0.0,49,0.7916666666666666
136211,type current battery produce ?,generator work produce current ?,0,0.0,0.0,24,0.8275862068965517
136212,warehouse amazon located ?,amazon 's warehouses like located ?,0,0.0,0.0,17,0.918918918918919
136213,third normal form rdbms ?,normal forms rdbms ?,0,0.0,0.0,7,0.8888888888888888
136214,kinetic energy relative ?,kinetic energy momentum related ?,0,0.0,0.0,12,0.8387096774193549
136215,hillary clinton lie benghazi attacked video instead honest america ?,hillary lie benghazi say video ? trying protect obama 's re-election chances ?,1,0.0,0.0,49,0.9090909090909091
136216,account quora never signed ?,account quora never signed ?,1,0.0,0.0,0,1.0
136217,word 'dexterous ' used sentence ?,word 'temerity ' used sentence ?,0,0.0,0.0,6,0.8666666666666667
136218,many days period get pregnant ?,get pregnant 14 days period started ?,1,0.0,0.0,23,0.9032258064516129
136219,"sahara , average temperatures compare ones karakum desert ?","sahara , average temperatures compare ones dasht-e kavir ?",1,0.0,0.0,11,0.95
136220,core java less interest core java ?,core java ?,1,0.0,0.0,24,0.782608695652174
136221,"difference maestro , master card visa ?",old sbi maestro debit card want replace new master / visa debit card . one ? much cost ?,0,0.0,0.0,62,0.7368421052631579
