id,question1,question2,is_duplicate,CosineSimilarity,JaccardSimilarity,Levenshtein,DiceSimilarity
264002,kvpy sa 2016 ?,cut kvpy sa stream ?,1,0.6198497453340202,0.4,10,0.6153846153846154
264003,one incident life want share ?,one incident life really want share ?,1,0.0,0.0,7,0.9696969696969697
264004,late night conversations feel deep true ?,deep conversations happen often night ?,0,0.0,0.0,23,0.9444444444444444
264005,deal stress ?,manage deal stress ?,1,0.0,0.0,7,0.8571428571428571
264006,smoking affect training ?,smoking affect running ?,0,0.0,0.0,3,0.967741935483871
264007,time travel ?,time travel ?,1,0.0,0.0,0,1.0
264008,indian women respect indian men ?,indian men hate indian women ?,0,0.0,0.0,10,0.8148148148148148
264009,taj mahal really symbol love ?,taj mahal considered monument love ?,1,0.0,0.0,17,0.7878787878787878
264010,whatsapp groups provide stock market updates regarding buy ?,free whatsapp telegram groups stock market advice ?,1,0.0,0.0,37,0.8837209302325582
264011,charles simonyi ask job interview microsoft non-disclosure agreement form regarding paperwork word excel ?,difference creating non-disclosure agreement western australia ? use agreement would united states ?,0,0.0,0.0,76,0.8260869565217391
264012,skittles made ?,skittles made ?,1,0.0,0.0,0,1.0
264013,clock inventor know time ?,"first clock invented , know time ?",1,0.0,0.0,10,0.875
264014,mayweather win ?,watch manny pacquiao vs floyd mayweather free ?,0,0.0,0.0,34,0.7058823529411765
264015,american chain outlets fail singapore ?,dunkin ' donuts fail singapore ?,0,0.0,0.0,15,0.8333333333333334
264016,company provides best website design services usa affordable price ?,company provides best website design service usa ?,0,0.0,0.0,18,0.9523809523809523
264017,really war india pakistan uri attack ? effects ?,indian economy affected war india pakistan ?,1,0.0,0.0,39,0.8888888888888888
264018,present research project local impacts global climate change ?,"chances , fall love often ?",0,0.0,0.0,46,0.6875
264019,give extempore nothing coming mind point time ?,mind tips hacks : problem realising answer giving comes fully ?,0,0.0,0.0,45,0.7317073170731707
264020,way get free coins pokemon go ?,get free coins pokemon go ?,1,0.0,0.0,4,0.9090909090909091
264021,calgary ?,'s calgary ?,0,0.0,0.0,3,0.8888888888888888
264022,measures could prevented cash crunch post demonetization india ?,"notice child labour i.e . kid ( ) working food shops , hotels factories ?",0,0.0,0.0,56,0.7272727272727273
264023,possible make internet friends quora ? ?,make online friends people quora ?,1,0.0,0.0,23,0.9444444444444444
264024,convert shia islam ?,muslim come islam ?,0,0.0,0.0,11,0.7692307692307693
264025,many times one sex day ?,many times sex day ?,0,0.0,0.0,4,0.96
264026,prepare inorganic chemistry neet 2017 ?,prepare neet ( chemistry ) ?,1,0.0,0.0,17,0.7777777777777778
264027,ngos work agriculture himachal pradesh ? work problems faced farmers himachal ?,scenic place himachal pradesh ?,0,0.0,0.0,56,0.7777777777777778
264028,question still asked quora ?,questions never asked quora ?,1,0.0,0.0,6,0.9333333333333333
264029,differences struct c c++ ?,differences c c++ ?,0,0.0,0.0,7,0.9166666666666666
264030,"react somebody ( friend ) asking caste belong , first meeting getting-to-know-each-other phase ?",name bollywood movie friend telling horror stories jungle car gets decay ?,0,0.0,0.0,70,0.8163265306122449
264031,evaluate integral ?,"ca n't indians convert unaccounted money bitcoins ? traced ? , n't government ban bitcoin transactions ?",0,0.0,0.0,89,0.6875
264032,best political solution kashmir conflict ?,solution kashmir conflict ?,1,0.0,0.0,15,0.9142857142857143
264033,period come indus valley civilization ?,happened india post harappan era formation mahajanapadas ?,0,0.0,0.0,44,0.7428571428571429
264034,people open beer bottles hand shown american movies tv series ?,best thing learned tv series movie ?,0,0.0,0.0,43,0.8888888888888888
264035,hen produce egg ?,hens produce eggs ?,1,0.0,0.0,2,0.96
264036,necessary rinse rice cooking ? significant difference rinsing rice ?,rinse rice cooking ? consequences rinse ?,1,0.0,0.0,34,0.7586206896551724
264037,"suitable solar panel installation provider near lindsay , california ca ?","suitable solar panel installation provider near arcadia , california ca ?",0,0.0,0.0,6,0.9743589743589743
264038,online reputation management works ?,online reputation management ?,0,0.0,0.0,6,0.9032258064516129
264039,apple watch require iphone ?,use apple watch without using iphone ?,1,0.0,0.0,15,0.875
264040,relevance morality modern world ?,ethics still relevant modern world ?,1,0.0,0.0,19,0.9090909090909091
264041,get snapchat account back forgot original email password ?,find get back snapchat hacked forgot password email ?,1,0.0,0.0,36,0.9767441860465116
264042,tree frog 's food chain ?,south china 's tiger food chain ?,0,0.0,0.0,16,0.9696969696969697
264043,build vocabulary cat exam ?,build 'vocabulary ' cat exam ?,1,0.0,0.0,3,0.9714285714285714
264044,best study strategies ?,improve study efficiency ?,1,0.0,0.0,17,0.6666666666666666
264045,possible add external processors and/or ram computer usb port ?,"possible detect usb port remotely classroom management software ? yes , ?",0,0.0,0.0,49,0.8292682926829268
264046,download free music iphone ?,get free music downloads iphone ?,1,0.0,0.0,18,0.9473684210526315
264047,causes failure revolt 1857 ?,political causes revolt 1857 ?,0,0.0,0.0,14,0.9444444444444444
264048,console gaming dying ?,buy gaming laptop gaming console ?,0,0.0,0.0,22,0.8387096774193549
264049,insomnia : n't able sleep past four nights . best ways get sleep ?,n't able sleep two days ? something wrong ?,0,0.0,0.0,40,0.8837209302325582
264050,good chance bernie sanders run president 2020 ?,bernie sanders run 2020 ?,1,0.0,0.0,22,0.8125
264051,elevator lights turn 're used ?,use arrows elevator ?,0,0.0,0.0,23,0.7586206896551724
264052,procrastinate waste lot time ?,waste time ?,0,0.0,0.0,18,0.75
264053,waste water air conditioner safe drink ?,water drop air conditioner 's ? water comes ?,0,0.0,0.0,19,0.8387096774193549
264054,ca n't delete questions quora ?,ca n't delete question quora ?,1,0.0,0.0,1,1.0
264055,good websites help final year project ?,basics needed `` angular js '' ?,0,0.0,0.0,29,0.7368421052631579
264056,tubes come back normal tubal ligation ?,"get small blisters back mouth , mostly eating . normal ? something prevent ? ( see details )",0,0.0,0.0,69,0.7906976744186046
264057,michael jackson cleft put chin ?,michael jackson peter pan fans ' eyes ?,0,0.0,0.0,18,0.8947368421052632
264058,"word `` scent '' , 's ' ' c ' silent ?",words end letter c ?,0,0.0,0.0,26,0.8571428571428571
264059,n2 considered polar non-polar molecule ?,makes cof2 molecule polar ?,0,0.0,0.0,29,0.8125
264060,best way make half fry egg ?,egg fried oil bad weight loss ?,0,0.0,0.0,25,0.8125
264061,get new neko atsume wallpapers ? work ?,weather change game play neko atsume ?,0,0.0,0.0,28,0.9142857142857143
264062,best hollywood movies ever ?,best hollywood movie ?,1,0.0,0.0,6,0.967741935483871
264063,good thesis statement nature vs civilization ?,good thesis template ?,0,0.0,0.0,26,0.7878787878787878
264064,'s day life hollywood producer like compare starting ?,feel like demons really head life figured starting feel see physical presence ?,0,0.0,0.0,57,0.9545454545454546
264065,"fact based american history book , neutral , without political bias ?","done diploma course , eligable 12 standered job ?",0,0.0,0.0,54,0.8
264066,psychology everyday life : things make indians happy ?,things makes indians happy ?,1,0.0,0.0,28,0.8108108108108109
264067,universities columbus exploration recruit new grads ? majors looking ?,alcohal 's brand liquor 's digital marketing india banned ?,0,0.0,0.0,58,0.8181818181818182
264068,high school student start political career ?,high school student prepare future politics ?,1,0.0,0.0,20,0.9714285714285714
264069,caltrain significantly energy inefficient bart ?,n't like people touching ?,0,0.0,0.0,38,0.6
264070,boy get feminine body ?,boy get feminine butt ?,0,0.0,0.0,3,0.9230769230769231
264071,harvard business review : one obtain free digital electronic subscription hbr ?,cancel google apps subscription business ?,0,0.0,0.0,59,0.8421052631578947
264072,train mastiff/pitbull mix puppy ?,train rottweiler/pitbull mix ?,0,0.0,0.0,14,0.8235294117647058
264073,natural language understander english python ?,"tree-hugging , safe space , pearl clutching , `` therapy '' doll , `` 'm frightened '' weasels afraid donald trump ?",0,0.0,0.0,94,0.8095238095238095
264074,traditional method finding ground water ( dowsing ) done ?,best universities pursue higher studies canada field machine learning computational linguistics ?,0,0.0,0.0,73,0.8292682926829268
264075,best way lead life ?,best way lead life ?,1,0.0,0.0,0,1.0
264076,brahmin boy married non brahmin girl conduct thread ceremony son ?,brahmin girl marry non-brahmin boy ?,1,0.0,0.0,38,0.7878787878787878
264077,download facebook videos ?,download facebook video facebook app ?,0,0.0,0.0,13,0.9375
264078,top 5 tanks wwii ?,wwii tank legends ?,0,0.0,0.0,13,0.72
264079,barack obama ?,barack obama ?,0,0.0,0.0,0,1.0
264080,improve diet gain weight ? options gain weight ?,food eat gain weight ?,1,0.0,0.0,29,0.8
264081,benefits outsourcing ?,benefits outsourcing projects ?,0,0.0,0.0,9,0.9333333333333333
264082,get lot money 8 ball pool ?,earn coins 8 ball pool ?,1,0.0,0.0,10,0.7142857142857143
264083,chamath palihapitiya : get venture capital crowd funding startup ?,get venture capital funding started company need money run ?,1,0.0,0.0,49,0.9302325581395349
264084,best ways evaluate product manager candidates ?,best product managers israel ?,0,0.0,0.0,23,0.9230769230769231
264085,exactly demonetization inr 500/1000 going curb black money extent ?,banning present 500/1000 notes fight black money exchanged ?,1,0.0,0.0,37,0.88
264086,increase traffic blog ?,increase traffic blogspot blogger ?,0,0.0,0.0,12,0.967741935483871
264087,paytm earn profit ?,paytm making profit ?,1,0.0,0.0,4,0.8888888888888888
264088,probable cutoff kvpy sa 2016 ?,expected cutoff kvpy 2016 ?,1,0.4421283170275384,0.4,11,0.8205128205128205
264089,best digital marketing training institute kochi ?,best digital marketing training institute kochi ?,1,0.0,0.0,0,1.0
264090,abiotic factors desert ecosystem ?,5 biotic factors desert ecosystem ?,0,0.0,0.0,2,0.967741935483871
264091,safety precautions handling shotguns proposed nra entire u.s. including ’ territories possessions ? 1,safety precautions handling shotguns proposed nra entire u.s. including ’ territories possessions ? 2,0,0.0,0.0,1,0.9545454545454546
264092,like study computer science iit ?,get iit computer science subject good computer science ?,0,0.0,0.0,36,0.8235294117647058
264093,difficult thing done life ?,psychology everyday life : difficult thing learn accept life ?,0,0.0,0.0,37,0.8
264094,buy dell i7559 2512 gaming laptop ps4 gaming ? dont care portability dell 's side gaming piracy .,looking portable 14 inch laptop 40k 50k . dell laptop ?,0,0.0,0.0,74,0.7755102040816326
264095,supreme court directed cinema halls across country play national anthem start film ?,’ think good decision honorable supreme court play national anthem cinema halls ?,1,0.0,0.0,46,0.8780487804878049
264096,possible lose 20 kgs 4 months ?,lose 15kgs 4 months ?,0,0.0,0.0,12,0.7878787878787878
264097,"lost , 's significance using names like jeremy benthem & john locke ?",richard alpert 's character arc lost ?,0,0.0,0.0,54,0.6666666666666666
264098,certification demand networking field ccie data centre ccie security ?,"qualified statement , `` data scientist without ph.d degree pseudo data scientist '' ?",0,0.0,0.0,64,0.8
264099,long take human body replace pint donated plasma ?,long take body replace 1 pint blood ?,1,0.0,0.0,20,0.8717948717948718
264100,overcome nervousness working ?,overcome nervousness ?,0,0.0,0.0,8,0.8461538461538461
264101,someone overcome servere social anxiety ?,best way get rid social anxiety ?,1,0.0,0.0,20,0.8235294117647058
264102,keep getting prank called people caller id : find number ?,find called unknown `` caller id '' private number ?,1,0.0,0.0,33,0.8571428571428571
264103,start deep learning ?,'s effective way get started deep learning ?,1,0.0,0.0,23,0.8125
264104,one say circle infinite sides ?,see circle regular polygon infinite number sides ? ?,1,0.0,0.0,30,0.8571428571428571
264105,"want start new business . putting cab car rental services like ola , uber ?",register car ola cabs ? much pay ?,0,0.0,0.0,57,0.7692307692307693
264106,salary characters taarak mehta ka ooaltah chashmah ?,way kitchen jethalal gada show `` taarak mehta ka ooltah chashmah '' ?,0,0.0,0.0,31,0.7777777777777778
264107,ethical implications creating man-made man ?,na stable na+ ?,0,0.0,0.0,34,0.5714285714285714
264108,true see ’ viewed instagram ?,see view instagram ?,1,0.0,0.0,9,0.896551724137931
264109,convince parents let travel close friend ?,convince parents let travel ?,0,0.0,0.0,13,0.9333333333333333
264110,browserstack offer real mobile devices ?,get mobile devices review ?,0,0.0,0.0,27,0.8823529411764706
264111,best websites learn economics ?,best website learn economics ?,1,0.0,0.0,1,1.0
264112,best courses ms germany student graduate mechanical engineering ?,best courses ms germany student graduate mechanical engineering ?,1,0.0,0.0,0,1.0
264113,take step 1 exam ?,"best time prepare usmle , 'm 2nd year mbbs student india ?",0,0.0,0.0,46,0.5333333333333333
264114,recover permanently deleted emails gmail ?,retrive permanently deleted email gmail ?,1,0.0,0.0,5,0.9090909090909091
264115,'s squarespace bookings widget recommend ?,woocommerce work squarespace ?,0,0.0,0.0,30,0.8
264116,demonetization leads inflation deflation ?,extent demonetization help inflation country ?,1,0.0,0.0,19,0.7647058823529411
264117,post something quora ?,post something quora ?,1,0.0,0.0,0,1.0
264118,much brands like amul/mother dairy pay dairy farmers ?,"expand business small dairy retail shop level mother dairy , amul , etc . ?",0,0.0,0.0,50,0.8444444444444444
264119,would happen could use 100 % brain ?,happen human use 100 % brain ? question arise mind watching lucy movie trailer ...,0,0.0,0.0,63,0.851063829787234
264120,questions n't changed . marked needing improvement ?,people see questions marked needing improvement ?,1,0.0,0.0,20,0.8780487804878049
264121,truth claim bill clinton illegitimate black son ?,"bill clinton father black illegitimate son , danney williams ?",1,0.0,0.0,41,0.85
264122,get rid bad roommate ?,get rid irritating roommate ?,0,0.0,0.0,9,0.9166666666666666
264123,true resumes contain lies ?,example lie people believe true ?,0,0.0,0.0,25,0.7586206896551724
264124,civil engineering student aspiring civil services . subjects opt preparation mains ?,civil engineering student aspiring civil services . subjects opt preparation mains ?,1,0.0,0.0,0,1.0
264125,british colonize india ?,british started colonising india ?,1,0.0,0.0,12,0.9375
264126,"venture capital investor , chance invest tesla passed , rationale ?","venture capital investor , chance invest adyen passed , rationale ?",0,0.0,0.0,5,0.972972972972973
264127,business model shyp ?,shyp viable business model ?,0,0.0,0.0,17,0.9375
264128,scientific proof explanation ghosts ?,science explain existence ghosts ?,0,0.0,0.0,19,0.9375
264129,known prostitution tech industry ?,real support hillary silicon valley amongst tech workers ?,0,0.0,0.0,43,0.8421052631578947
264130,paperback book mean flipkart amazon ? understand difference e-book hard copy . paperback simply one might buy regular store ?,e-books cheaper paperbacks ?,0,0.0,0.0,101,0.6842105263157895
264131,"local laws regards nudity vermont , differ nudity laws georgia ?","local laws regards nudity vermont , differ nudity laws florida ?",0,0.0,0.0,4,1.0
264132,many anonymous questions quora ?,many people ask answer questions anonymously quora ?,1,0.0,0.0,27,0.875
264133,difference data analytics data mining ?,difference data analyticis data mining ?,1,0.0,0.0,1,1.0
264134,chuck norris google trick ?,chuck norris save world 2012 ?,0,0.0,0.0,13,0.7428571428571429
264135,"software developer ubuntu , prefer lts release latest version ?","last 1 year , twice decide family member kept ventilator ? would make decision ? ?",0,0.0,0.0,58,0.8837209302325582
264136,resolve feeling guilt shame ?,ways handle guilt shame ?,1,0.0,0.0,14,0.7878787878787878
264137,potato chips/crisps loud eat ?,necessary join classes preparation gre ielts/toefl examination ?,0,0.0,0.0,48,0.7222222222222222
264138,"choose mathematician physicist philosophical discussion , combination would choose ?","choose killing father killing wife son , would choose killing wife son . normal ?",0,0.0,0.0,62,0.8095238095238095
264139,examples energy converted matter nature ?,dark energy ever convertible usable energy ?,0,0.0,0.0,27,0.8421052631578947
264140,expect time travel become reality ?,possibility time travel becoming reality ?,1,0.0,0.0,13,0.8823529411764706
264141,site best direct download pc games without ads ?,'s good torrent site download games ?,0,0.0,0.0,30,0.8333333333333334
264142,alzheimer 's disease ?,alzheimer 's disease preventable ?,0,0.0,0.0,12,0.8387096774193549
264143,'s best advice best thing say ? ( read story first ),"first time quora , advice would give get best site ?",0,0.0,0.0,43,0.7142857142857143
264144,committed mistake joing private physiotherapy college ? ( read details ),"roman times , plunder divided among soldiers , ?",0,0.0,0.0,55,0.7804878048780488
264145,budget cost per episode impractical jokers ?,time impractical jokers get new crew ?,0,0.0,0.0,33,0.8648648648648649
264146,find shortest distance two skew lines ?,maximum distance two points ?,0,0.0,0.0,20,0.7272727272727273
264147,much average american spend eating per month ?,asians split bill meal ?,0,0.0,0.0,34,0.6666666666666666
264148,happens user information closing ebay account ?,reviews exilant rpa product fusion ?,0,0.0,0.0,34,0.7692307692307693
264149,different chinese western diet culture ?,differences chinese western diet ?,1,0.0,0.0,11,0.9285714285714286
264150,one quit smoking ? one ?,one quit smoking ?,0,0.0,0.0,6,1.0
264151,procedure followed someone files fir ?,procedure filing fir ?,1,0.0,0.0,19,0.8666666666666667
264152,feel love someone rude ?,feel hate someone loves ?,0,0.0,0.0,7,0.7692307692307693
264153,best apps windows phone ?,top 5 apps windows phone ?,1,0.0,0.0,5,0.9285714285714286
264154,much uber charge passengers ride ?,know uber rating passenger ?,0,0.0,0.0,16,0.75
264155,performance lyf mobiles ?,performance lyf phone ?,1,0.0,0.0,6,0.8666666666666667
264156,told best guy friend like likes back . ?,barcelona full tourists second half september ?,0,0.0,0.0,37,0.8205128205128205
264157,"twit , tweep one twitterati ?",coined term `` twitterati '' ?,0,0.0,0.0,14,0.7407407407407407
264158,would define true friend ?,true friend ?,1,0.0,0.0,13,0.8695652173913043
264159,dib ?,"members lgbt community actively practice words paul muad'dib `` weaker , ask freedom according principles ; stronger , take away freedom according principles . `` ?",0,0.0,0.0,159,0.30303030303030304
264160,everyone earning millions home using uber app mobile ?,friends earning millions home using uber app ?,1,0.0,0.0,14,0.8888888888888888
264161,benefits using kali linux ?,read data like passwords messages sent network using kali linux ?,0,0.0,0.0,43,0.7647058823529411
264162,procedure transfer dead body air india ?,get rid dead body ?,0,0.0,0.0,25,0.7586206896551724
264163,legal live storage unit ?,legal persicope live sales calls ?,0,0.0,0.0,20,0.8148148148148148
264164,cymalta ( duloxetine ) affect similar receptor sites opiates ?,take opiates n't work ?,0,0.0,0.0,48,0.6285714285714286
264165,"submitting documents accenture , status candidature process since around month . expect offer letter ?","documentation process accenture month ago , got offer letter yet . ?",0,0.0,0.0,63,0.9333333333333333
264166,tax government india earn maximum revenue ?,tax government india earn ?,0,0.0,0.0,16,0.9655172413793104
264167,use ipad pro/windows surface pro win work ?,4 billion unemployed people globally deserve healthcare basic income ?,0,0.0,0.0,52,0.6666666666666666
264168,best easiest thesis economic trade ?,kohl 's loyalty program require social security number use ?,0,0.0,0.0,46,0.7567567567567568
264169,build magnetic propulsion engine ?,would build magnetic propulsion system ?,1,0.0,0.0,12,0.9473684210526315
264170,anybody aware alternative nikon ml-l3 wireless remote better range cheaper ?,new dol fudiciary rule affect roth ira ?,0,0.0,0.0,58,0.7317073170731707
264171,change bsnl broadband wifi router password ?,change bsnl broadband wired modem password ?,0,0.0,0.0,7,0.8947368421052632
264172,one get back speed post delivery attempted status missent ?,contact delivery boy delivery attempt made absent ? n't contact number ?,0,0.0,0.0,43,0.926829268292683
264173,men know age 23 ?,men know age 27 ?,0,0.0,0.0,1,0.9166666666666666
264174,best vegetarian restaurants bangalore ?,good vegetarian restaurants bangalore ?,1,0.0,0.0,4,0.967741935483871
264175,cost printing 2000 rupee note indian currency ?,would cost printing 2000 rupee note ?,1,0.0,0.0,22,0.8888888888888888
264176,examples discrete variables continuous variables ?,use method separation variables ?,0,0.0,0.0,29,0.918918918918919
264177,fine technologies used industries ?,technology neato use ?,0,0.0,0.0,19,0.8
264178,physicists arrive speed light verify correct ?,"assuming many worlds theory correct , universe speed light different ? would change things ?",0,0.0,0.0,62,0.8780487804878049
264179,need study evolution ?,need study ?,0,0.0,0.0,10,0.8181818181818182
264180,long jaundice last ?,long jaundice last ?,1,0.0,0.0,0,1.0
264181,interesting places visit chennai ?,great places visit chennai ?,1,0.0,0.0,8,1.0
264182,chip ?,chip ?,1,0.0,0.0,0,1.0
264183,"healthcare insurance plan , deductible amount ( need pay insurance starts covering healthcare costs ) include monthly premium payments ? , deductibles paid ?",someone enroll health insurance plan later decide use ( never used moment ) neither pay monthly premiums ?,0,0.0,0.0,107,0.9333333333333333
264184,`` compensation commensurate experience '' mean ?,"total compensation $ 214-216k senior software engineer total 14 years experience ( 3 years valley ) , one top tech firms silicon valley ?",0,0.0,0.0,99,0.5714285714285714
264185,much investment needed shoe designing making ?,much investment inr needed set gokart track ?,0,0.0,0.0,22,0.9714285714285714
264186,'s like live south africa ?,"view south africa , someone n't live ?",0,0.0,0.0,28,0.8648648648648649
264187,cultures considered innovative ?,cultures considered unethical elope ?,0,0.0,0.0,12,0.9032258064516129
264188,read someones mind ?,read human mind ?,1,0.0,0.0,6,0.8181818181818182
264189,employees agree realty good work-life balance ? differ across positions departments ?,employees associated estates realty good work-life balance ? differ across positions departments ?,0,0.0,0.0,15,1.0
264190,"vacum space , human ( carbon life form particular sructure ) sound like ?","vacum space , human ( carbon life form particular structure ) sound like ?",1,0.0,0.0,1,1.0
264191,good fashion tips men pakistan ?,best fashion tips men ?,0,0.0,0.0,13,0.8666666666666667
264192,find cell phone number free charge ?,find recent cell phone number free ?,0,0.0,0.0,14,0.9142857142857143
264193,washington dc district columbia thing ?,washington dc district columbia ?,1,0.0,0.0,6,1.0
264194,writing agreement plain paper getting signed make legal document ( without witnesses present ) ?,made notarized agreement landlord 500 stamp paper . landlord returning deposit . legal action take ?,0,0.0,0.0,74,0.8181818181818182
264195,people expect ?,people expect people ?,0,0.0,0.0,7,1.0
264196,google wave failed ?,google wave fail ?,1,0.0,0.0,2,0.9565217391304348
264197,require college degree become pilot emirates airline ?,shall become pilot emirates airlines class 12 ?,0,0.0,0.0,30,0.8108108108108109
264198,people believe world flat ?,people think earth flat ?,1,0.0,0.0,10,0.7586206896551724
264199,"india , percentage black money form cash ( 500s & 1000s ) ?",amount black money india form currency ?,1,0.0,0.0,38,0.7391304347826086
264200,process applying oxford university ?,procedure get admission oxford university ?,1,0.0,0.0,15,0.95
264201,"flavors native american spirit cigarettes , colors mean ?",american spirit light cigarettes ?,0,0.0,0.0,32,0.8484848484848485
264202,want win world war iii ?,would world war iii look like ?,0,0.0,0.0,17,0.782608695652174
264203,practical application logic gates ?,practical applications logic gates ?,1,0.0,0.0,1,1.0
264204,long distance relationship work ?,take successful long distance relationship ?,1,0.0,0.0,21,0.918918918918919
264205,unexpected military victory history ?,powerful military history ?,0,0.0,0.0,17,0.8108108108108109
264206,calculate clamping force high pressure die casting machine ?,low pressure cell high pressure cell differ ?,0,0.0,0.0,38,0.8571428571428571
264207,make facebook 's animated gif post clickable ?,way add multiple gifs one post facebook ?,0,0.0,0.0,32,0.9
264208,exactly tension russia & us russian involvement syria ? proxy war future ?,proxy war going russia us allies syria ?,1,0.0,0.0,50,0.8108108108108109
264209,"want thorough in-depth programming , statistics short time . ?","want change career ( manufacturing ) quality engineer data analyst ( non-manufacturing company ) , programming background know statistics , minitab , spss excel . skills learn ?",0,0.0,0.0,131,0.8235294117647058
264210,result sliding round ipu ?,ipu announce results sliding round ?,0,0.0,0.0,18,0.9333333333333333
