id,question1,question2,is_duplicate,CosineSimilarity,JaccardSimilarity,Levenshtein,DiceSimilarity
324850,become super saiyan ?,become super saiyan ?,1,0.0,0.0,0,1.0
324851,best name charity organization ?,best charity organization ?,0,0.0,0.09999999999999998,5,0.9696969696969697
324852,"compare working thoughtworks vs. working product company , say yahoo ?",like work thoughtworks india ?,0,0.0,0.0,44,0.8
324853,recover lost deleted history google chrome ?,history retrieved deleting google chrome ?,1,0.0,0.0,22,0.9696969696969697
324854,mean men look women 's eyes constantly ?,women find turn married men look pick ?,0,0.0,0.0,30,0.7272727272727273
324855,best phone 10k india ?,best phone 10000 ?,1,0.06807131804305179,0.11111111111111116,7,0.8571428571428571
324856,united airlines reservations number ?,american airlines customer service telephone number domestic flights usa ?,0,0.0,0.0,46,0.8648648648648649
324857,cure scalp psoriasis permanently ?,treat scalp psoriasis permanently ?,1,0.0,0.0,4,0.967741935483871
324858,gained 500 gm weight running 2 km everyday last 1 month ?,want try new sex positions know many . please help ?,0,0.0,0.0,43,0.7441860465116279
324859,name music playing background bosley hair commercials ?,name music playing background bosley hair commercials ?,1,0.0,0.0,0,1.0
324860,"girl messages everytime . asked date date , agrees . casually mentions boyfriend ? n't say onset ?",would girl would agree date casually mention boyfriend ?,1,0.0,0.07692307692307687,57,0.8636363636363636
324861,datascience course easy learn ?,datascience easy learn ?,1,0.0,0.0,7,0.9285714285714286
324862,surgical strike mean ?,surgical strike ?,1,0.0,0.0,5,0.9285714285714286
324863,kind questions answered quora ?,kinds questions quora get useful answers ? effective way asking question ?,0,0.0,0.0,47,0.8333333333333334
324864,best project management books ?,best books project management ?,1,0.0,0.09090909090909094,12,1.0
324865,could best idea startup ?,best idea startup ?,1,0.0,0.09999999999999998,6,0.8888888888888888
324866,pay porn star sex ?,many times porn stars sex camera typical week ?,0,0.171353977409638,0.0,29,0.8
324867,best web series watch ?,best web series watch ?,1,0.0,0.09090909090909094,0,1.0
324868,chat girl facebook first time ?,strategy make girl fond us facebook chat ?,0,0.0,0.0,28,0.8947368421052632
324869,actually possible travel time ?,time travel possible next 5 years ?,1,0.0,0.0,20,0.8571428571428571
324870,'s cause ww1 ?,cause ww1 ?,1,0.0,0.0,3,0.9473684210526315
324871,book circular train ticket ?,benifit booking circular journey ticket indian railway ?,0,0.0,0.0,32,0.8235294117647058
324872,good bad ?,good bad ?,0,0.11093568319714094,0.0,0,1.0
324873,chemical formula vanadium hydroxide ?,chemical formula strontium hydroxide ?,0,0.0,0.0,6,0.918918918918919
324874,love two person time ?,love one person time ? ?,1,0.0,0.0,5,0.9629629629629629
324875,developing country south america ?,south america : innovative country south america ?,0,0.0,0.0,23,0.8648648648648649
324876,review breaking free nehru : let 's unleash india ! ( book ) sanjeev ?,youngsters india hate nehru family ?,0,0.03686411077653303,0.0,54,0.7272727272727273
324877,msi service centers india ?,msi service centers india ?,0,0.05627474211305964,0.0,0,1.0
324878,types acoustic guitar ?,various types acoustic guitars differences ?,0,0.0,0.0,21,0.875
324879,common mistakes made event organisers dubai avoid ?,uber/ola calculates nearest driver quickly ?,0,0.0,0.0,36,0.8421052631578947
324880,"come people quora ask questions , get google quora question/answer site , expand ?",people quora ask questions easily findout google ?,1,0.0,0.0,46,0.8095238095238095
324881,stop ddos attack website ?,plan ddos attack ?,0,0.0,0.0,12,0.7692307692307693
324882,think donald trump winning us election mean something indians ?,"indian , think donald trump winning us election ?",1,0.0,0.0,32,0.975609756097561
324883,message anyone quora ?,send private message quora ?,0,0.0,0.0,15,0.8
324884,video showing youtube fix ?,computer unable play youtube videos ? fix ?,1,0.0,0.0,27,0.7692307692307693
324885,definition `` dilemma '' ? used sentence ?,definition 'peremptorily ' used sentence ?,0,0.0,0.0,14,0.8571428571428571
324886,back emf produce motors ?,back emf load dc shunt motor ?,0,0.0,0.0,12,0.8823529411764706
324887,world war going happen ?,world war three really going happen soon ? stressing week really scared .,1,0.0,0.0,49,0.8235294117647058
324888,best technology mobile phones ?,best platform mobile phone ?,0,0.0,0.09090909090909094,10,0.8125
324889,parents want teenage kids watching porn ?,parents react kids watching porn ?,0,0.0,0.0,10,1.0
324890,object see look telescope ?,"telescope pointed star positive dec want move star negative dec , simply rotate telescope downwards ? 's reasoning behind ?",0,0.0,0.0,100,0.5714285714285714
324891,exes ever truly friends ?,exes ever friends ?,1,0.0,0.0,6,0.8461538461538461
324892,difference programmer coder ?,"'s difference programmers , coders developers ?",0,0.0,0.0,18,0.8484848484848485
324893,set habits consider important success life ?,introverts celebrate birthday ?,0,0.0,0.0,33,0.8333333333333334
324894,negative balance bank account ?,mean account balance negative ?,0,0.0,0.0,20,0.9333333333333333
324895,mobile phone best 15k ?,best phone buy price 15000 ?,1,0.0,0.08333333333333337,16,0.7647058823529411
324896,type government guatemala ? compare countries ?,type government guatemala ? compare one argentina ?,1,0.0,0.0,11,0.9714285714285714
324897,failure nsec mean ?,expected nsec 2016 cutoff maharashtra ?,0,0.0,0.0,28,0.6470588235294118
324898,one intelligently ask questions ?,learn ask good questions ?,1,0.0,0.0,18,0.9032258064516129
324899,'wants share ' notification fb ?,want share internet ?,0,0.0,0.0,16,0.8148148148148148
324900,'s best coffee shop studying seattle ?,best coffee shops seattle work ?,0,0.0,0.09090909090909094,16,0.7222222222222222
324901,perfect ?,perfect woman ?,0,0.0,0.0,6,0.7619047619047619
324902,"attitude people near ( especially girls ) , change , soon get intern/job ?",tend get easily annoyed people soon get close ? change ?,0,0.0,0.0,51,0.8
324903,prepare microsoft hackathon code.fun.do ?,prepare job hackathon 2 days ?,0,0.0,0.0,18,0.7567567567567568
324904,become better python ? need better python become better python ?,need become better python developer ?,0,0.0,0.0,37,0.9333333333333333
324905,make online air ticket reservation site using rails ?,facebook provide air ticket ?,0,0.11055449803580508,0.0,38,0.6875
324906,brain transplant done ?,could brain transplant possible within lifetime ?,1,0.0,0.0,27,0.8235294117647058
324907,reduce eliminate social anxiety ?,good ways reduce social anxiety ?,1,0.0,0.0,15,0.9142857142857143
324908,possible faith god simultaneously embracing modern science ?,older people deny religion others embrace faith ?,0,0.0,0.0,45,0.975609756097561
324909,really necessary fresher certified get job ?,possible configure performance_schema mysql 5.1 ?,0,0.0,0.0,38,0.7441860465116279
324910,stop sensitive relationship ?,stop over-sensitive ?,0,0.0,0.0,18,0.8461538461538461
324911,reaction would realized close friend really well-off pretending poor ?,ways find time concentration given drainage basin ?,0,0.0,0.0,52,0.8
324912,"life start earth-like planet somewhere universe , possibility evolve exactly like earth ?","50 sextillion habitable earth-like planets universe , possible humans planets universe ?",0,0.0,0.0,51,0.875
324913,android app completely invert colors phone ?,important android phone apps ?,0,0.0,0.0,33,0.875
324914,stop masturbating daily ?,one stop masturbating good ?,1,0.0,0.0,9,0.9090909090909091
324915,estimate king solomon 's wealth today 's economy likely richest ?,wealth difference king solomon vs mansa musa ?,0,0.0,0.08333333333333337,47,0.8780487804878049
324916,much times masturbate week ?,many times masturbate month ?,0,0.0,0.0,8,0.8
324917,review temenos ?,temenos core banking system hosted cloud ?,0,0.0,0.0,31,0.625
324918,best way get six sigma certification india ? premier institute ? approximately much cost get green belt ?,useful six sigma green belt certification technical analyst qa guy ?,0,0.0305934752775279,0.0,72,0.9090909090909091
324919,valid reason dumped making partner wait sexual intimacy ?,"got dumped , ?",0,0.0,0.0,46,0.6060606060606061
324920,best laptop 70000 rupees ?,best laptop buy around 70000 rupees ?,1,0.0,0.07692307692307687,11,0.9032258064516129
324921,uses shear machine ?,believe super human powers awakened human beings ? ?,0,0.0,0.0,39,0.6875
324922,according newton 's third law motion every action equal opposite reaction n't cancel ?,"according newton 's third law motion , every action equal opposite reaction . move object , move ?",1,0.0,0.0,20,0.92
324923,catch locker room thief ?,catch thief stealing bike ?,0,0.0,0.0,17,0.7586206896551724
324924,survival instincts ?,survival instinct ?,1,0.0,0.0,1,1.0
324925,coined word `` india '' river `` indus '' named ?,"inhabitants indus valley civilization moved deeper areas india , n't ancient city built found areas ?",0,0.04321388818559402,0.0,76,0.7317073170731707
324926,biggest influencers 'investment ' niche ?,biggest influencers 'investing ' niche ?,1,0.0,0.0,3,0.9714285714285714
324927,difference pashtuns hazaras ?,hazaras seen conquering mongols thus foreign afghans/ pashtuns ?,0,0.0,0.0,49,0.8108108108108109
324928,"get professional knife , scissor & clipper blade sharpening service sydney ?","get professional , top quality sharpening service clipper blades sydney ?",1,0.0,0.0,40,0.9130434782608695
324929,source huge money patanjali spending new products investment advertisements ?,patanjali shares available bse nse ?,0,0.0,0.0,55,0.7567567567567568
324930,land acquisition bill ?,actually 'land acquisition bill 2015 ' coined anti farmer-pro industrialist bill indian print media ?,0,0.0,0.0,78,0.7
324931,good spas/massage parlours delhi offer cross gender facility ?,often police raid massage spas honduras ? ?,0,0.035945573847190083,0.0,47,0.95
324932,googling mean ?,google mean ?,0,0.0,0.0,3,0.9473684210526315
324933,phone text messages tracked ?,apps track text messages ?,0,0.0,0.0,17,0.8666666666666667
324934,clearest concise way define word `` adverb '' ?,clearest concise way define word `` adjective '' ?,0,0.0,0.0,6,0.95
324935,instagram choose user make suggested user ?,suggested user list appears searching instagram mean searched past ?,0,0.0,0.0,50,0.8823529411764706
324936,long distance relationships work ?,remain satisfied long distance relationship ?,1,0.0,0.0,23,0.8888888888888888
324937,breakup girlfriend future ?,breakup girlfriend ca n't marry future ?,0,0.0,0.0,13,0.8888888888888888
324938,nasa 's moon landing hoax ?,moon landing fake astronaut suits different images ?,1,0.0,0.0,38,0.7096774193548387
324939,best resources learning cybersecurity ?,best way learn data analysis beginner ?,0,0.0,0.07692307692307687,29,0.8387096774193549
324940,people ask questions quora instead googling ?,people ask questions quora could easily answered using search engine ?,1,0.0,0.0,32,0.8947368421052632
324941,'she ' french ?,something magnet ?,0,0.0,0.0,13,0.5454545454545454
324942,actually go losing weight ?,actually lose weight ?,1,0.0,0.0,6,0.967741935483871
324943,universe look like big bang ?,universe born ?,1,0.0,0.0,16,0.8461538461538461
324944,life-changing experience ?,life changing experience ?,1,0.0,0.0,1,0.9655172413793104
324945,preparing speeches rahul ghandi ?,prepares speeches rahul ghandi ?,1,0.0,0.0,3,1.0
324946,feel part clash royale developing team ?,least-often used card clash royale ?,0,0.10952420765417344,0.0,31,0.8108108108108109
324947,hedgehogs look like ?,hedgehogs like ?,0,0.0,0.0,5,1.0
324948,advertising personalization ?,advertising ?,0,0.0,0.0,16,0.8571428571428571
324949,attracted freckles ?,find people freckles attractive ?,0,0.0,0.0,22,0.8275862068965517
324950,"good , funny , sarcastic one line quotes ( everyday use ) tamil language ?",good tamil thesaurus use ?,0,0.036699323360891926,0.0,55,0.7368421052631579
324951,medicine healthcare : prevent stroke ?,prevent stroke ?,1,0.0,0.0,22,0.7333333333333333
324952,penis go sex ?,effect curved penis sex ?,0,0.0,0.0,17,0.64
324953,moons affect tides ?,relationship moon tides ? tides affect moon ?,1,0.0,0.0,31,0.8666666666666667
324954,dick short richard ?,dick become synonym richard ?,1,0.0,0.0,12,0.7857142857142857
324955,moving london dublin . one better option long run ?,research journal ?,0,0.0,0.0,44,0.5333333333333333
324956,earn money online ?,could make money online ?,1,0.0,0.0,9,0.8
324957,think outside `` think outside box '' box ?,think box ? learn think box ?,0,0.0,0.0,24,0.7333333333333333
324958,legal requirements selling homemade cosmetics soap india ?,want present famous natural cosmetics brand usa . documents need legally bring sell retail stores ?,0,0.04075062568991319,0.0,76,0.8292682926829268
324959,courageous ?,brave ?,0,0.0,0.0,7,0.5882352941176471
324960,neutrinos oscillate ?,significance neutrino oscillation ?,0,0.0,0.0,17,0.9285714285714286
324961,maggi instant noodles really nutritious ?,"lead content found maggi noodles . safe knorr , yipeee , instant soups ready eat ?",0,0.0,0.0,58,0.8421052631578947
324962,'m 18. make money online ?,could make money online ?,1,0.0,0.0,6,0.7586206896551724
324963,buying surface pro 4. better m3 processor i5 ? gamer makes difference .,better : lenovo helix surface pro ?,0,0.0,0.0,55,0.6818181818181818
324964,£ mean ?,meaning ตแล้วกัน ?,0,0.0,0.0,14,0.5217391304347826
324965,anyone cured teeth cavity without filling ?,cavities cured ?,0,0.0,0.0,34,0.7096774193548387
324966,best self help books ?,best self help book 've ever read ?,1,0.0,0.0714285714285714,14,0.8275862068965517
324967,anal sex dangerous unhealthy ?,anal sex safe ?,1,0.0,0.0,17,0.64
324968,'s erotic feature film seen ?,erotic movie ?,1,0.0,0.0,18,0.6923076923076923
324969,girls look away see staring ?,girls stare look away catch ?,0,0.0,0.0,16,0.9032258064516129
324970,disposable income greatest effect food consumption patterns . far agree statement ?,become super saiyan 2 ?,0,0.0,0.0,65,0.7777777777777778
324971,become popular impressive girls ?,best way impress girl ?,0,0.0,0.09999999999999998,14,0.7741935483870968
324972,"demand , .net java developers ? 10 years ?",worth move .net java 3+ years experience .net ?,0,0.0,0.0,31,0.7142857142857143
324973,end world ?,end world ?,1,0.0,0.0,0,1.0
324974,time travel possible yes travel past future ?,time travel already possible earth ?,1,0.0,0.0,25,0.8823529411764706
324975,lady gaga famous ?,lady gaga popular ?,1,0.0,0.0,7,0.782608695652174
324976,important thing sales person ?,michelin pilot sport a/s+ tires good acura tl ?,0,0.0,0.0,35,0.8571428571428571
324977,someone become astrophysicist ?,b.tech student become astrophysicist ? please reply ?,0,0.0,0.0,27,0.8888888888888888
324978,first home purchase experience ?,first home experience ?,0,0.0,0.0,9,0.9375
324979,companies make solar panels ?,best solar panel selling company india ?,0,0.0,0.07692307692307687,28,0.8125
324980,life become difficult men marriage ?,scared get married seeing parent horrible marriage life ?,0,0.0,0.0,37,0.8888888888888888
324981,get cheap chest binder ? safe use chest binder daily ?,"little sister came lesbian . family intensely homophobic , 're supporting financially . keep safe ?",0,0.0,0.0,76,0.8372093023255814
324982,graduate high school early ? 'm currently 10th grader .,"sophomore high school would like graduate early , classes need focus able ?",0,0.0,0.05882352941176472,50,0.782608695652174
324983,chemical formula sodium carbonate ?,chemical formula hydrogen carbonate ?,0,0.0,0.0,7,0.918918918918919
324984,things new employees know going first day oclaro ?,things new employees know going first day & ?,0,0.0,0.0,6,0.9523809523809523
324985,countries get paid use airspace ?,countries/airspaces el al ( israel airlines ) avoid ?,0,0.0,0.0,30,0.8235294117647058
324986,makes proud ?,'s one thing makes proud ?,0,0.0,0.0,13,0.8
324987,pakistanis think burhan wani ?,pakistanis think burhan wani ?,1,0.0,0.0,0,1.0
324988,easy get pr ( permanent resident ) canada province saskatchewan ?,get permanent residence canada pg ? easier getting permanent residence usa ?,0,0.0,0.0,47,0.7567567567567568
324989,"scientific point view , first man learn sex ?",early man learn sex ?,1,0.0,0.0,27,0.6666666666666666
324990,necessary take birth control pills everyday ?,happens n't take birth control hour ?,0,0.0,0.0,22,0.8648648648648649
324991,philippines ever invaded occupied ?,"`` occupy '' taken new part speech ? `` occupy '' always verb , n't ?",0,0.0,0.0,54,0.7368421052631579
324992,"sahara , average temperatures compare ones dasht-e kavir ?","sahara , average temperatures compare ones registan desert ?",1,0.0,0.0,12,0.95
324993,makes people lose interest quora ?,people lose interest quora ?,1,0.0,0.0,6,0.9333333333333333
324994,ways cancel people magazine subscription ?,cancel `` parents magazine '' subscription ?,0,0.0,0.0,16,0.9
324995,serialized inventory software tracks individual item serial ?,book help learn talk nicely politely ?,0,0.0,0.0,45,0.7027027027027027
324996,fedex ups drivers able get apartment buildings deliver packages ?,driver seats right side delivery trucks like ups fedex ?,0,0.0,0.0,46,0.8780487804878049
324997,stock exchanges function ?,stock exchange help ?,1,0.0,0.0,9,0.8387096774193549
324998,'s best way learn playing guitar ?,best way learn play guitar ?,1,0.0,0.08333333333333337,6,0.9696969696969697
324999,best stories mom dad shared ?,best stories mom/dad shared childhood ?,0,0.0,0.08333333333333337,11,0.896551724137931
325000,mobile phone buy rs.15000 ?,phone best 15k ?,1,0.0,0.09999999999999998,16,0.6875
325001,colors go well red ?,find colors go well skin tone ?,0,0.0,0.0,14,0.8148148148148148
325002,happens man loves woman ?,man loves woman ?,1,0.0,0.0,8,0.9166666666666666
325003,relation mechanical engineering engineering management ?,engineering management related mechanical engineering ?,0,0.0,0.0,44,0.9285714285714286
325004,scope sap accounting ?,scope opportunities learning sap ?,0,0.0,0.0,21,0.9285714285714286
325005,definition knowledgeable ?,definition knowledge ?,0,0.0,0.0,4,0.9285714285714286
325006,uses ms excel ?,best use ms excel ?,1,0.0,0.09090909090909094,6,0.9
325007,ice-cream ice cream ?,ice cream made ?,0,0.0,0.0,9,0.8888888888888888
325008,lose weight reduce waist quickly ?,easiest way lose weight faster ?,1,0.0,0.0,25,0.8235294117647058
325009,qualification get job fox traveller national geography ?,get job travel writer get sponsored travel ?,0,0.0,0.0,38,0.75
325010,find feel fear ?,never feel fear ?,0,0.0,0.0,5,0.8421052631578947
325011,china pakistan economic corridor ( cpec ) lead downfall china ?,pakistan make cpec china ?,0,0.0,0.0,40,0.7647058823529411
325012,’ bad experiences indian ladies . prefer marry someone race.have become bit racist ? protecting hurt ?,us past three months . bad experiences fellow indians american . missing ?,0,0.0,0.0,75,0.9166666666666666
325013,build focus work ethic like elon musk ?,train focus work ethic like elon musk ?,1,0.0,0.0,5,0.918918918918919
325014,hong kong 's movies tv series go decline golden age 20th century ?,happened hong kong movies tv drama ? decline much ?,1,0.0,0.0,40,0.8837209302325582
325015,emoticons : “ : / ” mean ?,emoticon ^^ mean ?,0,0.0,0.0,10,0.7692307692307693
325016,electrical energy ?,energy ?,0,0.0,0.0,11,0.7368421052631579
325017,basketball players wear clear masks ?,basketball players wear warm-ups ?,0,0.0,0.0,7,0.9032258064516129
325018,californians vote 2016 's proposition 60 ?,californians vote 2016 's proposition 56 ?,0,0.0,0.0,2,0.975609756097561
325019,journal entry selling computer ?,journal entry ?,0,0.0,0.0,17,0.8
325020,"evaluate indefinite integral [ math ] \displaystyle \int \dfrac { 1 } { x^2 ( x^2+4 ) } \ , dx [ /math ] ?","evaluate integral [ math ] \displaystyle\int_0^1\frac { \log x } { 1-x^2 } \ , dx [ /math ] ?",0,0.0,0.0,31,0.8857142857142857
325021,install cracked version microsoft office 2013 ?,install microsoft office 2013 ?,1,0.0,0.0,16,0.9230769230769231
325022,live nyc work long island pay city income tax ?,live nyc work outside city pay city income tax ?,1,0.0,0.0,11,0.9523809523809523
325023,good ways relieve stress budget ?,relieve stress ?,0,0.053977773407153665,0.0,17,0.6923076923076923
325024,good universities offering data science master 's australia ?,good universities australia offering data science/big data related courses ?,1,0.044894514032972434,0.0,32,0.8947368421052632
325025,three reasons growth representative government 13 colonies ?,democracy characterized 13 colonies ?,0,0.0,0.0,37,0.8205128205128205
325026,good idea buy certified car ( less 30k miles ) car rental company ?,good idea buy used car car rental agency ?,1,0.0329834721175428,0.0,32,0.8095238095238095
325027,many days diet loose belly fat get six pack abs ?,combination diet exercise tips result losing belly fat building six pack abs ?,1,0.0,0.0,40,0.9523809523809523
325028,uncle 's dead body 's face turned severely black ears completely blue . poisoned ?,"considering sam tarly 's weakness dangers 's faced relative dead characters , dead ?",0,0.0,0.0,64,0.8260869565217391
325029,mun sessions interesting ?,pm modi fly japan banning rs . 500 1000 notes ?,0,0.0,0.0,38,0.6285714285714286
325030,sell car ?,easiest way sell car ?,0,0.0,0.0,12,0.8
325031,find gmail accounts ?,get list gmail addresses ?,1,0.0,0.0,14,0.7407407407407407
325032,diabetics consume orange sweet lime ?,sweet foods diabetic eat ?,0,0.0,0.0,27,0.7741935483870968
325033,udemy courses worth taking learn code ? 's money would put ?,would literary course udemy worth making ?,0,0.0,0.08333333333333337,45,0.9523809523809523
325034,'s like snapchat influencer ?,snapchat ?,0,0.0,0.0,19,0.6923076923076923
325035,"hillary clinton ’ health , affect democratic party us presidential elections ?",pneumonia affect hillary clinton health perspective ?,0,0.0,0.0,56,0.9
325036,agriculture : want good agriculturist . possible ?,agricultural engineer good prospects usa ?,0,0.05489604938211609,0.0,29,0.8888888888888888
325037,trust someone use meth ?,trust people using crystal meth ?,1,0.0,0.0,15,0.7586206896551724
325038,literally fastest way make money ?,fastest way make money legally ?,0,0.0,0.0,18,0.9032258064516129
325039,cope studies pressure anxiety ?,cope anxiety ?,0,0.0,0.0,17,0.8571428571428571
325040,example sentence word `` terse '' ?,example sentence using word `` '' ?,0,0.0,0.0,12,0.9230769230769231
325041,best brand suits gives english attire ?,famous brand men 's suit ?,0,0.0,0.0,27,0.75
325042,one become emotionally mentally strong life ?,way become mentally stable strong ?,1,0.0,0.0,19,0.9090909090909091
325043,much 100w light bulb change temperature room ?,replace 100w bulb resister reduce ?,0,0.0,0.0,30,0.8108108108108109
325044,hillary clinton trigger ww3 ?,indication hillary clinton start major war ?,1,0.0,0.0,21,0.7878787878787878
325045,girl women sensitive age ?,women sensitive regarding age ?,1,0.0,0.0,15,0.9333333333333333
325046,corporate culture like masonite international ? culture different companies ?,corporate culture like service corporation international ? culture different companies ?,0,0.0,0.0,17,0.972972972972973
325047,annie clark st. vincent pansexual ?,annie erin clark st. vincent pansexual ?,1,0.0,0.0,5,1.0
325048,richest african ?,richest countries africa ?,0,0.0,0.0,11,0.9230769230769231
325049,accent colors go well black red color scheme ?,colors go gold ?,0,0.0,0.0,32,0.6666666666666666
325050,getting calls random numbers lately . reply calling ?,getting calls number showing ?,0,0.0,0.0,27,0.8421052631578947
325051,increase productive study time ?,increase studying time ?,0,0.0,0.0,14,0.875
325052,write program python convert integer one base another ?,"chrome written c++ , assembly python . able write three different languages come one product ? method used merge programming languages create software ?",0,0.0,0.0,112,0.8181818181818182
325053,possible vulkan game engine running older hardware without rewriting rendering parts opengl manually ?,possible run pc without rom bios chip ?,0,0.0,0.0,73,0.8205128205128205
325054,fastest ways increase height ?,could increase height ?,1,0.0,0.0,12,0.7741935483870968
325055,knowledge one create operating system ?,create operating system ?,1,0.0,0.0,14,0.8823529411764706
325056,"startups india using amazon 's ec2/s3 services ? hosting solutions like fast , reliable webapp primarily meant indian users ?",best cloud service providers available india ? something equivalent amazon 's ec2 ?,0,0.02651152410287147,0.0625,92,0.8518518518518519
325057,quora remove questions ?,quora remove questions ?,0,0.0,0.0,0,1.0
325058,favourite non-fiction author ?,favourite non-fiction author ?,1,0.0,0.0,0,1.0
325059,"one evaluate [ math ] \cos { \theta } +\sec { \theta } [ /math ] , given [ math ] 4\cos^2 { \theta } +4\sec^2 { \theta } =5 [ /math ] ?",evaluate cosθ+secθ given 4cos²θ+4sec²θ=5 ?,1,0.0,0.0,99,0.7346938775510204
325060,scope mechanical engineering usa ?,scope mechanical engineer sales sector ?,0,0.0,0.0,12,0.9375
325061,best phones 20000 ?,smartphones : best phone buy 10k rupees ?,0,0.0,0.07692307692307687,27,0.7096774193548387
325062,universe big bang ?,matter exist big bang ?,1,0.0,0.0,9,0.8
325063,true 80 % science mentioned quran true ?,"trued prophet , muhammad , encouraged followers rape captured woman front husbands sexual relationship nine year old girl ?",0,0.0,0.0,97,0.6666666666666666
325064,best storage cleaner app windows phone ?,best music app windows phone ?,0,0.0,0.08333333333333337,14,0.8571428571428571
