id,question1,question2,is_duplicate,CosineSimilarity,JaccardSimilarity,Levenshtein,DiceSimilarity
139052,best ways massage leg long rides ?,fruit would consider like hourglass body shape ?,0,0.15924637375917106,0.0,32,0.8205128205128205
139053,gary johnson going debating 2016 presidential debates ?,"gary johnson polling 11 % , likely 2016 presidential debates ?",1,0.0,0.0,15,0.9361702127659575
139054,give impressive self-introduction ?,said make introduction impressive ?,0,0.0,0.0,28,0.8333333333333334
139055,best natural treatments acid reflux ?,ways manage acid reflux ?,0,0.0,0.0,19,0.8571428571428571
139056,things new employees know going first day general communications ?,things new employees know going first day general cable ?,0,0.0,0.0,12,0.9545454545454546
139057,petrol stored petrol pump ? much petrol petrol pump store average ?,much money needed set petrol pump ?,0,0.0,0.0,45,0.8484848484848485
139058,someone get depression ?,one get depression ?,0,0.0,0.0,4,0.96
139059,verified profile quora ?,take verified quora ?,1,0.0,0.0,12,0.8571428571428571
139060,everyone `` genius '' ? could ?,genius ?,0,0.0,0.0,23,0.64
139061,salt used washing soap ?,anti-caking agent easily available use common salt prevent wetness using sprinkler ?,0,0.0,0.0,67,0.7368421052631579
139062,rules regulations visiting inmate valdosta prison compare prisons alabama ?,rules regulations visiting inmate valdosta prison compare prisons georgia ?,0,0.0,0.0,6,0.972972972972973
139063,'s best birthday present ?,best birthday present someone ever given ?,0,0.0,0.0,22,0.8484848484848485
139064,see viewed instagram ?,know view instagram ?,1,0.0,0.0,6,0.896551724137931
139065,convert mp3 file midi file ?,would convert mp3 file .dat file ?,0,0.0,0.0,10,0.8888888888888888
139066,ca final exams nov 16. plan studies ? also ind-as applicable exams ?,shall prepare ca final nov 16 exams,1,0.0,0.0,50,0.7804878048780488
139067,ca n improve communication skill ?,improve communication skills ?,1,0.0,0.0,6,1.0
139068,someone panic attack ?,panic attack ?,0,0.0,0.0,8,0.8181818181818182
139069,parts plant cell ?,definition plant cell ?,0,0.0,0.0,9,0.75
139070,find man used email account social sites ?,find man used email account dating sites ?,1,0.0,0.0,5,0.967741935483871
139071,saltwater taffy candy imported italy ?,saltwater taffy candy imported mongolia ?,1,0.0,0.0,7,0.972972972972973
139072,highest-paying countries mechanical engineers ?,highest paying mechanical engineering job india ?,0,0.0,0.0,24,0.8717948717948718
139073,o+ blood group universal donor ?,donors people o-ve blood group ?,0,0.0,0.0,25,0.875
139074,investors right invest country want ?,searching algorithms prefer ?,0,0.0,0.0,29,0.7647058823529411
139075,best camera phone ?,mobile best camera ?,1,0.0,0.0,13,0.8148148148148148
139076,get job product based company india ?,get job product based company ?,0,0.0,0.0,6,0.972972972972973
139077,tofind caste dead girl ?,know caste dead girl ?,1,0.0,0.0,6,0.9032258064516129
139078,difference ssc hsc ?,difference hsc board cbse syllabus ?,0,0.0,0.0,19,0.7857142857142857
139079,"shop one looking box , leave money box forego paying ?",hate job ?,0,0.0,0.0,46,0.4666666666666667
139080,difference infatuation `` real love '' ?,difference infatuation love ? mean focusing good side person ?,1,0.0,0.0,30,0.8333333333333334
139081,ancient khmer empire scientifically tested ?,ancient civilizations scientifically tested ?,1,0.0,0.0,12,0.7647058823529411
139082,learn ask right questions ?,ask right questions ?,1,0.0,0.0,6,0.967741935483871
139083,best book learn python ?,best beginner friendly book python ?,1,0.0,0.0,18,0.8484848484848485
139084,canada use maple leaf flag ?,maple leaf canadian flag ?,1,0.0,0.0,17,0.8888888888888888
139085,song `` cheer sleepy jean '' ?,u2 song `` one '' ?,0,0.0,0.0,19,0.6428571428571429
139086,"examples carnivore , herbivore , omnivore animals ?",examples carnivores omnivores ?,0,0.0,0.0,21,0.9090909090909091
139087,get pregnant 16 days period ?,get pregnant 14 days period started ?,1,0.0,0.0,9,0.9375
139088,'s good moveset rockruff pokemon sun moon ?,team pokemon sun moon ?,0,0.0,0.0,23,0.7333333333333333
139089,unhide people searched instagram ?,unblock someone instagram search ?,0,0.0,0.0,23,0.8888888888888888
139090,user friendly efficient project management software ?,user-friendly efficient project management software ?,1,0.0,0.0,1,0.9767441860465116
139091,"guy stares eyes , follows , tries near , copies body language , feelings ?","guy lives nearby keeps staring , smiling making eye contact . like ?",0,0.0,0.0,52,0.8372093023255814
139092,prepare ssc chsl exam ?,prepare ssc chsl ?,1,0.0,0.0,5,0.9090909090909091
139093,multiple sclerosis contagious ?,contagious multiple sclerosis ?,1,0.0,0.0,22,1.0
139094,"failed get medical college year . studied allen , kota last year . drop another year . go back kota study home ?",study plans mbbs 1st year ?,0,0.0,0.0,94,0.75
139095,"major effects cambodia earthquake , effects compare rat islands earthquake 1965 ?","major effects cambodia earthquake , effects compare arica earthquake 1868 ?",1,0.0,0.0,10,0.9019607843137255
139096,like sibling ?,'s like sibling ?,1,0.0,0.0,3,0.9523809523809523
139097,make suicide look like accident ?,die make look like accident ?,1,0.0,0.0,9,0.9285714285714286
139098,quickbooks installation support phone number ?,quickbooks hosting support number ?,1,0.0,0.0,15,0.918918918918919
139099,scholarship ?,aisee scholarship ?,0,0.0,0.0,6,0.9565217391304348
139100,negative views obama 's presidency dampen prospects similarly aspiring african-americans ?,"african american president , barack obama helped harmed racial divide u.s. ? please site specifics make case .",0,0.0,0.0,82,0.782608695652174
139101,prep jet lag ?,prevent jet lag ?,1,0.0,0.0,4,0.9090909090909091
139102,'s really west westeros ?,'s west westeros ?,1,0.0,0.0,7,0.8571428571428571
139103,good technique score high pte ?,good online tutorials pte ?,1,0.0,0.0,16,0.8387096774193549
139104,agni 5 missile tested range ?,"executing tests missiles , ( recent indian agni 5 missile 5000 kms range ) manage range missile could reach ?",0,0.0,0.0,84,0.7368421052631579
139105,study want become ceo ?,degree finish become ceo ?,1,0.0,0.0,11,0.6666666666666666
139106,write computer game featuring real person main character ?,computer games jimmy wales play ?,0,0.0,0.0,36,0.8648648648648649
139107,coding grow time ?,love grow time ?,0,0.0,0.0,5,0.8
139108,protect inside car disaster occurs ?,fix pain occured upright weight lifting wrist ?,0,0.0,0.0,37,0.8235294117647058
139109,class 12 marks matter iit ?,board marks 12 class count jee 2018 ?,0,0.0,0.0,24,0.7428571428571429
139110,"dogs scratch floor , even concrete ones ?",animals : male dog lift leg urinate ?,0,0.0,0.0,34,0.7647058823529411
139111,would $ 20 trillion ?,would eat poop 1 trillion dollar ?,0,0.0,0.0,16,0.7586206896551724
139112,nosql ?,nosql movement ?,0,0.0,0.0,9,0.7777777777777778
139113,'m american citizen . help niece get us citizenship ?,'m us citizen . help niece get green card faster ?,1,0.0,0.0,22,0.95
139114,n't question answered quora ?,n't everyone ask answer question answer quora ?,1,0.0,0.0,22,0.875
139115,someone blocked number see call ?,blocked number see missed calls ?,1,0.0,0.0,16,0.967741935483871
139116,hamsters eat cucumber ?,hamsters eat strawberries ?,1,0.0,0.0,9,0.8333333333333334
139117,whatsapp : getting blue tick marks one contact whatsapp . 's reason ?,'ve sent message friend whatsapp day ago recently saw online still n't get blue ticks . could reason ?,0,0.0,0.0,70,0.8979591836734694
139118,tourist attractions scandinavian highlands compare attractions france ?,tourist attractions scandinavian highlands compare attractions ireland ?,0,0.0,0.0,5,0.9743589743589743
139119,go google summer code ?,get entry google summer code contest ?,1,0.0,0.0,16,0.8888888888888888
139120,best dating site require registration credit card number ?,become paid member online dating sites without credit card ?,0,0.0,0.0,40,0.8648648648648649
139121,-log ( x ) equal log ( 1/x ) ?,things conservative would never say ?,0,0.0,0.0,28,0.47058823529411764
139122,much data youtube video consume ?,mobiles laptops consume amount data watching youtube video 360p quality ?,0,0.0,0.0,48,0.8095238095238095
139123,"best wifi-enabled places work ( cafes , libraries , etc . ) montreal ?","'s best public places super high speed wi-fi work ( cafes , libraries , etc . ) montreal ?",1,0.10829847069258643,0.0,34,0.9230769230769231
139124,mercedes discontinue sls amg ?,mercedes stop making sls amg ?,1,0.0,0.0,10,0.9090909090909091
139125,basic difference 2g 3g ?,difference 3g & 4g ?,1,0.0,0.0,10,0.7857142857142857
139126,age travel speed light ?,light travel faster light 's speed ?,0,0.0,0.0,18,0.9333333333333333
139127,unexpected things first-time visitors moldova notice ?,unexpected things first-time visitors canada notice ?,0,0.0,0.0,6,0.9767441860465116
139128,india changing modi government ?,india really changing pm modi ?,0,0.0,0.0,20,0.8387096774193549
139129,"boarding flight , face problems name ticket n't fully match id proof ?",passport first name last name . last name mandatory online flight booking sites . put name booking tickets domestic flights us ?,0,0.0,0.0,98,0.9361702127659575
139130,naturally curly hair ?,cut curly hair ?,0,0.0,0.0,8,0.9565217391304348
139131,fashion designers showcase clothes accessories never see anyone wearing . make ?,point fashion shows people hardly ever seen wearing clothes ?,0,0.0,0.0,44,0.9047619047619048
139132,depression ?,depression ?,1,0.0,0.0,0,1.0
139133,"shutterfly ship uk ? , shipping rates ?","shutterfly , company currently taking huge losses , gives away money marketing strategy retail investors n't get tax deductions company invested giving away money ?",0,0.0,0.0,133,0.8181818181818182
139134,quora degrading ?,quora degrading ?,1,0.0,0.0,0,1.0
139135,favourite anime favourite ?,favourite animal ( ) ?,0,0.0,0.0,10,0.896551724137931
139136,cell nucleus need double membrane ?,"cells cell membrane ? , ?",0,0.0,0.0,20,0.8461538461538461
139137,would world like everyone nice ?,"would happen everyone earth becomes nice , good , caring honest ?",0,0.0,0.0,46,0.7368421052631579
139138,advertise youtube video without paying monetize . mean adsense ?,block advertisements come along google youtube pages ?,0,0.0,0.0,45,0.8372093023255814
139139,pages automatically got liked facebook account . avoid ?,convert facebook personal profile fan page ?,0,0.0,0.0,44,0.85
139140,4. figure ’ good ?,figure 'm good ?,1,0.0,0.0,5,0.8
139141,11:11 mean snapchat terms ?,importance 11:11 ?,0,0.0,0.0,21,0.8571428571428571
139142,"einstein mean said : `` science without religion lame , religion without science blind '' ? agree ?",one believe science religion time ?,0,0.0,0.0,71,0.7368421052631579
139143,dog lick bed ?,dogs lick ?,0,0.0,0.0,5,0.8571428571428571
139144,w.c.a.i.c . stand ?,++ stands c++ ?,0,0.0,0.0,16,0.8
139145,post question quora ?,post question quora ?,1,0.0,0.0,0,1.0
139146,able make websites lose net neutrality ?,people still able websites net neutrality ?,1,0.0,0.0,17,0.9090909090909091
139147,"god forbid happens ; trump/hillary die pull race , happens ?","best deodrant nike among - ride , urban musk , control , party . @ rajivsheth ?",0,0.0,0.0,61,0.8235294117647058
139148,binocular vision ? important ?,binocular vision ?,1,0.0,0.0,12,0.896551724137931
139149,like music ?,like music ?,0,0.0,0.0,0,1.0
139150,jobs involve bit adventure ?,jobs involve adventure ?,0,0.0,0.0,4,1.0
139151,donald trump start nuclear war ?,afraid donald trump start nuclear war ?,1,0.0,0.0,7,0.9411764705882353
139152,come know today app founder 1more startup base ai nlp shifting uk tomorrow ?,bag sweets contain mints & toffees . 21 mints bag . one quarter sweets toffees . calculate total sweets ?,0,0.0,0.0,79,0.8085106382978723
139153,dissolve table salt water ?,berocca dissolve water ?,0,0.0,0.0,16,0.9655172413793104
139154,parliamentary sovereignty ? immune judicial review ?,review judicial review ?,0,0.0,0.0,30,0.7647058823529411
139155,famous musically ?,become famous musically ?,1,0.0,0.0,7,0.9230769230769231
139156,"mean passport police verification initiated request sent sp office , district south delhi . ?",getting status `` police verification report clear application review regional passport office '' 1 month . ?,0,0.0,0.0,67,0.8260869565217391
139157,develop thinking ability ?,strenghten brain thinking ability ?,1,0.0,0.0,14,0.8125
139158,'m 23 years old . possibility become professional soccer player ? players age older became great footballer ?,"'m 16 georgia , worked , could chance become professional soccer player ?",0,0.0,0.0,69,0.7755102040816326
139159,one thing want die ?,one thing want die ?,1,0.0,0.0,0,1.0
139160,"aviation logistics issues : basic difference boeing airbus aircraft , pilot 's point view ?",difference boeing airbus ?,1,0.0,0.0,65,0.7894736842105263
139161,best ways get free upgrades flights ?,get free upgrades flights ?,1,0.0,0.0,10,0.9090909090909091
139162,google play app review time affected manual reviews ?,remove bad review app google play store ?,0,0.0,0.0,34,0.8717948717948718
139163,communication ?,communication ?,1,0.0,0.0,0,1.0
139164,best memes ?,best memes girls ?,0,0.0,0.0,6,0.7777777777777778
139165,download speed decrease upload set minimum torrent ?,upload speed affect downloading speed utorrent ?,1,0.0,0.0,27,0.9142857142857143
139166,would happen euro collapsed ?,happen euro collapses ?,1,0.0,0.0,7,0.9285714285714286
139167,"delhi , mumbai bengaluru world class cities ?",brilliant idea delhi dialogue initiative make delhi world class city ?,0,0.0,0.0,43,0.9047619047619048
139168,late study medicine become doctor ?,late go medical school 24 ?,1,0.0,0.0,19,0.7272727272727273
139169,recommended daily calorific value dieting men ?,"could major `` game chicken '' type , dangerous standup two states early trump ' presidency ?",0,0.0,0.0,73,0.7441860465116279
139170,recommend good book design ?,recommend good book ?,0,0.0,0.0,7,0.9230769230769231
139171,rebut ben shapiro 's opinion black lives matter ?,many riots started black lives matter ?,0,0.0,0.0,23,0.8421052631578947
139172,"sahara , average temperatures compare ones great basin desert ?","sahara , average temperatures compare ones chihuahuan desert ?",1,0.0,0.0,10,0.9743589743589743
139173,advantages disadvantages e-ticketing ?,disadvantages e-ticketing ?,1,0.0,0.0,11,1.0
139174,dogs know difference hand petting foot petting ?,humans know dogs like eat produce pets ' food ?,0,0.0,0.0,33,0.9
139175,get better writing song lyrics ?,write song lyrics ?,1,0.0,0.0,14,0.9655172413793104
139176,apple hire international students software engineering internships positions ? hire mena ?,tumblr hire software engineering interns ?,0,0.0,0.0,54,0.918918918918919
139177,one cope eventually overcome social anxiety disorder ?,overcome social anxiety ?,1,0.0,0.0,29,0.9142857142857143
139178,approach guy like ?,approach guy like ?,1,0.0,0.0,0,1.0
139179,make 1000 $ per day online ?,make $ 1000 day online ?,1,0.0,0.0,8,0.9375
139180,treat bug bites lips ?,get bug bites eyelids ? treated ?,0,0.0,0.0,17,0.8888888888888888
139181,failure story ?,failure stories ?,1,0.0,0.0,3,0.96
139182,president obama pardon hillary clinton election ?,[ pre-election ] president obama pardon hillary clinton leaving office ?,0,0.0,0.0,28,0.8571428571428571
139183,reliance jio tariff really cheap ?,reliance jio tariff plans costly india ? reliance jio really beat cheap local broadbands ?,0,0.0,0.0,56,0.9142857142857143
139184,explain difference neft/rtgs/imps ?,open first bank account ?,0,0.0,0.0,27,0.7058823529411765
139185,improve life ?,way improve life ?,1,0.0,0.0,4,0.88
139186,meant generic web page exactly ?,good web page publisher ?,0,0.0,0.0,21,0.6666666666666666
139187,take screenshot pc ?,take screenshot computer screen ?,1,0.0,0.0,13,0.9285714285714286
139188,temperature related density ?,nice ideas prom entrance ?,0,0.0,0.0,23,0.8275862068965517
139189,much money equity donald trump 's father lend give ?,love girl say friend adding ready even date . ?,0,0.0,0.0,41,0.8
139190,"view arvind kejriwal gst bill , never seen comments issue ?",disaster relief fund distributed ?,0,0.0,0.0,46,0.7222222222222222
139191,best way learn math ? learn math effectively ?,best way learn mathematics ?,1,0.0,0.0,20,0.9411764705882353
139192,cat b.tech mechanical engineering useful ?,best field earning money completing b.tech mechanical engineering ?,1,0.0,0.0,40,0.8717948717948718
139193,julian aassange ever free ?,'s julian assange ?,0,0.0,0.0,14,0.8461538461538461
139194,self enlightenment ?,enlightenment ?,0,0.0,0.0,5,0.9090909090909091
139195,julian assange want donald trump president ?,wants donald trump president ?,0,0.0,0.0,16,0.9411764705882353
139196,remove windows 8 `` watermark '' ?,remove watermark dvd ?,0,0.0,0.0,16,0.8
139197,libertarianism fall apart 's proved majority citizens willing sacrifice freedom safety ?,drives libertarians champion freedom ultimate sovereign value possible values must submit ? logic ?,0,0.0,0.0,74,0.8444444444444444
139198,disadvantages behind circumcision ?,benefits circumcision ?,0,0.0,0.0,17,0.8125
139199,percentage terrorists muslim ?,"percentage world 's terrorists muslim , reasons phenomenon ?",1,0.0,0.0,30,0.8648648648648649
139200,possible get upgraded ece cse jiit sec128 ?,sunni muslims feel iranian thugs killing sunni women chidren syria iraq ?,0,0.0,0.0,58,0.6666666666666666
139201,civil liberties president lincoln suspend civil war ?,civil liberties president lincoln violate ?,1,0.0,0.0,15,0.9411764705882353
139202,would win fight : james bond jason bourne ?,would win fight jason bourne james bond ?,1,0.0,0.0,14,0.975609756097561
139203,ready reckoner rate dombivali ?,custom duty rate import ready made garments india ?,0,0.0,0.0,36,0.7647058823529411
139204,review 22 jump street ( 2014 movie ) ?,review 21 jump street ( 2012 movie ) ?,0,0.0,0.0,2,0.9743589743589743
139205,"masturbation cause vicious cycle reducing penis sensitivity , makes one masturbate longer harder reach orgasm , reduces penis sensitivity ?",possible reduce size penis ?,0,0.0,0.0,115,0.7368421052631579
139206,one figure purpose ?,figure purpose ?,1,0.0,0.0,4,0.9565217391304348
139207,recreational drugs : baking soda clean system methamphetamine ?,baking soda clean marajauan system ?,0,0.0,0.0,41,0.9047619047619048
139208,favorite batman movie ?,favourite batman movie ?,1,0.0,0.0,1,0.9629629629629629
139209,time machine ever invented ?,someone invent time machine ?,0,0.0,0.0,21,0.8461538461538461
139210,better company bras : jockey body care ?,"company better fresher , tcs uhg ?",0,0.0,0.0,27,0.7567567567567568
139211,"anchoring someone sit-ups ( ie . holding ankles ) , also expected count sit-ups ?",would cause someone feel though `` head spinning '' woken sleep ( without sitting standing ) ?,0,0.0,0.0,67,0.8163265306122449
139212,recently completed engineering electronics communication.how make carrier telecom sector ?,pursue computer science engineering masters bachelors degree electronics communication engineering ?,0,0.0,0.0,70,0.8780487804878049
139213,difference politics political science specialization international relation ?,different political political science ?,0,0.0,0.0,42,0.967741935483871
139214,common questions asked interview ?,common interview questions asked internships ?,0,0.0,0.0,15,0.9473684210526315
139215,electricity-generating windmills shut part time ? produce power grid handle ?,lights go rains ? government shut power supply ?,0,0.0,0.0,52,0.9
139216,coolest thing buy rs 3000 india ?,lcd/led best buy around 25k india ?,0,0.0,0.0,19,0.8
139217,would china declare war india india ever attacked pakistan first ? santhosh kumar,would china declare war india india ever attacked pakistan first ?,1,0.0,0.0,15,0.975609756097561
139218,good emacs color themes use ?,put color theory good use ? artists use ?,0,0.0,0.0,27,0.875
139219,deleted,get online pdf epub versions books ?,0,0.0,0.0,32,0.36363636363636365
139220,increase iq level ?,increase iq ?,1,0.0,0.0,6,0.9090909090909091
139221,holocaust plausible ?,holocaust ?,0,0.0,0.0,10,0.8333333333333334
139222,'ashoka chakra ' indian flag 24 spokes ?,people tend forget ashoka chakra indian national flag ?,0,0.0,0.0,34,0.8947368421052632
139223,learning thoughtbot 's upcase.com worth want land job ror development ?,developer office want learn opp concept online . possible well continue job ?,0,0.0,0.0,63,0.8888888888888888
139224,catholics : stop watching internet porn ?,stop watching porn ?,1,0.0,0.0,21,0.9032258064516129
139225,hibernate like movie passengers age travel another planet ?,humans hibernate like movie passengers age ?,1,0.0,0.0,29,0.972972972972973
139226,equivalent indian shoe size uk size 8 ?,trying buy men running shoes woman . woman eu 40. equivalent men eu size ?,0,0.0,0.0,55,0.7142857142857143
139227,like girls bare feet ?,find girls bare feet attractive ?,1,0.0,0.0,14,0.8275862068965517
139228,lose belly fat month without going gym ?,lose belly fat right diet month ?,0,0.0,0.0,17,0.8888888888888888
139229,good $ 400 gaming pc build wifi ?,best $ 400 gaming pc build ?,0,0.0,0.0,9,0.8421052631578947
139230,sunroof close automatically lock car ?,car lock stuck locked ?,0,0.0,0.0,24,0.8
139231,relief valve centrifugal pump ?,centrifugal pump ?,0,0.0,0.0,13,0.967741935483871
139232,"caste system eradicated india ? , ?",ideas eradication caste system india ?,1,0.0,0.0,27,0.9285714285714286
139233,philippines becoming one attractive places world invest implements independent foreign policy ?,best tourist spot philippines ?,0,0.0,0.0,78,0.7222222222222222
139234,gift someone something flipkart without invoice bill delivery box mention thing inside ?,"bad things flipkart today ( early 2016 ) ? competing amazon ( price , service , delivery , etc. ) ? changed last year ?",0,0.0,0.0,84,0.7857142857142857
139235,us colleges accept ielts ?,us universities accept ielts ?,1,0.0,0.0,9,0.8148148148148148
139236,men want sex women ?,women biologically programmed think sex less men ?,1,0.0,0.0,34,0.6666666666666666
139237,treat eyelid ulcer ?,treat ulcer eyelid ?,1,0.0,0.0,11,1.0
139238,study get 150+ mh-cet 2017 engineering ( pcm ) ?,reappear mh cet 2017 first year engineering ?,0,0.0,0.0,32,0.8
139239,think positively ?,help think positive ?,1,0.0,0.0,7,0.9629629629629629
139240,hillary clinton really want start war russia ?,would hillary clinton start world war iii / war russia ?,1,0.0,0.0,22,0.9090909090909091
139241,'s best one-player card game ?,best three-player card games ?,0,0.0,0.0,8,0.8888888888888888
139242,blow-dry curly hair straight ?,blow-dry hair straight ?,0,0.0,0.0,6,0.9411764705882353
139243,way copy downloaded magazines jiomags devices ?,"online journalism : newspapers/magazines get international articles , buy others `` copy/steal '' ?",0,0.0,0.0,74,0.7391304347826086
139244,'s like work mechanical engineer car company ? career ?,mechanical engineer work software company like tcs pursue masters abroad mechanical later ?,0,0.14935423745862494,0.0,63,0.8571428571428571
139245,like live hyderabad alone ?,like live hyderabad ?,1,0.0,0.0,6,0.9285714285714286
139246,responsible demolition babri masjid ?,"responsible babri masjid demolition : hindus , muslims , dirty politics ?",1,0.0,0.0,43,0.8421052631578947
139247,"property tax rate granville , ohio ? compared one california ?","property tax rate granville , ohio ? compared one alaska ?",0,0.0,0.0,7,0.9302325581395349
139248,many blackheads nose ? get rid ?,get rid blackheads nose ?,1,0.0,0.0,17,0.9444444444444444
139249,good deeds could ?,get good deeds ?,0,0.0,0.0,10,0.7777777777777778
139250,saltwater taffy candy imported hong kong ?,saltwater taffy candy imported czech republic ?,1,0.0,0.0,13,0.8837209302325582
139251,guys know boner ?,escorts feel nervous know good-looking client ?,0,0.0,0.0,35,0.6875
139252,happen fell black hole ?,would happen person went black hole ?,1,0.0,0.0,16,0.7741935483870968
139253,type motor used ceiling fan ? ceiling fan work ?,often ceiling fans fall ?,0,0.08624906628331461,0.0,29,0.7647058823529411
139254,difference marketing strategy marketing plan ?,difference marketing strategy marketing tactics ?,1,0.0,0.0,7,0.9411764705882353
139255,’ us declare war north korea ?,us declares war russia north korea ?,0,0.0,0.0,10,0.9411764705882353
139256,would quickly learn language ?,best methods learn language ?,1,0.0,0.0,12,0.6666666666666666
139257,individuals events history source pride lithuania ?,individuals events history source pride germany ?,0,0.0,0.0,7,0.9473684210526315
139258,reviews www.cosmicpetrochem.com ?,review www.buttermyresume.com ?,0,0.0,0.0,15,0.8387096774193549
139259,best free silico pcr program web ?,pros cons pcr techniques ?,0,0.0,0.0,24,0.6451612903225806
139260,get meth system 2 days ?,"long take meth get system 'm 6 ' 0 , 155 lb 17 years old ?",1,0.0,0.09090909090909094,38,0.6111111111111112
139261,12th marks affect ms studies ?,infosys consider 12th aggregate 12th pcm marks ?,0,0.0,0.0,37,0.8421052631578947
139262,path cleared cumberland gap became highway west ?,might total budget travelling india singapore via road journey back newly opened highway ?,0,0.0,0.0,67,0.9090909090909091
139263,describe bit logical instructions format example using ? relation microcontroller application ?,"describe data moving instructions format , example using ? relation microcontroller application ?",0,0.0,0.0,10,0.9523809523809523
139264,newton 's rings circular shape ? square shape ?,circular ring pattern obtained newton 's ring method ?,0,0.0,0.0,42,0.9
139265,best books prepare ssb ?,best books prepare iit jam physics exam ?,0,0.0,0.0,18,0.7586206896551724
