id,question1,question2,is_duplicate,CosineSimilarity,JaccardSimilarity,Levenshtein,DiceSimilarity
326958,apple earn money ipod itunes ?,ca n't get music shared itunes library ipod ?,0,0.0,0.0,31,0.8648648648648649
326959,like manage technical engineering team indonesia ?,"kind masters degree engineers , want leave purely technical field , go management , policy making analysis jobs ?",0,0.0,0.0,81,0.7906976744186046
326960,cancel tickets paytm ?,file tdr tickets booked paytm ?,0,0.0,0.0,15,0.8125
326961,scope green building technology low carbon building designs india ?,want design build home india . pros cons compared buying pre-built house ?,0,0.03225027438224614,0.0,52,0.9302325581395349
326962,keep flies away head walking ?,walk away imagination gather closer enjoy ?,0,0.0,0.0,34,0.7428571428571429
326963,find episode game show contestant ?,situation use em algorithm find probability ?,0,0.0,0.0,35,0.8108108108108109
326964,google ever hired anybody 40 years old software engineer ?,level software engineer google would someone worked 4 years government engineer ?,0,0.0,0.0625,52,0.8571428571428571
326965,happens slack competitors ? ?,use slack multiple teams/projects ?,0,0.0,0.0,25,0.8484848484848485
326966,life precious ?,precious life ?,0,0.0,0.0,10,1.0
326967,lead bank india ?,lead bank ?,1,0.07080968275830378,0.0,6,0.9473684210526315
326968,powerful darth sidious defeated maul savage opress ?,one tell much salary tcs-assistant consultant developer chennai ?,0,0.0,0.0,48,0.8205128205128205
326969,think people looking things phone interviews ?,people see 'm looking phone ?,0,0.0,0.0,29,0.8
326970,many devices one netflix account simultaneously stream ?,netflix still use aws streaming ?,0,0.0,0.0,38,0.8
326971,aishwarya rai marry abhishek bachchan ?,"movies like sarkar guru , abhishek bachchan stop definitive cinema ?",0,0.0,0.0,42,0.6842105263157895
326972,corporate culture like premier ? culture different companies ?,corporate culture like sears ? culture different companies ?,0,0.0,0.0,6,1.0
326973,best way give powerpoint presentation ?,make good powerpoint presentation ?,1,0.0,0.0,11,0.8125
326974,much charge design shirt graphic designer ?,charge graphic design services ?,0,0.0,0.0,25,0.8666666666666667
326975,tcs ?,tcs values ?,0,0.0,0.0,7,0.6666666666666666
326976,cool things excel ?,cool things c++ ?,0,0.0,0.0,4,0.88
326977,逆天 mean ?,'s meaning “ 高级黑 ” ?,0,0.0,0.0,13,0.5217391304347826
326978,good would laptop gaming ?,laptop good gaming ?,0,0.06719173681864576,0.0,14,0.9230769230769231
326979,buy-back shares ?,buy-back shares mean ?,1,0.0,0.0,5,0.9285714285714286
326980,pencils use sketching ?,kind pencils brand pencils use sketching ?,0,0.0,0.0,19,0.875
326981,chances getting pregnant 3 days period ?,u get pregnant day period ends ?,1,0.0,0.0,19,0.875
326982,apple going discontinue macbook air ?,apple update macbook air discontinue ?,1,0.13062761905221518,0.0,26,0.972972972972973
326983,vertebrates invertebrates ? examples ?,examples invertebrates ?,0,0.0,0.0,19,1.0
326984,coolest charismatic russian athletes going sochi ?,coolest charismatic chinese athletes going sochi ?,0,0.0,0.0,7,0.967741935483871
326985,much uncharted 4 cost make ?,much would cost family 4 live bangalore ?,0,0.0,0.07692307692307687,25,0.7692307692307693
326986,amg means mercedes benz cars ?,"car better , bmw mercedes benz ?",0,0.0,0.0,19,0.8571428571428571
326987,fastest superhero ever ?,batman greatest superhero times ?,0,0.0,0.0,14,0.7586206896551724
326988,difference kenyon gyro 3 axis gimbal ? gives better stability ?,much frustated choosing it.i focusing programming cant.what ?,0,0.0,0.0,55,0.7142857142857143
326989,hp laptops worth buying ?,hp laptops ?,1,0.0,0.0,13,0.6923076923076923
326990,much equity offer technical co-founder ?,much equity offer technical co founder ?,1,0.0,0.0,1,0.972972972972973
326991,greatest tv ad history ?,n't books use ads tv ?,0,0.0,0.0,19,0.6428571428571429
326992,best gaming pc configuration 75k inr ?,best gaming pc configuration rs 75000 ?,1,0.0,0.08333333333333337,8,0.95
326993,would leidenfrost effect help explain spontaneous arousal thin repulsive layer air around hot nickel ball ?,"legal charges , , brought alfred p. baldasaro suggestion hillary shot firing squad `` treason '' ?",0,0.07204918532771297,0.0,84,0.7916666666666666
326994,universal grammar principles parameters languages ?,principles grammar ?,0,0.0,0.0,34,0.896551724137931
326995,view someones 's private instagram pictures ?,view someone 's private instagram pictures ?,1,0.0,0.0,1,1.0
326996,best way get girl like ?,get girl like back ?,1,0.0,0.0,14,0.8461538461538461
326997,`` mother 's maiden name '' mean ?,applying passport gave wife 's surname mine maiden surname marriage certificate . create problem ?,0,0.0,0.0,73,0.6666666666666666
326998,"possible make 3g android phone support 4g sim card network , provided rooted micro sim slot ?",possible use 4g sim 3g phone ?,0,0.0,0.0,69,0.7804878048780488
326999,contingent asset contingent liability ?,contingent asset ?,0,0.0,0.0,21,0.88
327000,man 5 times old son 2 years ago sum square ages 114 find age son ?,"father said son '' old time birth . '' father 's age 38 years , son 's age five years back ?",0,0.0,0.0,62,0.6666666666666666
327001,scope spagobi current data warehouse & bi world ?,main components data warehouse ?,0,0.0,0.0,28,0.8648648648648649
327002,could ssri done permanent damage brain ?,damage caused bpa exposure reversed ?,0,0.0,0.0,33,0.8235294117647058
327003,"send message instagram unsend , would person still see drop notifications bar ?","send dm instagram unsend person seen , would still see ?",0,0.0,0.0625,39,0.9230769230769231
327004,create website like freepostcodelottery.com ?,create website like logotournament.com ?,0,0.0,0.0,15,0.8205128205128205
327005,words stronger weapons ?,ways nuclear weapon powerful ordinary weapons . sends quivers apprehension backs people ?,0,0.0,0.0,72,0.6111111111111112
327006,download 8tracks playlist ?,come playlists 8tracks likes plays ?,0,0.0,0.0,21,0.8484848484848485
327007,remove glue laminate flooring ?,better float glue engineered wood floor ?,0,0.0,0.0,25,0.8387096774193549
327008,"lesser-known sights see visiting bragança paulista , brazil ?",associate director ey ?,0,0.0,0.0,48,0.5142857142857142
327009,implement mru technique cache management want recent data available cache fast access ?,ok clear data caches applications ?,0,0.0,0.0,68,0.7368421052631579
327010,think doctor strange ( movie ) good ?,review doctor strange ( 2016 movie ) ?,0,0.05861429916374467,0.0,15,0.8292682926829268
327011,tips getting higher scores scramble friends ?,word lists scramble friends words friends use ?,0,0.0,0.0,34,0.8648648648648649
327012,best inspiring moment life motivates every time life ?,inspiring moment life ?,1,0.0,0.0,31,0.875
327013,best pair studio monitors $ 220 ?,best pair studio monitors $ 450 ?,0,0.0,0.09090909090909094,2,0.918918918918919
327014,"10th grade , living central europe , want move us . crying every day hate live . ?",second year graduation n't like course life city ( delhi ) . return hometown join college ?,0,0.0,0.0,72,0.7843137254901961
327015,improve writing routine ?,ways improve writing ?,0,0.0,0.0,13,0.8666666666666667
327016,would someone use quora google instead ?,people use quora could easily find answer quick google search ?,1,0.0,0.0,40,0.7894736842105263
327017,smoking pregnant bad ? pregnancy unborn child affected smoking ? much smoking bad ?,adverse health implications smoking ?,0,0.0,0.0,62,0.8780487804878049
327018,biggest lie society taught believe ?,biggest lie 've ever led believe ?,1,0.0,0.0,13,0.6896551724137931
327019,best comedy movies youtube ?,best comedy movie find youtube ?,1,0.0,0.08333333333333337,5,0.9333333333333333
327020,google code-in ?,google code-in ?,1,0.0,0.0,0,1.0
327021,read someone 's whatsapp messages without access mobile phone ?,read friend 's whatsapp chat without taking phone ?,0,0.0,0.0,24,0.8780487804878049
327022,game thrones season 7 air india ?,release date games thrones s6 ?,0,0.19706202931185632,0.0,27,0.8666666666666667
327023,banning 500 1000 notes stop black money ?,replacing 1000 notes 2000 notes going stop corruption black money ?,1,0.0,0.0,32,0.9047619047619048
327024,country never colonized power ?,country never ruled occupied another country ?,1,0.0,0.0,22,0.8823529411764706
327025,ca n't ios calendar app set recurring event dates 'the first monday month ' ?,"disable notifications birthdays notification center ios 5 without disabling event notifications calendars ? , ?",0,0.0,0.0,80,0.8444444444444444
327026,adodb adodc visual basic 6.0 ?,create messaging service visual basic 6.0 ?,0,0.0,0.0,21,0.7647058823529411
327027,"expression `` liquor beer , 're clear . beer liquor , never sicker . '' true ?",'s `` beer liquor '' saying ? come ?,0,0.0,0.0,54,0.7619047619047619
327028,download video facebook android device ?,download videos xtape.com android phone ?,0,0.0,0.0,12,0.7222222222222222
327029,examples animals live water ?,examples animals living water ?,1,0.0,0.0,3,0.967741935483871
327030,went wrong polling 2016 us presidential election ?,predictions polls wrong results 2016 presidential election ?,1,0.0,0.0,24,1.0
327031,"novice writer , tips get beyond writer 's block ?",ways combat writer 's block ?,1,0.0,0.0,27,0.7894736842105263
327032,mean claim zero allowances w-4 ?,employer give w-9 form fill instead w-4 form ?,0,0.0,0.0,32,0.7368421052631579
327033,something ashamed proud ?,"ashamed , 're ?",0,0.0,0.0,15,0.6666666666666666
327034,revenge good justice good ?,revenge good ?,1,0.11285058038368098,0.0,13,0.75
327035,much money make driving hatchback part-time uber pune ?,always warnings cookies browsers ?,0,0.10086796300783014,0.0,42,0.7027027027027027
327036,worst breakup experience ?,worst breakup experiences ?,0,0.0,0.0,1,1.0
327037,know really want partner ?,know really want something ?,0,0.0,0.0,8,0.8
327038,"pulp fiction available netflix ? , ?",moral pulp fiction ? jules live vincent die ?,0,0.0,0.0,25,0.7777777777777778
327039,likely climate change accelerate ?,anarchast ? yes spelled like,0,0.0,0.0,28,0.8387096774193549
327040,best way explain string theory layperson ?,explain simple way string theory ?,1,0.0,0.0,25,0.9444444444444444
327041,concept backpropagation neural networks phenomenon actually observed brain ?,neuroscience : backpropagation work brain ?,1,0.0,0.0,50,0.8292682926829268
327042,india win gold medal rio olympics ?,many gold india win rio olympic ?,1,0.04557483611524244,0.0,16,0.9375
327043,font used “ freed ” image ?,font used `` '' image ?,0,0.0,0.0,9,0.8484848484848485
327044,best ways find job india ?,best way find job india ?,1,0.07304457942603576,0.08333333333333337,1,1.0
327045,61 get bullyed ?,get bullied ? 61 years old .,1,0.0,0.0,19,0.8
327046,colin kaepernick bad thing ?,tattoos colin kaepernick ? get ? pictures ?,0,0.0,0.0,22,0.8484848484848485
327047,human capital significant ?,human capital ?,0,0.0,0.0,12,0.8888888888888888
327048,reasons lesser attendance percentage ssc cgl exam 2016 ?,many applicants ssc cgl exam 2016 ?,0,0.0,0.0,28,0.8717948717948718
327049,"competitions/events electrical engineering students like hackathon/topcoder/facebook hacker cup cse students ? yes , ?",participate facebook hacker cup ?,0,0.0,0.0,88,0.75
327050,best bsc biotechnology colleges india ?,colleges offer bsc biotechnology india ?,1,0.054187255510746254,0.0,21,0.9411764705882353
327051,best neighborhoods stay marrakesh ?,like live marrakesh ?,0,0.0,0.0,21,0.6896551724137931
327052,mean electron dual nature ( particle wave properties ) ?,electron dual nature ?,1,0.0,0.0,34,0.75
327053,chrome crashing ?,chrome crashing continuously ?,0,0.0,0.0,13,0.8666666666666667
327054,'s opinion decision removal 500 1000 rupees currency notes ?,modi 's decision demonetization 500 1000 notes welcomed public ?,1,0.0,0.0,36,0.8636363636363636
327055,dutch view afrikaners ?,general dutch feel afrikaners ?,1,0.0,0.0,11,0.8823529411764706
327056,people study psychology ?,motivates people study psychology ?,0,0.0,0.0,10,0.875
327057,show marks 1st attempt mu oet 2nd attempt result certificate ?,necessary get 50 % marks mu-oet 2015 qualify ?,0,0.0,0.0,45,0.7659574468085106
327058,martial art style right ?,martial art right ?,1,0.0,0.0,6,0.8695652173913043
327059,hot men ever feel attracted ugly woman ? ?,attractive men : feel women throw ?,0,0.0,0.0,30,0.8333333333333334
327060,ask question without getting marked ‘ need improve ’ ?,question marked needing improvement perfectly clear well written ?,0,0.0,0.0,44,0.8444444444444444
327061,saying `` calm '' make angry person angry ?,get angry/aggressive person calm ?,0,0.0,0.0,29,0.8333333333333334
327062,riots obama ?,protests obama took office ?,0,0.0,0.0,17,0.8
327063,part time job options vit vellore ?,part time jobs rajahmundry ?,0,0.11606840066614083,0.0,17,0.8235294117647058
327064,biggest culture shocks people face coming taiwan ?,biggest culture shocks people face coming brazil ?,0,0.0,0.0,6,0.9523809523809523
327065,create artificial gravity satellite ?,methods generating artificial gravity ?,0,0.0,0.0,25,0.8484848484848485
327066,adjectives describe history ?,adjectives describe earth ?,0,0.0,0.0,6,0.9333333333333333
327067,companies offer artificial intelligence as-a-service ( aiaas ) ?,non-tech companies using artificial intelligence ?,0,0.0,0.0,37,0.8717948717948718
327068,india respond uri attacks ?,india respond uri terror attack ?,1,0.05372697180356952,0.0,8,1.0
327069,online procedure express entry canada software engineer 4 years experience ?,4 years experience manufacturing industries . get job software domain ?,0,0.0,0.0,60,0.8888888888888888
327070,get cash advance american express ?,get cash foreign account ?,0,0.0,0.0,20,0.75
327071,"< status : fail , please try later > instagram ?",failing thing trying . want something make start . suggestions help ?,0,0.0,0.0,52,0.7804878048780488
327072,"much people work taxi companies like olacabs , taxiforsure , meru cabs earn per month ?",new york city taxis : much money nyc cab drivers make average ?,0,0.0,0.0,61,0.8
327073,react.js awesome ? n't get till awesome ?,react.js application incomplete without flux ?,0,0.0,0.0,28,0.8205128205128205
327074,would translate phrase kite runner - 'for thousand times ' arabic persian ?,arabic ( language ) : translation real ?,0,0.0,0.0,56,0.6829268292682927
327075,niit delhi good digital marketing course ?,digital marketing colleges india ?,1,0.048587557719809535,0.0,27,0.9411764705882353
327076,prepare upsc ?,prepare ias 2017 ?,1,0.0,0.0,7,0.6666666666666666
327077,best examples really good design ?,examples bad design ?,0,0.06789151454049698,0.0,14,0.875
327078,minimum marks required get college either mbbs bds neet ?,many minimum marks required get mbbs college neet ?,1,0.0,0.0,26,0.95
327079,heart chest hurt 're emotionally sad ?,chest hurt pushups ?,0,0.0,0.0,24,0.6428571428571429
327080,earn money part time online ?,"earn money online , seriously ?",1,0.15636304150059965,0.0,16,0.8148148148148148
327081,good time drink tea ?,best time day drink tea ?,0,0.06641214639208902,0.08333333333333337,8,0.8148148148148148
327082,world war 3 likely ?,world war 3 coming ?,1,0.0,0.0,6,0.7407407407407407
327083,use original jackson pollock painting ex machina replica ?,'s plot summary ex machina ?,0,0.0,0.0,39,0.8717948717948718
327084,called knowledge learning ? differences words ?,called knowledge learning ? differences two words ?,1,0.0,0.0,4,0.9696969696969697
327085,oxidation number carbon glucose ?,oxidation number sodium ?,0,0.0,0.0,12,0.9090909090909091
327086,challenges face writer ?,challenging writer ?,1,0.0,0.0,7,0.9285714285714286
327087,long take get first love ?,long take get first love ?,1,0.0,0.0,0,1.0
327088,need open gym ?,need know open gym ?,1,0.0,0.0,5,0.9090909090909091
327089,"24 hours live , would ? specifics please .","24 hours left live , would ?",1,0.0,0.08333333333333337,24,0.8717948717948718
327090,happen eat paper ? bad ? cause health problems ?,bad eat paper ?,0,0.0,0.0,35,0.6923076923076923
327091,choose web hosting ?,switch hosting providers ?,0,0.0,0.0,19,0.8275862068965517
327092,aftermath trump winning presidential election ?,aftermath trump winning ?,1,0.0,0.0,22,0.8571428571428571
327093,save phone battery power playing pokemon go ?,battery saving tips tricks playing pokémon go ?,1,0.0,0.0,23,0.9
327094,softwares civil engineer must know ?,every civil engineer know ?,0,0.0,0.0,13,0.7878787878787878
327095,boyfriend ignores ?,boyfriend ignoring ?,1,0.0,0.0,3,0.96
327096,oldest companies world ?,oldest company world ?,1,0.0,0.0,3,0.9375
327097,format works best short youtube lectures : drawing whiteboard using slide deck green screen ?,coding mistakes interviewer usually look ask write code paper whiteboard ?,0,0.0,0.0,71,0.9130434782608695
327098,english cocker spaniel shed much ?,english cocker spaniels shed much ?,1,0.0,0.0,1,1.0
327099,people try ask silly questions quora rather googling ?,many people ask questions quora found google search ?,1,0.0,0.0,29,0.9
327100,best indian tv series ?,good indian tv series watch ?,1,0.0,0.0,10,0.7857142857142857
327101,micro grain structure low alloy steels ?,project science technology innovation food agriculture ?,0,0.0,0.0,45,0.7894736842105263
327102,ideal age start phd ?,'s ideal age start phd ?,1,0.0,0.0,3,0.9629629629629629
327103,value indian rupee increase ban 500 1000 rupee notes ?,could consequences recalling 500 1000 rupee note ?,1,0.0,0.0,27,0.9
327104,stop caring people think ?,stop worrying people think ?,0,0.0,0.0,4,0.875
327105,inter caste marriages bad ?,inter-caste marriages love bad ?,1,0.0,0.0,6,0.875
327106,prostitution legal india ?,prostitution legalized india ?,0,0.06830961860986792,0.0,4,0.967741935483871
327107,best ways cook frozen haggis ?,cook frozen pork roast ?,0,0.0,0.0,19,0.7878787878787878
327108,universities national commerce recruit new grads ? majors looking ?,universities snap-on recruit new grads ? majors looking ?,0,0.0,0.0,14,0.9523809523809523
327109,"salary rs 55000/month , one afford live mumbai ?","salary rs 22,000/month , one afford live mumbai ?",0,0.0,0.0,3,0.9565217391304348
327110,'best ' deck clash royale ?,good deck clash royale ?,1,0.0,0.0,7,0.8666666666666667
327111,positive things ?,positive ?,1,0.0,0.0,7,0.8571428571428571
327112,struggle fall asleep midnight ?,struggling fall asleep ?,0,0.0,0.0,12,0.9032258064516129
327113,best video player pc ?,best video player mac ?,0,0.0,0.09999999999999998,2,0.9696969696969697
327114,pakistan want kashmir ?,congress ( inc ) want gift kashmir pakistan ?,0,0.0,0.0,28,0.7878787878787878
327115,best online test series banking exams ?,best online test series bank exams ?,1,0.0,0.07692307692307687,3,0.967741935483871
327116,way see friend liking facebook ?,"way `` turn '' ability friends see `` liked '' commented facebook ? ( particularly , girlfriend 's newsfeed )",0,0.0,0.0,82,0.8
327117,gary vaynerchuk worth listening net worth $ 10 million wine business worth $ 4 million got ?,rob gronkowski 's net worth ? football career ?,0,0.0,0.0,67,0.7727272727272727
327118,"company file h1b visa person twice month ( march ) year ? company know decision april file another application , according following link ?","h1b approved year . since , company moved new location ( msa ) . need report new address stamping ?",0,0.0,0.0,96,0.9433962264150944
327119,worse getting knocked choked mma ?,fighting : like knocked ?,0,0.0,0.0,20,0.75
327120,actuary actually ?,actuary important ?,1,0.0,0.0,9,0.7272727272727273
327121,overcome feeling loneliness ?,overcome feeling loneliness ?,1,0.0,0.0,0,1.0
327122,'s best place holidays ?,best place holidays ?,0,0.0,0.09999999999999998,3,0.967741935483871
327123,annoying types questions quora ?,annoying questions quora wanted answer ?,1,0.0,0.0,20,0.9032258064516129
327124,know kind sexual deviant ?,guys last longer sex ?,0,0.0,0.0,20,0.7333333333333333
327125,average width two lane road ?,"toll roads : drove 110 express fastrak ( whatever 're called ) lanes today , without transponder . anything , except wait mail violation notice ?",0,0.0,0.0,123,0.6382978723404256
327126,best ways earn additional 5k per month ?,earn 5k per month ?,0,0.0,0.0,21,0.7878787878787878
327127,proton decay experiment confirm supersymmetry ?,proton decay experiment confirm theory supersymmetry ?,1,0.0,0.0,7,0.972972972972973
327128,people succeed others n't ?,people succeed n't ?,1,0.0,0.0,7,0.9285714285714286
327129,"counter people say , `` evolution theory '' ?",best brief way respond people say : '' evolution theory '' ?,1,0.0,0.0714285714285714,23,0.8095238095238095
327130,best way start learning c language within month ?,best way learn c ?,1,0.0,0.09999999999999998,31,0.8125
327131,liquid surface tension ?,flowing liquid surface tension ?,0,0.0,0.0,8,0.9411764705882353
327132,servlets handle multiple requests ?,many objects servlet created multiple requests ?,0,0.0,0.0,20,0.8421052631578947
327133,difference mirin rice wine ?,difference rice vinegar mirin ?,0,0.0,0.0,13,0.8333333333333334
327134,american government corrupt ?,american government corrupt ?,1,0.0,0.0,0,1.0
327135,want know anyone ever married woman philippines process like ?,"anyone ever experienced dream within dream ? anyone managed go even deeper ? , like ?",0,0.0,0.0,60,0.9047619047619048
327136,m.tech petroleum engineering course iit madras terms placements ?,scope mtech petroleum engineering iit madras ?,0,0.0,0.0,31,0.972972972972973
327137,germans compared huns world war ?,americans call germans world war 1 `` huns '' ?,1,0.0,0.0,26,0.8648648648648649
327138,"donald trump talking dirty billy bush , get along powerful bush family , got backstabbed becoming threat ?","told george bush etc . responsible 9/11 iraq saddam hussein , 's personal friend saudi royal family ?",0,0.0,0.0,86,0.8461538461538461
327139,much energy take pump 2 million litres water ?,much water must added 60 litres milk 1 1/2 litres rs.20 mixture worth rs.10 2/3 litres ?,0,0.0,0.0,60,0.7391304347826086
327140,long wait bitcoin core wallet sync giving trying different bitcoin wallet ?,one set bitcoin wallet false identity ?,0,0.0,0.0,45,0.9142857142857143
327141,general raheel sharif ex coas pakistan army saudi arabia ?,"expect pakistan retirement army general , raheel sharif ?",0,0.0,0.0,46,0.8837209302325582
327142,think eminem greatest rapper all-time ever live ?,think eminem greatest rapper touch mic ?,1,0.0,0.0,15,0.8235294117647058
327143,er choose banking ?,spouse exposing family dangerous bacteria substances changing work hospital ?,0,0.0,0.0,63,0.7368421052631579
327144,iphone 7edge free ?,get iphone free ?,0,0.0,0.0,10,0.88
327145,popular methods suicide ?,best methods suicide ?,1,0.0,0.09999999999999998,7,0.8275862068965517
327146,graduated english ?,graduation english ?,1,0.0,0.0,3,0.9655172413793104
327147,best video lectures learning linux ?,beginner start learning java ? best books video lectures topic ?,0,0.0,0.0625,48,0.8947368421052632
327148,gopro studio hide tool stabilize video ?,every time convert video gopro studio plays back 1 second . make play full duration ?,0,0.0,0.0,63,0.7619047619047619
327149,people take advantage good kind people ?,stop people taking advantage ?,0,0.052270111715586785,0.0,25,0.9655172413793104
327150,good bets make ?,good consequences losing bet workplace environment ?,0,0.07574518487817133,0.0,40,0.7058823529411765
327151,describe `` american way thinking '' cultural influences/varied upbringings define us american way think every day ?,"people countries , feel export american culture ? think pop culture ?",0,0.0,0.0,89,0.7391304347826086
327152,mean personality ?,mean personality ?,0,0.0,0.0,0,1.0
327153,kill morning ?,good things others also got benefited reverse ?,0,0.0,0.0,39,0.5925925925925926
327154,"mc , m+ , m- , mu mrc buttons calculators ?",best calculator ?,0,0.0,0.11111111111111116,28,0.7857142857142857
327155,places visit honeymoon kerala ?,places visit going kerala week friends ?,1,0.0,0.0,20,0.8108108108108109
327156,best sex tourism destination india ?,best sex tourism destinations india ?,1,0.055980137525808445,0.09090909090909094,1,1.0
327157,"women get pregnant male pre-cum coming contact egg , `` coitus interruptus , '' i.e . male withdrawing penis ejaculation , considered reliable form contraception ?",muhammad permit followers rape females newly captured jihad forbade azl ( coitus interruptus ) ?,0,0.0,0.0,123,0.8076923076923077
327158,review moana ( 2016 movie ) ?,review disney 's moana ( 2016 movie ) ?,1,0.0,0.0,10,0.8947368421052632
327159,donald trump like person ?,would pros cons donald trump becoming president ?,0,0.0,0.0714285714285714,29,0.8571428571428571
327160,importance power factor ?,power factor ? importance ?,1,0.0,0.0,22,1.0
327161,nerd ?,nerd ?,0,0.0,0.0,0,1.0
327162,buy shares bussiness shares ?,buy shares ?,1,0.0,0.0,17,0.9090909090909091
327163,indians dislike sonakshi sinha ?,people hate sonakshi sinha ?,0,0.0,0.0,13,0.88
327164,lifestyle itbp assistant commandant ?,role assistant commandant ( law ) indian coast guard ?,0,0.0,0.0,39,0.7222222222222222
327165,deal anxiety disorder ?,best ways deal generalized anxiety disorder ?,0,0.0,0.08333333333333337,22,0.875
327166,"brother recently went away college get really bored home , ?",really bored nothing ?,1,0.0,0.0,45,0.8484848484848485
327167,amazing photograph ever taken ?,best pictures ever taken ?,1,0.0,0.09090909090909094,14,0.7096774193548387
327168,journalist 's routine like ?,journalists want today ?,0,0.0,0.0,13,0.8
327169,much portable card swipe machine cost india obtain one ? carry around bag get payments ?,"shops public transport ( train , bus , cab , auto ) india start edc ( pos ) machines card payments even rupee ?",0,0.030995307558426322,0.0,76,0.8636363636363636
