id,question1,question2,is_duplicate,CosineSimilarity,JaccardSimilarity,Levenshtein,DiceSimilarity
248873,"list great people andhra pradesh history present fields eg. , arts , literature , politics , entertainment etc. ? ( many possible )",many users andhra pradesh airtel ?,0,0.0,0.0,105,0.7804878048780488
248874,page reload every time try comment ?,lie ?,0,0.10852712878956741,0.0,31,0.45454545454545453
248875,know girl likes think n't like back way around ?,think girl likes even though said n't like way . know sure ?,0,0.0,0.0,32,0.9047619047619048
248876,become top writer quora 2017 ?,might improve answers quora become top writer ?,1,0.0,0.0,34,0.7692307692307693
248877,perfect life ?,would perfect life like ?,1,0.0,0.0,11,0.8
248878,'s easiest way make money online ?,earn money easily online ?,1,0.0,0.0,19,0.8148148148148148
248879,"explain , simple terms , time n't exist past , 'now ' future exist simultaneously ? perceive time perceive really ? time n't exist , age ?",present defined respect space-time continuum ?,0,0.1547069713635247,0.1428571428571429,109,0.75
248880,people ask questions quora could easily found internet ?,many people ask questions quora.com could easily find answers online ?,1,0.0,0.0714285714285714,21,0.926829268292683
248881,best free soccer prediction software ?,best free veterinary management software ?,0,0.0,0.0,18,0.7878787878787878
248882,banning 500 1000 rupee affect black money ?,india demonetization 500 1000 rupees notes reduce black money ?,1,0.0,0.0,28,0.8888888888888888
248883,"want remove vocals song . used audacity , vocals completely removed . way make good karaoke vocals completely removed ? open source software way ?",software available free remove vocals song ?,0,0.0,0.0,116,0.8095238095238095
248884,would happen government ( country ) composed chiefly scientists ?,would happen government runs money ?,0,0.0,0.0,32,0.8837209302325582
248885,largest bird universe ?,biggest bird world ?,1,0.0,0.0,10,0.7857142857142857
248886,blood uric acid reduced ?,reduce uric acid levels body ?,1,0.0,0.0,15,0.8888888888888888
248887,like pornstar ?,'s like pornstar ?,1,0.0,0.0,3,0.9629629629629629
248888,home remedies help nausea ?,best home remedies nausea ?,1,0.0,0.0,10,0.8666666666666667
248889,story behind creation ipad ?,story behind creation android ?,0,0.0,0.0,6,0.967741935483871
248890,different scholarships engineering students india ?,scholarship programs engineering students india ?,1,0.0,0.0,18,0.9444444444444444
248891,youngest person reported new york times ?,like new york times reporter ?,0,0.0,0.0,28,0.875
248892,parents compare children convince stop ?,would parent justify something like ?,0,0.0,0.0,31,0.7692307692307693
248893,n't amazon looseleaf versions books ?,n't trump like amazon ? going ?,0,0.0,0.0,24,0.8
248894,"'s difference foundation , compact powder , bb/cc creams , mousse , concealer ?","buy , first foundation concealer ?",0,0.0,0.0,54,0.85
248895,use web whatsapp android mobile ?,whatsapp web disabled android tablets ?,0,0.0,0.0,20,0.9411764705882353
248896,sandy hook staged event government convince people support gun control ?,sandy hook staged promote gun control ?,1,0.0,0.0,36,0.95
248897,mobile games similar dokobots ?,best free android games ?,0,0.0,0.0,23,0.8666666666666667
248898,12 year old sex ?,12 year old sex ?,1,0.0,0.0,0,1.0
248899,trump really build wall make mexico pay ?,donald trump expect mexico pay proposed border wall ?,1,0.0,0.0,37,0.9230769230769231
248900,find purpose life ?,find purpose life ?,1,0.22016460602267066,0.16666666666666663,0,1.0
248901,top 10 bands time ?,greatest bands time ?,1,0.14638143633111925,0.16666666666666663,8,0.7857142857142857
248902,c c++ campailer mac ?,"301 one website another google use old `` on-site '' seo drop use new `` on-site '' seo ( h1 , h2 , metadata , etc ) ?",0,0.0,0.0,106,0.4878048780487805
248903,fix broken computer screen ?,fix damaged computer screen ?,1,0.0,0.0,6,0.8571428571428571
248904,written paper phygital marketing . publish paper ? also ensure copyrights paper ?,take virality account computation ltv mobile games ?,0,0.0,0.0,60,0.9047619047619048
248905,would save loved dog strange human ?,people love dogs much ?,0,0.0,0.0,20,0.7741935483870968
248906,make sweetened condensed milk evaporated milk ?,turn evaporated milk milk ?,0,0.0,0.0,30,0.8823529411764706
248907,hardest widely recognizable rap song karaoke ?,extract karaoke original song ?,0,0.0,0.0,33,0.7777777777777778
248908,kind business start investing less capital ?,type business started less capital ?,0,0.0,0.0,13,0.8823529411764706
248909,windows 10 sticky notes ?,change default font sticky notes windows 7 ?,0,0.0,0.0,26,0.7428571428571429
248910,"going interview android developer , questions expect technical round ?",web developer interview bank . questions ask manger going interview ?,0,0.0,0.0,50,0.8181818181818182
248911,best fantasy books 've read ?,best fantasy book read 20s ?,0,0.0,0.0,9,0.875
248912,passionately hate kids ?,kids hate green peppers ?,0,0.0,0.0,18,0.8275862068965517
248913,universities rowan recruit new grads ? majors looking ?,universities express recruit new grads ? majors looking ?,0,0.0,0.0,7,0.9523809523809523
248914,rail transport india considered safe ?,racism exist sydney ?,0,0.0,0.0,28,0.7586206896551724
248915,find chemical formula ammonium oxide ? uses ?,chemical formula amine ? used examples ?,0,0.11630132697360755,0.0,19,0.9714285714285714
248916,one change gender one change race ?,one change best ?,0,0.0,0.0,21,0.782608695652174
248917,forget person ?,forget people ?,1,0.0,0.0,4,0.8571428571428571
248918,shawshank redemption powerful ?,shawshank redemption best movies relevant best books ?,0,0.0,0.0,28,0.8947368421052632
248919,find family health insurance quotes arizona ?,find family health insurance quotes colorado ?,0,0.11859393193740943,0.11111111111111116,7,0.9743589743589743
248920,species smallest central nervous system ?,species would take world humans went extinct ?,0,0.0,0.0,29,0.8108108108108109
248921,dr. nowazardan pre-op diet ?,"ought diet student pre-medical coaching kota ? ( see details , please )",0,0.0,0.0,57,0.631578947368421
248922,top 3 biggest problems restaurant management managing waitstaff ?,biggest frustrations restaurant manager/owner today ?,0,0.0,0.0,35,0.8421052631578947
248923,best place visit kerala june ?,best places visit kerala 3 4 days ?,1,0.0,0.0,9,0.8
248924,exactly bill cosby wrong ?,bill cosby like person ?,0,0.0,0.0,17,0.7741935483870968
248925,biggest enemy punjab ?,biggest enemy ? ?,0,0.0,0.0,6,0.8461538461538461
248926,"name one book ( may series also ) changed life , brief summary message got book ?",name one book changed `` '' life ?,1,0.0,0.0,53,0.7619047619047619
248927,start learning c language ?,start preparing c language ?,1,0.0,0.0,4,0.9629629629629629
248928,'s favorite james bond film ?,'s favorite james bond movie ?,1,0.0,0.0,5,0.9714285714285714
248929,unlock carrier locked iphones ?,carrier unlock iphone ?,1,0.0,0.0,12,0.9333333333333333
248930,daniel ek : spotify available india free ?,daniel ek : spotify coming india ?,1,0.0,0.0,13,0.8421052631578947
248931,one explain von neumann architecture ?,"von neumann bottleneck , circumvented ?",0,0.0,0.0,26,0.8
248932,new york mets pitcher matt harvey called `` dark knight '' ? team mlb get permission dc comics batman-themed merchandise ?,pitcher 1957 new york yankees ?,0,0.0,0.0,101,0.7111111111111111
248933,rich soil valuable texas ?,build nutrient-rich soil gardens ?,0,0.0,0.0,26,0.8235294117647058
248934,get cellular companies install mobile tower plot land india ?,process rent land host mobile tower india ?,1,0.0,0.0,32,0.918918918918919
248935,first prime minister kolkata ?,first prime minister world ?,0,0.0,0.0,6,0.8666666666666667
248936,ethical decisions examples ?,moral decisions ? examples ?,1,0.0,0.0,7,0.9032258064516129
248937,good way casually try amazon web services ( aws ) products consumer ?,short example consume web service created using spring boot ?,0,0.0,0.0,47,0.8695652173913043
248938,popular service similar quora ?,website similar quora ?,1,0.0,0.0,12,0.8
248939,volunteer learn arabic palestine ?,go palestine become volunteer ?,0,0.0,0.0,25,0.9411764705882353
248940,many employees quora currently ?,many staff quora employ ?,1,0.0,0.0,16,0.9375
248941,"one mature eminem , bam margera , benedict cumberbatch , tom hiddleston adam sandler ?",tom hiddleston taylor swift good match ?,0,0.0,0.0,69,0.8421052631578947
248942,log facebook account forgot password ?,open facebook account forgot password gmail ?,1,0.0,0.0,10,0.95
248943,average student preparing iit jee . test series best ?,average student preparing iit-jee . test series best free ?,0,0.0,0.0,6,0.9444444444444444
248944,top fem fea service providers provide precise vibration analysis services worldwide ?,top fem fea service providers provide precise radiation analysis services worldwide ?,0,0.0,0.0,4,0.9743589743589743
248945,sell ebay ?,'s selling ebay 's popular 2016 ?,0,0.0,0.0,22,0.5714285714285714
248946,"difference desilting , dredging sand mining ?",difference basin valley ?,0,0.0,0.0,27,0.7741935483870968
248947,top programming languages learn ?,best programming languages learn today ?,1,0.0,0.0,10,0.9090909090909091
248948,things evolve way made sleep ? would make sense life need predators .,animals evolve need sleep ?,0,0.0,0.0,50,0.7222222222222222
248949,best way select best mobile app development company ?,select best mobile app development company ?,1,0.0,0.0,9,0.9714285714285714
248950,program extended periods time ?,"best time study , day night ?",0,0.13436940344759635,0.125,25,0.7096774193548387
248951,"looking back , important risk ever took , changed destiny ?",think important thing n't learned school ? wish knew back might changed current status ?,0,0.0,0.0,58,0.8636363636363636
248952,safety precautions handling shotguns proposed nra north carolina ?,safety precautions handling shotguns proposed nra arkansas ?,1,0.0,0.0,12,0.9743589743589743
248953,best treatment hair loss ?,'s best treatment hair loss ?,1,0.0,0.0,3,0.9655172413793104
248954,say happy new year japanese ? matter depending 'm speaking ?,happy new year language ?,0,0.0,0.0,38,0.6875
248955,redeem points app trailers iphone ? !,redeem points app trailer ?,0,0.0,0.0,10,0.9333333333333333
248956,spilled water damage laptop ?,best way repair water damaged laptop ?,0,0.0,0.0,14,0.9375
248957,bill gates ' iq really 160 ?,"iq limits : certain fundamental , unlearnable intrinsic abilities , held person iq 160 vs. person iq 100 . ( overcome ? )",0,0.0,0.0,102,0.6086956521739131
248958,turned life around ?,one catastrophic moment life turned life around ?,1,0.0,0.0,29,0.8387096774193549
248959,"personally , anal sex feel better vaginal sex ?",anal sex feel compared vaginal sex ?,0,0.0,0.0,20,0.8108108108108109
248960,learn write biblical hebrew alphabet ?,learn write biblical hebrew ?,1,0.0,0.0,9,0.9629629629629629
248961,meant term `` simple '' ?,meant term revenue cycle ?,0,0.0,0.0,13,0.6666666666666666
248962,sharing economy ?,meant sharing economy ?,1,0.0,0.0,6,0.9655172413793104
248963,ios emulator windows similar bluestacks android ?,youwave android emulator good memu bluestacks ?,0,0.0,0.0,34,0.9230769230769231
248964,turkish take responsibility armenian genocide ?,turkey held responsible armenian genocide ?,1,0.0,0.0,11,1.0
248965,meiosis phases look like ?,phases meiosis look like ?,1,0.0,0.0,10,1.0
248966,"messed alevel passed 2 alevels , american colleges offer undergraduate studies international students ?",working professional san francisco want continue studies . colleges offer masters/phd working people physics ?,0,0.0,0.0,83,0.8
248967,long distance relationships work ?,anyone whose long distance relationship actually worked ?,0,0.0,0.0,24,0.9473684210526315
248968,american saltwater taffy candies imported japan ?,saltwater taffy candy imported spain ?,1,0.0,0.0,15,0.972972972972973
248969,maintain healthy ?,hypnopedia work ?,0,0.0,0.0,15,0.64
248970,girl ever love ?,girl love ?,0,0.0,0.0,5,1.0
248971,n't republican party get banned racist views ?,"family supports trump ’ republican party . yet defend views , get laughed . ?",0,0.0,0.0,47,0.8260869565217391
248972,best movie bollywood 2015 ?,best bollywood movies 2015 ?,1,0.0,0.0,13,1.0
248973,use drain snakes lowes ?,maintance chemical use bathtub drain ?,0,0.0,0.0,29,0.7333333333333333
248974,gate less trodden path nitians ?,many iitians nitians appear gate/ese exam ?,0,0.0,0.0,32,0.7333333333333333
248975,nobel peace prize 2014 ?,malala yousafzai 2013 nobel peace prize ?,0,0.0,0.0,27,0.8205128205128205
248976,"good , inexpensive red wines ?",best inexpensive red wines ?,1,0.0,0.0,6,0.8275862068965517
248977,russians consider western eastern ?,russians consider western eastern ?,1,0.0,0.0,0,1.0
248978,african women love short wigs bangs ?,african women love wigs much ?,0,0.0,0.0,11,0.918918918918919
248979,filter questions/answers quora containing certain words ?,filter questions quora feed contain either words `` atheist '' `` obama '' ?,1,0.0,0.0,44,0.8292682926829268
248980,become management consultant ?,become management consultant ?,1,0.0,0.0,0,1.0
248981,browser consumes least ram ?,light weight os run 1gb ram consuming less hard disk ?,0,0.0,0.0,37,0.8333333333333334
248982,often use egg mask face ?,kind facial mask use face ?,0,0.0,0.0,16,0.7857142857142857
248983,real estate agents desire ?,real estate agents desire ?,1,0.0,0.0,0,1.0
248984,use desktop version instagram ?,upload pictures pc instagram ?,0,0.0,0.0,16,0.8823529411764706
248985,"would world war 3 , south china sea disputes ca n't resolved ?",south china sea dispute lead world war iii ?,1,0.0,0.0,37,0.8947368421052632
248986,much half sleeve cost ?,much cost get crown tattoo wrist usa ?,0,0.0,0.0,26,0.7333333333333333
248987,many questions quora seem like really homework questions ?,many students use quora homework ?,1,0.0,0.0,33,0.9142857142857143
248988,best 360 degree employee review tool available cloud service reasonable cost ?,way create valid 360-degree feedback survey using template ? template available ?,0,0.0,0.0,60,0.92
248989,mgit good placements ?,vit good placement ?,0,0.0,0.0,3,0.9333333333333333
248990,best place get slow loris ?,american go procuring slow loris pet ?,0,0.0,0.0,21,0.875
248991,startpage.com make money ?,linkis.com make money ?,0,0.0,0.0,9,0.8
248992,mascot georgetown bulldog `` hoyas '' team nickname ?,"quora official mascot , would ?",0,0.0,0.0,42,0.7
248993,best way start day entrepreneur ?,best way start day ?,0,0.0,0.0,13,0.88
248994,sentence examples using `` simile '' ?,sentence examples using `` allegory '' ?,0,0.0,0.0,8,0.918918918918919
248995,india abuse bangladesh ? india wants cripple economy development bangladesh ?,"china , india , bangladesh , pakistan extremely large populations compared geographical area ?",0,0.0,0.0,62,0.8888888888888888
248996,men rape murder women ?,men rape women ? n't women rape men ?,0,0.0,0.0,19,0.8333333333333334
248997,best way make fried chicken ?,make best fried chicken ?,1,0.0,0.0,12,0.9411764705882353
248998,need baking soda bake cookies ?,baking soda and/or baking powder cookies ?,1,0.0,0.0,21,0.8666666666666667
248999,'s worst thing ever teenager ?,worst thing teenager ?,1,0.0,0.0,8,0.9285714285714286
249000,free web host .tk domains ?,want start small business village bihar ?,0,0.0,0.0,33,0.7428571428571429
249001,"best coaching institute ca-cpt howrah , kolkata ?",best coaching institute upsc preparation kolkata ?,0,0.0,0.0,13,0.9230769230769231
249002,take full page screenshot chrome using selenium ?,google chrome takes .com page search thinks 'm denmark . 6 months ago . help ?,0,0.0,0.0,56,0.85
249003,mind-blowing facts environment ?,mind-blowing facts environment ?,1,0.0,0.0,0,1.0
249004,stop 8 week husky puppy biting shoes ?,stop husky/border collie puppy chewing socks ?,1,0.0,0.0,24,0.8421052631578947
249005,"best `` startling plot twist '' movies , la sixth sense psycho ?",best movies plot twist ?,0,0.0,0.0,45,0.7027027027027027
249006,london ?,london ?,1,0.0,0.0,0,1.0
249007,fix stuck power button ipod touch ( 4g ) without taking service ?,fix broken power button iphone 4 ?,0,0.0,0.0,40,0.8095238095238095
249008,main reasons behind ww1 ?,main causes behind ww1 ?,1,0.0,0.0,5,0.8666666666666667
249009,feel like go physically unattractive physically attractive ?,feel like go physically attractive unattractive ?,0,0.0,0.0,13,1.0
249010,many asian men buzz cuts crew cut hairstyles ?,full hair head really want buzz cut . good idea ?,0,0.0,0.0,35,0.8205128205128205
249011,increase basal metabolic rate ?,basal metabolic rate ?,0,0.0,0.0,9,0.9629629629629629
249012,convert videos 3gp ?,convert videos .h265 files ?,0,0.0,0.0,11,0.7058823529411765
249013,prescribed book mechanical engineer students clear isro scientist/engineer sc exam ?,prescribed book cs students clear isro scientist/engineer sc exam ?,0,0.0,0.0,18,0.9767441860465116
249014,buying unlimited google drive account ebay good idea ?,'m looking buy casio watch cheaper ebay . good idea buy ebay ?,0,0.0,0.0,44,0.8095238095238095
249015,prepare group 2 ca final nov 16 3 months ?,shall prepare ca final nov 16 exams,0,0.0,0.0,21,0.8292682926829268
249016,"much time take charge 10,000 mah power bank ?",much time 2600 mah power bank take charge ?,0,0.09918018874798738,0.09999999999999998,27,0.9047619047619048
249017,"suitable solar panel installation provider santa clara , california ca ?","suitable solar panel installation provider santa rosa , california ca ?",0,0.0,0.0,4,1.0
249018,"ankara , turkey common istanbul ?","eat tacos ankara , turkey ?",0,0.0,0.0,25,0.875
249019,books english writers india independence british rule ?,tamil books british rule india ?,0,0.0,0.0,41,0.8648648648648649
249020,reviews tool ( band ) ?,review tool ( band ) ?,1,0.0,0.0,1,0.9696969696969697
249021,green tea help lose weight ?,green chai tea assist weight loss ?,1,0.0,0.0,16,0.9333333333333333
249022,beloved french/francophone singers/songs/albums children ?,best french pop stars 1980s ?,0,0.0,0.0,40,0.6666666666666666
249023,improve overall quality higher education india ?,overall quality education india bad ?,0,0.0,0.0,19,0.8648648648648649
249024,know tchaikovsky gay ?,peter tchaikovsky gay ?,1,0.0,0.0,5,0.8387096774193549
249025,join army finish college ?,join army finishing college ?,0,0.0,0.0,3,1.0
249026,traveller.com ?,shoppybag.com ?,0,0.0,0.0,9,0.56
249027,many books allen study material ( jee ) ?,many books allen study material ( pmt ) ?,0,0.0,0.0,3,0.95
249028,"'s like work pilot trans maldivian airways ? terms lifestyle islands , work schedule , destination , pay etc . current requirements first officer position ( hours , ratings ) ?","u.s. , current prospective employee feel bad wanting work 40 hours per week ?",0,0.0,0.0,138,0.8771929824561403
249029,fee post graduation coarses automotive designing dypdc ?,freelance automotive designer ? pros cons ?,0,0.0,0.0,33,0.9473684210526315
249030,polite way `` poke '' someone n't yet replied email ?,"ask someone , politely , reply email ?",0,0.0,0.0,32,0.8571428571428571
249031,causes behind war 1971 pakistan bangladesh ?,reason behind war 1971 pakistan bangladesh ?,1,0.0,0.0,5,0.9302325581395349
249032,feel like soldier ?,feel like child soldier ?,0,0.0,0.0,6,0.9166666666666666
249033,people say life begins 40 ?,people say life begins conception ?,0,0.0,0.0,10,0.875
249034,interesting person actively using quora ?,interesting person quora ?,1,0.0,0.0,15,0.875
249035,trace phone calls cell phone ?,people trace location call made cellular phone ?,1,0.0,0.0,23,0.8275862068965517
249036,"differences recognition recognization ? give examples , please !",interesting facts coconuts ?,0,0.0,0.0,50,0.7222222222222222
249037,top universities offering masters science analytics nc state northwestern ?,technical masters science business analytics program offered university cincinnati ? candidate absolutely know coding ?,0,0.0,0.0,86,0.9333333333333333
249038,pepe play casemiro 's position ?,necessary affluent farming community income tax ?,0,0.0,0.0,35,0.8235294117647058
249039,want learn `` internet things . '' best book learn ?,best resources learn internet things ( iot ) ?,1,0.0,0.0,32,0.7567567567567568
249040,internet never invented ?,would world look like today internet n't invented ?,1,0.0,0.0,32,0.6923076923076923
249041,could consequences recalling 500 1000 rupee note ?,consequences 500 1000 rupee notes banning ?,1,0.0,0.0,25,0.9230769230769231
249042,accenture recruitment process ?,processes accenture job ?,1,0.0,0.0,22,0.8571428571428571
249043,typical first jobs newly graduated engineers ?,many industries west bengal ?,0,0.20355227462700679,0.0,35,0.8421052631578947
249044,earn money emergency ?,earn emergency cash ?,1,0.0,0.0,11,0.8695652173913043
249045,popular fiction book ?,popular fiction novel/book time ?,1,0.0,0.125,11,0.8823529411764706
249046,"many questioners quora ask general information certain topics , need expert advise ? ’ google ?",many people ask things quora could easily google ?,1,0.0,0.0,62,0.8695652173913043
249047,make pancakes without batter ?,make crispy batter ?,0,0.0,0.0,14,0.8125
249048,simple symbols convey incredibly complex concept ?,athena symbolize ?,0,0.0,0.0,39,0.7272727272727273
249049,best way/book learn psychology ?,good books learn psychology ?,1,0.0,0.0,9,0.8888888888888888
249050,eastern ghats formed ?,hills formed landscape ?,0,0.0,0.0,20,0.8
249051,best videocon microwave oven service center hyderabad ?,best videocon microwave oven repair center hyderabad ?,1,0.0,0.0,5,0.972972972972973
249052,"primary , principle purpose life ?",grand purpose life ?,1,0.0,0.0,16,0.8125
249053,increase literacy rate tribal areas influence tribal kids complete school education ?,"survivor tv show : going tribal council , far players walk ? often leave daylight get dark ?",0,0.0,0.0,70,0.8695652173913043
249054,many zeros 1 million ?,"zero divided zero ( 0/0 ) equal zero , undefined 1 ?",0,0.0,0.0,40,0.6285714285714286
249055,win ballon d'or 2017 ?,ballon d'or winner year ?,0,0.0,0.0,15,0.8
249056,integrate : 2x sec^3 ( x^2 +3 ) tan ( x^2 +3 ) ?,solve [ math ] 2x^3-x^2+11x+3=0 [ /math ] ?,0,0.0,0.0,33,0.5238095238095238
249057,post secondary means ?,post-secondary courses ?,0,0.0,0.0,7,0.896551724137931
249058,biggest role models among teenagers 1970s ?,biggest role models among teenagers 2000s ?,0,0.0,0.0,3,0.8888888888888888
249059,become good quality engineer ?,become good quality engineer automotive industry ?,0,0.0,0.0,20,0.9473684210526315
249060,"major effects cambodia earthquake , effects compare andreanof islands earthquake 1957 ?","major effects cambodia earthquake , effects compare somatra earthquakes 2007 ?",1,0.0,0.0,19,0.8627450980392157
249061,get traffic website ?,increase traffic blog ?,1,0.0,0.0,13,0.8571428571428571
249062,6-weeks old pit bull puppies behave ?,take care 6 week old german shepherd puppy ?,0,0.0,0.0,32,0.75
249063,hp officejet 4620 airprint compare hp color laserjet enterprise m750n ?,hp officejet 4620 airprint compare hp laserjet enterprise m604n ?,0,0.0,0.0,9,0.9545454545454546
249064,wo n't ipod touch 4th generation charge ?,ipod touch charge ?,1,0.0,0.0,22,0.875
249065,person love hates ?,person love hates ?,1,0.0,0.0,0,1.0
249066,get views post behance ?,get views behance ?,1,0.0,0.0,5,0.9333333333333333
249067,make easy money online ?,easy way make money online ?,1,0.0,0.0,10,0.96
249068,one thing proud happy ?,one thing proud life ?,0,0.0,0.0,5,0.8666666666666667
249069,right assessment sadguru jaggi vasudev ? loquacious really attained knowledge wisdom saints known possess ?,'re thoughts sadguru jaggi vasudev ?,1,0.0,0.0,81,0.75
249070,claim voluntary layoff unemployment benefits state nevada ?,claim voluntary layoff unemployment benefits state iowa ?,0,0.0,0.0,5,0.95
249071,funniest joke 've ever heard read ?,best joke ever heard ?,1,0.0,0.0,14,0.8125
249072,1031 tax deferred exchange ?,“ tax-free ” 1031 exchange ?,1,0.0,0.0,15,0.8823529411764706
249073,bad news wife says needs time ?,girl wo n't leave boyfriend keeps saying loves needs time ?,0,0.11092638566623876,0.09090909090909094,35,0.7777777777777778
249074,favorite hollywood movie released 2010 2014 ?,best hollywood movie released 2010 2014 ?,0,0.0,0.0,7,0.9523809523809523
249075,incresing prices petrola deasel every month …my question governemnt involve price hiking ?,siren always driver behind driver every cop car ?,0,0.0,0.0,67,0.7804878048780488
249076,tools best mobile application development ?,best mobile application development tools ?,1,0.0,0.0,12,1.0
249077,best hollywood erotic movie ?,best erotic hollywood movies time ?,1,0.0,0.125,16,1.0
249078,hillary clinton 's policy towards india-us relations ?,would hillary clinton 's foreign policy towards india elected president united states ?,1,0.0,0.0,40,0.926829268292683
249079,flirt text message ?,flirt text message ?,1,0.0,0.0,0,1.0
249080,best way make money online ?,easy ways make done extra money online ?,1,0.0,0.0,15,0.875
249081,tarek fatah hate pakistan much ?,’ government pakistan still stripped nationality tareq fatah ?,0,0.0,0.0,44,0.7368421052631579
249082,salary doctor india ?,range doctors ' salaries bigger cities india ? differ mbbs mds ?,0,0.0,0.0,48,0.7741935483870968
249083,many [ math ] 4 [ /math ] digit atm pins formed [ math ] 9 [ /math ] digits ?,add 5 odd numbers get 30 ?,0,0.0,0.0,64,0.6153846153846154
249084,top places visit kerala ?,best place stay visit kerala ?,1,0.0,0.0,8,0.896551724137931
249085,alloy ? strongest alloys ?,alloy ?,1,0.0,0.0,19,0.6666666666666666
249086,get rid fat around hips ?,exercises done reduce fat around hip ?,1,0.0,0.0,18,0.9090909090909091
249087,drink green tea sleeping ?,drink green tea ?,0,0.0,0.0,9,0.88
