id,question1,question2,is_duplicate,CosineSimilarity,JaccardSimilarity,Levenshtein,DiceSimilarity
271025,best place ncr get car accessories ?,add ram pc even different brand different specs ?,0,0.0,0.0,35,0.7741935483870968
271026,language שדה בריר ?,language ?,0,0.0,0.0,9,0.7272727272727273
271027,inertia measured ? measured ?,inertia measured ?,1,0.0,0.0,11,1.0
271028,stop thinking start ?,stop thinking start ?,1,0.0,0.1428571428571429,0,1.0
271029,often people sex ?,often people sex ?,1,0.0,0.0,0,1.0
271030,"black death 14th century wiped europe , would rule world ?",black death affect history europe ?,0,0.0,0.0,35,0.8292682926829268
271031,big 4 averse freshers cas took 3 attempts clear ?,first attempters clearing upsc civil services exam veterans n't even 3-4 attempts ? wisdom gain clear early ?,0,0.0,0.0,73,0.7659574468085106
271032,would anyone allow wife fucked another man ?,"man baby wife , starts body building another baby wife 2 years later , would second baby grow muscular first ?",0,0.0,0.0,85,0.8571428571428571
271033,uses r bar symbol ?,"story behind using one/two lines ( = , || ) etc . currency symbols ?",0,0.0,0.0,52,0.5789473684210527
271034,donald trump manage win 2016 us election ?,donald trump 2016 usa presidential election ?,1,0.0,0.0,20,0.9523809523809523
271035,advice would give person debilitating social anxiety ?,effective ways stop social anxiety ?,1,0.0,0.0,29,0.8421052631578947
271036,"best worst things public transit zhangjiagang shi , jiangsu , china ? could improved ?","best worst things public transit lianyungang shi , jiangsu , china ? could improved ?",0,0.0,0.0,6,0.9583333333333334
271037,blood sample hurt ’ done ?,honey bees die use sting ?,0,0.0,0.0,20,0.7096774193548387
271038,improve humor ?,improve sense humour ?,1,0.0,0.0,7,0.9166666666666666
271039,"differences deobandi , barelvi & salafi subsects sunni islam ?",differences halal sunni shia islam ?,0,0.0,0.0,33,0.8
271040,brown bread really brown ?,brown bread brown ?,0,0.0,0.0,7,0.9090909090909091
271041,reduce waist size 40 32 ?,best ways lose weight ?,0,0.0,0.0,16,0.5161290322580645
271042,learn french spanish ?,"best foreign language learn among german , french spanish ?",0,0.0,0.0,37,0.7878787878787878
271043,possible hack whats app ?,possible hack whatsapp messenger ?,1,0.0,0.0,11,0.8823529411764706
271044,"evidence exists martin luther king , jr. engaged orgies white prostitutes women ?",know martin luther king jr. admired gandhi ?,0,0.0,0.0,48,0.8636363636363636
271045,would psychopath react break ?,psychopaths misanthropic ?,0,0.0,0.0,17,0.6875
271046,stay night terminal 3 igi delhi airport n't next flight board ? plane lands midnight .,airline pilot land plane airport wants ?,0,0.0,0.0,63,0.7027027027027027
271047,old vhs copies walt disney movies worth ?,find walt disney 's movie `` song south '' ?,0,0.0,0.0,28,0.8
271048,cost icl ( implantable collamer lens ) india benefits lasik surgery ?,good eye care hospitals lasik surgery noida/delhi ? cost ?,0,0.0,0.0,53,0.8372093023255814
271049,palanca letter write one ?,one write christmas letter ?,0,0.0,0.0,21,0.8571428571428571
271050,views ban 500 1000 rupee notes india ?,500 1000 rs notes banned goi new notes 500 2000 issued ?,1,0.0,0.0,41,0.8947368421052632
271051,old try become successful film director ?,newcomer film industry right work 3rd assistant director commercials . path follow become successful director ?,0,0.0,0.0,81,0.7804878048780488
271052,bill clinton expelled oxford ?,"could propel space tying rope ball throwing , , would ball able pull good distance ?",0,0.0,0.0,66,0.7222222222222222
271053,use omegle ipod touch compared using lollichat ?,use omegle ipod touch compared using afreechat.com ?,0,0.0,0.0,9,0.9473684210526315
271054,best places visit finland ? www.krazybutterfly.com,best places visit estonia ? www.krazybutterfly.com,0,0.0,0.0,7,0.9787234042553191
271055,tips making job interview process getty realty ?,tips making job interview process agree realty ?,0,0.0,0.0,5,1.0
271056,stimulants cause mania ?,stimulants cause mania ?,1,0.0,0.0,0,1.0
271057,unlock samsung galaxy duos ( gt-s6102 ) phone gets locked due multiple unlocking attempts ?,samsung galaxy phone unlock ?,0,0.0,0.0,62,0.7727272727272727
271058,find someone help determine dream means ?,feel dream ?,0,0.0,0.0,29,0.72
271059,best food eat fever ?,best food eat munich ?,0,0.0,0.0,6,0.7142857142857143
271060,hierarchy cops indian police ?,call police officers `` cops '' ?,0,0.0,0.0,28,0.7586206896551724
271061,`` quora `` mean ?,`` quora '' mean ?,1,0.0,0.0,2,0.9565217391304348
271062,find direction give purpose life ?,ways find direction purpose life ?,1,0.0,0.0,10,0.8571428571428571
271063,5 examples simple sentences ?,sentence examples using `` bet '' ?,0,0.0,0.0,21,0.8125
271064,calmly tell straight best friend like ?,best friend call talk boyfriend ? shall tell feel ?,0,0.0,0.0,38,0.918918918918919
271065,european medical schools recognised gmc britain ?,old old start medical school ?,0,0.0,0.125,35,0.8484848484848485
271066,impressions week nine nfl season ?,impressions week three nfl season ?,0,0.0,0.0,4,0.9375
271067,signs women give satisfied sex ?,men really thick ignore signs girls give ?,0,0.0,0.0,31,0.7058823529411765
271068,evolutionary advantage noses wide flat noses narrow protruding ?,haircut would best face nose ?,0,0.0,0.0,49,0.8108108108108109
271069,much energy generate breath running walking ?,jayalalitha enter politics ? leave acting films ?,0,0.0,0.0,36,0.7368421052631579
271070,always people kowtow money ?,"established worldwide practice famous people paid public appearances , would command highest priced ticket many people would turn see ?",0,0.0,0.0,113,0.7368421052631579
271071,designed graphics adobe cc ?,designed graphics new adobe cc suite ?,1,0.0,0.0,10,0.9090909090909091
271072,trump loses election ?,"donald trump , long term , loses election ?",1,0.0,0.0,21,0.875
271073,many applications forms submitted passport seva portal one login id ?,change details submitted passport form ?,0,0.0,0.0,41,0.926829268292683
271074,benefit joining ebiz ?,friends asking join ebiz . safe business ebiz ?,0,0.0,0.0,30,0.7333333333333333
271075,`` must-see '' documentaries films true stories ?,documentaries consider essential viewing ?,0,0.0,0.0,35,0.8108108108108109
271076,quora 's successor ?,m.k.gandhi 's family ( successors ) ?,0,0.0,0.0,21,0.5882352941176471
271077,reduce weight ?,lose post marriage weight ?,1,0.0,0.0,16,0.6666666666666666
271078,sure church god one church needed salvation ?,`` one church god bible taught lord jesus christ '' rest ; considered false churches ?,0,0.0,0.0,57,0.8205128205128205
271079,aftershave invented ?,invented aftershave ?,1,0.0,0.0,18,1.0
271080,best sources learn python language ?,start learning python ?,0,0.0,0.1428571428571429,21,0.875
271081,normal ejaculate 7 10 continuous strokes aroused watching porn ?,normal watch porn ?,0,0.0,0.0,45,0.7027027027027027
271082,signature identify proof ?,painful osteochondral autograft ?,0,0.0,0.0,25,0.8823529411764706
271083,would happen dc motor supplied ac vice-versa ?,changes made make ac motor dc motor vise versa ?,0,0.0,0.0,29,0.8108108108108109
271084,costs owning private jet ?,many private jets park san jose airport ?,0,0.0,0.0,32,0.8125
271085,effects would seen coming days result banning 500 1000 rupees notes india ?,effect banning 500 1000 rupees notes india world economy ?,1,0.0,0.0,45,1.0
271086,change wifi password router ?,change wifi password ?,1,0.0,0.0,7,0.9411764705882353
271087,much investment would need start car wrapping shop/business ?,much investment would need start car wrapping shop/business gujarat ?,0,0.0,0.0714285714285714,8,0.9777777777777777
271088,best website learn linux ?,best site practice learn linux ?,1,0.0,0.0,10,0.896551724137931
271089,ancient mayans scientifically tested ?,ancient civilizations scientifically tested ?,1,0.0,0.0,10,0.8666666666666667
271090,buy pepsi 1893 ?,"better , coke pepsi ? ?",0,0.0,0.0,16,0.5384615384615384
271091,"main imports exports venezuela , venezuela 's industry compare belize 's ?","main imports exports venezuela , venezuela 's industry compare mexico 's ?",0,0.0,0.0,4,0.9777777777777777
271092,effects venus conjunct mars 11th house leo ?,result conjunction venus saturn 4th house ?,0,0.0,0.0,28,0.8571428571428571
271093,want start event organizing business friends hyderabad . good idea ?,got offer company start 2 weeks . good idea update linkedin new job ?,0,0.0,0.0714285714285714,58,0.782608695652174
271094,best historical strategy games android ?,strategy-based android game best ?,0,0.0,0.11111111111111116,30,0.8823529411764706
271095,juice make gain weight ?,honey make gain weight ?,0,0.0,0.0,5,0.8275862068965517
271096,one earn money online without investment ?,'s easiest way make money online ?,0,0.0,0.0,31,0.8125
271097,dr. anbumani ramadoss win 2016 elections ?,anbumani ramadoss stage surprise coming elections ?,0,0.0,0.0,23,0.8
271098,women iinie outie belly button ?,women innie belly button ?,1,0.0,0.0,7,1.0
271099,calculate possible subsets given set ( c would preferrable ) ?,"null set , subset every set ?",0,0.0,0.0,43,0.6285714285714286
271100,band pune join singer ?,join band delhi ?,0,0.0,0.0,17,0.7407407407407407
271101,statistics skyscraper-construction worker fatalities 1930s ?,1930s known ?,0,0.0,0.0,52,0.6470588235294118
271102,wise start studying medicine age 32 33 ?,old old start medical school ?,0,0.0,0.125,27,0.6875
271103,improve spoken english ?,improve english language ?,1,0.0,0.0,13,0.9032258064516129
271104,difference milk buttermilk,differences buttermilk heavy cream ?,0,0.0,0.0,19,0.8235294117647058
271105,'s brendan fraser 's political beliefs ?,'s best movie brendan fraser played ?,0,0.0,0.0,27,0.8888888888888888
271106,recover deleted photos android internal memory ?,recover deleted photo hangouts ?,0,0.0,0.0,21,0.8571428571428571
271107,universities northwestern recruit new grads ? majors looking ?,universities fedex recruit new grads ? majors looking ?,0,0.0,0.0,10,0.9302325581395349
271108,robert downey jr. jerk real life ?,robert downey jr real life ?,0,0.0,0.0,6,0.9411764705882353
271109,best places intern ?,best places intern mumbai ?,0,0.0,0.0,7,0.9285714285714286
271110,maximize happiness life ?,sustain happiness life ?,0,0.0,0.0,7,0.8148148148148148
271111,know posted question quora ?,quora : post question quora ?,0,0.0,0.0,8,0.8666666666666667
271112,deal bullies work ?,one deal bully work ?,1,0.0,0.0,7,0.8571428571428571
271113,mean period three days late ?,cause woman 's period late ?,1,0.0,0.0,19,0.8235294117647058
271114,could stranger woman tell 2-weeks pregnant wife pregnant ?,go telling wife got two different women pregnant ?,0,0.0,0.0,34,0.8421052631578947
271115,pros cons merging railway budget union budget ?,pros cons union railway budget 2015 ?,0,0.0,0.0,18,0.8837209302325582
271116,heisenberg uncertainty principle ?,heisenberg 's uncertainty principle ?,1,0.0,0.0,3,0.9714285714285714
271117,typhoons happen formed ?,big typhoons get ? typhoons formed ?,1,0.0,0.0,16,0.875
271118,apple release next macbook air ?,next macbook air likely released ?,1,0.0,0.0,30,0.9142857142857143
271119,"good solar panel installation provider near aptos , california ca ?","suitable solar panel installation provider near aptos , california ca ?",1,0.0,0.0,8,0.918918918918919
271120,"chemical composition hair bleach ( powder liquid ) , ?",safe bleach hair clorox ?,0,0.0,0.0,40,0.6486486486486487
271121,become billionaire ?,want billionaire 2 years ; plan ?,0,0.0,0.0,21,0.6896551724137931
271122,place beautiful place singapore ?,beautiful place visit singapore ?,1,0.0,0.0,12,0.9714285714285714
271123,happens donald trump actually wins ? good bad ?,think happen u.s donald trump wins ?,1,0.0,0.0,29,0.85
271124,"would happen us primaries , election , candidates president either die disqualified reason ?",might happen president-elect donald trump election ? impact ?,0,0.0,0.0,61,0.85
271125,trustworthy official turkish accounts military casualties fight isis pkk ?,apply discriminant analysis ( multivariate ) data normally distributed ?,0,0.0,0.0,62,0.7619047619047619
271126,get best grades school ?,get best grades school ?,1,0.0,0.0,0,1.0
271127,broke girlfriend want back . ?,"broke girlfriend three months back prepared lifelong commitment . want back , ?",1,0.0,0.0,50,0.8780487804878049
271128,happened new year ’ eve bangalore ?,exactly happened 2017 new year 's eve bengaluru ? could causes ?,1,0.0,0.0,32,0.7441860465116279
271129,learn use unix online ?,use unix online ?,1,0.0,0.0,6,0.9090909090909091
271130,much cost start news tv channel india ?,much would cost construct 800 sqft area rcc slab ?,0,0.0,0.0,31,0.8205128205128205
271131,good ways get rid belly fat ?,get rid belly fat ?,1,0.0,0.0,10,0.896551724137931
271132,"possible play pirated games playstation 4 ? , way without modifying system ?",possible play pirated games new xbox one ?,0,0.0,0.0,38,0.8571428571428571
271133,good japanese restaurants san francisco ?,"best french restaurant san francisco , ?",0,0.0,0.0,14,0.7878787878787878
271134,streaming kodi illegal germany ?,streaming kodi illegal ?,0,0.0,0.0,8,0.967741935483871
271135,many monthly hours dvd player used ?,many months take movie released dvd ?,0,0.0,0.0,19,0.8823529411764706
271136,views modi governments decision demonetize 500 1000 rupee notes ? affect economy ?,use demonetizing rs . 500 & rs . 1000 notes ?,1,0.0,0.0,58,0.7906976744186046
271137,men lower beings compared women ?,men treat women ?,0,0.0,0.0,18,0.6666666666666666
271138,"buy macbook air , macbook , macbook pro ?",buy macbook air macbook pro : india london ?,0,0.0,0.0,17,0.8387096774193549
271139,would react male friend asked blowjob ?,really want offer male best friend blowjob ?,0,0.0,0.0,23,0.8947368421052632
271140,individuals events history source pride colombia ?,individuals events history source pride germany ?,0,0.0,0.0,7,0.95
271141,reset gmail password highlighting recovery email option ?,reset gmail password n't remember recovery information ?,1,0.0,0.0,20,0.9047619047619048
271142,change facebook username ?,change facebook username ?,1,0.0,0.0,0,1.0
271143,'s like accidentally chop limb ?,painful lose limb could compared ?,0,0.0,0.0,26,0.7777777777777778
271144,"logging gmail previously , used see shva=1 url . see something like pli=1 . , reason change ?",way see mailing lists 'm subscribed gmail ?,0,0.0,0.0,73,0.7272727272727273
271145,first question quora ?,ask first question quora ?,1,0.0,0.0,4,0.9629629629629629
271146,advantages disadvantages thermal power plants ?,thermal power plant chhattisgarh ?,0,0.0,0.0,37,0.9142857142857143
271147,"difference powerlifter , bodybuilder , strongman crossfit trainer ?",subtle difference following two sentences ?,0,0.0,0.0,50,0.8717948717948718
271148,narendra modi think arvind kejriwal ?,aap claiming narendra modi scared arvind kejriwal ?,0,0.0,0.0,19,0.8333333333333334
271149,australian senate ?,australian senate ?,1,0.0,0.0,0,1.0
271150,best foods eat jaundice ?,best food eat family ?,0,0.0,0.0,7,0.7586206896551724
271151,'s best perfume men ?,best branded perfume men ?,1,0.0,0.0,9,0.8888888888888888
271152,make great tacos ?,make amazing tacos ?,1,0.0,0.0,7,0.8461538461538461
271153,happens miss gcse results day ?,"would happen never looked mirror , one day ?",0,0.0,0.0,28,0.7567567567567568
271154,’ like working goldman sachs ?,working goldman sachs ?,1,0.0,0.0,7,0.9411764705882353
271155,know love ?,know love ?,1,0.0,0.0,0,1.0
271156,boxer rebellion ?,started boxer rebellion ?,0,0.0,0.0,8,0.8333333333333334
271157,best quickest way download whole playlist videos youtube ?,song played following video ?,0,0.0,0.0,41,0.7567567567567568
271158,true 're physically born `` females '' ?,true 're females womb ?,1,0.0,0.0,23,0.7777777777777778
271159,know many people search one exact keyword google play every day ( week/month ) ?,search perfect keywords one-way taxi services ad google ?,0,0.0,0.0,54,0.851063829787234
271160,"n't file police report car accident happened month ago . insurance company wo n't pay damage , ?",n't get money paid year worth car insurance n't get accident year ?,0,0.0,0.0,60,0.9090909090909091
271161,views modi governments decision demonetize 500 1000 rupee notes ? affect economy ?,n't think modi repeal decision ban 500 1000 notes cause high inconvenience ?,1,0.0,0.0,52,0.8163265306122449
271162,stop pug/cavalier mix humping furniture ?,stop labrador/pug mix humping pillows ?,1,0.0,0.0,21,0.8292682926829268
271163,improve pronunciation english ?,improve pronunciation english ?,1,0.0,0.0,0,1.0
271164,best washing machine service center hyderabad located ?,best washing machine service center hyderabad ?,1,0.0,0.0,8,0.9473684210526315
271165,quickbooks support phone number los angeles ?,best intuit quickbooks support plans ?,1,0.0,0.0,31,0.918918918918919
271166,minimum internet speed required stream 4k video youtube ?,netflix streaming work well internet speed ? much better website videos like youtube ?,0,0.0,0.0,47,0.8
271167,defective interest getting married ?,'m love best friend ?,0,0.0,0.0,24,0.7741935483870968
271168,lose fat month without going gym lifting weights ?,lose weight without going gym ?,1,0.0,0.0,24,0.9375
271169,think daily habits relates health ?,"software engineer , find hard maintain daily routine ?",0,0.0,0.0,40,0.7428571428571429
271170,"win 2015 ipl , rcb , csk mi ?","going win ipl 2015 , csk mi ?",1,0.0,0.0,12,0.8888888888888888
271171,audio technica m30x casual listening ?,"bought audio technica m40x headphones , satisfied output . need burn-in , listen high quality audio files , need headphone amplifier overcome low volume ?",0,0.0,0.0,121,0.7346938775510204
271172,cyrus mistry removed tata group ?,ratan tata remove cyrus mistry ?,1,0.0,0.0,22,0.875
271173,possible cops trace lost mobile using imei number even sim card taken ?,mobile stolen . possible thief change imei number using software ?,0,0.0,0.09090909090909094,42,0.8292682926829268
271174,worst thing ever done someone ?,worst thing ever school ?,0,0.0,0.0,10,0.8666666666666667
271175,lose weight ?,would realistic plan lose weight ?,1,0.0,0.0,21,0.7586206896551724
271176,typhoons formed ?,typhoons originate ? formed ?,1,0.0,0.0,12,0.9032258064516129
271177,unusual different food cuisine nepal ?,unusual different food cuisine turkey ?,0,0.0,0.0,6,0.9090909090909091
271178,tech lovers new york ?,new york hate new jersey ?,0,0.0,0.0,16,0.8275862068965517
271179,life hard ?,life hard understand ?,0,0.0,0.0,11,0.8333333333333334
271180,women actually like dick pics ?,epic advertisement scam pics ?,0,0.0,0.0,21,0.75
271181,whey protein considered vegan ?,whey protein vegetarian ?,1,0.0,0.0,12,0.9090909090909091
271182,possible go anonymous real life well ?,kind ruined training well internship required upcoming 7th semester ( 1 credit point ) . college going start days . could possibly ?,0,0.0,0.05555555555555558,113,0.7391304347826086
271183,learn digital marketing ?,good ways learn become best digital marketer ?,1,0.0,0.0,25,0.8125
271184,difference chocolate truffles ?,difference chocolate truffles made ?,1,0.0,0.0,5,0.9696969696969697
271185,antisemitism still exists nowadays ?,antisemitism still prevalent world ?,1,0.0,0.0,14,0.8387096774193549
271186,lottery usa green card really work ?,green card ( diversity visa ) lottery work ?,1,0.0,0.0,30,0.8648648648648649
271187,beneficial believe god ?,necessary believe god ?,1,0.0,0.0,8,0.8666666666666667
271188,work faster ?,work faster pc ?,0,0.0,0.0,3,0.9166666666666666
271189,differences larceny robbery ?,'s difference larceny robbery ?,1,0.0,0.0,4,0.967741935483871
271190,america danger ?,trump 's win going affect china ?,0,0.0,0.0,26,0.6666666666666666
271191,good usb c headphones available india work oneplus 2 ?,birth certificate alias name mother passport ? po ready issue passport due problem register office ready,0,0.0,0.0,83,0.8095238095238095
271192,catherine great enlightenment ?,catherine great support enlightenment ?,1,0.0,0.0,8,0.8666666666666667
271193,learn motosports photography ?,learn professional photography ?,0,0.0,0.0,9,0.9032258064516129
271194,circle important apache tribe symbol ? mean ?,butterfly important apache tribe symbol ? mean ?,0,0.0,0.0,7,0.9444444444444444
271195,masturbation really reduce sperm count ?,masturbation causes low sperm count ?,1,0.0,0.0,12,0.9142857142857143
271196,change credit rating agency 2nd year review india ?,like work credit rating agency ?,0,0.0,0.0,31,0.8125
271197,advantages disadvantages hydraulic system application ?,oil used hydraulic system ?,0,0.0,0.0,33,0.8888888888888888
271198,ok 18 year old sex 27 28 year old guy ?,okay date 22 year old guy 'm 18 ?,0,0.0,0.0,21,0.8333333333333334
271199,cigarettes go bad ?,cigarettes go stale ?,0,0.0,0.0,4,0.88
271200,make lot money selling t-shirts ?,become billionaire selling t-shirts ?,1,0.0,0.0,14,0.8823529411764706
271201,apply canada express entry crs score 420 ?,applying canadian express entry . 426 points . chances ?,0,0.0,0.0,25,0.85
271202,vhdl assignment operator ?,learn vhdl coding ?,0,0.0,0.0,21,0.8387096774193549
271203,n't know much paintings . paintings look simple worth millions ? started making ?,people make awesome crazy looking paintings ? comb paints different directions together ?,0,0.0,0.0,66,0.8444444444444444
271204,x-labs ?,like lab manager ?,0,0.0,0.0,13,0.5
271205,best way tell mom act age ?,study subjects first year college india ?,0,0.0,0.0,30,0.7272727272727273
271206,top hackers recover deleted third party encrypted whatsapp/ sms messages ?,top hackers recover deleted third party encrypted whatsapp/sms messages ?,1,0.0,0.0,1,1.0
271207,indifferent people think ?,stop caring much people think ?,1,0.0,0.0,14,0.75
271208,use whatsapp ?,use whatsapp ?,1,0.0,0.0,0,1.0
271209,mute questions contain particular text quora ?,way mute questions certain keywords quora ?,1,0.0,0.0,20,0.8
271210,good dares texting ?,good text book lawyer ?,0,0.0,0.0,16,0.7142857142857143
271211,get sugar daddy ?,become sugar daddy ?,0,0.0,0.0,5,0.8
271212,good workout routine 16 year old overweight ?,"good 15 year old ( 75kg ) workout routine , build muscle ?",0,0.0,0.0,38,0.7391304347826086
271213,easiest way make money ?,make money ?,0,0.0,0.0,12,0.8181818181818182
271214,word `` abasement '' used sentence ?,word `` admonished '' used sentence ?,0,0.0,0.0,9,0.9142857142857143
271215,would happen president obama declared martial law ?,would happen president tried take entire government declaring martial law ?,1,0.0,0.0,29,0.9
271216,best road trips done india ?,best road trip destinations india ?,1,0.0,0.0,10,1.0
271217,remove vocals song make instrumental ?,remove vocals song ?,1,0.0,0.0,18,0.8666666666666667
271218,complete procedure apply indian passport list required documents ?,documents required indian passport ?,1,0.0,0.0,41,0.9411764705882353
271219,primary complex show abnormality high rbc count less hemoglobin ?,complex number represent entire image pixel image ?,0,0.0,0.0,48,0.9230769230769231
271220,difference senior section engineer junior engineer railway exam ?,main differences physicists engineers ?,0,0.0,0.0,45,0.7894736842105263
271221,best sites downloading movies ?,best site 300mb movies download ?,0,0.0,0.0,19,0.9090909090909091
271222,lace bean boots ?,best way way tie bean boots ?,0,0.0,0.0,14,0.782608695652174
271223,comes mind hear word office ?,comes mind hear word gentleman ?,0,0.0,0.0,8,0.875
271224,barn owls screech night ?,barn owls screech ?,1,0.0,0.0,6,0.896551724137931
271225,christmas island ?,christmas island ?,0,0.0,0.0,0,1.0
271226,today 's dow jones industrial average ?,dow jones industrial average ?,1,0.0,0.0,9,0.9444444444444444
271227,measures awareness take prevent accident caused lighting strike specially countries like bangladesh ?,"provocative marketing campaigns known succeed , measured brand awareness metrics ?",0,0.0,0.0,79,0.9090909090909091
271228,school board best india ?,best school board india ?,1,0.0,0.0,10,1.0
271229,main development chhattisgarh ?,major development chhattisgarh ?,1,0.0,0.0,3,0.972972972972973
271230,much profit poultry farms india ?,goat farming profitable business india ?,0,0.0,0.0,24,0.8333333333333334
271231,commercial subsistence agriculture ? differ ?,differences subsistence commercial agriculture ?,1,0.0,0.0,29,1.0
271232,happens play full-hd video phone resolution 720p ?,videos available 4320p hd resolution ?,0,0.0,0.0,29,0.8372093023255814
271233,beginner matlab programming . difference two operations `` rem '' `` mod '' ? functionally different ?,function two different name saved python file giving different results unable find difference . seeing ?,0,0.0,0.0,85,0.9166666666666666
271234,vmware hire computer engineering freshers india members technical staff software engineers ? two better paid ?,get job nasa india ?,0,0.0,0.0,95,0.6857142857142857
271235,products cost $ 10 buy supplier sell $ 60 ?,cost fix cello buy one ?,0,0.0,0.0,32,0.7058823529411765
271236,"matt damon like , person ?",review matt damon ( actor ) ?,0,0.0,0.0,18,0.6875
271237,travel agency good thomas cook cox kings international travel terms budget comforts ?,new create using plastic waste ?,0,0.0,0.0,68,0.6842105263157895
271238,much cost buy coke yemen ?,much cost buy coke são tomé príncipe ?,0,0.0,0.0,15,0.8235294117647058
271239,derive mr mc approach tr tc approach producer equilibrium ?,demand money derived demand ?,0,0.0,0.0,47,0.6666666666666666
271240,uses numerical analysis computer science ? specific applications ?,applications numerical methods computer science ?,1,0.0,0.0,42,0.8823529411764706
271241,measures used nominate g20 ?,commonly used tools measure density ?,0,0.0,0.0,25,0.8125
271242,make think liked became `` committed '' ?,russians think english language ?,0,0.0,0.0,32,0.6451612903225806
