id,question1,question2,is_duplicate,CosineSimilarity,JaccardSimilarity,Levenshtein,DiceSimilarity
76860,see question google telephone interview ( google docs ) listen interviewer get question ?,"google interviews , candidate , telephone interview tested general concepts irrespective areas interest make questions based areas interest chose recruiter ?",0,0.0,0.0,103,0.8444444444444444
76861,multimonitor graphic card ?,", species , obsessed intelligence rating people based perceived intelligence ?",0,0.0,0.0,64,0.7647058823529411
76862,earn back money lost shares ?,mother cheating father . ?,0,0.0,0.0,22,0.7096774193548387
76863,suspensory ligament ? function ?,function suspensory ligaments ?,1,0.0,0.0,20,1.0
76864,"since joining metallica , james hetfield taken guitar lessons ?",james hetfield ?,0,0.0,0.0,47,0.7647058823529411
76865,anyone conservative would willing constructive conversation political beliefs ?,believe world end ?,0,0.0,0.0,65,0.7272727272727273
76866,"could represent single object , would object ? ?",energy universe transferred single object ? affect everything else ? ( given wo n't explode . ),0,0.0,0.0,67,0.7659574468085106
76867,"’ delete quora account , ?",unsubscribe delete quora account ?,1,0.0,0.0,13,0.8387096774193549
76868,become viewed writer quora least amount time without spamming low quality answers ?,viewed writer ever quora ?,0,0.0,0.0,61,0.7222222222222222
76869,spy whatsapp pc ?,'s best app spy wife 's whatsapp bbm chat messages ?,0,0.0,0.09090909090909094,36,0.7407407407407407
76870,overcome writer 's block ?,overcome writer 's block ? ( songwriting ),1,0.0,0.0,16,0.8888888888888888
76871,best coaching mp psc ?,best coaching mp psc ?,1,0.0,0.125,0,1.0
76872,attracts smart men ?,attracts women men ?,0,0.0,0.1428571428571429,5,0.9090909090909091
76873,happened katrina kaif 's stardom ?,n't katrina kaif 's films well ? exactly happened career ?,1,0.0,0.0,39,0.8421052631578947
76874,fix external hdd fails initialize ? gives data error ( cyclic redundancy check ) time try fix .,fix java error ?,0,0.0,0.0,81,0.5405405405405406
76875,relationship client server ?,difference server client ?,0,0.0,0.0,22,0.7857142857142857
76876,cheapest best way travel throughout europe ?,cheapest way travel europe ?,0,0.0,0.125,16,0.9411764705882353
76877,deal jealous friends ?,deal jealous wife ?,0,0.0,0.0,6,0.8888888888888888
76878,become successful college ?,tips well college ?,1,0.0,0.0,14,0.6666666666666666
76879,tinder work ?,tinder grow fast ?,0,0.0,0.0,8,0.8
76880,tips men tinder ?,tinder hacks men india ?,0,0.0,0.0,12,0.8
76881,like major sociology ?,sociology good major ?,0,0.0,0.0,19,0.896551724137931
76882,food allergy ?,like food allergies jail ?,0,0.0,0.0,13,0.8
76883,masters computer science networking degree germany ?,trunking protocols use trunk link two cisco switches ?,0,0.0,0.0,46,0.8333333333333334
76884,try work two companies ?,work two companies simultaneously ?,1,0.0,0.0,19,0.9411764705882353
76885,happens real estate prices self-driving cars ?,would happen ran front self-driving car ?,0,0.0,0.0,22,0.9230769230769231
76886,would happen indonesia america declared war china ?,would war us china play ?,0,0.0,0.0,34,0.9090909090909091
76887,donald trump become president ?,donald trump win vote ?,1,0.0,0.125,14,0.8484848484848485
76888,health benefits coffee ?,health benefits drinking coffee ?,1,0.0,0.0,9,0.875
76889,many people ask questions quora easily answered number legitimate sources web ? heard google bing ?,people bother ask questions quora could google get answer ?,1,0.0,0.0,65,0.9545454545454546
76890,feel airbag hits face ?,feel airbags deploy accident ?,0,0.0,0.0,13,0.8125
76891,"document accepted format : pdf , max size per page 300kb ?",heal psychological damage done bullying ?,0,0.0,0.0,47,0.6976744186046512
76892,toughest interview question ever asked ?,best puzzling question ever asked interview ?,1,0.0,0.11111111111111116,23,0.8717948717948718
76893,hillary clinton corrupt average politician ?,people think hillary clinton corrupt ?,0,0.0,0.0,32,0.9090909090909091
76894,mistake regret ?,regret ?,1,0.0,0.0,8,0.7058823529411765
76895,names teenage mutant ninja turtles ? color bandana wear ?,kind pizza teenage mutant ninja turtles eat ?,0,0.0,0.0,27,0.8108108108108109
76896,dog food brand best yorkie puppies ?,best brand puppy food bulldogs ?,1,0.0,0.125,24,0.9142857142857143
76897,causes black diarrhea ?,might cause yellow watery diarrhea vomiting ?,0,0.0,0.0,27,0.7058823529411765
76898,best lyrics bollywood ?,best soulful lyrics bollywood ?,0,0.0,0.1428571428571429,8,0.9333333333333333
76899,new invention mechanical engineering usa ?,greatest mechanical engineering invention time ?,0,0.0,0.0,25,0.9411764705882353
76900,improve power factor circuit ?,improve power factor ?,0,0.0,0.0,8,0.9655172413793104
76901,difficult score 65 % marks pune university engineering field . valuable suggestions score well ?,difficult score distinction university pune ?,1,0.0,0.0,62,0.7727272727272727
76902,safety precautions handling shotguns proposed nra north carolina ?,safety precautions handling shotguns proposed nra massachisetts ?,1,0.0,0.0,13,0.9743589743589743
76903,best things life n't scale ?,best things life ?,0,0.0,0.1428571428571429,10,0.8888888888888888
76904,google actually replacing nexus pixel ?,google replacing nexus pixel ?,1,0.0,0.0,9,0.9375
76905,repair corrupted usb drive ?,offer b- tech architect ghana ?,0,0.0,0.0,25,0.6666666666666666
76906,make money make money ?,earn money ?,1,0.0,0.0,13,0.8888888888888888
76907,people concerned trump presidency ?,main concerns trump presidency ?,1,0.0,0.0,8,0.9375
76908,donald trump win elections ?,donald trump win 2016 us presidential election ?,1,0.2572987877996148,0.09090909090909094,22,0.8947368421052632
76909,good strategy board games ?,good strategy risk ( board game ) ?,0,0.0,0.0,9,0.8666666666666667
76910,countries south america ?,many countries south america ?,1,0.0,0.0,5,0.9655172413793104
76911,get job mechanical engineers australia 1 year experience india & applying visa subclass-489 ?,"'m software engineer 1.5 years experience mobile application development , specifically windows phone application . apply jobs india ? necessary hire agent ?",0,0.0,0.0,117,0.7931034482758621
76912,campus bits pilani best ? ?,"best dancer bits , pilani - pilani campus ?",0,0.0,0.125,26,0.875
76913,set business page facebook ?,change category facebook fan page ?,0,0.0,0.0,26,0.8125
76914,‘ roger ’ still used uk mean ‘ sex ’ ?,get eth zurich phd computer science ?,0,0.0,0.0,29,0.7222222222222222
76915,voltmeter reading ?,voltmeter ?,0,0.0,0.0,8,0.782608695652174
76916,think important life ?,mportant life ?,1,0.0,0.0,7,0.9285714285714286
76917,improve sex drive ?,increase sex drive ?,1,0.0,0.0,5,0.75
76918,helpful digital marketing course ?,best digital marketing course online beginner ?,1,0.0,0.09999999999999998,22,0.8947368421052632
76919,blacks whites equal usa ?,race iranian/persian people belong ?,0,0.0,0.0,27,0.6
76920,light move ?,light moves ?,1,0.0,0.0,1,0.9565217391304348
76921,best ways deal menstrual cramps ?,menstrual cramps gases treated ?,0,0.0,0.0,23,0.875
76922,cow blood used making chocolate milk ?,male milking cows ?,0,0.0,0.0,26,0.8484848484848485
76923,think modi government banning 500 & 1000 currency note 9th november ?,balaji viswanathan 's take 500 & 1000 rupees currency notes ban india ?,1,0.0,0.0,45,0.8235294117647058
76924,dnc committee chair debbie wasserman schultz fired ? power remove deemed bad job ?,debbie wasserman schultz stripped role dnc convention ?,0,0.0,0.0,45,0.9545454545454546
76925,britney spears converted islam ?,led downfall britney spears ?,0,0.0,0.0,26,0.8571428571428571
76926,cloverfield love hate film ?,big boss polarizing show people either completely hate completely love ?,0,0.0,0.0,55,0.7222222222222222
76927,best teacher nit warangal ?,best teacher nit warangal ?,1,0.0,0.125,0,1.0
76928,objects one natural frequency ?,many natural frequencies object ?,0,0.0,0.0,20,0.9444444444444444
76929,scrabble download windows 7 ?,download windows 7 home basic drivers 32-bit ?,0,0.0,0.0,34,0.8108108108108109
76930,font used luke cage title sequence ?,font used kickstarter logo ?,0,0.0,0.0,20,0.9411764705882353
76931,senior cat eating ?,"senior cat eating , ?",0,0.0,0.0,2,0.96
76932,animals consciousness self awareness ?,animals consciousness and/or free ?,1,0.0,0.0,11,0.9032258064516129
76933,seen ads digital profit course . real fake ?,digital profit courses real fake ?,1,0.0,0.0,11,0.9444444444444444
76934,"quora country , would like ?","quora country , would look like ?",1,0.0,0.0,5,1.0
76935,best coaching institute ugc-net preparation political science ?,best coaching institute net/jrf exam political science delhi ?,0,0.0,0.08333333333333337,20,0.8292682926829268
76936,holocaust many jews died auschwitz ?,many jews murdered holocaust ?,0,0.0,0.0,23,0.918918918918919
76937,instagram ( product ) : know visits instagram profile ?,know views instagram profile ?,1,0.0,0.0,27,0.8571428571428571
76938,would happen walked moon without spacesuit ?,could create planet would like ?,0,0.0,0.0,29,0.8823529411764706
76939,many people us classic cars 2014 ?,dad va wants give car california . better `` buy '' car low value gift ?,0,0.0,0.0,57,0.6190476190476191
76940,mean commit suicide dream ?,repetitive dreams mean ?,0,0.0,0.0,20,0.8148148148148148
76941,motor used refrigerator ?,refrigerator work ?,0,0.0,0.0,16,0.7692307692307693
76942,"rank website , fair time frame , industry highly competitive ? special activity/task needs considered ?",make website allows user upload file subdomain ? file needs converted pdf doc . choose asp.net drupal ?,0,0.0,0.0,80,0.8979591836734694
76943,charge fuel surcharge paying credit/debit cards india ?,much fuel surcharge applicable use credit card pay ?,0,0.0,0.0,28,0.9230769230769231
76944,theist 's opinion bill maher ?,bill maher 's opinion hinduism ?,0,0.0,0.0,19,0.9090909090909091
76945,get back original skin colour ? tanned .,remove sun tan skin back original skin ?,1,0.0,0.0,30,0.8888888888888888
76946,"[ math ] ( 4,2 ) [ /math ] [ math ] ( 6,18 ) [ /math ] lie line perpendicular [ math ] 2x+ay=14 [ /math ] , value [ math ] [ /math ] ?",wilrussia us trigger nuclear war syria internet ?,0,0.0,0.0,113,0.5217391304347826
76947,speak english fluently ? ) ?,speak english fluently within short period time ?,1,0.0,0.0,23,0.8421052631578947
76948,christianity polytheistic ?,christian ?,0,0.0,0.0,16,0.8
76949,mbas work technology companies ? specializations ?,steps involved mechanical separation ?,0,0.0,0.0,31,0.7894736842105263
76950,treatment anal fissures ?,"poop toxic , n't anal fissure kill make ill ?",0,0.0,0.0,27,0.7878787878787878
76951,many six digit numbers formed using digit 1 2 3 4 5 6 without repetation number divisible unit digit ?,"many 4 digit numbers divisible 6 formed using digits 0,1,2,3,4,5 repetition allowed ?",0,0.0,0.0,58,0.9310344827586207
76952,letv le 1s ( eco ) good smartphone ?,good alternates letv le 2 ?,0,0.0,0.0,30,0.7647058823529411
76953,cost renal function test ( kidney ) mumbai ?,cost cortisol mumbai ?,0,0.0,0.0,26,0.7647058823529411
76954,ways lose 20 lbs four months ?,best ways lose weight ?,0,0.0,0.125,21,0.7272727272727273
76955,best candy country ?,country best candy ?,0,0.0,0.1428571428571429,15,1.0
76956,"best hair length cool , spiky hair ?",best hair length dark red hair ?,0,0.0,0.11111111111111116,11,0.8235294117647058
76957,name song reggae ? everybody jumping music love ?,"lyrics samantha fox 's song , `` music food love '' ?",0,0.0,0.0,39,0.7727272727272727
76958,differences apache kafka rabbitmq ?,apache kafka work ?,0,0.0,0.0,20,0.6666666666666666
76959,could germany wwii invaded ussr declared war america ?,helo ?,0,0.0,0.0,50,0.4166666666666667
76960,like play fantasy football nate silver ?,play yahoo fantasy football free ?,0,0.0,0.0,18,0.875
76961,review information ?,review information matrix ?,0,0.0,0.0,7,0.9629629629629629
76962,"15-year-old , social anxiety disorder ?","21 years-old student living egypt , suffer social anxiety disorder . doctor willing help contact ?",0,0.0,0.0,62,0.782608695652174
76963,see pm2.5 ?,pollution : interior voc pm2.5 levels universities compare inside home inside buildings ?,0,0.0,0.0,80,0.5454545454545454
76964,care much people think ?,stop affected people think ?,1,0.0,0.0,11,0.8125
76965,dc++ speed low ?,stuff download dc leaving iit ?,0,0.0,0.0,25,0.6428571428571429
76966,empirical data evidencing claim patriarchy oppresses women liberal western countries ?,empirical data claim patriarchy oppresses women liberal western countries ?,0,0.0,0.07692307692307687,11,0.9523809523809523
76967,recover conversation deleted whatsapp messages ?,ice fall ?,0,0.0,0.0,41,0.5185185185185185
76968,cant fresh-water animals survive salt water ?,ammonium salts soluble water ?,0,0.0,0.0,30,0.7878787878787878
76969,become like minato ?,"download movie extra torrent , would cyber crime india ?",0,0.0,0.0,44,0.7272727272727273
76970,get poptropica money maker free ?,get free money tapped ?,0,0.0,0.0,17,0.8666666666666667
76971,best online drawing course ?,online courses take guarantee get job finish course ?,0,0.0,0.0,35,0.8333333333333334
76972,examples alkalis ?,examples alkali ?,1,0.0,0.0,1,1.0
76973,feel like kissed hard ?,keep simple security ( kiss ) ?,0,0.0,0.0,21,0.5714285714285714
76974,individual family business togo today prepare adapt coming impacts climate change ?,individual family business sweden today prepare adapt coming impacts climate change ?,0,0.0,0.0,6,0.9777777777777777
76975,right partner ?,partner right ?,0,0.0,0.0,12,1.0
76976,suitable inpatient drug alcohol rehab center near hancock county ia ?,suitable inpatient drug alcohol rehab center near henry county ia ?,0,0.0,0.0,5,0.9743589743589743
76977,value indian rupee increase ban 500 1000 rupee notes ?,benefits ban 500 1000 rupees note ?,1,0.0,0.0,24,0.8648648648648649
76978,gurus currently marketing industry saying something really new future communication planning ?,"market software product ? marketing plan ? target audience education industry , real estate hospitals .",0,0.0,0.0,78,0.9565217391304348
76979,get really cheap orchids online ?,get google business listing code phone number rather post mail ?,0,0.0,0.0,47,0.8888888888888888
76980,blame happening syria ?,blame situation syria ?,1,0.0,0.0,8,0.8
76981,stop terrorism permanently root ?,stop terrorism permanently ?,1,0.0,0.0,5,1.0
76982,know girl virgin ?,guy know girl virgin ( ) sex first time ?,0,0.2563878268576187,0.0,23,0.6875
76983,best video production company miami ?,best video production company miami ?,0,0.0,0.11111111111111116,0,1.0
76984,teams finals cricket world cup 2015 ?,going final cricket world cup 2015 ?,1,0.0,0.0,6,0.9333333333333333
76985,"atheist jews believe promised land tradition , purely religious ?",`` co+build '' good name company ? ( particularly question `` + '' ),0,0.0,0.0,58,0.75
76986,homosexuality manisfestation behavior since feeling attraction require sex people gender ?,"since exponential curves n't actually `` knee '' , people refer technological singularity happening `` knee curve '' ?",0,0.0,0.0,90,0.8333333333333334
76987,shy naked front men ? ?,"gym , exercises commonly done men avoided women ?",0,0.0,0.125,37,0.6470588235294118
76988,masala bonds works returns ?,bonds work ?,0,0.0,0.0,16,0.7692307692307693
76989,find seo projects ?,seo ?,0,0.0,0.0,14,0.5263157894736842
76990,much time take update aadhaar details online ?,many days take update aadhaar data online ?,0,0.0,0.0,11,0.9444444444444444
76991,learn machine learning ?,children primary school learn programming - yes/no ? ?,0,0.0,0.0,36,0.7741935483870968
76992,minimum tds level drinking water maximum ro system ?,many tds required safe drinking water ?,0,0.0,0.0,33,0.8421052631578947
76993,similar platform quora spanish speakers ?,"spanish language website , app service similar quora ?",1,0.0,0.0,40,0.8
76994,favorite band snow patrol probably almost done recording new album think new single ?,metallica working new album ?,0,0.0,0.0,62,0.8292682926829268
76995,"better bpharm degree india , mpharm mba ?",bpharm mpharm join iit ?,0,0.0,0.0,28,0.7857142857142857
76996,"forgot change political party democrat , still vote democrat nc primaries ?",democratic party dying ?,0,0.0,0.0,57,0.8333333333333334
76997,", sometimes , head hurts work feel tired eventhough 've slept 9 hours ?","feel light-headed giddy , sometimes several days particularly intense 30 minute weight lifting exercise ?",0,0.0,0.0,75,0.8235294117647058
76998,'s best way write essay ?,ca n't write good essay ?,1,0.0,0.0,14,0.7857142857142857
76999,proof existence aliens ? anyone seen aliens ?,actual proof aliens ?,1,0.0,0.0,31,0.9032258064516129
77000,start linux system ?,start linux system ?,1,0.0,0.0,0,1.0
77001,get foreign friends ?,want find foreign friends . ?,0,0.0,0.0,10,0.8888888888888888
77002,indian population engineers ?,percentage people india speak english ?,0,0.0,0.0,27,0.875
77003,women wear makeup ?,important women wear makeup ?,1,0.0,0.125,10,0.9230769230769231
77004,best iphone 5s color men ?,take best iphone 5s ?,0,0.0,0.125,15,0.8
77005,facebook 's friend recommendation system work ?,type font system facebook recommend ?,0,0.0,0.0,35,0.8888888888888888
77006,put lock screen password samsung galaxy j5 working tried change password accepting password ?,"somebody tried login sbi account due 3 attempts got locked . security measure , locked internet access account . , went sbi unlock gave kit new password , n't work . ?",0,0.0,0.0,122,0.8
77007,"love country music , hate lyrics country songs . listen ?",listened punjabi song . lyrics something like `` love many times . '' information song ?,0,0.0,0.0,64,0.8085106382978723
77008,think modi 's new policy ban rs 500 rs 1000 notes ?,n't think modi repeal decision ban 500 1000 notes cause high inconvenience ?,1,0.0,0.0,46,0.8979591836734694
77009,impact gst different sectors ?,gst impact different sectors india ?,1,0.0,0.0,14,1.0
77010,easiest way learn laws india ?,best way go learning programming ? start easiest language first look one high demand ?,0,0.0,0.125,66,0.7428571428571429
77011,"many , couple , several ?",long `` couple years '' ?,0,0.0,0.0,14,0.8125
77012,open .hw6 files ?,open .z01 file ?,0,0.0,0.0,4,0.7407407407407407
77013,competitive hiring process teamhealth ?,expensive make bunker ?,0,0.0,0.0,28,0.6875
77014,would happen every woman dissapeared except one ?,would happen one woman earth ?,0,0.0,0.0,22,0.8333333333333334
77015,intuitively explain fact carnot cycle efficiency thermodynamic cycles ?,shear stress generate reaction ?,0,0.0,0.0,56,0.7058823529411765
77016,insert square root symbol microsoft word ?,"microsoft word , insert pi symbol ?",0,0.0,0.0,32,0.8717948717948718
77017,peter tchaikovsky gay ?,tchaikovsky homosexual ? know ?,1,0.0,0.0,22,0.7428571428571429
77018,bangladeshi hindu cricketers played bangladesh cricket team ?,hard fan bangladesh cricket team ?,0,0.0,0.0,31,0.8947368421052632
77019,common indian brand hydrocortisone cream ?,common brand names cimetidine india ? ones popular easily available otc ?,0,0.0,0.0,51,0.8571428571428571
77020,kind president would ted kennedy ?,5 best american presidents ?,0,0.0,0.16666666666666663,26,0.6451612903225806
77021,long ibuprofen take work ?,'s best way protect stomach regularly taking nsaid like ibuprofen ?,0,0.0,0.18181818181818177,53,0.8292682926829268
77022,one become better writer hindi ?,best ways become better writer communicator ?,0,0.0,0.11111111111111116,20,0.8
77023,best software learn communication engineer ?,best software mechanical engineer learn ?,0,0.0,0.11111111111111116,19,0.9444444444444444
77024,best possible way get away murder ?,kill someone get away ?,1,0.0,0.0,21,0.7878787878787878
77025,publish novel ?,one publish book ?,1,0.0,0.0,8,0.9230769230769231
77026,nafta affect canada ?,north american trade deal nafta good canada ?,1,0.0,0.0,29,0.72
77027,"'m student nyu , planning pursue careers consulting.what majors minors take ? 'm artsy person personality like ngo .",pharmacy people help mph degree ?,0,0.0,0.0,100,0.717948717948718
77028,best way make girl jealous ?,best way make girl constantly think ?,0,0.2228487582737612,0.2222222222222222,14,0.8648648648648649
77029,sentence examples using `` complacent '' ?,example `` complacent '' sentence ?,0,0.0,0.0,25,0.9090909090909091
77030,feel went skydiving first time ?,skydiving career ?,0,0.0,0.0,19,0.7741935483870968
77031,get rid acne caused stress ?,get rid pimples face ?,1,0.0,0.0,15,0.7857142857142857
77032,parents see nothing wrong evasion saying flat lie child asked difficult question ?,"might parents yell , threaten , spank rather use time deal child 's constant refusals ?",0,0.0,0.0,60,0.8695652173913043
77033,flash ( barry allen ) die ?,would happened barry saved younger self flash vs reverse flash fight home year 2000 ?,0,0.0,0.0,66,0.7
77034,top studies ?,top study ?,1,0.0,0.0,3,0.8421052631578947
77035,lte changed volte ?,difference 4g lte volte ? phone buy one volte 4g .,0,0.0,0.0,37,0.7058823529411765
77036,average intelligence level reddit askscience users ?,difference person average intelligence person genius intelligence ?,0,0.0,0.0,41,0.8823529411764706
77037,take modafinil adderall ?,take adderall mild adhd ?,0,0.0,0.0,15,0.8461538461538461
77038,best case studies design thinking successful ?,pictures added case study ?,0,0.0,0.0,34,0.6666666666666666
77039,much ritalin increases cortisol levels ?,decrease cortisol levels ?,0,0.0,0.0,16,0.8275862068965517
77040,meet people rio de janeiro foreigner ?,feel live rio de janeiro foreigner ?,0,0.0,0.0,7,0.8666666666666667
77041,verilog-a verilog-ams different ?,verilog-a verilog-ams utilized industry ?,0,0.0,0.0,13,0.8888888888888888
77042,good mechanical engineering seminar topics ?,third-year mechanical engineering student . seminar topics would help stand others ?,1,0.0,0.0,43,0.8717948717948718
77043,batman ever kill joker ?,joker ever die ?,0,0.0,0.0,14,0.72
77044,good ways get response time url jsp ?,get data servlets display jsp ?,0,0.0,0.0,22,0.8235294117647058
77045,safe cebu 22-year-old male backpacker ?,cebu safe visit/travel ?,1,0.0,0.0,28,0.6470588235294118
77046,many volts equal 1 kilowatt ?,many electrons would produce 1 amp current 1 second ?,0,0.0,0.0,38,0.7777777777777778
77047,turns people quora ?,dislike quora people ?,0,0.0,0.0,17,0.8148148148148148
77048,fairy tail official differ fairy tail ?,fairy tail differ fairy tail 2 ? fairy tail 2 sequel fairy tail ?,0,0.0,0.0,33,0.7857142857142857
77049,world end ?,world going end ?,1,0.0,0.0,6,0.9
77050,"vacuum energy appears expansion limit , infinite energy created ? yes energy infinite ?",since dark energy appears mean infinite potential dark energy created infinite ?,1,0.0,0.0,43,0.8780487804878049
77051,possible create new universe ?,could humans ever create new universe ?,1,0.0,0.0,14,0.8571428571428571
77052,global warming replaced climate change found global warming ?,global warming end climate change ?,1,0.0,0.0,27,0.918918918918919
77053,"best places visit things san diego , ca ?",best places visit san diego ?,1,0.0,0.11111111111111116,12,0.9411764705882353
77054,qualifications become ias ?,minimum qualifications ias ?,1,0.0,0.0,15,0.9333333333333333
77055,"gyms workout facilities : gain weight , goes straight butt thighs . best way work areas ?",best way lose weight : gym jogging ?,0,0.0,0.25,68,0.8095238095238095
77056,banning rs . 500 rs . 1000 notes help overcoming corruption india ?,would demonetization 500 1000 rupee notes actually help curbing black money india ?,1,0.0,0.0,53,0.88
77057,tips first time ld debater ?,last-minute tips first-time debater ?,0,0.0,0.0,16,0.9032258064516129
77058,main reasons pacific states territories opt “ lesser degrees independence ” ?,main reason india underdeveloped despite ( compared us & uk ) achieving independence 65 years ago ?,0,0.0,0.0,60,0.7111111111111111
77059,good ways 100 % working ways hack gmail account ?,gmail hacked ? ?,0,0.0,0.0,38,0.6470588235294118
77060,people ignore holy bible holy quran subject us must equal ?,"india , people made swear either holy books like bhagvad gita law procedures constitution like elected leaders oath ?",0,0.0,0.0,83,0.8444444444444444
77061,quora censor opinions answers ?,quora expect stay business censor many things ?,1,0.0,0.0,28,0.7647058823529411
77062,dan bilzerian get many girls ? money ?,joaquin phoenix get scar lip ?,0,0.0,0.0,28,0.6666666666666666
77063,famous kanpur ?,famous alumni hbti kanpur ?,0,0.0,0.0,12,0.8275862068965517
77064,edit 8 thumbnails chrome 's homepage ?,use chrome console edit run javascript ?,0,0.0,0.0,35,0.85
77065,myopia truly incurable without surgery ? ?,possible reduce myopia without surgery lasik ?,1,0.0,0.0,25,0.926829268292683
77066,tell woman likes guy ?,know woman likes ?,0,0.0,0.0,8,0.8571428571428571
77067,could modern army beat pokemon army ?,felicitation speeches considered motivational ?,0,0.0,0.0,37,0.7428571428571429
77068,australia considered part u.k ?,u.k viewed australians ?,0,0.0,0.0,24,0.8484848484848485
77069,donald trump win presidency ?,trump win america 's vote ?,1,0.2572987877996148,0.125,20,0.8571428571428571
77070,anne klein calvin klein related ?,calvin klein make tailored suits ?,0,0.0,0.0,22,0.8666666666666667
77071,universities gb minerals recruit new grads ? majors looking ?,universities compass minerals recruit new grads ? majors looking ?,0,0.0,0.0,7,0.9523809523809523
77072,realistically make money online ?,various ways one earn money online ?,1,0.0,0.0,17,0.8
77073,"really like girl , boyfriend . ?",dating advice : really like girl already boyfriend . ?,1,0.2410089835788803,0.0,23,0.8648648648648649
