id,question1,question2,is_duplicate,CosineSimilarity,JaccardSimilarity,Levenshtein,DiceSimilarity
136872,get ideas advertising products ( presentation ) ?,get ideas advertising products ?,1,0.0,0.0,17,0.9411764705882353
136873,top students manage time ?,ways top students manage time ?,1,0.0,0.0,5,0.9333333333333333
136874,kvpy sa expected cut 2016 ?,cut kvpy sa stream ?,1,0.0,0.0,20,0.75
136875,different backgroundsubtractormog2 opencv 2.4 opencv3 ?,stable opencv 3.0 beta ?,0,0.0,0.0,39,0.7
136876,density mixture o2 n2 ntp 1.3 g/l.calculate partial pressure o2 ?,cheapest daily parking nyc high line ?,0,0.0,0.0,53,0.7317073170731707
136877,characteristics local infections ?,steps take improve internet speed . rural area paying 12 mbs getting around 5 mbs . ?,0,0.0,0.0,65,0.5789473684210527
136878,korea 3rd world country ?,korea 3rd world country ?,0,0.0,0.0,0,1.0
136879,best diet lose 30 pounds month ?,like lose 30 pounds one month ?,1,0.0,0.0,12,0.9411764705882353
136880,crop circles originate ? logical explanation behind phenomenon ?,mystery behind crop circles ?,1,0.0,0.0,52,0.8888888888888888
136881,bike best india ?,best bike india short boys ?,0,0.0,0.0,17,0.8461538461538461
136882,become video game designer developer ?,one become video game designer developer ?,1,0.0,0.0,4,1.0
136883,would conor mcgregor fair muhammed ali ?,remove proxy-hijacker virus laptop ?,0,0.0,0.0,33,0.631578947368421
136884,"cheapest , painless , easiest way commit suicide ?",good reasons commit suicide ?,0,0.0,0.0,28,0.7647058823529411
136885,people hate cops ?,"stop urges want hatchet attack cops , people hate me/diss ?",0,0.0,0.0,44,0.6666666666666666
136886,effective writing tips ?,good writing tips ?,1,0.0,0.0,9,0.7692307692307693
136887,liberals think allegation hillary clinton maybe war hawk donald trump ?,hillary clinton war hawk ?,1,0.0,0.0,45,0.7777777777777778
136888,feel like women sex ?,sex feel like girl ?,1,0.0,0.0,13,0.75
136889,happens report account instagram person find ?,report spam delete instagram account ?,0,0.0,0.0,26,0.9142857142857143
136890,best additional courses mechanical engineers getting job ?,best additional course mechanical engineers ?,1,0.0,0.0,13,0.972972972972973
136891,computer science exam ( 12th board ) 27th maths 18th . strategy towards syllabus cs time score 100 ?,strategy score 90 % marks 12th class board exam 3 months cbse bord ?,0,0.0,0.0,69,0.7636363636363637
136892,c++ abstract machine ?,c++ good language machine learning ?,0,0.0,0.0,21,0.7333333333333333
136893,magnetic memorable communicator ?,magnetize rare earth magnets ?,0,0.0,0.0,20,0.7142857142857143
136894,best hadoop training institute chennai ?,best hadoop training center chennai ?,1,0.0,0.0,8,0.9696969696969697
136895,soft personality bad thing ?,every done good thing bad person feel ?,0,0.0,0.0,27,0.972972972972973
136896,barium sulfate dihydrate formula determined ?,formula hydrated barium chloride ? determined ?,0,0.0,0.0,25,0.9444444444444444
136897,best way reduce body weight ?,best ways lose weight ? best diet plan ?,1,0.0,0.0,24,0.8235294117647058
136898,endangered element mercury ?,elemental mercury really dangerous ?,0,0.0,0.0,24,0.9333333333333333
136899,get meth system asap ?,get meth system faster ?,1,0.0,0.0,4,0.8695652173913043
136900,much medical evidence support claim weed causes cancer ?,smoking weed cause cancer ?,1,0.0,0.0,33,0.8
136901,best environment fossils form ?,best model watch fossil brands ?,0,0.0,0.0,18,0.8125
136902,tall 'm 5 ' 8 12 1/2 ? 'm pretty healthy active .,well predict child 's ( adult ) height information parents ?,0,0.0,0.0,47,0.5909090909090909
136903,improve professional resume ?,build improve resume ?,1,0.0,0.0,16,0.8275862068965517
136904,donald trump potential good president ?,donald trump good president ?,1,0.0,0.0,10,1.0
136905,works carried assistant executive officer mechanical department ongc ?,steve ballmer 30th employee microsoft richer earlier 29 ?,0,0.0,0.0,49,0.7111111111111111
136906,views decision narendra modi discontinue use 500 1000 currency notes ?,opinion discontinuation 500 1000 rupee notes ?,1,0.0,0.0,35,0.8648648648648649
136907,create community ?,build community ?,1,0.0,0.0,6,0.7692307692307693
136908,whose win beneficial india-donald trump hillary clinton ?,"would better india , donald trump hillary clinton ?",1,0.0,0.0,18,0.9047619047619048
136909,may ’ mass surveillance declared illegal european court justice . pm theresa may accept abandon investigatory powers act ?,new york businesses vs california businesses ?,0,0.0,0.0,98,0.7441860465116279
136910,"good solar panel installation provider mar vista , california ca ?","good solar panel installation provider near meadow vista , california ca ?",0,0.0,0.0,9,0.9743589743589743
136911,exactly love ?,exact meaning love ?,1,0.0,0.0,8,0.8
136912,questions boys parents ask arranged marriage ?,questions ask arranged marriage boy ?,0,0.0,0.0,17,0.972972972972973
136913,access skype business online o365 account ?,"microsoft rebrand lync client `` skype business '' , remains separate platform skype ? n't confusing users ?",0,0.0,0.0,76,0.7441860465116279
136914,"bubble football bristol , bubble football ?",difficult play games like fifa 15 n't know play football ?,0,0.0,0.0,39,0.631578947368421
136915,pay icici credit card bill physical bank ?,pay electricity bill via state bank india without credit card ?,0,0.0,0.0,41,0.8947368421052632
136916,long marijuana stay urine ? get rid ?,long weed stay blood ?,1,0.16865199655948376,0.1428571428571429,23,0.7741935483870968
136917,develop android app using python ? new python well android .,constraints using python write android apps ?,0,0.0,0.0,36,0.8947368421052632
136918,mutual fund invest ?,mutual funds worth investment ?,0,0.0,0.0,11,0.875
136919,low power wireless communication technologies used wearables ?,subjects learn expert wireless communications ?,0,0.0,0.0,44,0.8717948717948718
136920,canada based firms providing revenue based financing ?,top 10 vc firms korea ( 2015 ) based deals sums invested ?,0,0.0,0.0,43,0.7727272727272727
136921,best way learn touch typing ?,'s best way learn touch type adult ?,0,0.0,0.0,10,0.8947368421052632
136922,'s difference studying iits/nits prestigious private colleges ?,difference iit renowned private college ?,1,0.0,0.0,28,0.8421052631578947
136923,would happen supply diesel petrol car vice versa ?,better buy petrol diesel car india ?,0,0.0,0.0,32,0.8888888888888888
136924,familiar essay ?,familiar essay look like ?,0,0.0,0.0,10,0.9166666666666666
136925,internet begging ?,begging dropped ?,0,0.0,0.0,14,0.8
136926,french parisians hate eiffel tower ever get sick ?,eiffel tower ?,0,0.0,0.0,36,0.6896551724137931
136927,good ways wash dog ?,wash dog ?,1,0.0,0.0,10,0.9473684210526315
136928,orcs tolkein 's world go death ?,orcs go mandos die ?,1,0.0,0.0,19,0.7741935483870968
136929,independency ?,independent taxes ?,0,0.0,0.0,7,0.7
136930,someone 's phone powered happens call ?,easy shut call forwarding cricket phone ?,0,0.0,0.0,34,0.7567567567567568
136931,green tea help reduce belly fat ?,green tea useful reducing fat ?,1,0.0,0.0,12,0.8125
136932,according varun dhawan overact ?,varun dhawan actually learn acting stop overacting ?,1,0.0,0.0,34,0.8888888888888888
136933,happen die ? thoughts ?,happens die ? ( human ),1,0.0,0.0,9,0.7857142857142857
136934,get girl ?,get girl get ?,0,0.0,0.0,4,1.0
136935,"spoiler alert ! ! ! movie , `` departed '' mark wahlberg ( dignam ) kill matt damon end ?",spoiler-alert ! ! criminal shown winning end movie drishyam ?,0,0.0,0.0,57,0.7916666666666666
136936,unlucky country ?,country unlucky one ?,1,0.0,0.0,13,0.9565217391304348
136937,pass ca ipcc 10 days ?,pass ipcc 10 days ?,1,0.0,0.0,3,1.0
136938,solve permutation problem repetition ?,solve permutation problem ?,0,0.0,0.0,11,1.0
136939,qualities great promotions team member ?,agile software development : excuses heard team member want scrum ?,0,0.0,0.0,46,0.7804878048780488
136940,'s ideology behind cracking games programs ?,cracked games uploaded torrent ?,0,0.0,0.0,33,0.8108108108108109
136941,"approximately , many hours work take write good book ?",long take write novel ?,1,0.13247227940072345,0.1428571428571429,37,0.7027027027027027
136942,best documentaries minoan culture history crete ?,best documentaries 2016 ?,0,0.0,0.0,28,0.8108108108108109
136943,marriage hard ? ?,marriage hard ?,1,0.0,0.0,2,1.0
136944,happens pawn reaches opposite end chessboard ?,many squares chessboard ?,0,0.0,0.0,27,0.75
136945,update android 2.3.6 newer version ?,update android version jelly bean 4.3 kitkat 4.4 samsung galaxy s3 phone ?,0,0.0,0.0,49,0.7111111111111111
136946,best escort service bangalore ?,best escort service provider bangalore ?,1,0.0,0.0,9,0.9375
136947,earn money online ?,realistically make money online ?,1,0.0,0.0,16,0.8461538461538461
136948,python saying code wrong ?,code wrong ?,0,0.0,0.0,14,0.7407407407407407
136949,'s dispute india pakistan sir creek ?,"strategic purpose border disputes china , india pakistan ?",0,0.0,0.0,42,0.8235294117647058
136950,thalamus processes information senses ?,risks injury thalamus ?,0,0.0,0.0,28,0.75
136951,tell going pursue agriculture mba iim interviews ? valid reason pursuing mba ?,pursue one year mba completing mba 5 years earlier ?,0,0.0,0.0,52,0.8717948717948718
136952,rock stars concert ?,makes good rock concert ?,0,0.0,0.0,13,0.88
136953,usually quant score test takers score 750 gmat ? also usually verbal score ?,score 740 gmat ?,0,0.0,0.0,61,0.7222222222222222
136954,learn speak english ?,'s best way learn english ?,1,0.0,0.0,14,0.7586206896551724
136955,control emotions ?,control emotions public ?,1,0.0,0.0,7,0.8888888888888888
136956,serverless computing ?,"soon serverless computing , like aws lambda , becomes norm ?",0,0.0,0.0,38,0.8421052631578947
136957,come brownfield capital netted $ 80m `` big short '' ?,"`` big short '' , mark baum takes call securitization forum , speaker comment `` must bank america '' ?",0,0.0,0.0,76,0.8163265306122449
136958,think ban rs . 500 rs . 1000 currency notes ?,think banning ₹500 ₹1000 notes ?,1,0.0,0.0,20,0.8108108108108109
136959,prevent acne ?,prevent acne simply home ?,0,0.0,0.0,12,0.7407407407407407
136960,indian civil engineering degree holder get job civil engineering company ?,civil engineer construction management master holder . currently working qms professional . get job coimbatore ?,0,0.0,0.0,76,0.851063829787234
136961,economics natural resource ?,natural resources ?,0,0.0,0.0,11,0.9230769230769231
136962,would best programming language diy learn today ?,best programming language learn ( opinion ) ?,1,0.0,0.0,20,0.8648648648648649
136963,useful channels magazine political science student ?,useful channels magazines political science student ?,1,0.0,0.0,1,1.0
136964,redmi note 4 launched india ?,xiaomi redmi note 3 launched india soon ?,0,0.0,0.0,13,0.8823529411764706
136965,south korean economic turnaround happen ?,would happen president obama got close south korean dmz `` rock guard '' ? would secret service defend ?,0,0.0,0.0,79,0.7906976744186046
136966,"produced number ones us - giorgio moroder , beegees quincy jones ?",many active phone numbers us ?,0,0.0,0.0,51,0.7368421052631579
136967,properly put condom ?,put condom ?,1,0.0,0.0,9,0.8333333333333334
136968,long distance relationship work ?,cope long distance relationship ?,1,1.0,0.6,10,0.9411764705882353
136969,recover forgotten hotmail password email ?,recover hotmail password ?,0,0.0,0.0,16,0.918918918918919
136970,best mario strategy super smash bros. 4 ?,best dr. mario strategy super smash bros. 4 ?,1,0.0,0.0,4,0.972972972972973
136971,many journal articles report statistical significance power ?,many journal articles eschew reporting power tests ?,0,0.0,0.0,32,0.95
136972,make brown grass green ?,fruit : make sure apple n't turn brown ?,0,0.0,0.0,28,0.7272727272727273
136973,use castor oil hair dandruff ?,castor oil used grow hair ?,0,0.0,0.0,17,0.875
136974,mahabharata really happen ?,mahabharat really happen ?,1,0.0,0.0,1,1.0
136975,led cyrus mistry ouster tata group ?,tata sons board voted remove cyrus mistry chairman ?,1,0.0,0.0,40,0.8
136976,deal unconscious anxiety ?,person deal unconscious anxiety ?,1,0.0,0.0,7,0.9375
136977,integrate travel api website ?,find top travel api integration company india ?,0,0.0,0.0,31,0.7272727272727273
136978,get mods gta v xbox one ?,transfer gta 5 character ps4 xbox one ?,0,0.0,0.0,23,0.6875
136979,improve pronunciation english ?,improve speaking ?,1,0.0,0.0,17,0.8125
136980,come comfort zone ?,break comfort zone ?,1,0.0,0.0,5,0.88
136981,improve english speaking skills ?,improve english grammar ?,0,0.0,0.0,14,0.967741935483871
136982,get kaththi english subtitles ?,get laddu babu movies english subtitles ?,0,0.0,0.0,15,0.8387096774193549
136983,cern lhc open portals dimensions ?,get fields dimension data source tableau ?,0,0.0,0.0,30,0.8235294117647058
136984,minerva schools kgi ?,minerva kgi ?,1,0.0,0.0,8,0.8148148148148148
136985,donald trump win despite projections would fail ?,donald trump win election ?,1,0.0,0.0,23,0.9142857142857143
136986,many people gather hornbill festival ?,people india really know celebrate festivals ?,0,0.0,0.0,28,0.8205128205128205
136987,soy milk dangerous ?,soy milk bad ?,1,0.0,0.0,8,0.7857142857142857
136988,question never asked quora yet ?,question asked quora ? find something ask quora ?,1,0.0,0.0,30,0.8235294117647058
136989,"uses different sorting algorithms like bubble , selection , insertion , shell , merge , heap , quick , tree , radix , counting bucket sort real-life scenarios ?",strategy quickly merges sort use ?,0,0.0,0.0,132,0.7619047619047619
136990,creative new year 's resolution 2017 ?,new years resolutions 2017 ?,1,0.0,0.0,12,0.9230769230769231
136991,best book mysql ?,best sites/books becoming mysql dba ?,0,0.0,0.0,20,0.7741935483870968
136992,stay goa ?,great places stay goa ?,1,0.0,0.0,13,0.7619047619047619
136993,looking opinions users salesforce chatter . productivity tool time-waster ?,"kolkata . would best option get certification aws , azure salesforce kolkata-based company ?",0,0.0,0.0,73,0.9019607843137255
136994,"weather orlando like june , differ weather january ?",weather orlando like june ?,0,0.0,0.0,25,0.9142857142857143
136995,pigs smart ?,intelligent pigs ?,0,0.0,0.0,14,0.7
136996,long take die stress ?,long take fly appear person dies ?,0,0.20845504774336318,0.125,17,0.9032258064516129
136997,germany continue allow unvetted refugees actual terror strikes happen ?,"donald trump president , fit pique really order nuclear strike denmark , would strike actually happen ?",0,0.0,0.0,69,0.9130434782608695
136998,would animated movies work ? developed ? content movie matters anime ?,get animation movie ideas ?,0,0.11580425761651532,0.0,49,0.75
136999,learn java home ?,learn java home ?,1,0.0,0.0,0,1.0
137000,okay dogs eat peanut butter ?,dogs eat peanut butter ? risks involved ?,1,0.0,0.0,22,0.8823529411764706
137001,true rape crisis sweden germany immigration refugees ?,caused sweden rape statistics rise significantly past years ?,0,0.0,0.0,45,0.918918918918919
137002,possible find job canada ?,possible find job canada india ?,0,0.0,0.0,6,1.0
137003,many mosquito bites take kill human ?,many times single mosquito bite human within 8 hours ?,0,0.0,0.0,30,0.8648648648648649
137004,create hovering text stays still scene camera moving ?,safe public wifi need logon using ?,0,0.0,0.0,39,0.6285714285714286
137005,read whatsapp messages computer ?,read someone whatsapp messages computer ?,0,0.0,0.0,8,0.9696969696969697
137006,mahesh babu ?,"better , ravi teja mahesh babu ?",0,0.0,0.0,19,0.75
137007,hans zimmer compose soundtrack ?,top 20 'personal favorite ' soundtracks hans zimmer ( 10 n't created 10 ) ?,0,0.0,0.0,58,0.8
137008,want alternative netflix wherein ratings impact titles suggested . video service well ?,want establish fair pay design team sites services best find competitive pay rates based title experience level ?,0,0.0,0.0,74,0.9130434782608695
137009,improve pronunciation english ?,best path take improve english ?,1,0.0,0.0,20,0.8888888888888888
137010,proxy class vector < bool > : :reference needed c++ ?,"need structure , powerful class c++ ?",0,0.0,0.0,37,0.75
137011,happened farmville 2 bonus collector ?,farmville 2 country escape losing popularity ?,0,0.0,0.0,34,0.8780487804878049
137012,one know something ?,know something everything ?,0,0.0,0.0,15,0.896551724137931
137013,'s difference blouse shirt ?,type bra lady wear blouse saree ?,0,0.0,0.0,20,0.6875
137014,best way study history ?,best way study history ?,1,0.0,0.0,0,1.0
137015,one learn play chess ?,one learn play chess ?,1,0.0,0.0,0,1.0
137016,address two people business letter ?,write business letter ( read details ) ?,0,0.0,0.0,31,0.875
137017,go mars ?,able travel mars ?,0,0.0,0.0,11,0.631578947368421
137018,proof hell exists ?,baptism children exist bible ?,0,0.0,0.0,18,0.7333333333333333
137019,girl marry indian army personnel ?,indian army : worry merit list tes 34 ?,0,0.0,0.0,28,0.7878787878787878
137020,best book gate preparation physics ?,best book preparing physics bitsat ?,0,0.0,0.0,16,1.0
137021,create timer send whatsapp messages automatically ?,way automatically forward whatsapp messages specific sender another number ?,0,0.0,0.0,47,0.9523809523809523
137022,mind blowing facts family ?,mind blowing facts family ?,0,0.0,0.0,0,1.0
137023,best textbooks neuropsychology ?,best book neuropsychology ?,0,0.0,0.0,5,0.9714285714285714
137024,yahoo : tell sent email received read ?,tell someone read email sent ?,1,0.0,0.0,25,0.8387096774193549
137025,forgot apple id email ?,"forgot apple id password , ?",0,0.0,0.0,10,0.8666666666666667
137026,husband like name abigail . would okay give daughter legal name abby ?,"could choose song play funeral summarize eulogy , would ?",0,0.0,0.0,53,0.7727272727272727
137027,top 10 dangerous cities us ? dangerous ?,dangerous us cities ? dangerous ?,1,0.0,0.0,13,0.9032258064516129
137028,best hotels rajasthan ?,best hotel rajasthan ?,1,0.0,0.0,1,1.0
137029,programmable shifter ?,programmable shifter ?,1,0.0,0.0,0,1.0
137030,best lesson learn life ?,'s important lesson 've learned life ?,1,0.0,0.0,17,0.8
137031,improve ability learn ?,speed learn ?,1,0.0,0.0,13,0.64
137032,start studying first semester b.com ( h ) srcc want score good marks ?,use jio 4g htc desire 526 gplus pleace ?,0,0.0,0.0,56,0.6222222222222222
137033,money changer make profit ?,money changers hedge fx exposures ?,0,0.0,0.0,16,0.8
137034,best simple ways loose weight ?,best way loose weight ?,1,0.0,0.0,8,0.9333333333333333
137035,increase traffic website using social media ?,increase traffic site ?,1,0.0,0.0,22,0.7333333333333333
137036,join indian navy engineering ?,join indian navy engineering ?,1,0.0,0.0,0,1.0
137037,youtube take long process videos 're uploaded ?,need pretty face start youtube channel ?,0,0.1499725002786232,0.0,36,0.8205128205128205
137038,best web design agencies manufacturers ?,good services outsourcing web design ?,0,0.0,0.0,32,0.8484848484848485
137039,best book gate ece ?,best book prepare gate ece ?,1,0.0,0.0,8,0.9166666666666666
137040,trump win presidency ?,donald trump win presidency ?,1,0.0,0.0,7,0.9090909090909091
137041,always aroused ?,always sexually aroused ?,1,0.0,0.0,9,0.96
137042,makes proud country ?,proud citizen country ? accomplishment ?,1,0.0,0.0,29,0.8571428571428571
137043,"difference velvet , velour , velveteen , structural standpoint ?",difference cotton cotton knit ?,0,0.0,0.0,41,0.7333333333333333
137044,epoch charge credit card ?,credit card companies charge much stores accept cards ?,0,0.0,0.0,34,0.8666666666666667
137045,"best activities children visiting agra , uttar pradesh , india ?","best activities children visiting noida , uttar pradesh , india ?",0,0.0,0.0,4,0.9743589743589743
137046,harvard likely accept ?,get harvard undergrad ?,0,0.0,0.0,15,0.6666666666666666
137047,restored faith humanity ?,experiences restore faith humanity ?,1,0.0,0.0,13,0.8823529411764706
137048,best new inventions people n't know ?,best new smartphone inventions people n't know ?,0,0.0,0.0,11,0.8823529411764706
137049,singapore ?,guys singapore ? recommend first first travel ?,1,0.0,0.0,36,0.7096774193548387
137050,ways weld aluminum steel ?,forged steel welded ?,0,0.0,0.0,20,0.6153846153846154
137051,bsnl : bsnl psu ?,bsnl ?,0,0.0,0.0,11,0.8
137052,evolve rh negative blood ?,"rh+ fetal blood mixes rh- mother 's blood , problem . n't occur fetal blood group different mother 's ?",0,0.0,0.0,85,0.6829268292682927
137053,company owns harvard university ?,`` cold call '' harvard business school ?,0,0.0,0.0,24,0.7567567567567568
137054,get job sas ?,get job sas ?,1,0.0,0.0,0,1.0
137055,best places visit goa ?,best places visit goa ?,1,0.0,0.0,0,1.0
137056,sex bad ?,sex seen bad ?,1,0.0,0.0,5,0.9411764705882353
137057,possible take prof ( semi ) pictures using iphone 6s/galaxy s7 lenses ( preferably min ) photo editing software ?,"better camera , iphone 6s samsung galaxy s7 ?",0,0.0,0.0,84,0.8461538461538461
137058,use human brain studying foreign language ?,brain change learn new language ?,1,0.0,0.0,25,0.7272727272727273
137059,get traffic blog www.tovibez.com ?,get trafffic blog www.sportsdear.blogspot.com ?,0,0.0,0.0,18,0.8648648648648649
137060,building best architecture china ?,building best architecture israel ?,0,0.0,0.0,6,1.0
137061,sex stranger man ?,sex strangers ?,1,0.0,0.0,4,0.9523809523809523
137062,environmental issue ?,less discussed environmental issues ?,0,0.0,0.0,16,0.9333333333333333
137063,kind music love ?,music like best ?,1,0.0,0.0,12,0.7692307692307693
137064,find b constant van der waals equation ?,van der waals radius ?,0,0.0,0.0,22,0.8125
137065,nas referring raps `` rockefeller died aids / end chapter . `` ?,come nobody died aids 60s ?,0,0.0,0.0,48,0.5555555555555556
137066,underrated singer ?,underrated singers ?,1,0.0,0.0,1,1.0
137067,favorite place earth ?,favorite place earth ?,1,0.0,0.0,0,1.0
137068,recruit better ?,"hr recruitment , better , recruitment non-it recruitment ?",0,0.0,0.0,42,0.75
137069,best thing bought ?,best thing ever bought ?,1,0.0,0.0,5,0.9230769230769231
137070,typhoid transmitted disease ?,typhoid spread ?,1,0.0,0.0,16,0.9285714285714286
137071,advantages come higher number cylinders car engine ?,cars even number cylinders ?,0,0.0,0.0,28,0.8888888888888888
137072,best online job support website ?,best online secure job ?,0,0.0,0.0,15,0.896551724137931
137073,"cold gobi desert get , average temperatures compare ones great victoria desert ?","cold gobi desert get , average temperatures compare ones syrian desert ?",1,0.0,0.0,12,0.975609756097561
137074,mental disabilities diagnosed 1930 's ?,"recently , taken scratching arm manner coping intense jealousy ( non-relationship ) . indicate mental issue ?",0,0.0,0.08333333333333337,87,0.5777777777777777
137075,best earphone/headphone inr 3000 ?,best headphones rs . 3000 available india ?,1,0.0,0.0,26,0.8888888888888888
137076,percentage questions quora answers ?,percentage questions quora left unanswered ?,1,0.0,0.0,9,0.9142857142857143
137077,best study options ms newzealand 3year graduation followed mba marketing finance ?,"'m graduated university delhi commerce . love sketching , drawing photography . 'm stuck situation . future ?",0,0.0,0.0,83,0.84
137078,"written languages develop right-to-left ? ( e.g. , arabic , hebrew )","language written left right , right left , vertical directionality ?",0,0.0,0.0,52,0.8260869565217391
137079,best way spend 10 lakh inr fairly decent risk liability ?,one one 's free time ?,0,0.0,0.0,45,0.5454545454545454
137080,iphone really expensive ? ?,iphone 6s expensive ?,1,0.0,0.0,8,0.8148148148148148
137081,difference save save ?,difference save save ?,1,0.0,0.0,0,1.0
137082,’ upset trump . positive side could help get ?,trump win help indian ?,0,0.0,0.0,33,0.7058823529411765
137083,colors affect mood ?,colors affect mood ?,1,0.0,0.0,0,1.0
137084,calculate ph buffer solution acetic acid naoh ?,ph acetic acid mixed naoh ?,0,0.0,0.0,29,0.75
137085,career advice would give someone wants become bank teller ?,advice given someone wants bank teller ?,1,0.0,0.0,21,0.9743589743589743
137086,lewis structure n2o3 ?,lewis structure c2h4o ?,0,0.0,0.0,4,0.8666666666666667
137087,?,ethnicity people look like ?,0,0.0,0.0,27,0.14285714285714285
137088,"argentina , near future , invaded south georgia instead falklands ?",argentina near future invaded south georgia instead falklands ?,1,0.0,0.0,4,0.972972972972973
137089,benefits taking pcm ?,benefit taking ap exam without taking course ?,0,0.0,0.0,28,0.8333333333333334
137090,clinton supporters recognise many trump supporters genuine grievances ?,trump supporters clinton supporters misunderstand ?,0,0.0,0.0,36,0.8823529411764706
137091,make money youtube videos ?,make money youtube channel ?,1,0.0,0.0,7,0.7741935483870968
137092,choose semi-truck accident lawyer ?,look choosing semi-truck accident lawyer ?,1,0.0,0.0,8,0.975609756097561
137093,improvise alto saxophone ?,learn improvise alto saxophone ?,0,0.0,0.0,6,1.0
137094,meaning life ?,"according , meaning life ?",1,0.0,0.0,12,0.8
137095,famous movie scenes involving tea ?,famous movie scenes involving glasses ?,0,0.0,0.0,6,0.967741935483871
137096,industrial training ?,industrial training mean ?,1,0.0,0.0,5,0.9230769230769231
137097,widely accepted credit cards small businesses restaurants monaco ?,widely accepted credit cards small businesses restaurants australia ?,0,0.0,0.0,8,0.972972972972973
137098,feel apple removing headphone jack iphone 7 ?,apple remove headphone jack iphone 7 ?,0,0.0,0.0,8,0.9473684210526315
137099,interesting facts myths sex ?,"got selected wipro ( band 1 ) campus placement.but , given wrong dept study candidate desktop , reject ?",0,0.0,0.0,86,0.5909090909090909
