id,question1,question2,is_duplicate,CosineSimilarity,JaccardSimilarity,Levenshtein,DiceSimilarity
264864,best food eat empty stomach ?,best food options eat japan ?,0,0.0,0.0,15,0.7586206896551724
264865,ways think effectively ?,think effectively ?,1,0.0,0.0,5,0.896551724137931
264866,people think hillary clinton serial liar ?,people believe hillary clinton dishonest ?,1,0.0,0.0,16,0.8823529411764706
264867,best place live india ?,best city reside india ?,1,0.0,0.0,9,0.8148148148148148
264868,lhc ?,lhc ?,1,0.0,0.0,0,1.0
264869,good affordable tequila mixers ?,good liquors would mix tequila make less stingy ?,1,0.0,0.0,27,0.8421052631578947
264870,much better human ? muslim buddhist ?,plot 'depth ' values stationary point ?,0,0.0,0.0,29,0.7647058823529411
264871,alleles ?,alleles ? examples ?,1,0.0,0.0,11,0.8
264872,get guy like like ?,get guy like think ?,0,0.0,0.0,4,0.9090909090909091
264873,find cph4 ?,possible way create synthetic cph4 ?,0,0.0,0.0,27,0.5714285714285714
264874,world war iii soon ?,prophecies world war 3 actually happen ?,1,0.0,0.0,26,0.7333333333333333
264875,processing time australian visa 190 ?,process get visa several countries time ?,0,0.0,0.0,23,0.918918918918919
264876,become political leader ?,become leader ?,0,0.0,0.0,10,0.88
264877,twitter api : possible get count replies retweets particular tweet ?,twitter api let somebody tweet word `` dm '' ?,0,0.0,0.0,39,0.7222222222222222
264878,"difference bluetooth 4.0 , 3.0 2.0 ?",difference bluetooth 4.0 4.1 headphones ?,0,0.0,0.0,13,0.8372093023255814
264879,best daily planner/schedule android app ?,must android apps ?,0,0.0,0.0,26,0.75
264880,"drive edmonton auckland described , cities ' attractions compare victoria ?","drive edmonton auckland described , history cities compare contrast history vancouver ?",1,0.0,0.0,34,0.9302325581395349
264881,win life ?,one succeed life ?,1,0.0,0.0,11,0.7
264882,good mock test series nmat ?,best mock test series nmat 2015 ?,0,0.0,0.0,9,0.7878787878787878
264883,best film ever seen ?,"opinion course ; would consider greatest book , greatest film ever directed/written ?",1,0.0,0.0,65,0.6842105263157895
264884,'s regular morning routine ?,'s morning routine ?,1,0.0,0.0,8,0.9285714285714286
264885,one correct ? ) ?,one correct : came came ?,0,0.0,0.0,10,0.8
264886,make money online free ?,make money online ?,1,0.0,0.0,5,0.9166666666666666
264887,stupidest thing ever done ?,stupidest thing done ?,1,0.0,0.0,5,0.9285714285714286
264888,coincidence worlds developed countries northern hemisphere ?,amt103 swift message elaborated ?,0,0.0,0.0,49,0.6486486486486487
264889,handsome ?,startup ?,0,0.0,0.0,8,0.4444444444444444
264890,toshiba laptop rebooting ?,factory reset toshiba laptop ?,0,0.0,0.0,24,0.8387096774193549
264891,apple 's maps traffic provider ?,apple 's maps provider ?,0,0.0,0.0,8,0.9032258064516129
264892,bollywood ever compete hollywood content ?,bollywood ever compete hollywood ?,1,0.0,0.0,8,0.9696969696969697
264893,admission process mit ?,detailed admission procedure mit ?,0,0.0,0.0,13,0.9333333333333333
264894,retrieve permanently deleted emails cox.net ?,get emails permanently deleted accident back ?,0,0.0,0.0,21,0.8108108108108109
264895,check data used user 's connection single router ?,best router use india home great connectivity ?,0,0.0,0.0,36,0.8108108108108109
264896,narcissists obey tell never speak ?,'re depressed want run away problems sleep never wake ?,0,0.0,0.0,37,0.8108108108108109
264897,best book biology class 9 ?,best book biology class 9 ?,1,0.0,0.0,0,1.0
264898,funniest incident happened friends ?,funniest incident happened flight ?,0,0.0,0.0,5,0.9032258064516129
264899,powerful hero marvel ?,powerful marvel franchise ?,0,0.0,0.0,13,0.875
264900,heading drift tunnel ?,bus drift tarmac ?,0,0.0,0.0,12,0.6666666666666666
264901,"work luxury car dealership , say teen comes get picture , sitting car ?",get work car sales dealership ?,0,0.0,0.0,52,0.85
264902,"right-angle triangle , perpendicular 3^1/2 times base . ratio opposite angles ?","right-angle triangle , perpendicular [ math ] \sqrt { 3 } [ /math ] times base . ratio opposite angles ?",1,0.0,0.0,28,0.8421052631578947
264903,get job google mca ?,get job google mca ?,1,0.0,0.0,0,1.0
264904,move banning 500 & 1000 rupee notes right ?,use demonetizing rs . 500 & rs . 1000 notes ?,1,0.0,0.0,31,0.8
264905,tell best friend 'm love ?,tell best friend 'm love ?,0,0.0,0.0,0,1.0
264906,sexiest actress bollywood ?,dumbest actress bollywood ?,0,0.0,0.0,4,0.875
264907,religions misogynist sexist ?,religions misogynistic ?,0,0.0,0.0,6,0.9285714285714286
264908,easiest way destroying enemy aircraft carrier ?,would destroy aircraft carrier ?,0,0.0,0.0,20,0.8484848484848485
264909,bitcoin currency ?,bitcoin currency commodity ?,0,0.0,0.0,10,0.9230769230769231
264910,reason multi-column layout magazines newspapers ?,write newspaper column ?,0,0.0,0.0,40,0.8888888888888888
264911,check milk adulterated ?,easiest way determine whether milk pure adulterated ?,1,0.0,0.0,32,0.8125
264912,best book self studying networking ?,best books network basics ?,0,0.0,0.0,19,0.75
264913,learn become professional full stack javascript developer ?,best way become full stack javascript developer newbie ?,0,0.0,0.0,27,0.9545454545454546
264914,fittest bollywood actresses 2016 ?,fittest bollywood actress ?,0,0.0,0.0,7,0.8888888888888888
264915,correct : time flies time flys ?,"'s correct : `` n't change rule time travel per se '' `` n't change rule time travel , per se '' ?",0,0.0,0.0,70,0.6666666666666666
264916,many zeros 1 million ?,many zeros 520 ?,0,0.0,0.0,9,0.7857142857142857
264917,egyptian god horus really born december 25 ?,mythology : egyptian god horus born 25th december ? `` gods '' compared jesus zeitgeist movie ?,1,0.0,0.0,64,0.88
264918,popular leslie cheung hk ? memory hk local ?,"african person , easy get long term visa stay hk ?",0,0.0,0.0,38,0.8717948717948718
264919,'m scared growing . every time think future feel stressed/scared . prevent feeling ?,best app compress videos ?,0,0.0,0.0,71,0.6829268292682927
264920,profitable passenger air routes world ?,'s profitable flight route world ?,1,0.0,0.0,16,0.918918918918919
264921,c++ program run hardware directly run operating system ?,run file transfer program dev c++ ?,0,0.0,0.0,43,0.8780487804878049
264922,add airtime tracfone free ?,get free minutes tracfone ?,0,0.0,0.0,18,0.8571428571428571
264923,motivational speakers ?,like motivational speaker ?,0,0.0,0.0,6,1.0
264924,learn marathon ?,learn marathon ?,1,0.0,0.0,0,1.0
264925,stop pit bull/english bulldog mix puppy humping furniture ?,stop miniature pinscher/chihuahua mix stop humping furniture ?,1,0.0,0.0,28,0.85
264926,best earphone 1000 ?,best earphones 600 ?,0,0.0,0.0,3,0.9285714285714286
264927,'s good way improve english accent ?,"non-native english speaker , improve accent ?",0,0.0,0.0,31,0.8292682926829268
264928,race change grow ?,possibility race changes grow ?,1,0.0,0.0,13,0.7586206896551724
264929,four hemispheres earth ? differ one another ?,hemispheres earth ? differ ?,1,0.0,0.0,17,0.896551724137931
264930,ca n't create blog quora ?,ca n't make blog quora ?,1,0.0,0.0,4,0.9375
264931,"whatsapp web working . 'm using chrome browser windows 8.1 laptop , internet speed decently good . opened web.whatsapp.com qr code n't load . keeps going round round . fix ?",use chrome web browser ?,0,0.0,0.0,152,0.5714285714285714
264932,'s difference liability duty ?,difference tax duty ?,0,0.0,0.0,11,0.8387096774193549
264933,internet bored ?,boredom : internet get bored ?,1,0.0,0.0,14,0.8695652173913043
264934,worst thing happened nice ?,best thing ever happened nice ?,0,0.0,0.0,8,0.875
264935,exactly manifolds ( intuitively ) differences graphs ?,manifold layman 's terms ?,0,0.0,0.0,38,0.75
264936,people quora able write really long descriptions question ?,add long details quora question ?,1,0.0,0.0,39,0.8571428571428571
264937,indian cricketer geoffrey boycott 's all-time xi ?,employees nutrisystem good work-life balance ? differ across positions departments ?,0,0.0,0.0,63,0.8888888888888888
264938,best book inorganic chemistry ?,best book study inorganic chemistry 20 days ?,1,0.0,0.0,14,0.8947368421052632
264939,determine spicy chilly ? measurement ?,measure heat chillies using scoville scale ? apparatus used ?,0,0.0,0.0,43,0.8888888888888888
264940,hard land jetliner washington national airport compared airport san diego ?,much would cost land heathrow airport ?,0,0.0,0.0,54,0.918918918918919
264941,jobs demand australia ?,demanding jobs australia ?,1,0.0,0.0,13,0.9696969696969697
264942,possible display 3 digits ( instead 2 ) exponent scientific notation python ? print ( ' % 17.8e\n ' % 0.0665745511651039 ) 6.65745512e-002,dadabhai naoroji 's drain theory ? proved ?,0,0.0,0.0,117,0.5818181818181818
264943,surname `` lee '' common china ?,integral function say function 's properties ' ?,0,0.0,0.0,39,0.7647058823529411
264944,"imessage message says delivered , still chance blocked ?",someone blocked number see texts 'm sending ?,0,0.0,0.0,43,0.8
264945,introvert new fad ?,introvert new cool ?,1,0.0,0.0,4,0.8
264946,suitable inpatient drug alcohol rehab center near moultrie county il ?,suitable inpatient drug alcohol rehab center near fulton county il ?,0,0.0,0.0,5,0.95
264947,good book algorithms ?,best book learn data structures algorithms ?,1,0.0,0.0,26,0.8823529411764706
264948,strongest majors terms job prospects weakest majors marist college ?,strongest majors terms job prospects weakest majors smith college ?,0,0.0,0.0,5,0.9743589743589743
264949,need get permission police shoot short film inside rented apartment ?,ask permission shoot film public place ?,0,0.0,0.0,41,0.8648648648648649
264950,get relief back pain ?,best way deal back pain ?,1,0.0,0.0,9,0.7741935483870968
264951,best psychology blogs ?,good psychological blogs ?,1,0.0,0.0,8,0.8148148148148148
264952,best words rhyme `` always '' ?,interesting words rhyme `` pain '' ?,0,0.0,0.0,13,0.8333333333333334
264953,much top management consulting firms charge clients per consultant 2015 ?,much top management consulting firms charge clients per consultant ?,0,0.0,0.0,5,0.9
264954,one pronounce 'cipriani ' ?,pronounce “ faq ” ?,0,0.0,0.0,13,0.7692307692307693
264955,appraisers know home value realtors ?,left area lower jaw stiff eye makes sounds slightly press . feel causes psychological issues ?,0,0.0,0.0,73,0.8095238095238095
264956,things like spouse ?,love spouse ?,1,0.0,0.0,9,0.6956521739130435
264957,girls stop falling bad boys ?,stop falling love girl friend ?,0,0.0,0.0,21,0.875
264958,"car traveling 26 meters per second accelerating -13 m/s^2 . traveling , driver brings car complete stop . using equation -26+26t-6.5t^2 , long take driver stop car ?",car starts rest accelerates 6m/s^2 final velocity 60m/s . far car travel time ?,0,0.0,0.0,115,0.7037037037037037
264959,make money online india ?,one earn money online without investment home ?,1,0.0,0.0,28,0.6896551724137931
264960,"cats receive petting purring sexual sensation , something different entirely ?",cats like petted ?,0,0.0,0.0,62,0.6285714285714286
264961,priorities life first last ?,# 1 priority life ?,0,0.0,0.0,18,0.8
264962,"better career c , c++ node.js ?",learn c++ learning node.js ?,0,0.0,0.0,18,0.8125
264963,perform factory reset dell laptop ?,master reset dell laptop ?,1,0.0,0.0,11,0.8888888888888888
264964,blood type found mother type ab blood father type blood ?,blood type/types found offspring mother type ab blood father type b blood ?,0,0.0,0.0,18,0.8947368421052632
264965,possible india stop sharing water pakistan ?,"india denies pakistan water , pakistan give nuclear weapons ?",0,0.0,0.0,44,0.8421052631578947
264966,sin ? different wrong ?,sin ?,1,0.0,0.0,18,0.5555555555555556
264967,dogs bark ?,dogs bark wolves n't ?,0,0.0,0.0,11,0.7407407407407407
264968,ca n't find voice recordings nikola tesla yt internet ?,voice recording nikola tesla exist ?,0,0.0,0.0,22,0.8888888888888888
264969,nothing goes way plan love life . ?,shall everything goes wrong life ?,0,0.0,0.0,24,0.9142857142857143
264970,shall gift 13 year old boy birthday ?,gift 12 year old boy birthday ?,1,0.0,0.0,7,0.9142857142857143
264971,reddit ( website ) : cultural faux pas jailbait subreddit ?,reddit ( website ) : cultural faux pas /r/jailbait ?,1,0.0,0.0,13,0.9767441860465116
264972,differences rugby american football ?,difference american football rugby ?,1,0.0,0.0,13,0.972972972972973
264973,albus dumbledore get elder wand ?,gave dumbledore wand ?,1,0.0,0.0,15,0.9032258064516129
264974,family travelling right thinking buying gopro . really worth buy one taking landscape pics videos ?,buy gopro europe ?,0,0.0,0.0,82,0.5714285714285714
264975,"get ticket ( parking speeding ) rental car , happens n't pay ticket ?",happens rental car agency pays speeding ticket process pleading guilty ?,0,0.0,0.0,54,0.85
264976,things new employees know going first day impax laboratories ?,things new employees know going first day silicon laboratories ?,0,0.0,0.0,6,0.9545454545454546
264977,conduct poll facebook ?,conduct poll quora ?,0,0.0,0.0,7,0.7857142857142857
264978,get uan number ?,use uan use multiple uan number ?,0,0.0,0.0,18,0.8
264979,"harmful download tubemate android , google play store ?",unable download apps google play store mobile data ?,0,0.0,0.0,36,0.926829268292683
264980,best birthday present cat ?,best birthday present ?,0,0.0,0.0,4,0.9655172413793104
264981,true ca n't donate blood 've got tattoo ?,rules donating blood tattoo ?,0,0.0,0.0,20,0.8387096774193549
264982,remove account quora ?,take unsubscribe quora ? want anything quora .,1,0.0,0.0,32,0.6666666666666666
264983,people believe everything happen reason ?,believe everything happens reason ? ?,1,0.0,0.0,10,1.0
264984,"noam chomsky : every neo-eugenics talking population , solve populating solar system maybe expand suns cradel ?","n't know much , big bang happen , way expanding ? using solar system guide",0,0.0,0.0,75,0.9019607843137255
264985,winrar able make profit virtually free product ?,winrar make money ?,1,0.0,0.0,32,0.7272727272727273
264986,would win 1v1 fight ? longbowman knight ?,would win 1v1 fight ? longbowman sniper ?,0,0.0,0.0,4,0.8780487804878049
264987,value instagram account 1 million followers ?,get million followers instagram ?,0,0.0,0.0,33,0.8823529411764706
264988,2pac alive ?,2pac dead ?,0,0.0,0.0,5,0.7777777777777778
264989,wat sql injection ?,sql injection ?,1,0.0,0.0,4,0.9230769230769231
264990,best hotels varanasi ?,top hotels varanasi ?,1,0.0,0.0,4,0.9285714285714286
264991,review chetan bhagat books english ?,review ‘ one indian girl ’ chetan bhagat ( 2016 book ) ?,0,0.0,0.09999999999999998,33,0.7727272727272727
264992,find website accounts associated email address ?,find domain names associated email address ?,0,0.0,0.0,13,0.9090909090909091
264993,`` natural rights '' ?,natural rights ?,0,0.0,0.0,6,0.9230769230769231
264994,love girl . brahmin brahmin . explain parents ?,brahmins generally light skin tones compared castes ?,0,0.0,0.0,39,0.8205128205128205
264995,generic job groups engineering ?,'s take relation modi yoga ?,0,0.0,0.0,26,0.5806451612903226
264996,"moto g android 5.0.2. issue getting call , display ringtone audible come phone since 2-3 days . fix ?","motorola mobility : updating moto g android 5.0.2 ( ota ) , battery draining faster rate . way fix downgrade kitkat ?",0,0.0,0.0,89,0.847457627118644
264997,u.s. housing markets pre-inspections common ?,housing markets pre-inspections common ?,0,0.0,0.0,5,0.972972972972973
264998,average lifespan dinosaur ?,"lifespan average large dinosaur , say t-rex brontosaurus ?",0,0.0,0.0,37,0.8421052631578947
264999,family gifts uk taxable ?,family gifts taxable uk ?,1,0.0,0.0,6,1.0
265000,jamia millia islamia good college bba ?,jamia millia islamia good bba ?,1,0.0,0.0,8,0.9230769230769231
265001,people extremely nice cars want remain anonymous ?,parameters considered selection forbes ' 74 powerful people ?,0,0.0,0.0,46,0.8
265002,"parts motherboard , work ?",different parts motherboard parts ?,0,0.0,0.0,16,0.8125
265003,meet irish people toronto canada ?,one meet british/irish people toronto/gta area ?,1,0.0,0.0,18,0.8484848484848485
265004,change email address ?,change email address ?,1,0.0,0.0,0,1.0
265005,well tesla cars drive ice snow ?,"good idea drive new tesla across country ? concerned charging , wondering potential issues/repairs car .",0,0.0,0.0,83,0.7894736842105263
265006,20 years old 5 feet 9.5 ( 177 cm ) tall . possible grow cms taller ?,possible increase height get taller 20 ?,0,0.0,0.0,52,0.6956521739130435
265007,husband wife o+ blood group healthy child ?,husband wife positive blood group problem children ?,1,0.0,0.0,17,0.9090909090909091
265008,woman 's neck taste like kiss ?,women like men kiss neck ?,0,0.0,0.0,19,0.8888888888888888
265009,muslim man date foreign girl ?,muslim man date divorce woman children ?,0,0.0,0.0,15,0.8235294117647058
265010,merriam webster real actual person ?,merriam webster acquire name ?,0,0.0,0.0,15,0.875
265011,retake gre given score ?,often retake gre ?,0,0.0,0.0,14,0.8
265012,best private server clash clans ?,server hardware need game like clash clans ?,0,0.0,0.0,22,0.75
265013,difference facebook twitter ?,differences facebook twitter ?,1,0.0,0.0,1,0.967741935483871
265014,get started male porn star ?,male porn stars get big cock ?,0,0.0,0.0,23,0.8387096774193549
265015,interesting topics new users follow ?,keep track interesting content topics following ?,0,0.0,0.0,27,0.9090909090909091
265016,ngos work home earn money ?,ngos work home ?,0,0.0,0.0,11,0.9230769230769231
265017,swami vivekananda participated freedom fight ?,n't kashmiri youth form political party instead freedom movements participate development activities ?,0,0.0,0.0,73,0.8571428571428571
265018,fallen love best friend ?,feel like fall love best friend ?,1,0.0,0.0,10,0.967741935483871
265019,stream services broadcast password protection stream ?,"embeddable music player stream live content , live stream become archived stream demand content ? players /services like also api ?",0,0.34648256190941146,0.0,100,0.8
265020,worst country live ?,worst countries live ?,0,0.0,0.0,3,0.9655172413793104
265021,print pdf ebook a4 paper sides bind make a5 size story-book ?,"bought ebook pdf format , right print hard copy read lend anyone wishes read book , legally ?",0,0.0,0.0,67,0.7555555555555555
265022,question deleted .,"favorite quotes said 'role model ' , 'life mentor ' , person ( ) admire , look , respect , find inspiration ?",0,0.0,0.0,94,0.6111111111111112
265023,would win hulk wonder woman ?,win fight hulk wonder woman ?,1,0.0,0.0,8,0.9090909090909091
265024,gender : differences `` waves '' feminism ? similar terms ?,fourth wave board quora so-named ?,0,0.0,0.0,45,0.6666666666666666
265025,notable biological differences people different races ?,biological basis different races ?,1,0.0,0.0,25,0.9696969696969697
265026,got wisdom teeth extracted noticed white stuff growing inside cheek extraction site ? infection scabs ?,wisdom teeth growing sideways ?,0,0.0,0.0,74,0.8108108108108109
265027,crime reuse medical device india ?,awareness related cyber crimes low india students given oppurtunity get know even though learn network security ?,0,0.0,0.0,92,0.7567567567567568
265028,people identify different birth gender psychiatrists accept normal ?,"bodies made sex gender , ca n't people gender reproduce ?",0,0.0,0.0,51,0.8292682926829268
265029,beat steamworks island poptropica ?,find guide steamworks island poptropica ?,0,0.0,0.0,10,0.8947368421052632
265030,definition potential ?,’ edmure tully command freys let rob stark ’ army pass since house frey vassal house tully ?,0,0.0,0.0,79,0.6857142857142857
265031,better drink weight loss- green tea lemon water ?,green tea fat burner ? help weight loss ? much drink ? time drink ?,0,0.0,0.0,44,0.8780487804878049
265032,"feel lonely , stop feeling way ?",stop feeling lonely time ?,1,0.0,0.0,23,0.8666666666666667
265033,happens fall probation ?,happens fall probation vit ?,0,0.0,0.0,4,0.967741935483871
265034,make video calls whatsapp ?,make video call ?,0,0.0,0.0,10,0.8275862068965517
265035,benefits taking diazepam xanax ?,benefits taking xanax ?,0,0.0,0.0,9,0.8666666666666667
265036,", exactly , modern era start history ?",century modern era start ?,1,0.0,0.0,17,0.8125
265037,ivanka trump like person wharton / upenn ?,donald trump student upenn ?,0,0.0,0.0,24,0.7878787878787878
265038,would someone stay relationship ca n't forgive partner abortion ?,clinton kaine approach relations russia putin ?,0,0.0,0.0,46,0.75
265039,n't cars usually auto-dimming side mirrors ?,n't cars pop-up headlights anymore ?,0,0.0,0.0,26,0.95
265040,personal definition integrity ?,exudes integrity ?,0,0.0,0.0,16,0.7586206896551724
265041,special harvard law review ?,review harvard law school ?,0,0.0,0.0,11,0.9285714285714286
265042,'m non-med grade 11 right really want go us higher studies . ?,want medicine i.e . study mbbs usa . studying 11th grade . steps follow get seat medical reputed us university ?,0,0.0,0.0,83,0.851063829787234
265043,people watch pewdiepie entertainment learn become youtuber earn loads money ?,much money earn youtube india ?,0,0.0,0.0,54,0.8888888888888888
265044,"ring someone whatsapp , 3g connection wifi connection , still receive missed call notification ?",share internet laptop 's wifi connection using mobile 3g- 4g-modem ?,0,0.0,0.0,63,0.851063829787234
265045,top 10 websites visit everyday ?,best websites visit everyday ?,1,0.0,0.0,6,0.8666666666666667
265046,furry ?,furry ?,1,0.0,0.0,0,1.0
265047,much ctc need india take home salary 270000 ?,annual ctc 37.50 lacs india . much expect thailand saving equally maintaining similar lifestyle ?,0,0.0,0.0,73,0.75
265048,city south carolina good helping homeless ?,good south american city live month summer brush already decent spanish skills ?,0,0.0,0.0,58,0.926829268292683
265049,many americans vote donald trump ?,americans actually vote donald trump ?,0,0.0,0.0,14,1.0
265050,"manish sisodia performed delhi 's education minister , till december 2016 ?",make manish sisodia chief minister delhi ?,0,0.0,0.0,48,0.7619047619047619
265051,occupied nagaland get freedom india ?,'m popular school/college days . sometimes feel sad . ?,0,0.0,0.0,42,0.8205128205128205
265052,man get fear committed relationship ?,fear commitment get ?,1,0.0,0.0,21,0.8387096774193549
265053,dogs cry ?,stray dogs make crying howling sounds night ?,0,0.0,0.0,35,0.6206896551724138
265054,cheap accommodation options sunburn festivals 2015 ?,best cheap luxury travel options ?,0,0.0,0.0,40,0.7906976744186046
265055,long person shot head remain conscious feel pain ?,people shot head experience pain death ?,0,0.0,0.0,30,0.8571428571428571
265056,possible exchange old 500 rupee notes dec 31 ?,found old 500 rupees note closet.since rbi n't accepting old notes 31th dec ?,1,0.0,0.0,55,0.9166666666666666
265057,reduce belly fat minimal time ?,whats best way reduce belly fat ?,1,0.0,0.0,26,0.8125
265058,jokes make feel better ?,jokes make friend feel better ?,0,0.0,0.0,7,0.9032258064516129
265059,"gay man attracted transgender man , make straight man ?","man watching ts porn looking ts escorts , married . make gay bi ?",1,0.0,0.0,47,0.85
265060,money laundering detected ?,money laundering work ?,0,0.0,0.0,8,0.875
265061,banning 500 1000 notes stop black money ?,demonetization 500 1000 rupee notes stop corruption ?,1,0.0,0.0,28,0.7692307692307693
265062,started revivalism jamaica ? importance movement ?,"name anime series moon racer , uncovers lie earth uninhabitable ?",0,0.0,0.0,51,0.8
265063,possible time travel past ?,possible travel time real life ?,1,0.0,0.0,14,0.9655172413793104
265064,tell someone chatting messenger ?,spy facebook chat history ?,0,0.0,0.0,22,0.7096774193548387
265065,find needs improved question marked needing revision ?,wrong question marked `` needs improvement '' ?,1,0.0,0.0,34,0.9
265066,stop see post pictures facebook ?,stop seeing people may know facebook ?,0,0.0,0.0,15,0.7647058823529411
265067,control dreams ? dream wan na dream ?,control dreams ?,1,0.0,0.0,21,0.9629629629629629
265068,"india wars pakistan , part kashmir still pakistan ?","india claim wars pakistan , despite fact latter still holds control major part kashmir seized india wars ?",0,0.0,0.0,64,0.8421052631578947
265069,meaning 'home heart ' ?,meaning phrase `` heart earth '' matthew 12:40 ?,0,0.0,0.0,28,0.7058823529411765
265070,got ideas pink clothing ?,shop clothes ?,0,0.0,0.0,16,0.7692307692307693
265071,make bomb science class would sent jail ?,kill someone zone death would go jail ?,0,0.0,0.0,21,0.8648648648648649
265072,function integral proteins cell membranes ?,functions cell membranes ?,0,0.0,0.0,17,0.9411764705882353
265073,"could donald trump actually good president , even better hillary clinton would ?",donald trump good president ?,1,0.0,0.0,51,0.8205128205128205
265074,anonymous questions get answers compared non-anonymous ?,anonymous quora questions get views ?,1,0.0,0.0,34,0.8648648648648649
265075,respond guy asks girlfriend ?,guy asked coffee 's got girlfriend . seems like good guy . go ?,0,0.0,0.0,46,0.8421052631578947
265076,syrians running away isis ?,syrian refugees running assad isis ?,1,0.0,0.0,11,0.8333333333333334
265077,"possible live normal life without sleeping ? , ? techniques overcome sleep ?",possible function without sleep ?,0,0.0,0.0,49,0.8205128205128205
265078,first time sex feel like ?,like sex first time ?,1,0.0,0.0,14,1.0
265079,many hours programmers code ?,best programmers use fewest lines code ?,0,0.0,0.0,27,0.7777777777777778
265080,opportunities exist completing b.tech mechanical engineering ?,fields enter completing b.tech mechanical engineering ?,1,0.0,0.0,15,0.9
