id,question1,question2,is_duplicate,CosineSimilarity,JaccardSimilarity,Levenshtein,DiceSimilarity
336886,much time take male ejaculate masturbation ?,take time males ejaculate ?,0,0.1867020371656664,0.19999999999999996,23,0.8387096774193549
336887,use usb 3.0 device usb 2.0 port ?,use usb 2.0 usb 3.0 port ?,0,0.0,0.0,9,0.875
336888,get job mnc ?,get job mnc ?,1,0.0,0.0,0,1.0
336889,"beginning épée fencer , take care fencing equipment ?",bought épée fencing gear . care ?,1,0.14155878539060018,0.0,33,0.8108108108108109
336890,arraylist implemented java ?,"java , iterate list ?",0,0.0,0.0,19,0.7857142857142857
336891,best novels 2014 ?,best novels 2015 ?,0,0.0,0.0,1,0.9285714285714286
336892,always reason something ?,something reason reason ?,0,0.0,0.0,16,0.896551724137931
336893,virat kohli ( 2016 ) better sachin tendulkar ( 1999 ) ?,virat kohli new sachin tendulkar ?,0,0.0,0.0,23,0.7906976744186046
336894,'s difference psychiatrist psychologist ?,difference psychiatrist therapist ?,0,0.0,0.0,11,0.8823529411764706
336895,much black money recovered till ?,much black money unearthed demonetization ?,0,0.0,0.0,18,0.9473684210526315
336896,india bad olympics football ?,"despite billion people , india bad olympics ? india lack talent ?",1,0.0,0.0,41,0.8823529411764706
336897,gst change indian economy ?,gst affect indian economy enacted ?,1,0.0,0.0,14,0.9333333333333333
336898,on-page seo ?,onpage seo ?,1,0.0,0.0,1,0.9473684210526315
336899,n't pla attacked taiwan yet ?,n't china invaded nepal bhutan yet ?,0,0.0,0.0,18,0.8125
336900,story behind name ?,’ meaning name ?,1,0.0,0.0,9,0.5833333333333334
336901,corporate culture like fossil ? culture different companies ?,corporate culture like godaddy ? culture different companies ?,0,0.0,0.0,6,0.9473684210526315
336902,east timor ?,anyone east timor ?,0,0.0,0.0,7,0.9090909090909091
336903,write successful scholarship essay ?,essay topics could write `` mongol army '' history paper ?,0,0.0,0.0,44,0.8205128205128205
336904,sxsw ?,sxsw ?,0,0.0,0.0,0,1.0
336905,song played comedy central 's ad show playing house ?,song playing backgroung add ?,1,0.0,0.0,35,0.7894736842105263
336906,indian cricket team experimenting color jersey ?,proud ?,0,0.0,0.0,43,0.4444444444444444
336907,"nationalities considered white ? mix nationalities percentage white , would still considered white ?",considered white ?,1,0.0,0.0,82,0.7647058823529411
336908,according evil superhero comic-villain ?,unlikable movie villain ?,0,0.0,0.0,25,0.6875
336909,always web hosting supports php ?,always web host providers support php ?,1,0.0,0.0,10,0.8888888888888888
336910,`` must read '' books one must go getting married ?,book one read getting married ?,1,0.0,0.0,24,0.875
336911,null hypothesis layman 's terms ?,null hypothesis ? important ?,0,0.0,0.0,13,0.9696969696969697
336912,find tracking devices law enforcement put motorcycle & truck ?,entrapment allowed law enforcement tactic ?,0,0.0,0.0,32,0.8205128205128205
336913,going join oasis group ? ut 's good ?,good profile though want join spjimr . go ?,0,0.0,0.0,32,0.7777777777777778
336914,world war iii coming ?,war coming ?,1,0.0,0.0,10,0.9166666666666666
336915,"'m 18 , ran away home . possible parents put missing persons report police ?",'m considering become police officer start ? ( 'm 18 college student ),0,0.0,0.0,57,0.8163265306122449
336916,intuitive explanation homotopy ?,intuitive explanation homotopy fiber ?,0,0.0,0.0,6,0.9142857142857143
336917,scope building technology building sciences masters degree architecture ?,like study masters building science without architecture background ?,0,0.0,0.0,46,0.926829268292683
336918,handle guy ?,handle guy like ?,1,0.0,0.0,5,0.9166666666666666
336919,machines ever replace humans ?,future work : machines replace humans ?,1,0.0,0.0,19,0.8
336920,scope market ?,scope marketing ?,0,0.0,0.0,3,0.8888888888888888
336921,many people ask questions quora.com could easily find answers online ?,people ask questions quora instead googling ?,1,0.0,0.0,33,0.8205128205128205
336922,keep laptop turning ?,fix laptop keeps turning ?,1,0.0,0.0,10,0.9032258064516129
336923,become psychologist ?,become lawyer psychologist ?,0,0.0,0.0,7,0.9090909090909091
336924,president philippines dare use obscenity potus ?,philippine president rodrigo duterte call barack obama `` son bitch '' ?,0,0.0,0.0,50,0.85
336925,find way grow taller ( maximize height ) ? 'm 16 .,grow taller 18 ?,1,0.0,0.0,36,0.5945945945945946
336926,coding useful ?,kind jobs use coding ?,0,0.0,0.0,15,0.8148148148148148
336927,performance bond work ?,perform balance inquiry icici bank ?,0,0.0,0.0,20,0.7878787878787878
336928,causes dunning-kruger effect ?,dunning-kruger effect ?,1,0.0,0.0,7,0.9333333333333333
336929,increase power ?,effective way increase one 's power ?,1,0.0,0.0,21,0.8275862068965517
336930,structural design ?,structure design organization ?,0,0.0,0.0,15,0.896551724137931
336931,hillary clinton ever lied anything ?,major ways hillary clinton lied public ?,1,0.0,0.0,23,0.7567567567567568
336932,best digital marketing course online beginner ?,best online short courses digital marketing ?,1,0.0,0.0,29,0.972972972972973
336933,interesting topics paper presentation ?,best topic paper presentation medicine ?,0,0.0,0.0,18,0.8571428571428571
336934,life fucked ?,life fucked ?,0,0.0,0.0,0,1.0
336935,could father attracted adopted daughter ?,father give equal share daughter never deserves ?,0,0.0,0.0,37,0.75
336936,much iim graduates earn 10 years graduating ?,score 70 % graduation much weightage given 10 selection process iim ?,0,0.0,0.0,46,0.8095238095238095
336937,car salesmen use personal selling ?,many used cars sell register dealer ?,0,0.0,0.0,26,0.8387096774193549
336938,know 2002 gujarat riots ?,modi lie night think 2002 riots ? justify riots thinking 1984 riots peacefully go sleep ?,0,0.0,0.0,71,0.6818181818181818
336939,"best sulfonating agent catalyst alkyl nonyl phenol ? alkyl group 8 , reaction must simple effective ?",correct ( poetic ) meaning urdu word `` zeest '' ?,0,0.0,0.0,80,0.6521739130434783
336940,format fax normally ?,send fax ups store ?,0,0.0,0.0,15,0.6923076923076923
336941,earn money internet ?,earn money part time online ?,1,0.0,0.0,13,0.9166666666666666
336942,universities care.com recruit new grads ? majors looking ?,universities walmart recruit new grads ? majors looking ?,0,0.0,0.0,7,0.975609756097561
336943,"suitable solar panel installation provider albany , california ca ?","suitable solar panel installation provider near aptos , california ca ?",0,0.0,0.0,8,0.9743589743589743
336944,funniest thing dog done ?,'s craziest/funniest thing dog ?,1,0.0,0.0,17,0.8125
336945,united states headed towards civil war ?,usa heading towards civil war ?,1,0.0,0.0,13,0.9714285714285714
336946,good apps learn computer networking ?,best way learn networking online ?,0,0.0,0.0,23,0.8
336947,format moto g2 work good ?,"uploaded video youtube immediately uefa claimed , came know early copied video ?",0,0.0,0.0,65,0.6285714285714286
336948,opportunities completing bds ?,know sleep apnea bruxism plain stress ?,0,0.0,0.0,29,0.8
336949,best method converting json csv file ?,happened high low currents passed required welding process ?,0,0.0,0.0,45,0.7368421052631579
336950,february 28 29 days ? similar months ?,month february 29 days ?,1,0.0,0.0,26,0.9230769230769231
336951,improve handwriting english ?,improve handwriting ?,0,0.0,0.0,8,0.9411764705882353
336952,top english melodius songs ?,best melodies english songs ?,1,0.0,0.0,16,0.896551724137931
336953,chances getting good us university ms low grades undergrad projects ?,chances getting good uk university ( undergrad ) ?,0,0.0,0.0,22,0.8095238095238095
336954,'s best plan lose weight ?,'m overweight . begin lose weight ?,1,0.0,0.0,15,0.8235294117647058
336955,salt water taffy candy imported france ?,saltwater taffy candy imported czech republic ?,1,0.0,0.0,14,0.9
336956,changes noticed started meditating ?,changed since started meditating ?,1,0.0,0.0,6,0.9655172413793104
336957,apply hair wax daily ?,use hair wax daily ?,0,0.0,0.0,5,0.8461538461538461
336958,ngo 's thane weekend volunteering ?,ngo 's cyberabad weekend volunteering ?,0,0.0,0.0,8,0.9
336959,able perform well academics even though parents support decisions . feel guilty . ?,"parent , support son 's decision change gender ?",0,0.0,0.0,58,0.7619047619047619
336960,ever add 4th ram windows gives bsod memory_management error . solution ?,got bcd error reverting back windows 8.1 windows 10 tab . solutions ?,0,0.0,0.0,51,0.782608695652174
336961,uninstall ubuntu install windows 7 ?,uninstall ubuntu install windows 10 ?,0,0.0,0.0,2,0.896551724137931
336962,fact nobody ever visited us future mean time travel undoubtedly impossible ?,time seen fourth dimension einstein believed mean creature could travel four dimensions travel way time three dimensions ? possible also mean future real past ?,0,0.0,0.0,115,0.9523809523809523
336963,start preparing upsc exam ?,"start preparing ias exam 2016 , achieve ?",1,0.0,0.0,18,0.7777777777777778
336964,sourav sarkar iit kharagpur ?,thing hate iit kharagpur ?,0,0.0,0.0,11,0.8148148148148148
336965,terraria ?,app terraria ?,0,0.0,0.0,4,0.9333333333333333
336966,feel fucked ?,"ceo , feel fuck ?",0,0.0,0.0,8,0.8421052631578947
336967,late 23 year old start college aiming doctor ?,16 years old late starting learing classical music becoming professional play back singer ?,0,0.0,0.0,66,0.7804878048780488
336968,much jared padalecki jensen ackles get paid per episode supernatural ?,much vets get paid per year ?,0,0.0,0.0,44,0.8108108108108109
336969,advantages disadvantages using models produce knowledge world ?,knowledgeable person world ?,0,0.0,0.0,45,0.8
336970,reasonable get angry people cancel last minute ?,best friend get angry easily ?,0,0.0,0.0,30,0.7878787878787878
336971,best way pump septic tank ?,often pump septic tank ? ?,0,0.0,0.0,9,0.8387096774193549
336972,embarrassing moment ever happened due mobile phone ?,embarrassing moment happened front wife ?,0,0.0,0.0,18,0.8648648648648649
336973,text girlfriend every day ?,"guy girlfriend really likes . every day looks eyes , stares . ?",0,0.0,0.0,41,0.8
336974,score weed hyderabad ?,find weed hyderabad ?,1,0.0,0.0,5,0.7692307692307693
336975,spanking legal us ?,parents legally allowed spank children ?,0,0.0,0.0,29,0.7096774193548387
336976,unhappy braces come ?,happy braces come ?,1,0.0,0.0,2,0.9285714285714286
336977,practical applications wave particle duality ?,"political instability common italy ? example , italy 63 different governments last 70 years .",0,0.0,0.0,68,0.7111111111111111
336978,get call details airtel prepaid number ?,get call details prepaid number ?,0,0.0,0.0,7,1.0
336979,turn airplane mode iphone ?,airplane mode iphone ?,0,0.0,0.0,5,0.9285714285714286
336980,best food ?,'s best food ?,1,0.0,0.0,3,0.9473684210526315
336981,favorite character star trek series ?,favorite character star trek tv series ? ?,1,0.0,0.0,5,1.0
336982,best race skyrim ?,friend told skyrim star wars video games . apt comparison ?,0,0.0,0.0,47,0.6857142857142857
336983,health benefits eating raw cabbage ?,health benefits cabbage ?,1,0.0,0.0,11,0.9333333333333333
336984,people ask intimate questions quora ?,people ask obscure questions quora ?,0,0.0,0.0,7,0.9090909090909091
336985,lose weight without exercising ?,lose weight without sport ?,1,0.0,0.0,9,0.8666666666666667
336986,nerdy mit ?,nerdy mit students ?,1,0.0,0.0,9,0.9090909090909091
336987,manage time study wisely ?,manage time studies ?,1,0.0,0.0,6,0.8888888888888888
336988,tenten really weak ?,weakness ?,0,0.0,0.0,15,0.7368421052631579
336989,sinai stupid jewplicate ararat ?,people stupid make bad impression jnu students politics ?,0,0.0,0.0,41,0.8571428571428571
336990,one bcci sharad pawar supporting lalit modi ?,mind-blowing facts sharad pawar ?,0,0.0,0.0,35,0.9
336991,"say , india “ uri terror attack ” pakistan ?",done india uri attack tackle pakistan ?,1,0.0,0.0,17,0.8571428571428571
336992,navy corpsman `` c '' school ?,navy corpsman ?,1,0.0,0.0,15,0.8571428571428571
336993,kind questions anthropologists ask ?,think kind questions ask ?,0,0.0,0.0,22,0.875
336994,think aap fulfill promises mentioned manifesto ? ?,kejriwal able fulfill promises ?,0,0.0,0.0,32,0.8
336995,"difference people status like rich , poverty , middle-class , upper-middle class ?",prepare mun country lebanon ?,0,0.0,0.0,66,0.7368421052631579
336996,happen stop eating added sugar year ?,stop eating sugar eliminate belly fat ?,0,0.0,0.0,26,0.8235294117647058
336997,meaning scope study project report ?,meaning reporter ?,0,0.0,0.0,20,0.8
336998,best site download tv series ?,best place look latest tv series downloads ?,1,0.0,0.0,23,0.9090909090909091
336999,find clients digital marketing agency ?,digital marketing agency finds client ?,1,0.0,0.0,26,1.0
337000,remove satellite dish ?,uninstall satellite dish ?,1,0.0,0.0,9,0.7692307692307693
337001,interesting thing lately ?,'s best thing ? best thing someone ?,0,0.0,0.0,21,0.6923076923076923
337002,hard learn snowboard ?,best place tahoe learn snowboard ?,0,0.0,0.0,15,0.896551724137931
337003,made islam spread around world faster religion ?,islam spread around world ?,1,0.0,0.0,21,0.9090909090909091
337004,causes blood cancer ?,causes cancer ?,0,0.0,0.0,6,0.8181818181818182
337005,introduce ssb interview ?,answer `` tell '' interview ?,0,0.0,0.0,14,0.6896551724137931
337006,learn linear algebra well ?,learn linear algebra ?,1,0.0,0.0,5,0.9523809523809523
337007,zaga zunt mean ?,israelis think yiddish ?,0,0.0,0.0,18,0.5
337008,"journal entry vat paid purchases vat collected sales , i.e . input greater output ?",advantages vat/gst sales tax ?,0,0.0,0.0,61,0.6285714285714286
337009,green phone icon messenger mean ?,green dot beside phone icon messenger app mean ?,0,0.0,0.0,15,0.9032258064516129
337010,chetan bhagat books worth reading ?,people praise chetan bhagat much ?,1,0.0,0.0,30,0.8
337011,become indian foreign service officer ?,indian foreign service officers vote ?,0,0.0,0.0,13,0.9032258064516129
337012,season 7 walking dead ?,walking dead season 7 ?,1,0.0,0.0,18,1.0
337013,become topper class ?,best way become topper class ?,0,0.0,0.0,9,0.9285714285714286
337014,"mother born germany . moved us , became citizen born ( 1975 . ) get dual citizenship germany ?",immigrated became canadian citizen . child become canadian automatically born us ?,0,0.0,0.0,70,0.8235294117647058
337015,safety precautions handling shotguns proposed nra utah ?,safety precautions handling shotguns proposed nra vermont ?,1,0.0,0.0,7,0.95
337016,son railway employee eligible railway cricket team ? procedure eligible ?,track management system ( tms ) indian railways ? role day-to-day work railway employee involved tms ?,0,0.0,0.0,74,0.8636363636363636
337017,taking pictures women public places without consent illegal india ?,legal take photos people without consent india ?,0,0.0,0.125,34,0.9230769230769231
337018,guys online dating many years without settling anyone ?,get info download pretty reckless selling full album tracklist ?,0,0.0,0.0,50,0.85
337019,difference sleeping meditation ?,difference meditation sleep ?,1,0.0,0.0,15,0.9696969696969697
337020,way get facebook ad coupon free ? ?,get facebook ad coupons ?,1,0.0,0.0,11,0.8823529411764706
337021,make racist hate people country ?,hate people think better others . racist ?,0,0.0,0.0,30,0.8571428571428571
337022,bought lenovo laptop amd radeon r5 m330 2gb graphic card.how change graphic card latest one plz help ?,"best activities children visiting banda aceh , indonesia ?",0,0.0,0.0,78,0.7555555555555555
337023,enlightenment according hinduism ?,hinduism ?,0,0.0,0.0,24,0.6923076923076923
337024,einstein atheist ?,einstein atheist ? ?,1,0.0,0.0,2,1.0
337025,keeping tablet computer next microwave damage tablet ?,idea ideal tablet computer ?,0,0.0,0.0,37,0.8333333333333334
337026,two wheelers petrol engine ?,two wheelers petrol engine diesel engine ?,1,0.0,0.0,14,0.9655172413793104
337027,best ways thaw lobster tails ?,properly thaw frozen lobster tails ?,1,0.0,0.0,15,0.875
337028,"unknown abscess ( later healed ) , pain ( subsided ) dead nerve , would dentist know look dead nerve ?",fresh would memory today seem went coma tomorrow emerged one year later ?,0,0.0,0.0,78,0.7142857142857143
337029,develop website builder ?,build website builder ?,1,0.0,0.0,6,0.8888888888888888
337030,better mba ?,mba better pgdm ?,0,0.0,0.0,8,0.8421052631578947
337031,would happen saw world augmented vision ?,would happen world financial markets products world going forward crowd funded ?,0,0.0,0.0,53,0.9
337032,make high quality video small file size ?,save high quality videos small files ?,1,0.0,0.0,7,0.9473684210526315
337033,pros cons cartilage piercing ?,pros cons septum piercing ?,0,0.0,0.0,8,0.8571428571428571
337034,difference transgender transexual person ?,difference ( ) transgender transexual ?,1,0.0,0.0,11,0.8888888888888888
337035,celebrate independence day ?,celebrations independence days ?,0,0.0,0.0,5,0.9333333333333333
337036,better option b sc sc ?,argue peace compassion correct way ?,0,0.0,0.0,23,0.7586206896551724
337037,toefl scores accepted canadian immigration department ?,95 decent toefl score ?,0,0.0,0.0,43,0.7741935483870968
337038,6 divisions gema ?,would list drama plays fit 6-7 graders ?,0,0.0,0.0,31,0.6470588235294118
337039,find information sunrock marijuana ?,best video marijuana ?,0,0.0,0.0,21,0.8125
337040,ever become immortal ?,ever reach immortality ?,1,0.0,0.0,8,0.8888888888888888
337041,attack 1-3-1 zone basketball ?,3 second rule basketball ?,0,0.0,0.0,14,0.8125
337042,ironic thing ever happened ? ironic ?,ironical instance ever happened ?,1,0.0,0.0,18,0.9032258064516129
337043,hack facebook account ?,hack friend 's facebook account ?,1,0.0,0.0,10,0.8387096774193549
337044,"humans coming africa encountered bred neanderthals , neanderthals come ?",neanderthals originate ? also africa ?,1,0.0,0.0,53,0.8888888888888888
337045,actual meaning life ?,purpose life ?,1,0.0,0.0,12,0.5833333333333334
337046,female billionaires world ?,female billionaires world ?,1,0.0,0.0,0,1.0
337047,good websites improve reading comprehension ?,good blogs/websites read improving reading comprehension ?,1,0.0,0.0,14,0.95
337048,study math ?,study math ?,1,0.0,0.0,0,1.0
337049,`` internship '' supposed based google ?,internships google ?,0,0.0,0.0,20,0.8125
337050,freedom msrit ?,taught 1st year msrit ?,0,0.0,0.0,15,0.64
337051,isfjs : si-ti look like ?,infps worst myers-briggs personality type ?,0,0.0,0.0,29,0.625
337052,take ap classes next year ?,take 4 ap classes next year ?,0,0.19490094229565127,0.16666666666666663,2,0.9655172413793104
337053,girl telling girl 're interested physically ?,cultural studies ?,0,0.0,0.0,35,0.7586206896551724
337054,would see husband cry ?,husband lie ? see details .,0,0.0,0.0,20,0.7333333333333333
337055,"trump land dc post office project fair/impartial/blind competitive bidding , get access property process ?","think today 's top artists forgotten twenty years ? , stand test time ?",0,0.0,0.0,77,0.7555555555555555
337056,similarities differences different classical dance forms india ?,forms classical dance india ?,0,0.0,0.0,37,0.9655172413793104
337057,space ships reduce amount co2 creating oxygen ?,best month job opportunity us mba students ?,0,0.0,0.0,38,0.8421052631578947
337058,like high iq ?,like high iq ?,1,0.0,0.0,0,1.0
337059,improve english aspects ?,specifically improve english ?,1,0.0,0.0,21,0.9142857142857143
337060,best laptop 40000 inr ?,best laptop buy 40000 inr ?,1,0.0,0.0,4,0.9375
337061,jinyang li 's 'distributed systems ' course new york university ?,makes new york university ( nyu ) good school ?,0,0.0,0.0,51,0.8695652173913043
337062,like work national institute oceanography ?,like work national institute oceanography ? ?,1,0.0,0.0,2,1.0
337063,good gifts foreign visitor bring 're invited someone 's home andorra first time ?,good gifts foreign visitor bring 're invited someone 's home vietnam first time ?,0,0.0,0.0,7,1.0
337064,makes proud country ? ?,makes proud country ?,1,0.0,0.0,2,1.0
337065,pokemon look like dogs ?,lab/boxer/pit bull mix dogs look like ?,0,0.0,0.0,28,0.75
337066,highest paying jobs nursing ?,highest paying jobs ?,0,0.0,0.0,8,0.9375
337067,best way learn new words ?,learn new words ?,1,0.0,0.0,9,0.88
337068,"degree better far reliable , computer engineering computer science ?","one better , computer science computer engineering ? ?",0,0.0,0.0,37,0.8888888888888888
337069,example platform leveraged another platform gain users ?,difference marketplace platform ? examples great !,0,0.0,0.0,43,0.85
337070,effect banning 500 1000 rs notes real estate sector india ? expect sharp fall prices short/long term ?,demonetized notes 500 1000 effect real estate ?,1,0.0,0.0,75,0.8372093023255814
337071,enneagram type 4 people ( tragic romantics ) tend break relationships suddenly without explanation ?,talents enneagram type 2 people ?,0,0.0,0.0,79,0.6829268292682927
337072,deal negativity around ?,deal negative friends ?,0,0.0,0.0,7,0.8275862068965517
337073,'s store republican party 2016 presidential election ?,trump debacle 2016 republican party go ?,1,0.0,0.0,38,0.9090909090909091
337074,"`` train busan '' , exactly main character ( fund manager ) indirectly caused outbreak ?",[ spoiler ] main character star wars killed ? chance coming back ?,0,0.0,0.0,58,0.7346938775510204
337075,difference left join left outer join sql ?,sql : difference various types joins ?,0,0.0,0.0,25,0.8648648648648649
337076,one best invaluable friendship quotes student ?,best forums engineering students ?,0,0.0,0.0,28,0.7647058823529411
337077,many hours day average ivy league undergraduate spend learning cramming ?,like ivy league undergraduate student ?,0,0.0,0.0,40,0.8333333333333334
337078,food safety : bad consumption avocado gone brown ?,"ate avocado skin , bad ?",0,0.0,0.0,36,0.7027027027027027
337079,"difference enum , union struct c programming ?",unions useful c programming ?,0,0.0,0.0,24,0.8823529411764706
337080,one priceworthy : ipod nano ipod touch ?,would buy ipod nano ipod touch ? one worth ?,1,0.0,0.0,28,0.9142857142857143
337081,"unlimited editorial input , new amendments constitution us would propose ? ?",amendments added u.s. constitution ?,0,0.0,0.0,53,0.8125
337082,americans think ridiculed rest world ?,americans think rest world dangerous ?,0,0.0,0.0,17,0.972972972972973
337083,use old phone number viber still asks confirmation using new number ?,phone dead . want install viber new phone number . receive messages sent never delivered old phone turned start new new device without retrieving old messages ?,0,0.0,0.0,120,0.9333333333333333
337084,"gpa 3.7-8 incoming junior , 've procrastinator thus far . 'm entering full ib next year . still go 3.9 ?",couple days december around germany ?,0,0.0,0.0,86,0.6666666666666666
337085,politicians email scandals besides hillary clinton ?,’ spring 2016. hillary clinton indicted ?,0,0.0,0.0,39,0.7804878048780488
337086,guy ejaculates taste ?,"wrong friends guy know likes , already told interested platonic friends ?",0,0.0,0.0,58,0.6666666666666666
337087,best excuse give teacher missing class ?,teacher always making fun front whole class . without getting mad giving lower grades ?,0,0.0,0.0,66,0.7804878048780488
337088,ex contacts ?,ex contacts ?,1,0.0,0.0,0,1.0
337089,strong gravity dying star make atoms dissapear ?,"since speed equal distance divided time , speed light constant time ?",0,0.0,0.0,52,0.7567567567567568
337090,one start small business ?,ways start business ?,0,0.0,0.0,10,0.8148148148148148
337091,story happened 2002 ?,story happened 1997 ?,0,0.0,0.0,4,0.8387096774193549
337092,many polls odds makers fail correctly predict outcome 2016 us presidential election ?,2016 us election polls get wrong ?,1,0.0,0.0,66,0.8095238095238095
337093,pros cons mba ?,pros cons mba ?,1,0.0,0.0,0,1.0
337094,best way teach child swim ?,teach kid swim ?,1,0.0,0.0,12,0.8571428571428571
337095,approximately many hours spent internet till date ?,amount time spent internet ?,0,0.0,0.0,30,0.8387096774193549
337096,like a.p.j . abdul kalam ?,a. p. j. abdul kalam study ?,0,0.0,0.0,14,0.8275862068965517
337097,follow someone instagram see many times viewed profile ?,see viewed instagram post ?,1,0.0,0.0,39,0.9142857142857143
337098,best blogging platform - wordpress blogger make money online ?,wordpress blogger compare blogging platforms ?,1,0.0,0.0,44,0.9
337099,process recovery old email account hotmail ?,recover emails compromised hotmail account ?,0,0.0,0.0,31,0.972972972972973
337100,best tanning oil use yellowish skin ?,best tanning oil use yellowish skin ?,1,0.0,0.0,0,1.0
337101,feel like friends ?,poor friends feel rich friends ?,0,0.0,0.0,16,0.8
337102,expensive boiling crab seafood restaurants ?,boiling crab seafood restaurant expensive ?,0,0.0,0.0,19,1.0
337103,eating pineapple help recover fever ?,long cat take recover fever due heat stroke ?,0,0.0,0.11111111111111116,32,0.8235294117647058
337104,separates humans animals ?,real difference humans animals ?,1,0.0,0.0,13,0.8275862068965517
337105,anyone encounter ghost real life ?,ever seen ghost real life ?,1,0.0,0.0,13,0.875
337106,common people distance most/all friends hitting life-changing personal tragedies ?,cope many people life distancing ?,0,0.0,0.0,60,0.8648648648648649
337107,air india operate dreamliners short haul domestic routes ?,air india provide free meals even short journey ( 50 minutes surat mumbai ) ?,0,0.0,0.0,44,0.7619047619047619
337108,get dog urine smell hardwood floors ?,common problems associated hardwood floors ?,0,0.0,0.0,21,0.8648648648648649
337109,best paying jobs ?,good paying jobs ?,1,0.0,0.0,4,0.8888888888888888
337110,buy jackfruit los angeles ?,buy weed los angeles without card ?,0,0.0,0.0,22,0.8421052631578947
