id,question1,question2,is_duplicate,CosineSimilarity,JaccardSimilarity,Levenshtein,DiceSimilarity
268002,start android ios mobile app ?,useful apps ? ?,0,0.0,0.0,24,0.5833333333333334
268003,civil engineer get job isro ?,job profile scientist/engineer `` sc '' isro civil engineer ?,0,0.0,0.0,42,0.8571428571428571
268004,"hotel yercaud hill-station would safe unmarried couples , without harassment police , hotel staff , moral police ?","hotel yelagiri hill-station would safe unmarried couples , without harassment police , hotel staff , moral police ?",0,0.0,0.0,6,0.9777777777777777
268005,story christian mythology nost relevant today modern societies ?,story christian mythology relevant today ?,0,0.0,0.0,22,1.0
268006,tell 've blocked facebook messenger ?,still see public likes blocked facebook ?,0,0.0,0.0,27,0.7428571428571429
268007,`` syscall '' interface ethereum 's evm provide dapps ?,"beginer , book read music want produce edm ?",0,0.0,0.0,42,0.7142857142857143
268008,donald trump ’ win elections impact indian students applying higher education us ?,trump 's victory effect indian students higher studies ?,1,0.0,0.0,40,0.8571428571428571
268009,'s story behind american flag ?,best stories behind country 's flag ?,1,0.0,0.0,15,0.95
268010,would happen earth moon jupiter ?,would happen jupiter collided earth ?,0,0.0,0.0,18,0.9411764705882353
268011,search best five star hotel bhopal ?,find best five star hotel bhopal ?,1,0.0,0.0,6,0.9090909090909091
268012,ways give feedback candidates without disclosing much ?,best treatment heal wound ?,0,0.0,0.0,42,0.7894736842105263
268013,best smartphones inventions ?,best mobile phones technology inventions ?,1,0.0,0.11111111111111116,18,0.8125
268014,ways increase typing speed keyboard ?,increase typing speed fast ?,1,0.0,0.0,12,0.8484848484848485
268015,work finance department startup company ?,work finance department ?,0,0.0,0.0,16,0.9142857142857143
268016,"bank mistakenly deposits $ 1,000,000 account , legally allowed spend realize mistake ?","student live new delhi , india . 40,000 rupees bank account . invest ?",0,0.0,0.0,64,0.8
268017,best way increase traffic new blog ?,best way drive traffic website ?,1,0.0,0.0,13,0.8125
268018,"boyfriend ca n't breath mouth , nose . tries almost throws . normal go doctor ?","since nose breathing function , mouth breathing function ? redundant ?",0,0.0,0.0,57,0.8837209302325582
268019,ca n't stop crying even people tell cry ?,stop crying people angry ?,0,0.0,0.0,18,0.9375
268020,attract customers ?,attract customers store ?,0,0.0,0.0,6,1.0
268021,develop ios sdk existing service like payment gateway ?,payment gateway company used wcf services experience ?,0,0.0,0.0,43,0.9047619047619048
268022,ca n improve communication skill ?,improve communication skills specially pronunciation skill ?,1,0.0,0.0,36,0.9714285714285714
268023,people told `` seller agents '' use redfin ?,redfin available manhattan ?,0,0.0,0.0,35,0.6666666666666666
268024,history behind naming stations mumbai ?,procedure organize event/ activities mumbai railway stations ?,0,0.0,0.0,45,0.8
268025,modify question reasking ?,edit question quora ?,0,0.0,0.0,12,0.8387096774193549
268026,given offer click labs ? worth joining given many bad reviews quora ( mostly old ) ?,working aricent past 5 months software engineer offer snapdeal higher package . go ? worth joining snapdeal ?,0,0.0,0.0,81,0.8
268027,go tier 3 data center ?,need data center ?,0,0.0,0.0,8,0.8181818181818182
268028,14 days late period without pregnant ?,"girlfriend sex , naked , private parts touched , periods 15 days late . pregnant ?",0,0.0,0.0,55,0.782608695652174
268029,get 10 lpa plus package fresher backlogs/supplementary semesters placements ?,m.sc . statistics fresher india get job salary package 12 lpa ?,0,0.0,0.0,55,0.8333333333333334
268030,"lose weight eating normal indian home cooked food , coupled half hour running every morning ?",best ways lose weight ?,0,0.0,0.0,79,0.6842105263157895
268031,improve english speaking writing skills ?,enhance english writing skills ?,1,0.0,0.0,15,0.8484848484848485
268032,claim abandoned car ( usa ) ?,one go claiming barn find usa ?,0,0.0,0.0,21,0.8823529411764706
268033,someone 've lost wireless usb connector logitech keyboard mouse ?,someone 've lost wireless usb connector iball keyboard mouse ?,0,0.0,0.0,7,0.9545454545454546
268034,"difference twin turbo , bi-turbo twin scroll turbo ?",difference bi-turbo twin-turbo ?,0,0.0,0.0,21,0.9090909090909091
268035,best place india ?,bombay best place india ?,0,0.0,0.0,7,0.896551724137931
268036,examples love analogies ?,example analogy ?,0,0.0,0.0,9,0.8461538461538461
268037,'s best fighting game ps4 ?,injustice best ps4 fighting game ?,0,0.0,0.0,16,0.8823529411764706
268038,'s reasonable amount spend per workstation office furniture ?,need know buying furniture home office ?,0,0.0,0.0,44,0.8
268039,atomic radius measured ?,atomic radius usually measured ?,1,0.0,0.0,8,0.9285714285714286
268040,interesting thing ever happened ?,best thing almost happened ?,1,0.0,0.0,14,0.8
268041,"computers perform subtraction , multiplication , division perform addition ?","computers still use nine 's complement addition perform math functions , 2nd generation computers ?",0,0.0,0.0,66,0.8571428571428571
268042,pursue biotechnology b.tech mechanical engineering ?,available options government jobs completing b.tech mechanical engineering ?,1,0.0,0.0,36,0.9
268043,download movie free ?,websites download movies free ?,1,0.0,0.0,10,0.9032258064516129
268044,scotland leave uk due brexit ?,scotland northern ireland leave uk ?,0,0.0,0.0,21,0.9142857142857143
268045,unhealthy sex strangers cope loneliness/depression ? consequences continued behavior kind ?,one overcome depression anxiety ?,0,0.0,0.0,66,0.7804878048780488
268046,first amendment 's purpose ?,first amendment important ?,1,0.0,0.0,8,0.9333333333333333
268047,would happen another world war ?,world war 3 happen ?,0,0.0,0.0,22,0.8888888888888888
268048,best books learning python ?,good books online tutorials learning python basics ?,1,0.0,0.0,28,0.918918918918919
268049,interesting products innovations boston properties coming 2016 ?,interesting products innovations boston scientific coming 2016 ?,0,0.0,0.0,8,0.9777777777777777
268050,change font facebook ?,change font facebook posts ?,1,0.0,0.0,6,0.9285714285714286
268051,get fear death ?,get fear death ?,1,0.0,0.0,0,1.0
268052,craziest/weirdest things 've seen penguin ?,craziest/weirdest things 've seen crow ?,0,0.0,0.0,7,0.9230769230769231
268053,everyone today ?,everyone ?,1,0.0,0.0,6,0.8421052631578947
268054,iphone worth ?,buying iphone 6 plus worth ?,1,0.0,0.0,14,0.7586206896551724
268055,kendall kylie jenner close ?,like kendall kylie jenner school ?,0,0.0,0.0,9,0.967741935483871
268056,study get good marks ntse ?,get good marks ntse exam books refer ?,1,0.0,0.0,23,0.8387096774193549
268057,best way learn big data ?,perquisites learn big data ?,1,0.0,0.0,10,0.8387096774193549
268058,start answering questions chegg ca n't see option homepage ?,see answers chegg ?,0,0.0,0.0,43,0.7333333333333333
268059,india become developed country 2050 ?,india become developed country 2040 ?,0,0.0,0.0,1,0.9523809523809523
268060,iima course media management ?,iphone 6 t-mobile use family mobile ?,0,0.0,0.125,28,0.6470588235294118
268061,chemical properties ammonia ?,chemical properties carbon ?,0,0.0,0.0,5,0.967741935483871
268062,get job pune mechanical engineer ?,get mechanical engineer job pune ?,1,0.0,0.0,18,1.0
268063,oldest wildlife sanctuary india ?,wildlife india ?,0,0.0,0.0,17,0.7407407407407407
268064,u° scale used measure temperature ?,ways measuring temperature ?,0,0.0,0.0,14,0.6896551724137931
268065,protocol homekit use communicate devices ?,use apple homekit devices ?,0,0.0,0.0,24,0.9444444444444444
268066,quora flagged question needing improvement ?,every question quora need improvement ?,1,0.0,0.0,21,0.8888888888888888
268067,beautiful lines comment beautiful pictures ?,beautiful pictures indian bhabi ?,0,0.0,0.0,26,0.8823529411764706
268068,best karaoke software ?,best karaoke software ?,1,0.0,0.0,0,1.0
268069,embarrassing injury ?,embarrassing moment swimming pool ?,0,0.0,0.0,18,0.7333333333333333
268070,many times safely dye hair month ?,long wait dye hair ?,0,0.0,0.0,20,0.8387096774193549
268071,transfer uk university us university ?,possible transfer us community college uk university ?,0,0.0,0.0,25,0.8
268072,reset gmail password n't remember recovery information ?,reset gmail password n't remember recovery information ?,0,0.0,0.0,0,1.0
268073,pulses challenges prospects food security ?,prospects challenges pulses sustainable food security ?,1,0.0,0.0,20,0.9743589743589743
268074,learn children ?,adults learn children ?,0,0.0,0.0,7,0.88
268075,badass thing parent ever done ?,cringe-worthiest thing middle school ?,0,0.0,0.0,29,0.7272727272727273
268076,kill george o'malley grey 's anatomy ?,life work surgeons really shown grey 's anatomy ?,0,0.0,0.0,23,0.8888888888888888
268077,best railway minister far india ?,best railway minister ?,0,0.0,0.0,10,0.9333333333333333
268078,pole roots characteristics equation ?,take admission m.a delhi university ?,0,0.0,0.0,30,0.7428571428571429
268079,best movie 2016 ?,movie 2016 watch ?,1,0.0,0.0,11,0.8
268080,ask right questions ?,one master art asking right questions ?,1,0.0,0.0,18,0.967741935483871
268081,take control masturbation ?,stop masturbation ?,1,0.0,0.0,10,0.8275862068965517
268082,world war 3 likely ?,likely world war iii future ?,1,0.0,0.0,16,0.8571428571428571
268083,career prospects master 's degree economics dse isi ?,job prospects masters degree economics ?,0,0.0,0.0,16,0.9090909090909091
268084,"supplied san bernardino shooters semi-automatic rifles ( bought handguns , semi-automatic rifles ) ?",many semi-automatic rifles per year walmart sell ban ?,0,0.0,0.0,66,0.8181818181818182
268085,carry rice hong kong ?,hong kong part japan ?,0,0.0,0.0,18,0.72
268086,happy ?,happy ?,0,0.0,0.0,0,1.0
268087,people asperger 's less manipulative without ?,people asperger 's prone addiction others ?,0,0.0,0.0,19,0.8333333333333334
268088,engineering management university alberta ?,university alberta ?,0,0.0,0.0,23,0.9333333333333333
268089,india ban `` made china '' products ?,india ca n't ban chinese products ?,1,0.0,0.0,12,0.9444444444444444
268090,best online course recruitment ?,best online course ?,0,0.0,0.0,12,0.9629629629629629
268091,best laptop buy inr 50k ?,laptop best 50k budget ?,1,0.0,0.0,17,0.8235294117647058
268092,estonian men like ?,albanian men like ?,0,0.0,0.0,4,0.8181818181818182
268093,probable cutoff kvpy sa 2016 ?,expected kvpy 2016 sa cut ?,1,0.0,0.0,21,0.8205128205128205
268094,anyone trinidad tobago ?,trinidad tobago ?,0,0.0,0.0,7,0.9166666666666666
268095,e-commerce different traditional commerce ?,features online supermarket different traditional e-commerce site ?,0,0.0,0.0,29,0.8823529411764706
268096,planing start company sell insurances online/offline india . licences required ? get licenses ?,since 4 weeks could n't properly get good night 's sleep ticklish sensation goes head everywhere legs . ?,0,0.0,0.0,82,0.782608695652174
268097,singapore 's crime rate low ?,birth rate low singapore ?,0,0.0,0.0,23,0.8484848484848485
268098,best colleges dehradoon psychology visit come check colleges ?,"hi portlanders , 's best thing city , 36 hours portland ? info : 'm america ; 'm coming asia traveling alone visit reed college , spending another day two portland . seeing seattle visiting family vancouver ?",0,0.0,0.0,169,0.7843137254901961
268099,really bored nothing ?,bored ?,1,0.0,0.0,15,0.6363636363636364
268100,ext js used ?,ext js : ext js niche skill ?,0,0.0,0.0,18,0.6086956521739131
268101,need help writing argument essay article `` n't help kids homework ? dana goldstein,person higher iq lower problem solving ability someone lower iq ?,0,0.0,0.0,65,0.7906976744186046
268102,prepare good notes feel 'm forgetting everything . fear n't prepared enough . ?,feel forget everything learn ?,0,0.0,0.0,50,0.8108108108108109
268103,ragging experience ?,experience ragging ?,0,0.0,0.0,16,1.0
268104,ban rs 500 1000 notes impact indian economy ?,banning 500 1000 inr going help indian economy ?,1,0.0,0.0,17,0.8717948717948718
268105,stupid thing donald trump said ?,worst things donald trump said ?,1,0.0,0.0,7,0.9696969696969697
268106,people nasa think spacex ?,nasa think elon musk 's spacex ?,1,0.0,0.0,20,0.9090909090909091
268107,"thee following script , ( ɖ∀ཡز∂ ɐŧ ƫҿϟɮ☉ ɽφʉʛƕ ) , appears like written greek ?","following script , ( ɖ∀ཡز∂ ɐŧ ƫҿϟɮ☉ ɽφʉʛƕ ) , appear like written greek ?",1,0.0,0.0,6,0.9866666666666667
268108,start competitive coding ?,experience competitive coding start first ?,1,0.0,0.11111111111111116,21,0.9411764705882353
268109,earn extra money weekends faridabad ?,earn extra money weekends delhi ?,0,0.0,0.0,8,0.8888888888888888
268110,typing skills matters getting job mnc ?,skills experience matter getting job ?,0,0.0,0.0,20,0.9473684210526315
268111,start e-commerce company ?,start run e-commerce business ?,1,0.0,0.125,12,0.8275862068965517
268112,best place holiday india ?,best places holidays india ?,1,0.0,0.0,2,1.0
268113,philosophy life ?,philosophy life ?,1,0.0,0.0,0,1.0
268114,unlock ipads forgotten password ?,unlock ipad ?,1,0.0,0.0,20,0.7741935483870968
268115,best thing worst thing ever life ?,worst thing life ?,1,0.0,0.0,16,0.9333333333333333
268116,"think trump ’ secretary state appointment rex tillerson , ceo exxon mobil ?","thoughts donald trump 's potential candidate secretary state , rex tillerson ?",0,0.0,0.0,59,0.8636363636363636
268117,"way get quora show list questions meet criteria also drawn high level interest , i.e. , lots followers ?",n't quora app show list questions following ?,0,0.0,0.09999999999999998,72,0.7906976744186046
268118,sell products online money ?,sell products online ?,0,0.0,0.0,6,0.9333333333333333
268119,get letter usa nepal sent regular overseas mail.will get call receive docments dont po box ?,"received offer letter tcs , got mail stating register nsr ( national skill registry ) . mandatory register ?",0,0.0,0.0,77,0.7555555555555555
268120,favorite animals ?,three favorite animals ?,1,0.0,0.0,6,0.9655172413793104
268121,perishable goods ?,extrovert friends make fun belittle time even though constantly tell done like ?,0,0.0,0.0,66,0.7027027027027027
268122,long take hpcl announce interview result gae ? announce website mail .,"make schedule , since always gets disturbed announced test assignment next day ?",0,0.0,0.0,56,0.8444444444444444
268123,much need save retirement ? start saving plan ?,much save good retirement plan ?,1,0.0,0.0,23,0.972972972972973
268124,'s best response friend expelled school ?,"11th right . school past 12 years . , still feel best true friends . ?",0,0.0,0.0,54,0.7619047619047619
268125,best way teach piano ?,best books teaching piano ?,0,0.0,0.0,8,0.8666666666666667
268126,top 10 product-based software companies india ?,best product-based software companies india ?,0,0.0,0.0,6,0.95
268127,blood donation good health ?,donating blood good health ?,1,0.0,0.0,13,1.0
268128,movie ( ) made cry ?,is/are movie ( ) made cry ?,1,0.0,0.0,7,0.9333333333333333
268129,safety precautions handling shotguns proposed nra rhode island ?,safety precautions handling shotguns proposed nra georgia ?,1,0.0,0.0,9,1.0
268130,youtube lyric videos load faster music videos ?,many people think really annoying music better informative narration youtube video ?,0,0.0,0.0,59,0.8780487804878049
268131,get job graduation civil engineer ?,get job civil engineering ?,0,0.0,0.0,14,0.9032258064516129
268132,learn speak fluent english ?,could improve english ?,1,0.0,0.0,16,0.7272727272727273
268133,gender writes popular novels ? ?,5 things consider choosing cloud service mobile apps ?,0,0.0,0.11111111111111116,39,0.8421052631578947
268134,ca n't view revision history shared document google docs ?,way see viewing history chat history google docs ?,0,0.0,0.0,25,0.9230769230769231
268135,communism : like live communist russia ( ussr ) ?,communism last china ussr ?,0,0.0,0.0,27,0.7878787878787878
268136,"sms service , pinger/textfree , give number receive texts desktop client ?",sms service uber use ?,0,0.0,0.0,53,0.6470588235294118
268137,anyone learn draw ?,learn draw ?,1,0.0,0.0,7,0.9
268138,indian girls ever give lifts boys ?,indian men like curvy girls ?,0,0.0,0.0,20,0.7647058823529411
268139,artificial intelligence ?,factors involved artificial intelligence ?,1,0.0,0.0,17,0.8571428571428571
268140,secret behind bermuda triangle ?,'s mystery behind bermuda triangle ?,1,0.0,0.0,8,0.9142857142857143
268141,colleges start sending admission letters ?,mit release admission letters 3:16 pm ?,0,0.0,0.0,26,0.7878787878787878
268142,nice places hangout pune ?,best places hangout weekend pune ?,1,0.0,0.0,12,0.8484848484848485
268143,'s popular movie ?,popular movie watched ?,0,0.0,0.0,11,0.7741935483870968
268144,’ typeface used ‘ king ’ logo ?,"ex gf 's bday coming next week.i 'm dilemma whether send gift not.we good friends , however might ruin everything ?",0,0.0,0.0,97,0.723404255319149
268145,"india , things women easily , men ca n't ?",things muslims india countries ?,0,0.0,0.0,30,0.8333333333333334
268146,"confident , especially approaching girls ?",become confident front girls ?,1,0.0,0.0,27,0.8
268147,want kill someone n't want hurt living creature . feel satisfied ?,want kill n't want hurt living creature . feel satisfied ?,1,0.0,0.0,8,0.9545454545454546
268148,early warning signs tornado coming ?,warning signs tornado ? one case approaching tornado ?,1,0.0,0.0,31,0.8484848484848485
268149,people talent lives ?,find passion life ?,0,0.0,0.0,14,0.8333333333333334
268150,best addiction ?,best addiction ?,1,0.0,0.0,0,1.0
268151,good lat dumbbell exercises ?,best exercises lats ?,0,0.0,0.0,20,0.8275862068965517
268152,world famous business astrologer india ?,top 10 business astrologers india ?,1,0.0,0.0,11,0.8333333333333334
268153,canon dslr camera equivalent nikon d3200 ?,'s canon equivalent nikon d3200 ?,1,0.0,0.0,13,0.926829268292683
268154,significance lake baikal ?,lake baikal significant ?,1,0.0,0.0,21,0.9629629629629629
268155,"hotel kasauli hill-station would safe unmarried couples , without harassment police , hotel staff , moral police ?","hotel leh ladakh hill-station would safe unmarried couples , without harassment police , hotel staff , moral police ?",0,0.0,0.0,9,1.0
268156,important life lesson 've learned far ?,best lesson learned life ?,1,0.0,0.0,21,0.8387096774193549
268157,"hotel shillong hill-station would safe unmarried couples , without harassment police , hotel staff , moral police ?","hotel saputara hill-station would safe unmarried couples , without harassment police , hotel staff , moral police ?",0,0.0,0.0,7,0.9767441860465116
268158,critical issues delegates faced constitutional convention solve ?,like constitutional convention ?,0,0.0,0.0,34,0.8387096774193549
268159,define morality ?,define moral ?,0,0.0,0.0,3,0.9230769230769231
268160,type government guatemala ? compare one canada ?,type government guatemala ? compare one france ?,0,0.0,0.0,5,0.9411764705882353
268161,indian know indian railways facts ?,interesting things indian railways ?,1,0.0,0.0,19,0.7741935483870968
268162,start preparations civil service exam first year engineering ?,start preparing civil services first year engineering ?,1,0.0,0.09090909090909094,9,0.9142857142857143
268163,"phrase `` pressure incompressible fluid '' ( vs. containing surface ) sensible ? [ physics aside , seems linguistically oxymoronic . ]",use bash windows ?,0,0.0,0.0,122,0.5454545454545454
268164,people vote hillary clinton woman ?,people vote hillary clinton 's woman ?,1,0.0,0.0,3,0.9444444444444444
268165,essential skill ?,essential skills doctors ?,0,0.0,0.0,9,0.8333333333333334
268166,glue bonds paper metal ?,glue bonds metal plastic ?,0,0.0,0.0,11,0.9090909090909091
268167,inside black hole ?,universe exist inside black hole ?,1,0.0,0.0,15,0.8484848484848485
268168,issued non creamy layer certificate march 2014. valid till april 2017 ?,obc non-creamy layer eligibility son government employee ?,0,0.0,0.0,44,0.7111111111111111
268169,k-nearest neighbor algorithm different k-means clustering ?,"use k-nearest neighbors ? better algorithm nn , svm , etc . ?",0,0.0,0.0,37,0.8837209302325582
268170,steve jobs study college dropping ?,steve jobs drop college ?,0,0.0,0.0,14,0.8823529411764706
268171,"throw ball fast moving vehicle , come straight back hands fall behind us ?","sitting moving bus , throw ball upwards , still come back hands instead falling behind ?",1,0.0,0.0,58,0.9787234042553191
268172,"switching job ( 2-3 years ) , much percentage salary hike average among indian manufacturing companies ?",b2b businesses market product ?,0,0.0,0.0,85,0.7346938775510204
268173,"body soul , soul ?","'s relationship body , mind soul ?",0,0.0,0.0,22,0.6666666666666666
268174,celestial object bend space ?,`` bend space time '' mean ?,0,0.0,0.0,23,0.8
268175,going interviewed west point grad ? ?,stop second guessing time even 've clearly done well ?,0,0.0,0.0,40,0.8333333333333334
268176,many pages harry potter books combined ?,eighth harry potter book set ?,0,0.0,0.0,18,0.8823529411764706
268177,"many different numbers 4 digits made digits 0,1,2,3,4,5 , digit repeated ?","sum 4 digit numbers formed digits 0 , 1 , 2 , 3 , 4 ? repetitions allowed .",0,0.0,0.0,47,0.88
268178,'s difference bank guarantee letter credit ?,difference bank account balance credit card balance ? related ?,0,0.0,0.0,35,0.8823529411764706
268179,banning 500 1000 notes stop black money ?,would demonetization 500 1000 rupee notes actually help curbing black money india ?,1,0.0,0.0,49,0.8695652173913043
268180,light pollution free places around hyderabad ? give somenames ?,resign central govermnt job join state job… rejoin central govermnt two three years ?,0,0.0,0.0,62,0.8372093023255814
268181,better finance : nmims mumbai iift kolkata ? ?,true discrimination scenario iift kolkata ?,0,0.0,0.0,25,0.9142857142857143
268182,keys piano ascending ( bass high ) left right ?,best piano/keyboard learn beginner india 61 keys ?,0,0.0,0.0,37,0.8095238095238095
268183,"better iphone , 6 plus 6s ?",iphone better : iphone 6 iphone 6 plus ?,0,0.0,0.0,20,0.9375
268184,good resources learning numerical analysis ?,good resources learn alchemy ?,0,0.0,0.0,18,0.9375
268185,people go anonymous frequently quora ?,people go anonymous quora ?,1,0.0,0.0,11,0.9375
268186,non income student want apply pan card dont ao code question ao code non income person pune ?,"anyone ever gotten middle age , little experience happy occupation last 25 years ?",0,0.0,0.0,73,0.7906976744186046
268187,"exam india try crack , beyond iit/iim/upsc ( already b.tech & mba ) ?",crack iit exam ?,0,0.0,0.0,55,0.5789473684210527
268188,make laugh loud ?,make laugh ?,0,0.0,0.0,5,0.9090909090909091
268189,share beautiful moments life ?,beautiful touching moment life ?,1,0.0,0.0,16,0.875
268190,someone knows shawn mendes personally tell camera ?,marathi language born admixture kannada prakrit ?,0,0.0,0.0,43,0.7567567567567568
268191,create recurring appointment occur every third thursday every month outlook ?,vba macro outlook want run regular schedule like every half hour . ?,0,0.0,0.0,55,0.8888888888888888
268192,"'m 6 feet tall , royal enfield buy ?",height 6 '' 3 royal enfield would prefer ?,1,0.0,0.0,24,0.8
268193,one prepare toefl ?,prepare toefl ielts ?,1,0.0,0.0,10,0.8695652173913043
268194,'ve notice bottom hole tongue piercing white 's little bump kinda stings . could infected ?,tongue piercing infected bottom hole white around bit red stings push bar touch bottom ?,0,0.0,0.0,67,0.9130434782608695
268195,think possible consciously change perceptions time ?,"passage time changes based perception , possible minds capable manipulating time ?",1,0.0,0.0,56,0.9
268196,really mean tell someone love ?,find really means love someone ?,0,0.0,0.0,15,0.8571428571428571
268197,advantages taking premium membership matrimonial site ?,best matrimonial sites india ?,0,0.0,0.0,40,0.8235294117647058
268198,hillary clinton considered criminal ?,hillary clinton criminal ?,0,0.0,0.0,11,0.896551724137931
268199,iphone 5s 4g enabled ?,would rather see star wars movie : at-at size bb8 bb8 size at-at ?,0,0.0,0.0,55,0.5945945945945946
268200,level difficulty pega cba certification ?,difficulty level sbi po exam ?,0,0.0,0.0,24,0.8421052631578947
268201,feel death penalty `` cruel unusual punishment '' ?,death penalty cruel unusual punishment ?,1,0.0,0.0,11,0.918918918918919
268202,"cold gobi desert get , average temperatures compare ones patagonian desert ?","cold gobi desert get , average temperatures compare ones simpson desert ?",1,0.0,0.0,8,1.0
268203,indians believe indians iq 82 high indians ?,people say mahatma gandhi much indian revolution ?,0,0.0,0.0,39,0.6666666666666666
268204,risk management ? level used workplace ?,companies manage vendor risk ?,0,0.0,0.0,29,0.8888888888888888
268205,wrong code ?,wrong c++ code ?,0,0.0,0.0,4,0.9523809523809523
268206,peter singer : become philosopher ?,peter singer become philosopher ?,0,0.0,0.0,2,0.9696969696969697
268207,overcome insomnia anxiety exam ?,ways cope test-taking anxiety ?,0,0.0,0.0,20,0.75
268208,income based reservation replace caste based reservation india ?,ca n't caste based reservation replaced income based reservation making filing income returns mandatory also computerized ?,0,0.0,0.0,67,0.8292682926829268
268209,rich ?,rich jake williams ?,0,0.0,0.0,14,0.6
268210,bad college gpa ?,working produce clerk ?,0,0.0,0.0,18,0.6923076923076923
268211,learn seo online ?,learn seo online ?,1,0.0,0.0,0,1.0
268212,nothing goes right life ?,everything goes wrong life ?,1,0.0,0.0,10,0.896551724137931
