id,question1,question2,is_duplicate,CosineSimilarity,JaccardSimilarity,Levenshtein,DiceSimilarity
404209,fastest way sign yahoo mail ?,fastest way sign yahoo mail classic ?,0,0.0,0.0,8,0.9696969696969697
404210,kind user interests inmobi admob target ?,kind data facebook 's users ?,0,0.0,0.0,29,0.8484848484848485
404211,cerebral palsy hacks ?,cerebral palsy ?,0,0.0,0.0,6,0.9166666666666666
404212,often people travel abroad weekend ?,often people travel abroad ?,0,0.0,0.0,8,0.9333333333333333
404213,2s class indian railways ?,tqwl irctc wait list ?,0,0.0,0.0,18,0.75
404214,holi ?,'s holiness god ?,0,0.0,0.0,11,0.6666666666666666
404215,like work aaron sorkin ?,'s like work aaron sorkin ?,1,0.0,0.0,3,0.96
404216,new year resolutions 2017 ?,new year resolution 2017 plan execution ?,1,0.0,0.0,16,0.9230769230769231
404217,shocking moves expected prime minister modi ?,"demonetization , could next step needs taken indian government prevent black money corruption ?",0,0.0,0.0,70,0.8095238095238095
404218,requirements become ethical hacker ?,become ethical hacker ?,1,0.0,0.0,13,0.875
404219,windows 10 store error `` try later . something happened end '' ?,fix srt log file error windows 10 ?,0,0.0,0.0,48,0.75
404220,book read die ?,anyone enlist 'must read ' books die ?,1,0.0,0.0,26,0.7142857142857143
404221,international college students negatively affected trump becomes president ?,trump factor affect admission international students usa ?,1,0.1017034517579245,0.09090909090909094,59,0.8947368421052632
404222,make money travelling ?,way make money travelling ?,0,0.0,0.0,4,0.967741935483871
404223,travelling pakistan business visa affect chances getting us visa later india ?,apply us tourist visa getting h1b visa india ?,0,0.0,0.0,45,0.85
404224,improve english language ?,increase english fluency ?,1,0.0,0.0,13,0.7741935483870968
404225,best site dating experiences ?,best asian dating sites ?,0,0.0,0.0,11,0.8461538461538461
404226,"took 2 trips , 1 thats 3km & 1 thats 4km . draw show ur resultant displacement 2 trips could 7 km e , 1 km n , & 5 km . help anyone ?",upgrade moto g2 xt 1068 3g 4g ?,0,0.0,0.0,117,0.6122448979591837
404227,russian politics affect australia new zealand ?,russian politics geostrategy affect australia new zealand ?,1,0.0,0.0,12,0.9473684210526315
404228,procedure start tennis academy india ?,done make india sporting nation ?,0,0.0,0.0,28,0.8387096774193549
404229,remedy prolonged knee pain ?,remedies knee pain due cycling ?,0,0.0,0.0,20,0.875
404230,"n't want sleep night , ?","n't want go sleep . enjoy awake ! yet , need sleep . ?",0,0.0,0.0,33,0.7428571428571429
404231,klopp overrated ?,jurgen klopp overrated manager ?,1,0.0,0.0,15,0.8275862068965517
404232,got 92 percentile cat 2015. college apply ?,"got 86.3 percentile cat 2015 , colleges apply ?",0,0.0,0.0,7,0.8636363636363636
404233,play dolphin gamecube emulator using computer 's joypad ?,know used gamecube controller good ?,0,0.0,0.0,36,0.8
404234,caliber tragedy would take place gun advocates change mind gun control ?,n't `` gun control advocates '' bother learn anything firearms `` advocating '' ?,0,0.0,0.0,66,0.8695652173913043
404235,causes nationalism europe ?,causes nationalism ?,0,0.0,0.0,7,0.9285714285714286
404236,'s take speech pm pakistan un ?,views nawaz sharif 's speech un general assembly ?,0,0.0,0.0,34,0.7027027027027027
404237,reviews sensovision system ?,lothar matthaus germany 's greatest footballer ?,0,0.0,0.0,37,0.6451612903225806
404238,"know molecule single , double , triple bond ?","atom solid , liquid gas ? none ?",0,0.0,0.0,31,0.7777777777777778
404239,foreigner think chinese ?,think chinese people ?,0,0.0,0.0,17,0.8148148148148148
404240,build computer ?,start building computer ?,1,0.0,0.0,9,0.875
404241,get good college ?,get really good college ?,1,0.0,0.0,7,0.8571428571428571
404242,overcome pornography addiction ?,overcome porn addiction ?,1,0.0,0.0,7,0.9032258064516129
404243,quora determine many views answer gets ?,number views quora counted ?,1,0.0,0.0,29,0.8888888888888888
404244,gmat self-prep book best test ?,best gmat self-prep book 2016 ?,1,0.0,0.0,14,0.8888888888888888
404245,much cost maintain e-commerce website year ?,cost developing e-commerce website cost maintaining india ?,0,0.0,0.0,34,0.7894736842105263
404246,’ conservatives think life begins birth ?,n't conservatives remember founding fathers called terrorists british ?,0,0.0,0.0,42,0.85
404247,"among bollywood stars , actor actress much acting ?",bollywood actors actresses known acting ?,1,0.0,0.0,22,0.8717948717948718
404248,ways simplify square root 56 ?,square root 98 ?,0,0.0,0.0,16,0.6451612903225806
404249,stop using pornography masturbatory aid ?,"permanently let go looking , viewing watching pornography using masturbatory aid ?",1,0.0,0.0,45,0.8292682926829268
404250,mean facetime says someone `` available '' facetime ?,mom see facetime history ?,0,0.0,0.0,40,0.75
404251,"laptop cpu ( cpu monitor ) .i want copy data cpu laptop.is possible.if yes , ?",ligament ( e.g round ligament uterus ) transmit carcinoma ?,0,0.0,0.0,61,0.8372093023255814
404252,best free web hosting php ?,best free web hosting services ?,0,0.0,0.0,8,0.9032258064516129
404253,make website like fmovies.to ?,best way make website ?,0,0.0,0.0,20,0.7857142857142857
404254,internship available student `` ceramic technology '' third semester ? yes please tell !,5th sem student pursuing computer engineering want project java shuld go training ? yes please let know take training,0,0.0,0.0,88,0.8333333333333334
404255,ibm watson use elasticsearch ?,google use elasticsearch ?,0,0.0,0.0,10,0.8387096774193549
404256,common questions asked interviews ?,common questions asked interviews correct answer ?,0,0.0,0.0,15,1.0
404257,bitcoin ? legal india ?,bitcoin legal india ?,1,0.0,0.0,2,1.0
404258,difference psychologist psychiatrist ? ” ?,difference psychologist psychatist ?,1,0.0,0.0,6,0.972972972972973
404259,think wrong indian schools education ?,wrong current indian education ?,1,0.0,0.0,17,0.875
404260,phone best 12000 ?,best phone buy 15k ?,0,0.0,0.0,12,0.7857142857142857
404261,overall popular game thrones character ?,popular character game thrones series ?,1,0.0,0.0,21,0.9411764705882353
404262,troubleshoot toshiba laptop ?,reset toshiba laptop ?,0,0.0,0.0,8,0.9629629629629629
404263,burning fossil fuels contribute global warming ?,co2 contribute global warming water vapour ?,0,0.0,0.0,32,0.8648648648648649
404264,safe store external battery power bank ( usb devices ) car ?,make safe cheap power bank ?,0,0.0,0.0,39,0.7
404265,gain weight body ?,eat gain weight ?,1,0.0,0.0,9,0.8333333333333334
404266,green dot next phone icon messenger ?,"boyfriend says deleted facebook messenger app , still available video calling . next chat name mobile icon always says 1 min . mean ?",0,0.0,0.0,105,0.7441860465116279
404267,causes fall roman empire ?,important causes effects fall roman empire ?,1,0.0,0.0,18,0.967741935483871
404268,n't still great music like 70 's 80 's ?,raise young child 80 's music ?,0,0.0,0.0,27,0.8205128205128205
404269,diagnose antisocial personality disorder ?,feel like antisocial personality disorder ?,0,0.0,0.0,8,0.9090909090909091
404270,difference ?,difference `` & '' `` '' ?,0,0.0,0.0,14,0.8571428571428571
404271,stalin grandchildren still alive pro-russia ?,joseph stalin 's 5 year plan ? affect russia ?,0,0.1339321056589374,0.0,33,0.7692307692307693
404272,best new car products inventions people n't know ?,mind-blowing vehicles tools exist people n't know ?,1,0.0,0.0,29,0.8095238095238095
404273,happens put milk coffee maker ?,would happen put milk instead water automatic drip coffee maker ?,1,0.0,0.0,36,0.9473684210526315
404274,next generation parenting change stay ?,kind parents next generation ?,1,0.0,0.0,28,0.8387096774193549
404275,"accounting , debit expenses credit revenues ?",utilities expense accounting ? accrue record ?,0,0.0,0.0,35,0.8888888888888888
404276,copilotsearch.com ?,contenvania.com ?,0,0.0,0.0,10,0.7407407407407407
404277,analytics ?,analytical people like ?,0,0.0,0.0,14,0.782608695652174
404278,prepare aiims/neet/aipmt ?,prepare aiims ug entrance exams ?,0,0.0,0.0,14,0.8148148148148148
404279,minimum time required build flyover 1km ?,cheaper quicker way build underpass flyover ?,0,0.0,0.0,32,0.7804878048780488
404280,outfit ideas wear frat party ?,outfit ideas wear frat themed party ?,1,0.0,0.0,7,0.9375
404281,manaphy childish pokémon ranger temple sea ?,manaphy annoying pokemon ranger temple sea ?,1,0.0,0.0,8,0.918918918918919
404282,long distance relationship work ?,long distance relationships maintained ?,1,0.0,0.0,11,0.9142857142857143
404283,think removal magsafe connector apple 's 2016 macbook pro ?,cpu upgrade 2016 apple macbook pro mean ?,0,0.0,0.0,39,0.8
404284,jainism say homosexuality ?,jainism say gays homosexuality ?,1,0.0,0.0,5,0.9696969696969697
404285,many keywords racket programming language latest version ?,many keywords perl programming language latest version ?,0,0.0,0.0,6,0.975609756097561
404286,believe life death ?,true life death ?,1,0.0,0.0,6,0.8333333333333334
404287,one coin ?,'s coin ?,0,0.0,0.0,3,0.8
404288,"approx annual cost living studying uic chicago , indian student ?","little hairfall problem want use hair styling product . one prefer gel , wax clay ?",0,0.0,0.0,64,0.8695652173913043
404289,like sex cousin ?,like sex cousin ?,0,0.0,0.0,0,1.0
