id,question1,question2,is_duplicate,CosineSimilarity,JaccardSimilarity,Levenshtein,DiceSimilarity
269939,best ways lose lot weight quickly possible ?,lose weight quickly ?,1,0.0,0.0,23,0.9142857142857143
269940,cant someone stop thinking ?,stop thinking something ?,0,0.0,0.0,17,0.9285714285714286
269941,find gay businessman ?,gay man find boyfriend ? still believe true love gay men ?,0,0.0,0.0,44,0.8484848484848485
269942,funnels ? funnels work ?,funnels used ?,0,0.0,0.0,12,0.7619047619047619
269943,reason sleep apenea ?,reasons sleeping despite tired ?,0,0.0,0.0,14,0.8333333333333334
269944,round robin scheduling ?,round robin scheduling java ?,0,0.0,0.0,5,0.9090909090909091
269945,gay anal fisting harmful health ?,air coolers harmful health ?,0,0.0,0.0,13,0.8387096774193549
269946,endemic species india ?,cross species genetics possible ?,0,0.0,0.0,22,0.64
269947,prepare get selected google summer code . ?,tips clearing google summer code ?,1,0.0,0.0,19,0.9090909090909091
269948,amount heat electrical tape resist ?,use electrical tape ?,0,0.0,0.0,16,0.8571428571428571
269949,calculate energy savings antimicrobial technology ?,one calculate energy savings installing insulation ?,0,0.0,0.0,25,0.9142857142857143
269950,many people greedy ?,people greedy ?,1,0.0,0.0,5,0.8695652173913043
269951,good idea graduate early college ?,pros cons graduating college early ? ( 3-year vs 4-year plan ),0,0.0,0.0,41,0.7567567567567568
269952,disadvantages using hair dryer ?,best hair dryers curly hair ?,0,0.0,0.0,23,0.8
269953,stop thinking dying ?,stop thinking ?,0,0.0,0.0,6,0.9166666666666666
269954,get huge choice high quality wall floor tiles sydney ?,found durable easy clean floor tiles sydney ?,1,0.0,0.0,27,0.8648648648648649
269955,get many headaches ?,would get headaches lot ?,1,0.0,0.0,13,0.7407407407407407
269956,get trauma breakup ?,get first break ?,1,0.0,0.0,8,0.75
269957,"n't uti , still problems peeing . problems may causing ?",math problem divisor-limit-exponential-differntial-integral ?,0,0.0,0.0,50,0.7142857142857143
269958,feel like comedy writer ?,comedy ?,0,0.0,0.0,17,0.6956521739130435
269959,life always unfair ?,life unfair ? ?,1,0.0,0.0,9,0.8695652173913043
269960,'s good book self-study topology ?,'s best introductory book topology ?,1,0.0,0.0,20,0.8333333333333334
269961,processing gypsum powder ?,supplier gypsum powder grinding machine best ?,0,0.0,0.0,31,0.8648648648648649
269962,review telecom regulatory authority india ( trai ) ?,views net neutrality india ?,0,0.0,0.0,30,0.7777777777777778
269963,junior college singapore compared colombia ?,junior college singapore compared spain ?,0,0.0,0.0,7,0.9714285714285714
269964,beautiful actress world ?,beautiful actress europe ?,0,0.0,0.0,5,0.9032258064516129
269965,best time age man get married ?,age man suppose get married ?,1,0.0,0.0,15,0.8571428571428571
269966,american tv shows mostly popular india ?,american tv shows popular india ?,0,0.0,0.0,7,0.9743589743589743
269967,80/20 rule troubleshooting ?,80/20 rule ?,0,0.0,0.0,16,0.7142857142857143
269968,"program offer structure employees skills ? sort database cvs every employee , mostly internal use .",worth r programming coursera employees ?,0,0.0,0.0,74,0.7906976744186046
269969,good sodas mix vodka ?,good vodka tonic recipes ?,0,0.0,0.0,14,0.7142857142857143
269970,n't mormons wear tank tops ?,best 80 % work 20 % play smartphone ?,0,0.0,0.0,26,0.7428571428571429
269971,would consider robin hood hero villan ?,robin hood criminal hero ?,1,0.0,0.0,25,0.8387096774193549
269972,people make noises sex ?,girls make sounds sex ?,1,0.0,0.0,9,0.8275862068965517
269973,free app make money subscriber ?,developers make money free apps ?,0,0.0,0.0,18,0.7878787878787878
269974,pls suggest guy stage name music ?,suggest good guy stage name music pls ?,1,0.0,0.0,13,0.9375
269975,voice-over artist ?,break voice-acting business ?,0,0.0,0.0,18,0.8275862068965517
269976,allowed take spices checked luggage ? maximum amount take ?,carry spices check-in luggage netherlands ?,0,0.0,0.0,34,0.8205128205128205
269977,super bowls ?,"super bowl xlix ( february 1 , 2015 ) : win super bowl 2015 , seattle new england ?",0,0.0,0.0,70,0.5641025641025641
269978,safety precautions handling shotguns proposed nra florida ?,safety precautions handling shotguns proposed nra maine ?,1,0.0,0.0,6,0.9743589743589743
269979,know lose fat face ?,face fat . slim moon face ?,0,0.0,0.0,17,0.8148148148148148
269980,best browser facebook ?,browser best open facebook ?,1,0.0,0.0,12,0.9285714285714286
269981,"applied iift 2016 , send nc-obc certificate submit later ?",various stages life cycle source program neat diagram . ?,0,0.0,0.0,48,0.7555555555555555
269982,regret career ?,regret ?,0,0.0,0.0,7,0.8571428571428571
269983,ashwin next wizard spin bowling ?,think police customs working vehicle stops together ?,0,0.0,0.0,40,0.7368421052631579
269984,n't politician retirement ?,n't politicians retirement ?,1,0.0,0.0,1,0.9655172413793104
269985,top 10 favorite albums ?,top 10 music albums time list ?,1,0.0,0.0,17,0.8823529411764706
269986,antarctica desert ?,antarctica desert ?,0,0.0,0.0,0,1.0
269987,theon greyjoy evil game thrones ?,theon greyjoy really evil ?,1,0.0,0.0,15,0.9375
269988,opera browser ( built vpn ) genuine vpn ?,"opera vpn free , 's catch ?",0,0.0,0.0,29,0.6285714285714286
269989,make teenage years ?,make teenage years ?,1,0.0,0.0,0,1.0
269990,get job silicon valley n't live 'm senior developer ?,budhiya days ? preparing olympic ?,0,0.0,0.0,41,0.85
269991,bittersweet moment 've experienced life ?,nostalgic moment ever experienced life ?,0,0.0,0.0,12,0.8717948717948718
269992,man gets married escort bad morals ?,would marry someone knew sex worker ?,0,0.0,0.0,27,0.6875
269993,someone predict future ?,predict future ?,1,0.0,0.0,8,0.8461538461538461
269994,donald trump still hiding tax records ?,n't donald trump release tax returns ?,1,0.0,0.0,18,0.8571428571428571
269995,best wordpress hosting site ?,choose best wordpress hosting ?,0,0.0,0.0,12,0.967741935483871
269996,"'s important , knowledge imagination -- - ?",imagination knowledgeable important ?,0,0.0,0.0,26,0.8648648648648649
269997,"star wars , n't rebel soldiers wear kind protective armor like storm troopers ?",armour storm troopers star wars effective ?,0,0.0,0.0,56,0.7567567567567568
269998,hybridization no3- ?,lewis dot structure no3-1 ?,0,0.0,0.0,18,0.625
269999,individuals events history source pride greece ?,individuals events history source pride china ?,0,0.0,0.0,6,0.972972972972973
270000,movies real sex ?,movie first same-sex kiss ?,0,0.0,0.0,15,0.8148148148148148
270001,manaphy cry annoyingly pokemon ranger temple sea ?,manaphy childish pokémon ranger temple sea ?,1,0.0,0.0,13,0.9473684210526315
270002,white petroleum jelly good face moisturizer ?,petroleum jelly ?,0,0.0,0.0,28,0.7058823529411765
270003,write commission proposal ?,write proposal sponsors ?,0,0.0,0.0,16,0.9285714285714286
270004,four causes erosion ?,causes soil erosion ?,0,0.0,0.0,10,0.9166666666666666
270005,girls guys likely vegetarian ?,vegetarian girls guys common ?,1,0.0,0.0,24,0.875
270006,best way remove google homepage ?,restore google homepage ?,0,0.0,0.0,10,0.8666666666666667
270007,question marked needing improvement ! mean ? mark questions improvement ?,post question marked needing improvement ?,1,0.0,0.0,41,0.972972972972973
270008,tenderer ?,tendering engineer ?,0,0.0,0.0,10,0.875
270009,hard practice water polo compared pool swimming ?,hard practice water polo compared surfing ?,0,0.0,0.0,9,0.9473684210526315
270010,meaning แรงรักไฟมาร ?,ιχς mean ?,0,0.0,0.0,18,0.46153846153846156
270011,"couple live comfortably $ 11,000 month new york city ?","live comfortably $ 5,600 month new york city ?",0,0.0,0.0,10,0.8979591836734694
270012,access walmart wire home ?,buying tires walmart good idea ?,0,0.0,0.0,19,0.75
270013,song featured audi a3 commercial ?,theme song new audi 3 cabriolet ?,0,0.0,0.0,21,0.8947368421052632
270014,incident made cry public ?,made cry public ?,1,0.0,0.0,9,0.9333333333333333
270015,need ein want import us non us resident ?,get united states ein non-resident alien ? want start selling amazon usa .,0,0.0,0.06666666666666665,55,0.8235294117647058
270016,"better , gtx 960m amd radeon r7-m440 ?",graphic card better nvidia geforce gtx 950m ( 2 gb ) amd radeon m375 ( 4 gb ) ? extra memory make much difference perfomance ?,0,0.0,0.0,95,0.6666666666666666
270017,difference contingent liability provision ?,'s difference liability provision accounting ?,0,0.0,0.0,25,0.95
270018,codecademy code school equivalent learning use analytics make great products design decisions ?,codecademy equivalents kinds things ?,0,0.0,0.0,63,0.9523809523809523
270019,'m interested stock market . begin ? knowledge .,best ways invest money ?,0,0.0,0.0,37,0.7058823529411765
270020,masters english worth uk ?,"worth masters university manchester , uk electrical ( power ) engg ?",0,0.0,0.0,50,0.8292682926829268
270021,best programming blogs ?,best programming blog ?,1,0.0,0.0,1,1.0
270022,'s good song best friend lyric prank ?,good prank lyric text text friend ?,1,0.0,0.0,26,0.8947368421052632
270023,"pro-tamil forces captures majority regions southern india , would current indian government able take back ?",difference thinking middle age human sex compared thinking teenager ?,0,0.0,0.0,80,0.8333333333333334
270024,best way prepare bitsat 2018 ?,prepare bitsat 2018 ?,1,0.0,0.0,9,0.9333333333333333
270025,think donald trump unfit presidency ?,donald trump qualified president ?,0,0.0,0.0,14,0.8648648648648649
270026,difference adiabatic isothermal process ?,adiabatic process ?,0,0.0,0.0,22,0.8387096774193549
270027,foods start letter n ?,foods start letter ?,0,0.0,0.1428571428571429,2,0.9565217391304348
270028,causes someone constantly interrupt others talking ?,stop talking much ?,0,0.0,0.0,40,0.9142857142857143
270029,connect vc firms angel investors .,'s best way connect angel investors ?,1,0.0,0.0,16,0.7647058823529411
270030,law religious parents force children go church believe believe ?,religion : atheism another religion ?,0,0.0,0.0,42,0.7222222222222222
270031,lose weight ?,"ugly fat , lose weight ?",1,0.0,0.0,11,0.8148148148148148
270032,"would one decide proportion personal knowledge , belief , evidence ?",would someone 's soul decide kill person ?,0,0.0,0.0,45,0.7692307692307693
270033,", , minimum wage raised $ 15 ?",minimum wage increased $ 15.00 ?,1,0.0,0.0,12,0.8888888888888888
270034,gaining weight ?,gaining weight ?,0,0.0,0.0,0,1.0
270035,best laptop photo editing 70k inr ?,best laptop currently photo editing 40k ?,0,0.0,0.0,15,0.8780487804878049
270036,single illuminating question ask someone ?,subtle question ask someone biggest tell character ?,0,0.0,0.0,38,0.8823529411764706
270037,doesnt zero energy universe imply actions opposites happening time ?,"zero , since contains sense numbers opposites , largest number possible ?",0,0.0,0.0,51,0.85
270038,'s difference infatuation real love ?,difference infatuation true love ?,1,0.0,0.0,7,0.9375
270039,people least self-centered ?,people self-centered ?,0,0.0,0.0,6,0.9655172413793104
270040,people interpret bhagavad gita saying `` 's better live destiny imperfectly live imitation somebody else 's life perfection . `` ?,bhagavad gita overrated ?,0,0.0,0.0,107,0.7027027027027027
270041,traditional engineering degree canada jobs . transition cs taken cs courses ?,arvind kejriwal feeling right super flop bharat bandh plan ?,0,0.0,0.0,57,0.8292682926829268
270042,theoretical physicists believe god ?,physicists believe god ? ?,0,0.0,0.0,14,0.9411764705882353
270043,good metaphors acceptance ?,'s best metaphor ever ?,0,0.0,0.0,17,0.7586206896551724
270044,extent racism illegal united states ?,corrupt police united states ?,0,0.0,0.0,18,0.8387096774193549
270045,"one harder , programming mathematics ?",one get bored programming ?,0,0.0,0.0,20,0.8387096774193549
270046,washing hair everyday shampoo harmful ?,washing hair daily shampoo harmful ?,1,0.0,0.0,7,0.9473684210526315
270047,technology change culture ?,technology changing culture italy ?,0,0.0,0.0,9,0.9655172413793104
270048,cottage cheese cream cheese differ ?,cottage cheese different cheese ?,0,0.0,0.0,14,0.9333333333333333
270049,voted trump regret . vote regret ?,president obama regret ridiculing donald trump ?,0,0.0,0.0,32,0.7096774193548387
270050,good brainware college engineering ?,terna college engineering good ?,0,0.0,0.0,16,0.8888888888888888
270051,probability getting atleast one ace single throw two dice ?,jedi order exile dark jedi instead killing ?,0,0.0,0.0,44,0.7428571428571429
270052,best friend ?,find best friends ?,0,0.0,0.0,6,1.0
270053,lesser known important historical figures croatia people know ?,lesser known important historical figures qatar people know ?,0,0.0,0.0,5,0.975609756097561
270054,computer science undergrad put projects made udacity courses ( full stack developer ) resume ?,projects udacity full stack web developer ? complete month developer experience ?,0,0.0,0.0,66,0.8571428571428571
270055,possible believe genetic differences `` races '' ethnic groups without using claim superiority ?,'s like mistaken different ethnicity actually ?,0,0.0,0.0,66,0.8181818181818182
270056,calculate cgpa gpa final exam result ? cgpa gpa mean ?,calculate gpa cgpa ?,0,0.0,0.0,34,0.7407407407407407
270057,type doctor treats hemorrhoids ? treated ?,types doctors treats arthritis ?,0,0.0,0.0,19,0.9655172413793104
270058,difference pride integrity ?,difference pride dignity ?,0,0.0,0.0,5,1.0
270059,obtain international driving license ?,illegal people obtain driving license california ?,0,0.0,0.0,30,0.9411764705882353
270060,guys like tall girls ?,'m 21 year old girl guy ever asked number . 'm 5 ' 7 1/2″ . could tall ?,0,0.0,0.0,61,0.6341463414634146
270061,daniel ek : n't spotify come india yet ? launching india ?,daniel ek : n't spotify coming india instead huge internet consumption india ?,1,0.0,0.0,30,0.9777777777777777
270062,ok feel change field graduated engg ?,completed engineering mechanical want make career computer sector . different options . ?,0,0.0,0.0,69,0.8717948717948718
270063,lesser known fact indian railways ?,lesser known facts indian railways ?,1,0.0,0.0,1,1.0
270064,fan post credits scenes ?,fan ( 2016 film ) post credits scenes ?,1,0.0,0.0,14,0.7777777777777778
270065,would life death ?,life death . ?,1,0.0,0.0,8,0.8333333333333334
270066,btech student appear ugc-net history geography ?,prepare ugc net history ?,0,0.0,0.0,28,0.9142857142857143
270067,sad emotional songs could make cry ?,good songs make cry ?,1,0.0,0.0,17,0.875
270068,"govt banning rs . 500 1000 currency note , withdrawal limit 10,000 per day . saw senior citizen withdrawing 80,000 ?",good tv shows like `` tudors '' ?,0,0.0,0.0,98,0.6382978723404256
270069,"`` n't leave , life death . '' native english speakers comprehend sentence ? proverb ?",good summary proverbs ?,0,0.0,0.0,72,0.65
270070,tinder experience ?,experience tinder like ?,1,0.0,0.0,16,0.9166666666666666
270071,mean `` developing cutting edge desktop applications '' ? one explain detail .,"want develop application . good go django ror ? 'm beginner , one easy ?",0,0.0,0.0,54,0.782608695652174
270072,"ask live country apart india , country would ?",makes india different country rest world ?,0,0.0,0.0,31,0.8717948717948718
270073,usa implemented institutions policies like india root caste based differentiation resolved institutional racism us ?,funny creative mistakes made programming beginners ?,0,0.0,0.0,90,0.926829268292683
270074,`` limbo '' ?,actually limbo ?,0,0.0,0.0,11,0.6666666666666666
270075,sum √2+√4+√8+√16+√32+√64+√128+…up 20 terms ?,sum 1 ( /√2 ) + ( 1/√4 ) + ( 1/√8 ) + ( 1/√16 ) + ( 1√32 ) + ( 1/√64 ) + ( 1/√128 ) + ( 1/√256 ) …up 20 terms ?,0,0.0,0.0,67,0.9047619047619048
270076,benefits becoming ias officer ?,perks ias officer ?,1,0.0,0.0,15,0.7407407407407407
270077,"family live comfortable $ 9,000 month new york city ?","family 3 live $ 75,000 new york city ?",0,0.0,0.0,22,0.8695652173913043
270078,short attention span learn advanced english material quickly . considered “ dumb ” student ?,"short attention span , learn advanced english material quickly . considered “ dumb ” student ?",0,0.0,0.0,2,0.9811320754716981
270079,forget someone loved deeply ?,forget someone l love much ?,1,0.0,0.0,9,0.8125
270080,best digital marketing course mumbai ?,'s best digital marketing course mumbai ?,1,0.0,0.0,3,0.972972972972973
270081,get easily bored everything ?,get bored easily need psychological risk feel excited . ideas ?,1,0.0,0.0,43,0.8205128205128205
270082,top paying career options b.tech mechanical engineering ?,best career plan completing graduation b.tech ( mechanical engineering ) ?,1,0.0,0.0,33,0.8780487804878049
270083,movie best sex scene ?,top sex movies ?,0,0.0,0.0,14,0.8333333333333334
270084,scope supply chain management usa ?,scope supply chain management usa ?,1,0.0,0.0,0,1.0
270085,"atheist , overcome depression knowing 'll never loved ones 're gone ?",atheist depressing ?,0,0.0,0.0,49,0.7428571428571429
270086,study medicine uk ?,possible study medicine uk foreigner ?,0,0.0,0.0,19,0.7878787878787878
270087,mass neutron determined ?,mass neutron ? mass determined ?,1,0.0,0.0,7,1.0
270088,important : competition cooperation ?,better : competition cooperation ?,1,0.0,0.0,8,0.9629629629629629
270089,best cricketer ?,'s best cricketer world far ?,1,0.0,0.0,13,0.7407407407407407
270090,people quora ask silly questions facts googled easily ?,people ask basic questions instead searching ?,1,0.0,0.0,28,0.9
270091,best car technology gadgets ?,best car accessories technology ?,0,0.0,0.0,19,0.9375
270092,safe india lone young female traveller ?,india safe enough female traveller ?,1,0.0,0.0,12,0.9444444444444444
270093,gillian anderson : help charities ?,gillian anderson : help charities support ?,1,0.0,0.0,8,0.9714285714285714
270094,word 'penance ' used sentence ?,word 'perfidious ' used sentence ?,0,0.0,0.0,8,0.9032258064516129
270095,complicated program ever written ?,complicated program ever written errors ?,0,0.0,0.0,7,0.9714285714285714
270096,fields enter completing b.tech mechanical engineering ?,"completing b.tech mechanical engineering , job secured course take ?",1,0.0,0.0,39,0.8837209302325582
270097,approximate fuel consumption volvo 8400 bus idling ac ?,lifespan volvo bus ?,0,0.0,0.0,37,0.7368421052631579
270098,best harry potter film ?,favorite film harry potter series ?,1,0.0,0.0,17,0.9375
270099,perks dating australian woman ?,perks dating australian women ?,1,0.0,0.0,1,1.0
270100,would safest place live ww3 breaks ?,"global war , ww3 broke , country would safest live ?",1,0.0,0.0,40,0.8837209302325582
270101,difference computer science engineer programmer ?,"difference computer science , computer engineering , software engineering ?",0,0.0,0.0,32,0.9444444444444444
270102,universities offering masters mechanical australia ?,"rmit university , melbourne good masters automotive mechanical engineering ? job opportunities australia ?",0,0.0,0.0,63,0.8292682926829268
270103,"non-native english speakers , hardest accent understand ?",accent english hardest non native speaker understand ?,1,0.0,0.0,29,0.95
270104,make instagram account private ?,make instagram account private ?,1,0.0,0.0,0,1.0
270105,pornography law : legal distribute pornographic content ( image/video ) online app france italy ?,look someone 's private instagram account without following ?,0,0.0,0.0,71,0.8163265306122449
270106,causes night terrors ?,babycenter : causes night terror 2 year olds ?,1,0.0,0.0,24,0.8235294117647058
270107,like linus torvalds quora ?,’ linus torvalds quora ?,0,0.0,0.0,4,0.9032258064516129
270108,world ignorant american citizens ?,americans ignorant countries ?,0,0.0,0.0,21,0.8387096774193549
270109,better 'favorite ' 'retweet ' tweet twitter ?,twitter retweets : people tweet nothing say ?,0,0.0,0.0,29,0.6
270110,design principles minecraft cannon ?,"b1 vnsa rejected 2013 company reapplied , want specific answer give visa rejection.what reason give ?",0,0.0,0.0,82,0.7391304347826086
270111,find facebook user id ?,people generally know facebook id ?,0,0.0,0.0,25,0.7878787878787878
270112,tim cook 's email ?,tim cook like ?,0,0.0,0.0,7,0.8695652173913043
270113,make website like accountablehq.com wordpress ?,make website like canva.com wordpress ?,0,0.0,0.0,10,0.9047619047619048
270114,good facebook page name entertainment fun ?,good name facebook entertainment page ?,1,0.0,0.0,17,0.9714285714285714
270115,things visiting palestine tourist might know ?,things visiting netherlands tourist might know ?,0,0.0,0.0,9,0.9473684210526315
270116,n't airplanes fly much higher 35-38k ft ?,"things airline cabin crews know , wo n't tell ?",0,0.0,0.0,34,0.6976744186046512
270117,best pc game played 2016 ?,best pc game 2016 ?,1,0.0,0.0,7,0.9090909090909091
270118,breathe ?,breathe ?,0,0.0,0.0,0,1.0
270119,makes question right question ?,makes question good ?,1,0.0,0.0,12,0.9032258064516129
270120,n't touchid work iphone restarts ?,iphone requires password restarts ?,0,0.0,0.0,22,0.8823529411764706
270121,best alternatives quora ?,best alternative quora ?,1,0.0,0.0,1,1.0
270122,"slam brakes car panic , skid certain distance straight level road . traveling twice fast , distance would car skidded , conditions ?",car speedometer work ?,0,0.0,0.0,114,0.717948717948718
270123,best torrent sites ?,best torrent sites ?,1,0.0,0.0,0,1.0
270124,arnab goswami resign times ? start entrepreneurs . ?,arnab goswami quitting times ?,1,0.0,0.0,29,0.9090909090909091
270125,"want get reselling flipping cars state illinois expenses take consideration title , city/state tax , vehicle sticker fees ? get around ?","buy car california live washington state , pay taxes twice ?",0,0.0,0.0,101,0.9166666666666666
270126,sex important relationships ?,sex important relationship ?,1,0.0,0.0,1,1.0
270127,stop wanting everything ?,stop wanting kill ?,0,0.0,0.0,9,0.7586206896551724
270128,n't anyone reply questions quora ?,questions get ignored quora ?,1,0.0,0.0,21,0.8
270129,online tool convert python code java code ?,tool web application convert python code java ?,1,0.0,0.0,19,0.9444444444444444
270130,best youtube channels mechanical engineers ?,best youtube channel civil engineering student ?,0,0.0,0.0,18,0.918918918918919
270131,sweatpants called sweatpants 're sweater pants ?,"items made wool itchy , others soft ?",0,0.0,0.0,34,0.6875
270132,'s difference social networks social media ?,difference boys girls social media ?,0,0.0,0.0,14,0.8
270133,signs women give satisfied sex ?,signals girl gives 's interested guy ?,0,0.0,0.0,20,0.6875
270134,easiest way stop masturbation ?,best ways stop reduce frequency masturbation ?,1,0.0,0.0,22,0.8888888888888888
270135,difficult learn coding 30 old start ?,30 years old old start coding ?,0,0.0,0.11111111111111116,26,0.9142857142857143
270136,get porn addiction ?,best way overcome porn masturbation addiction ?,1,0.0,0.0,28,0.75
270137,monotreme ?,common examples monotremes ?,0,0.0,0.0,17,0.7272727272727273
270138,hp officejet 4620 airprint compare hp laserjet enterprise m605x ?,hp officejet 4620 airprint compare hp laserjet enterprise m605n ?,0,0.0,0.0,1,0.9777777777777777
270139,new currency note rs.2000 equipped nano gps chips ?,true 2000 note embeded gps chips ?,1,0.0,0.0,29,0.8292682926829268
270140,parallel universe ?,parallel universe work ?,0,0.0,0.0,5,0.8888888888888888
270141,"better compression , zip rar ?",extract unzip unrar password protected zip rar file ?,0,0.0,0.0,35,0.7428571428571429
270142,things look buying house condo built 1980 ?,things look buying house condo built 1950 ?,0,0.0,0.0,1,0.9523809523809523
270143,mechanical engineering ?,aim mechanical engineering ?,1,0.0,0.0,4,1.0
270144,ballistic missiles aim change direction ?,missiles aim change direction ?,0,0.0,0.0,10,0.9696969696969697
270145,intensity light become half lens cut horizontally cut perpendicular principal axis ?,find cutting length total length bbs ?,0,0.0,0.0,64,0.85
270146,ok,would wealthy ?,0,0.0,0.0,14,0.14285714285714285
270147,128 gb storage macbook pro retina enough ?,apple macbook pro ( retina display ) buy ?,0,0.0,0.0,28,0.7619047619047619
270148,approach giving price ( aka `` ask '' ) seed stage investors ?,investors care educational background founders ?,0,0.0,0.0,49,0.75
270149,latest trend ethnic dress girls ?,latest trend ethnic dress men ?,0,0.0,0.0,5,0.9285714285714286
270150,great programming projects beginners ?,beginner create great profile github ? projects contribute ? create project ?,0,0.0,0.0,51,0.8571428571428571
270151,best apps writing journal programming activities ?,'s n't first year engineering ?,0,0.3047865489590687,0.0,37,0.6060606060606061
270152,best website making posters ?,good website making poster ?,1,0.0,0.0,5,0.9696969696969697
270153,boyfriend moved fight told needs time work things mean ?,love guy made three times . getting married months said 'd contact months . mean ?,0,0.0,0.0,56,0.8095238095238095
270154,major social faux pas avoid visiting eritrea ?,major social faux pas avoid visiting sweden ?,0,0.0,0.0,6,0.9767441860465116
270155,feel like fall love best friend ?,happens best friends fall love ?,1,0.0,0.0,27,0.9090909090909091
270156,change theme magento e-commerce ?,want split test magento e-commerce website . split test checkout page ?,0,0.0,0.0,47,0.7428571428571429
270157,"still separate men women categories sports , equal ?",men 's women 's chess separate events ?,0,0.0,0.0,35,0.7428571428571429
270158,get complete list gmail accounts ?,find list gmail addresses ?,1,0.0,0.0,19,0.7586206896551724
270159,core subjects technical subjects btech study get job infosys campus ? dbms cn ?,get developer job infosys campus ?,0,0.0,0.0,52,0.9545454545454546
