id,question1,question2,is_duplicate,CosineSimilarity,JaccardSimilarity,Levenshtein,DiceSimilarity
337997,things new employees know going first day charming shoppes ?,things new employees know going first day vitamin shoppe ?,0,0.0,0.0,6,0.9523809523809523
337998,delete messages free version voxer send offline ?,check someone replied message freenode irc offline ?,0,0.0,0.0,32,0.8
337999,best book afcat ?,best books afcat ?,1,0.0,0.0,1,1.0
338000,"right time drink lime water , workout workout ?",right take bath workout ?,0,0.0,0.19999999999999996,25,0.8125
338001,possible change eye color ?,possible permanently change color eye ?,1,0.0,0.0,18,0.9411764705882353
338002,realistically make money online ?,make money online job ?,1,0.0,0.0,18,0.7857142857142857
338003,tr show love beloved girlfiend ?,dgca exams getting aircraft maintenance engineering license difficult clear ?,0,0.0,0.0,62,0.7058823529411765
338004,best programming language start learning ?,programming language best nowadays ?,1,0.0,0.0,17,0.9142857142857143
338005,cultural taboos different parts world ?,interesting cultural taboos europe ?,0,0.0,0.0,29,0.8823529411764706
338006,possible woman love 2 men time ?,love two person time ?,1,0.0,0.0,18,0.8666666666666667
338007,"food eat every day breakfast , lunch dinner ?",food eat every day protect health ?,1,0.0,0.0,20,0.7777777777777778
338008,worst screenwriter hollywood ?,best screenwriters hollywood ?,0,0.0,0.0,4,0.967741935483871
338009,promote youtube video free ?,promote youtube video free ?,1,0.0,0.0,0,1.0
338010,social enterprises give paid free legal services underserved poor people ? give examples ?,best executive mba option 1 year work ex around new delhi ?,0,0.0,0.0,66,0.8181818181818182
338011,best porn site buy membership ?,best porn site ?,0,0.0,0.0,15,0.8461538461538461
338012,okay sex people break partner still sexually active ?,"taking break boyfriend/girlfriend ya ’ still sex , okay sex people ?",1,0.0,0.0,47,0.7804878048780488
338013,advice would give 16 year old ?,advice would give 16 year old self ?,1,0.0,0.0,5,0.9444444444444444
338014,best editor javascript ?,best editor javascript coding ?,1,0.0,0.0,7,0.9375
338015,get help dental work afford pay ?,'m looking internships jobs work home decent pay . help ?,0,0.0,0.0,41,0.7804878048780488
338016,best psychiatrist pune ?,good psychiatrists chandigarh ?,0,0.0,0.0,14,0.8
338017,"'his last vow ' , mycroft mean saying `` east wind coming sherlock , 's coming get '' ?",sherlock respect mycroft tv series ?,0,0.0,0.0,66,0.7804878048780488
338018,'s 2017 new year resolution ?,new year resolutions 2017 ?,1,0.0,0.0,14,0.972972972972973
338019,get rid acne effect ?,get rid acne get nice skin ?,1,0.0,0.0,11,0.88
338020,life prison like ?,prison life like ?,1,0.0,0.0,10,1.0
338021,"hotel mathura would safe unmarried couples , without harassment police , hotel staff , moral police ?","hotel jaipur would safe unmarried couples , without harassment police , hotel staff , moral police ?",0,0.0,0.0,4,0.975609756097561
338022,ece domain students eligible write cs gate exam ?,person electronics background write gate cs domain ?,0,0.0,0.0,35,0.9230769230769231
338023,would win fight lion grizzly bear ?,would win fight grizzly bear rhino ?,0,0.0,0.0,11,1.0
338024,5.9 cgpa nit 316 gre . people think profile ?,cgpa 9.2. apply phd directly b.tech nit ?,0,0.0,0.0,34,0.7317073170731707
338025,living usa worth ?,america still worth living ?,1,0.0,0.0,18,0.875
338026,suitable safest place pune smoke weed ?,anybody smoked weed space ?,0,0.0,0.0,30,0.8235294117647058
338027,punjabi aroras different multani aroras ?,inland problem transporting 31m large component,0,0.0,0.0,36,0.7777777777777778
338028,could identify talent ?,discover talent identify ?,1,0.0,0.0,18,0.8666666666666667
338029,validity unsigned receipt ?,would look walmart receipt ?,0,0.0,0.0,17,0.7272727272727273
338030,many keywords pascal programming language latest version ?,many keywords c++ programming language latest version ?,0,0.0,0.0,5,0.9767441860465116
338031,could life possible without friction ? place friction zero ?,would happen lived world almost friction ?,0,0.0,0.0,38,0.9
338032,major differences jupyter project kibana ?,'s difference method function python ?,0,0.0,0.0,27,0.8421052631578947
338033,evidence illuminati exists ?,illuminati thing real ?,1,0.0,0.0,18,0.7142857142857143
338034,best way kill remove house flies ?,best way kill house flies ?,1,0.0,0.0,7,0.9142857142857143
338035,find real estate wholesaler chicago vicinity ?,python error `` list error range '' ?,0,0.0,0.0,35,0.7777777777777778
338036,time travel paradox ?,mind boggling example time travel paradox ?,0,0.0,0.0,22,0.9032258064516129
338037,trust answers quora ?,trust everything read quora ?,1,0.0,0.0,13,0.7586206896551724
338038,"'s quicker learn spanish german , know english ?","trump supporters think smart , fact retarded ?",0,0.0,0.0,36,0.8
338039,transfer funds bank account ( sbi bank ) friend 's bank account ( icici bank ) net banking ?,transfer money account friends account n't cheque net banking facility ?,0,0.0,0.0,51,0.8372093023255814
338040,remote device resource wo n't accept connection problem windows 8.1. solve problem ?,apps connect windows 8.1 ?,0,0.0,0.0,60,0.8205128205128205
338041,"treat sore throat , fatigue , headache ?",average pressure flow air expelled inhaling exhaling healthy adult male ?,0,0.0,0.0,51,0.7368421052631579
338042,economist think georgism ?,economists think georgism ?,1,0.0,0.0,1,1.0
338043,best method losing weight ?,lose weight ?,1,0.0,0.0,15,0.8461538461538461
338044,call bath bomb business ?,generally call person creates / makes / business ?,0,0.0,0.0,30,0.8
338045,anyone scored 45+ gate ece preparing 3 months ?,anyone secured 45+ marks gate last 3 months preparation ?,1,0.0,0.0,29,0.9333333333333333
338046,best season american horror story ?,seasons american horror story watch ?,1,0.0,0.0,12,0.9333333333333333
338047,aryan race ?,aryan race originate ?,0,0.0,0.0,10,0.8
338048,hate quora ?,one thing hate quora ?,1,0.0,0.0,10,0.8695652173913043
338049,get pregnant oral sex ?,girl get pregnant giving blowjob boy ?,1,0.0,0.0,21,0.7333333333333333
338050,similarities manner death cause death ?,could aztecs pre-columbian empires throw spanish conquest ?,0,0.0,0.0,42,0.8108108108108109
338051,best cloud storage solution would sync well adobe lr-edited photos generally viewed macbookair ?,"teachers truly understand stressed students papers , projects homework ?",0,0.0,0.0,71,0.8444444444444444
338052,'s favorite movies ?,favorite movies ?,1,0.0,0.0,3,0.96
338053,mind blowing upcoming mobile-phones 2016 ?,mind blowing camera phones 2016 exist ?,1,0.0,0.0,19,0.8695652173913043
338054,whose lyricist punjabi folk song “ kala doriya ” sung surinder kaur parkash kaur ?,would fund expedition ?,0,0.0,0.0,69,0.6666666666666666
338055,peter thiel boyfriend ?,peter thiel live ?,0,0.0,0.0,8,0.72
338056,best website builder india ?,best website builders india ?,1,0.0,0.0,1,1.0
338057,best friend ?,best friend ? ?,0,0.0,0.0,2,1.0
338058,lose belly fat without exercise ?,reduce belly hips fat without exercise ?,1,0.0,0.0,10,0.9473684210526315
338059,suitable inpatient drug alcohol rehab center near cross county ar ?,suitable inpatient drug alcohol rehab center near izard county ar ?,0,0.0,0.0,5,0.9743589743589743
338060,best book read 2016 ?,best book read 2015 ?,0,0.0,0.0,1,0.9333333333333333
338061,craving milk ?,"eat something give gas , long take give gas ?",0,0.0,0.1428571428571429,36,0.7142857142857143
338062,root galaxy s5 5.0 lollipop ?,root galaxy s5 5.0 & ?,0,0.0,0.0,8,0.9032258064516129
338063,beautiful ladies world ?,beautiful lady world ?,0,0.0,0.0,3,0.9333333333333333
338064,anna university rank holder 2016 wil announced ?,survey best topic students mcqs form ?,0,0.0,0.0,37,0.6666666666666666
338065,salary range junior big data developers china ?,salary freshers informatica big data developers india ? best ?,0,0.0,0.0,26,0.9047619047619048
338066,quora change font ?,quora change fonts ?,1,0.0,0.0,1,0.9655172413793104
338067,best phone buy 15k ?,phone buy 15k long term use ?,0,0.0,0.0,19,0.8823529411764706
338068,better enable non data scientists create insight data ? data discovery munging still issue .,"problem sets cs 109 similar , different , working actual data scientist ?",0,0.0,0.0,69,0.7391304347826086
338069,"'m 33 , working software architect . aspire become cto someday . mba ? mba degree going make achieve target faster ?",software engineer electronics engineer degree aspiring become mba . work quora mba ?,0,0.0,0.0,84,0.8163265306122449
338070,universities bridgehampton national bank recruit new grads ? majors looking ?,better 0 % coinsurance 100 % coinsurance ?,0,0.0,0.0,60,0.6666666666666666
338071,biggest lies told school ?,biggest lie told journalist ?,0,0.0,0.0,10,0.7586206896551724
338072,mean letter palms ? affect fortune ?,means palm lines hands ?,0,0.0,0.0,22,0.6666666666666666
338073,formula carbon graphite ?,"graphite , thus graphene , produced carbon sources necessary mine graphite ?",0,0.0,0.0,56,0.8421052631578947
338074,implement cloud computing xamarin.forms mobile app ?,post status facebook timeline xamarin forms mobile app ?,0,0.0,0.0,23,0.9
338075,add topics question quora ?,add topic quora ?,1,0.0,0.0,10,0.8888888888888888
338076,happens notice someone getting yelled almost everyone ? follow herd mentality thing think first ?,"someone says 'll punish unless crime , ca n't tell police , best thing ?",0,0.0,0.0,70,0.7906976744186046
338077,"politics united states america : running president 2016 , would platform strategy ?",would pros cons donald trump becoming president ?,0,0.0,0.0,61,0.8
338078,determine valency hydrogen ?,valency phosphorus determined ?,0,0.0,0.0,25,0.8888888888888888
338079,1st year engineering student find internships ?,1st year engineering students internships vacations ?,0,0.0,0.0,15,0.8888888888888888
338080,much thom hartmann make ? earn money ?,much alfie deyes worth ? make money youtube ?,0,0.0,0.0,29,0.8
338081,stop caring people think ?,stop worrying future ?,1,0.0,0.0,15,0.7096774193548387
338082,cook surimi ? common recipes ?,cook girello roast ? common recipes ?,0,0.0,0.0,12,0.8275862068965517
338083,best way compare contrast meiosis mitosis ?,compare contrast meiosis mitosis ?,1,0.0,0.0,9,0.896551724137931
338084,ordinary legislation ? difference ordinary legislation & constitutional amendment ?,meant term legislation ?,0,0.0,0.0,63,0.8125
338085,aamir khan use steroids transformation dangal earlier gajni movie ?,amir khan 's body transformation video dangal movie real tablets something ?,0,0.0,0.0,36,0.8780487804878049
338086,appearing boards 2017 mandatory jee 2017 given boards 2016 ?,wrote board exams ( non medical ) got 83 % 2016 dropping jee 2017 ?,0,0.0,0.0,47,0.7924528301886793
338087,best programming languages 2017 ?,best programming language learn 2017 ?,1,0.0,0.0,6,1.0
338088,state malaysia speaks pure hindi ?,state singapore speaks pure hindi ?,0,0.0,0.0,8,0.8484848484848485
338089,"make 30,000 month betting horses ?","make 50,000 month betting horses ?",0,0.0,0.0,1,0.9444444444444444
338090,one avoid extremely tired afternoon ?,avoid feeling sleepy afternoon ?,1,0.0,0.0,17,0.8484848484848485
338091,raziman t.v . ( self roled nanophotonics postdoc interested programming india ) maintaining strong islamic state ( isis ) agenda quora ?,n't india giving support us war isis directly ?,0,0.0,0.0,108,0.7555555555555555
338092,biggest mistake regret ?,biggest mistake ?,1,0.0,0.0,7,0.9565217391304348
338093,status mlm india many companies listed legally india ?,aboriginals drink lot alcohol ?,0,0.0,0.0,40,0.7272727272727273
338094,think melania trump 's nude sexually seductive pictures would affect role first lady ?,cricket isolated rules ?,0,0.0,0.0,68,0.7368421052631579
338095,money importance life ?,important money life ?,1,0.0,0.0,12,0.9655172413793104
338096,long programming logic control last ?,"mba admission 59.82 engineering , possible ?",0,0.0,0.0,37,0.6857142857142857
338097,objects changed time ?,us use mirrors changed time ?,0,0.0,0.0,12,0.875
338098,"humans die tomorrow , would human created dog breeds disappear ?","humans suddenly disappear , dog breeds would survive natural selection process ?",1,0.0,0.0,54,0.9545454545454546
338099,nutrition mind ?,nutrition ?,0,0.0,0.0,5,0.8888888888888888
338100,remove photo google ?,remove photo google ?,1,0.0,0.0,0,1.0
338101,toughest thing sell ?,toughest thing hide ?,0,0.0,0.0,4,0.9166666666666666
338102,long rabbits live ?,old rabbit live ?,1,0.0,0.0,4,0.8461538461538461
338103,get icloud password ?,recover icloud password ?,1,0.0,0.0,6,0.9032258064516129
338104,keep mole rats pets ?,clean pet mole rat ?,0,0.0,0.0,13,0.8333333333333334
338105,"girlfriend dumped richer guy , trust ?","girlfriend dumped richer guy , trust ?",1,0.0,0.0,0,1.0
338106,happened openbittorrent.com ?,happened filepile.com ?,0,0.0,0.0,12,0.8387096774193549
338107,"britishers voted brexit idea consequences , going happen us elections lead donald trump winning ?","invited donald trump great faith ministries church detroit , ?",0,0.0,0.0,74,0.8888888888888888
338108,difference stock shares ?,'s difference shares stocks ?,1,0.0,0.0,12,0.967741935483871
338109,indian rakesh jhunjhunwala got rich investing shares ?,rakesh jhunjhunwala radhakishan damani start journey indian stock market ?,0,0.0,0.0,46,0.9
338110,switch major economics psychology want work hr ?,change major economics psychology want work hr ?,1,0.0,0.0,6,1.0
338111,meaning spider web tattoo elbow ?,wave tattoo mean ?,0,0.0,0.0,21,0.6666666666666666
338112,fix error 403 google play ?,fix 504 error ?,0,0.0,0.0,18,0.7407407407407407
338113,lesser known places madison absolutely worth visiting terms natural beauty ?,lesser known places visit europe ?,0,0.0,0.0,44,0.85
338114,animal breeding ?,selective animal breeding ?,0,0.0,0.0,10,0.8571428571428571
338115,zoom screen computer ?,zoom computer screen ?,0,0.0,0.0,14,1.0
338116,learn machine learning ?,usual way start learning machine learning ?,1,0.0,0.0,19,0.8275862068965517
338117,individual family business sweden today prepare adapt coming impacts climate change ?,individual family business norway today prepare adapt coming impacts climate change ?,0,0.0,0.0,6,1.0
338118,hike messenger - business model ?,business model hike messenger ?,1,0.0,0.0,23,0.9696969696969697
338119,etf 's difference etf 's mutual funds ?,difference etf mutual funds ?,1,0.0,0.0,10,0.967741935483871
338120,god destroy devil end time forgive ?,god forgive satan ?,1,0.0,0.0,26,0.8666666666666667
338121,n't us dollar weakening ?,us dollar stronger currencies ?,1,0.0,0.0,19,0.875
338122,produce oxygen like trees reduce global warming ?,ca n't produce oxygen like trees reduce global warming ?,1,0.0,0.0,7,0.9777777777777777
338123,nutritional value tofu ?,nutritional value radishes ?,0,0.0,0.0,8,0.8571428571428571
338124,people come lives leave like ?,miss people lives n't love us ?,0,0.0,0.0,20,0.7407407407407407
338125,interesting facts associated human subconscious mind ?,get maximum benefit subconscious mind ?,0,0.0,0.0,29,0.9142857142857143
338126,feel like bukkake someone ?,feel orgasm ?,0,0.0,0.0,17,0.72
338127,"major effects cambodia earthquake , effects compare sanriku earthquake 1896 ?","major effects cambodia earthquake , effects compare arica earthquake 1868 ?",1,0.0,0.0,6,0.96
338128,best book material understand power system analysis ?,best books control engineering power systems point view gate preparation ?,0,0.0,0.0,41,0.8717948717948718
338129,good books world history comprehensive yet interesting ?,interesting insightful books world history ?,0,0.0,0.0,46,0.85
338130,good courses related software testing good job ?,software testing courses help get job ?,0,0.0,0.0,31,0.9230769230769231
338131,one overcome porn addiction ?,self rehab masturbation porn addiction ?,1,0.0,0.0,20,0.7878787878787878
338132,would cause period come 4 days early ?,would cause period come 6 days early ?,0,0.0,0.0,1,0.9411764705882353
338133,dreams really ? n't remember dream wake ?,n't remember dreams waking ?,1,0.0,0.0,20,0.875
338134,good books defence studies state pcs exam ?,best books state pcs exam ?,1,0.0,0.0,20,0.8125
338135,hack computer ?,hacked computer fixed ?,0,0.0,0.0,8,0.8666666666666667
338136,real estate industry affected india ban 500/1000 notes ?,real estate prices essential goods come india ban 500 1000 notes ?,1,0.0,0.0,23,0.8292682926829268
338137,conspiracy theories ever true ?,famous conspiracy theories came true ?,1,0.0,0.0,11,0.9090909090909091
338138,people love dogs ?,people love dogs much ?,1,0.0,0.0,5,0.8333333333333334
338139,would steve comisar 's life story make good movie ?,makes good movie car chase scene ?,0,0.0,0.0,37,0.7567567567567568
338140,best honeymoon place ?,best places around world honeymoon ?,0,0.0,0.0,23,0.8823529411764706
338141,way download episodes hotstar.com one single package ?,freely download arrow season 4 free episode one shot ?,0,0.0,0.0,37,0.8205128205128205
338142,states property taxes ?,states property tax ?,1,0.0,0.0,2,1.0
338143,celebrities quora ?,celebrities actively participating quora ?,1,0.0,0.0,23,0.8484848484848485
338144,first step take want start business ?,first step anyone take stating his/her business ?,1,0.20631392302799298,0.125,18,0.8235294117647058
338145,improve grammar writing sentences ?,improve english grammar ?,0,0.0,0.0,23,0.8387096774193549
338146,text friends ?,text friends free ?,0,0.0,0.0,5,1.0
338147,scooty prefer : honda activa hero maestro yamaha fascino ?,materials used make yamaha fascino bike shine protect colour,0,0.0,0.0,50,0.8205128205128205
338148,long take write book ?,long take write novel ?,1,0.247578769727375,0.19999999999999996,4,0.9285714285714286
338149,airline pilots flying mere passengers tend analyse pilot command skills ?,determines neck 's height ? length vertebrae ?,0,0.0,0.0,57,0.7894736842105263
338150,best coaching ssc cgl ?,best coaching ssc cgl ?,1,0.0,0.0,0,1.0
338151,emotional hollywood movies worth watching ?,good hollywood movies teens ?,0,0.0,0.0,19,0.9142857142857143
338152,feel christian pakistan ?,situation like christians pakistan ?,1,0.0,0.0,14,0.9032258064516129
338153,signs show girl loves ?,signs show woman really loves ?,1,0.0,0.0,10,0.896551724137931
338154,benefits living midwest ?,good colleges cs midwest ?,0,0.0,0.0,16,0.7857142857142857
338155,way make money online ?,make money home ?,1,0.0,0.0,9,0.8181818181818182
338156,good gifts foreign visitor bring 're invited someone 's home gambia first time ?,good gifts foreign visitor bring 're invited someone 's home iraq first time ?,0,0.0,0.0,6,0.972972972972973
338157,im realy tired living life social anxiety . anyone suggest tips get away anxiety ?,"overcome hesitation/ shyness start communicating english , especially girls think english language civilized ?",0,0.0,0.0,82,0.8085106382978723
338158,expectations christopher nolan 's dunkirk ?,expectations christopher nolan 's interstellar ?,1,0.0,0.0,11,0.9142857142857143
338159,best state india ?,'s best state india ?,1,0.0,0.0,3,0.9523809523809523
338160,anyone advice improve page rank/ get back links resource website made ?,anyone done research purchasing season tickets major sport maximize return investment ? anyone practical advice experience ?,0,0.0,0.0,91,0.851063829787234
338161,places one must visit ahmedabad ?,must visit places ahmedabad ?,1,0.0,0.0,18,0.9411764705882353
338162,easiest method clean shave bikini area home ?,shave bikini line ?,1,0.0,0.0,29,0.8
338163,american individualism ?,modern american values fetishize individualism expense sense community joint cooperative action ?,0,0.0,0.0,73,0.7567567567567568
338164,found local business directories australia ?,find local business directories australia ?,1,0.0,0.0,2,1.0
338165,would good 14 day itinerary north east india bike trip ?,best 4 day trip north india october ?,0,0.0,0.0,31,0.8205128205128205
338166,good written tutorial react ?,would best site/book/tutorial scala beginner ?,0,0.0,0.0,28,0.8823529411764706
338167,aim society ?,aim ?,0,0.0,0.0,8,0.625
338168,earn money online ?,make money online ?,1,0.0,0.0,3,0.9090909090909091
338169,differences amazon sde1 sde2 besides pay ?,amazon looks sde2 candidate ?,0,0.0,0.0,27,0.7428571428571429
338170,best way commit suicide die ?,die without pain ?,0,0.0,0.0,21,0.7142857142857143
338171,people like dimples person 's face ?,dimples attractive ?,1,0.0,0.0,25,0.7741935483870968
338172,submarine canyon formed ? difference ocean deep submarine canyon ?,difference ocean deep submarine canyon ?,0,0.0,0.0,26,1.0
338173,indian government ban 500 rs & 1000 rupees notes ?,banning 500 1000 rupee notes appreciated government bringing 500 2000 rupees market ?,1,0.0,0.0,52,0.9090909090909091
338174,longest snap streak snapchat ?,add custom filters snaps snapchat ?,0,0.0,0.0,19,0.7878787878787878
338175,important boy girlfriend ?,important girlfriend life ?,1,0.0,0.0,9,0.9375
338176,best institutes ms usa ?,best university usa ms education ?,0,0.0,0.0,17,0.7857142857142857
338177,question answers quora get much attention others ?,awesome questions never get 2 3 answers others get 50 ?,1,0.0,0.0,37,0.8421052631578947
338178,reviews www.arnavcreations.com ?,review www.buttermyresume.com ?,0,0.0,0.0,15,0.8387096774193549
338179,scientist currently answering cure cancer ? explain ?,cure cancer ?,1,0.0,0.0,40,0.64
338180,move berlin ?,move berlin ?,0,0.0,0.0,0,1.0
338181,start learning strengthen knowledge data structures algorithms ?,one refer ( books online courses ) learning data structures algorithms scratch ?,1,0.0,0.0,45,0.8780487804878049
338182,"difference programmer , good programmer great programmer ?",separates good programmer great one ?,1,0.0,0.0,26,0.8275862068965517
338183,would dave chappelle work louis c.k . would like ?,"louis c.k . 'banned ' david letterman 's show 15 years ? , ?",0,0.0,0.0,45,0.7727272727272727
338184,traffic laws australia particularly hard foreign drivers get used ?,traffic laws sweden particularly hard foreign drivers get used ?,0,0.0,0.0,8,1.0
338185,many americans hate donald trump ?,donald trump 's base ? popular ? people voting ? people like support ?,0,0.0,0.0,54,0.7894736842105263
338186,get girlfriend ?,get girls like ?,1,0.0,0.0,6,0.7619047619047619
338187,generate pdfs angularjs app using docraptor api ?,angularjs used cms ?,0,0.0,0.0,33,0.8125
338188,dr. nowzaradan 's diet plan performs surgery ?,impact diet soda keto diet ?,0,0.0,0.0,32,0.6285714285714286
338189,n't visiting country ?,visit country ?,0,0.0,0.0,7,0.9230769230769231
338190,determine size nerve cell ?,size nerve cell ? measured ?,0,0.0,0.0,21,0.896551724137931
338191,biggest mistake ever made whole life ?,biggest mistake life ?,0,0.0,0.0,16,0.8125
338192,hindu beliefs different american beliefs ?,hindu beliefs scientific ?,0,0.0,0.0,21,0.9032258064516129
338193,get rid acne ?,get rid pimples face ?,1,0.0,0.0,10,0.7692307692307693
338194,best gre coaching centres delhi ?,"best gre coaching centres delhi , especially maths ?",0,0.0,0.0,19,0.8888888888888888
338195,overcome fear ?,overcome fear coding ?,0,0.0,0.0,7,0.8333333333333334
338196,become male escort bangalore ?,like male escort ?,0,0.0,0.0,15,0.8148148148148148
338197,one learn recall without forgetting ?,best way learn anything without forgetting ?,1,0.0,0.0,16,0.8823529411764706
338198,get fear unknown ?,best way cope fear unknown ?,1,0.0,0.0,11,0.8
338199,cool whatsapp tricks ?,whatsapp tricks ?,1,0.0,0.0,5,0.9230769230769231
338200,become successful mechanical engineer student ?,way succeed chemical engineer ?,0,0.0,0.0,23,0.8333333333333334
338201,"google sheets , cell made hyper-link another cell ?",adjust cell click open another sheet google docs ?,0,0.0,0.0,40,0.85
338202,must-read copyright-free works literature malayalam ?,must-read copyright-free works literature tamil ?,0,0.0,0.0,7,1.0
338203,representative democracy confirms fairness democratic princples ?,worst teacher meet ?,0,0.0,0.0,51,0.6666666666666666
338204,medical researcher ?,latest projects medical research ?,0,0.0,0.0,18,0.8571428571428571
338205,songs listen hate someone ?,good songs listen hate someone ?,1,0.0,0.0,5,0.9629629629629629
338206,would win fight batman spider-man ? ?,would win fight batman spider-man ?,1,0.0,0.0,2,1.0
338207,create ble beacon signal using nrf5122 android devices ?,create ble beacon connect android devices custom app ? module use ? prerequisites ?,0,0.0,0.0,51,0.8
338208,product illustration analyst insurance industry much entry level employee make ?,path entry level employee ceo look like ?,0,0.0,0.0,59,0.918918918918919
338209,"1 1 1 1=r , 2 2 2 2=t , 3 3 3 3=e , 4 4 4 4=n , 5 5 5 5= ?",following expression evaluate ? ( [ math ] 1 / ( 2 * 3 * 4 ) ) + ( 1 / ( 3 * 4 * 5 ) ) + ( 1 / ( 4 * 5 * 6 ) ) + ... + ( 1 / ( ( n-2 ) * ( n-1 ) * n ) ) [ /math ],0,0.0,0.0,133,0.4583333333333333
338210,word 'truant ' used sentence ?,word 'adverse ' used sentence ?,0,0.0,0.0,7,0.9655172413793104
338211,easiest way gain weight extremely skinny guys ?,thin skinny . gain weight within month ?,1,0.0,0.0,29,0.8235294117647058
338212,way make girl fall love ?,make girl fall love ?,0,0.0,0.0,4,0.9285714285714286
338213,apply student visa canada 9-year gap studies ?,apply student visa canada 3-year gap studies ?,0,0.0,0.0,1,0.9473684210526315
338214,lamest jokes ever heard ?,lamest joke ever heard ?,1,0.0,0.0,1,1.0
338215,australia pr fee paid ?,"want support 3 months , much australian dollars need emigrating australia pr ?",0,0.0,0.0,59,0.7058823529411765
338216,sciencedaily.com reliable ?,labdoor.com reliable ?,0,0.0,0.0,11,0.896551724137931
338217,ca n't concentrate studies even wanted always feel sleepy lazy . ?,read/study focus/concentration avoid distractions/procrastination ?,0,0.0,0.0,55,0.85
